text,time,upvote,flair
"Hahaha I totally see it, wonder if he could grow a beard like that too",1647464870.0,2,:pride::AC_Milan:
Meaning winning scudetto apparently.,1647466722.0,1,:AC_Milan:
Well if you watched the whole game youd know why,1647467809.0,3,:FC_Barcelona:
"Hate Barcelona, then United, then Bayern",1647468858.0,3,:Real_Madrid:
i just despise the fact that negative football dominated a whole league,1647470124.0,-8,:Real_Madrid:
"Now that I think of it, perhaps it is the first time watching them at home.  Is there always this much whistling?",1647461486.0,1,:r_soccer_user:
"Well, not that shocked",1647461498.0,1,:c_Juventus:
stealing a living,1647465491.0,2,:r_soccer_user:
Definitely one of the best left footed cb for sure,1647467142.0,2,:r_soccer_user:
"Since ESPN just picked up La Liga in the States, they did a promotional mini segment of an American supporter for Villarreal. He explains his passion for the team and talks about the fanbase. It’s honestly very cool to me because I feel a lot of similarities with him being that I now live in the US and support Milan. Most people, including my wife, just don’t really care for the sport. But for me it’s always been my life.",1647483921.0,1,:AC_Milan:
"If you’re familiar with the ESPN+ App, you go to Soccer > La Liga > then it should be somewhere on the bottom.

Edit: Found it. Titled: The 5000 Mile Fan.",1647484191.0,1,:AC_Milan:
I'll allow it.,1647471435.0,1,:r_soccer_user:
one of their bench players had couple of tampons up the nose,1647463858.0,4,:Juventus:
"Yeah they mentioned Sociedad. I don't even remember it lol
Was he good?",1647463292.0,1,:transpride:
Same 😭,1647463443.0,1,:transpride:
I got you,1647463317.0,3,:Argentina:
No. Loaned him back to Sociedad right away who bought him eventually,1647463421.0,0,:transpride:
You are not as delusional as your username suggests,1647464641.0,3,:transpride:
"For sure, but especially in close games you cannot deny the randomic and episodic nature of events and situations which lead to goals.",1647465151.0,2,:transpride::Napoli:
Here's to hoping.,1647466866.0,1,:transpride::Napoli:
Situation report,1647463963.0,6,
[removed],1647463864.0,4,
He looks like one of the three stooges,1647465024.0,1,:c_Juventus:
"No, i always pick a side, otherwise i find it boring. If it's the PL there's always some vested interest. For the rest, it's sometimes it's simple as the jersey color",1647465468.0,1,:transpride:
"I was not unbaised, but that was a fun game",1647465503.0,2,:transpride:
It can't be explained. You either get it or you don't.,1647465797.0,2,:transpride::Napoli:
"I mean… it has nothing to do with them being female or trying to prove people wrong… And this isn’t just about these two Paramount+ commentators. Because the males that I’ve heard do Milan games are also shit. They have one guy who doesn’t speak into the mic correctly and you can barely hear him and when you do hear him, it sounds like he is about to fall asleep…",1647466157.0,1,:AC_Milan:
"Cuando la rompía no le dieron chances, y cuando la 1 estaba disponible no estaba atajando bien. Tuvo muy mal timing.",1647467083.0,1,:Argentina:
Ask Maguire was as bad as Deligt was today,1647467657.0,6,:Real_Madrid:
"mctominay fred maguire rashford elanga in the squad, put 28 y/o ronaldo in the and the result still wouldn't change",1647467710.0,6,
"nothing to do with ronaldo mate, just fits your narrative doesn't it. the guy's literally playing with a midfield that consists of mctominay and fred and players like maguire rashford shaw and wan bissakka",1647467834.0,7,
well the quality of the team also dropped drastically after his first season so it makes sense doesn't it?,1647467976.0,7,
idk how you took my comment but i'm mocking juve fans,1647467753.0,6,
"No, he is not Dybala. He can be a workhorse defensively too and can play a more box to box role if necessary. Dybala is more offensive.",1647464106.0,3,:c_Juventus:
He had injury issues at Tottenham,1647464166.0,2,:Juventus:
"Yes, that's the joke",1647467221.0,6,:Juventus:
Not as expected with Ronaldo there,1647467760.0,-3,:FC_Barcelona:
"Eh, he's useful. Just not 7m a year useful",1647465590.0,2,:Italy:
Thanks,1647466320.0,1,:Argentina:
"Pero no puedo preguntar en francés, (y tampoco sé cómo escribir las pronunciaciones en francés).",1647466456.0,1,:Argentina:
"Endavant, cony!",1647466661.0,1,:pride::Girona_FC:
Sí,1647467198.0,3,:transpride:
I’m watching your match on Pornhub you want to join me?,1647468912.0,2,:Indonesia:
"I am, thank you very much",1647467560.0,4,:pride::c_Juventus:
not really he just waived his arms around a bit,1647463061.0,1,
"In theory he has already recovered from his injury, so I expect him in the second half",1647463801.0,1,:Villareal:
Just wondering why all the women commentators and half time commentators are on today?,1647464694.0,1,:FC_Barcelona:
"I wouldn't say De Sciglio has been good, he's seeing a lot of balls because Villareal is forcing us to play on that side on purpose. De Sciglio is actually slowing down our attacks and with a better player we'd have gotten a lot more chances from the balls he received",1647464558.0,1,:Juventus:
"Ah wasn't aware of that, thought all of Europe had no restrictions anymore. Too bad though",1647464875.0,2,:FC_Utrecht:
"He honestly hasn't even played that much in general tbh. He had that calcification for like half of last season when he was starting to gear up, and Allegri hadn't really fielded him much this season before Mckennie and Zakaria got injured",1647465785.0,1,:Juventus:
"Nah he has been pretty solid here. He does a little of forward passing, but he carries the ball forward well",1647466038.0,1,:Italy:
You got a fair chance against Tottenham i will say. Defensively you are good and Spurs are less impressive when they are sitting back sometimes,1647464604.0,0,:transpride:
"Haha. 

But i think you guys are playing good. Might force a mistake from Villarreal who have been absorbing the pressure well so far",1647464507.0,1,:transpride:
"I’m rooting for the Spanish team, and judging from Villarreal’s past bad luck in the CL it’s never a given",1647466618.0,1,:FC_Barcelona:
Watch the game I suppose?,1647466837.0,1,
"i quite like Hargreaves, he's a bit more cosmopolitan in his perspective and opinions",1647465013.0,3,:c_Juventus:
Lmao facts 🤣😂,1647461364.0,1,:r_soccer_user:
..,1647461952.0,1,:r_soccer_user:
Looked like his back but whatever,1647467517.0,1,
You clearly haven’t been watching the game lmao.,1647467090.0,1,:pride::c_Juventus:
Not true lmao.,1647467106.0,1,:pride::c_Juventus:
I just want to be a part of the conversation,1647462924.0,2,
Im not saying hes bad just not worth what you paid for him.,1647461758.0,0,:AC_Milan:
"They're passing, yes - but with snail's pace at the front. Only chances Villareal created so far have come from individual actions. If they want to break Juve's defense down, that passing speed should be way faster.",1647463526.0,1,
Are we watching the same game? Lol he's so awful,1647462828.0,1,:r_soccer_user:
"Disagreed. Fell down while defending which led to the Lo Celso chance, got sucked up into the play and beaten by a flick that gave Villarreal another opportunity and I haven’t seen him put in a good cross yet. 

So, I think our definition of “good” is a bit different. Because I’ve seen more than a couple fuck ups.",1647462900.0,1,:AC_Milan:
"No, an actual foul is a penalty. That wasn't it.",1647467403.0,1,:River_Plate:
[deleted],1647462437.0,-1,
Poor from him. Thanks,1647467484.0,1,:transpride:
ngl you guys look good. But its hard to call it a rebirth when your two best players have a combined age of 70..,1647467286.0,0,:Chelsea:
"That's why I interpreted his comment as a ""don't jinx it"", lol, but I don't know",1647464239.0,2,:Juventus:
It is what it is. Injuries have been taking a toll on our team. Unlucky,1647467285.0,1,:c_Juventus:
2017 Umititi?,1647468670.0,2,:FC_Barcelona:
Yeah. That trumps all those exits,1647468327.0,8,:r_soccer_user:
you can't use it as an imsult if you are better than us at consecutive round16 exits...,1647470125.0,-7,:Juventus:
just saying you guys are also better than us at ro16 exits. Cant really meme us for it.,1647470168.0,1,:Juventus:
Away goals have been abolished,1647462145.0,3,:Real_Madrid:
"Feels like City vs Crystal Palace part 2 NGL. 

Just hope this game doesn't get spoilt by a bad/harsh refereeing decision",1647463361.0,2,:transpride:
yeah wasn’t sure until they showed the replay,1647467515.0,1,
After seeing another angle it looked intentional. Should've been a red,1647468699.0,5,:FC_Barcelona:
"Well whats your point? Vlahovic can outscore someone whos missed 3 months? I dont understand including haaland in here.

Heres my take: junior messias is a beast outscoring players like chiesa",1647465124.0,0,:r_soccer_user:
"fair enough, was watching liverpool",1647467862.0,1,
Negative football won the game today….rightfully so,1647470906.0,6,
"He was quite good but was severy lacking in aerial presence, he would stay on goal and wouldn't attack balls in the air",1647463950.0,2,:Real_Sociedad:
Ahh that makes sense. Thanks,1647464138.0,3,:transpride:
You are right then 👍,1647463929.0,2,:transpride:
"Seeing your flair, I guess you supported Atlético",1647465582.0,1,:Villareal:
Lmao. I will try to understand it after the game,1647465907.0,1,:transpride:
"I watch every game, trust me I can’t stand those guys either.",1647466799.0,1,:AC_Milan:
"Si, la verdad. No creo que sea mejor que el dibu, menos en la selección. Pero bancaron mucho tiempo a Armani cuando no se lo merecería en mi opinión",1647467265.0,2,:pride::Argentina:
"Lol Juve performing today has nothing to do with Ronaldo either, for all we know they could have been worse off.",1647468001.0,2,:Liverpool:
I mean this season dybala has been doing all that shit too.,1647464223.0,1,:c_Juventus:
He’s been injured the majority of his time with us it feels,1647464370.0,2,:Tottenham_Hotspur:
It's funnier when explained.,1647467399.0,1,:Tottenham_Hotspur:
No it was still expected. Did you think Ronaldo was back at his best because he got a hat trick in his last game or something lol,1647467836.0,5,
Well I can't argue there.,1647468155.0,1,:Real_Madrid:
[removed],1647463842.0,2,
"i didnt mean as in we play shit all the time, thats our game plan and it has been working for a bit now, unai is tactical genius. he has absorbed pressure really good in this tie",1647464610.0,2,
Its hard to watch dude,1647466929.0,1,:AC_Milan:
He played abroad and has seen more than just the PL. That seems to help,1647465334.0,1,:r_soccer_user:
You dont know what relying means,1647464479.0,1,
He’s not wrong. He’s doing good… for De Sciglio,1647463121.0,2,:Juventus:
"They are reserved to everybody, they are the opponents. Fuck them.

For 90 minutes they are our fiercest rivals",1647462582.0,3,:Juventus:
Tbf we’re better at everything in the UCL than you guys except losing finals lmfao,1647470477.0,2,:Real_Madrid:
I know it was sarcasm,1647462220.0,2,:Algeria:
Well I was wrong haha,1647466969.0,1,
"So Juventus dominated pretty much the whole game, they had multiple shots on target, Villarreal couldnt even cross the field. Then they fckd up with that penalty and everything was downhill from there but if you didnt watch it youd think villarreal dominated the game and kicked Juventus ass",1647468001.0,2,:FC_Barcelona:
"yeah one game where Villarreal on paper are far weaker than you guys, not half a decade of allegry-ball",1647471359.0,-7,:Real_Madrid:
"Thank you. 

Looks like Juventus can cause some troubles through corner then",1647464118.0,1,:transpride:
Sí,1647465698.0,2,:transpride:
"that's not what i'm saying is it? no player in the world can make a huge difference with such a terrible midfield. i'm not saying the result would've been much different with cr7 in this current juve squad, but some juve fans were acting like all their problems would be solved as soon as ronaldo left with this terrible midfield. not to mention that juve's current squad with locatelli zakaria and vlahovic is better than last year's juve.",1647468181.0,2,
"Dybala has never played box to box, lol.",1647464251.0,1,:c_Juventus:
He was playing pretty well in the first few minutes of the game,1647468639.0,0,:FC_Barcelona:
"Yeah, I expect goals",1647463923.0,2,:Villareal:
Oh got it now,1647464765.0,1,:transpride:
that is true - if there is something to meme juventus about its that not the ro16 exits which btw I was surprised at how many it was for real. I thought it was like 4 or something but 7 was brutal,1647471629.0,2,:Juventus:
It’s so hard for me to tell what’s sarcasm these days.,1647462270.0,2,:Real_Madrid:
😎🥰,1647467283.0,1,:transpride:
"Allegri hasn’t been our coach the past two years. Before that he took us to two finals. Simeone bounced Man U yesterday with Negative football and Tuchel won the CL just last year with negative football

Plastic fans are so weird, too much twitter",1647471836.0,9,
Basado,1647465759.0,3,:Villareal:
allegri is so finished,1647467776.0,1,:FC_Barcelona:
Hehe SiiUUU,1647469234.0,3,
your comment was well-informed and level-headed until you ruined it with that last sentence.,1647478727.0,-9,:Liverpool:
The veracity of what what I said prior to the last sentence is in no way enhanced or reduced by the last sentence. I guess it wasnt level headed but then again I wasn’t trying to be. 🤷🏽‍♂️,1647480750.0,2,
