text,time,upvote,flair
Leave it to us to score 3 goals on 0 chances against Samp in a league match and score 0 on 20 chances in a UCL knockout,1647463117.0,32,:Italy:
"This is going to be one of those Juve games where they have 30 scoring chances, and Villareal will score a dirty penalty in the 80' and win. The opposite of a normal juve game.",1647463555.0,29,
Dude Vlahovic is so complete what the fuck,1647463578.0,27,:Olympiacos:
And at home so embarrassing. Damn Spanish domination returning to CL.,1647467082.0,26,:AC_Milan:
It wouldn’t be Juventus in Champions League if I dont feel my blood pressure drop for 2 hours,1647463450.0,24,:c_Juventus:
"Finally a reason to give a fuck about the Champions League again, go yellow submarines.",1647468102.0,19,:Ajax:
Villareal vs. Benfica in the quarters please.,1647467613.0,17,:Forge_FC:
"even against Man United in the Europa league final, Villareal waited and waited and found a way through in the end. Emery's masterclass. Good Ebening sir. Respect!",1647469830.0,16,
Cuadrado: Juve legend? what a player,1647461613.0,16,:LA_Galaxy:
"Lol, just saw my grandmother's best friend in the stands on TV.",1647463033.0,14,:c_Juventus:
Lmao let’s fucking go you yellow twats,1647467056.0,15,:Real_Madrid:
"Chiellini ""we're gonna win the champion's league this year""  

Villareal: ""yes""",1647467357.0,14,:AC_Milan:
Cmon Juve do it for the coefficient,1647463109.0,12,:c_AS_Roma:
"goodness, we should have been 2-0 up at least",1647463665.0,11,:Juventus:
Wild how many teams seem to be mentally collapsing this round.,1647467541.0,12,:Benfica:
"I just imagined this game with 2017 Sandro, or Spinazzola or Cancelo playing on the left side...",1647463862.0,11,:Juventus:
"Consecutive RO16 exits for Juve,it’s football heritage",1647467019.0,10,:Argentina:
Piemonte Calcio is officially eliminated from UEFA Champions League,1647467622.0,30,
Loving the happy Italian song on the background after a disaster class of a match lmao,1647467702.0,22,:Benfica:
"Less than 10 minutes of watching, and Villarreal score 3. Juve fans should thank me for not tuning in earlier as it could’ve been 27-0 at this rate",1647467422.0,21,:FC_Barcelona:
"Vlahovic is magic, he's the one making things happen.",1647463675.0,10,:c_Juventus:
You can tell a ref is going to give a pen after going to the tv by how proud he looks when he’s running towards the pitch,1647466575.0,11,:Chelsea:
"3-0 Villarreal victory *in* Turin wasn’t *exactly* what I was expecting from this match, jeez Juve.",1647467338.0,10,:Leicester_City_FC:
"The match was pretty balanced, and then Juve conceded 3 goals in 15 minutes at home in the second leg of a Champions League knockout tie. This must be one of the mentally weakest performances I've ever seen.",1647467470.0,10,:Argentina:
I thought Villareal had a chance but I didn’t expect Juve falling completely apart like this,1647467501.0,10,:Denmark:
What was a better meltdown psg or juve?,1647467512.0,11,:AC_Milan:
"Emery winning in the CL, what's happening is he playing Europa League music in the locker room?",1647466914.0,10,:Bayern_Munich:
"""*Superleague*"" is being fast-tracked in this very moment by Agnelli.",1647467208.0,11,:r_soccer_user:
"Man, I wanted chukweze to score :(",1647467315.0,8,:Villareal:
3-0 most dangerous lead,1647467375.0,10,:FC_Barcelona:
Italian teams continue their path of misery in European competitions,1647467523.0,10,:Real_Madrid:
Common Piemonte you can still do it.,1647467526.0,9,:AC_Milan:
 Yellow nuclear submarine.,1647467614.0,9,:Argentina:
Madrid Atleti Villarreal and Benfica on one side of the bracket please,1647467712.0,17,:Real_Madrid:
Damn they really all said nah I'm not shooting,1647461738.0,9,:Colombia:
"Villarreal will very often will sit defensively and take things slow for 25 minutes then our of nowhere play some of the most beautiful football you'll see for 2 mins. 

They are genuinely all so good on the ball and cohesive but they always wait patiently for their moments to drive forward",1647462346.0,8,
Cuadrado is legit such a beast,1647462678.0,7,:c_Juventus:
Vlahovic is so good at that pass.,1647463571.0,8,:Manchester_United:
WTF is cuadrado doing...,1647463590.0,8,:Juventus:
"I can't believe we're actually playing football for once, they gonna make me cry",1647463839.0,8,:Juventus:
Must have been one of Arthur's first offside calls in his life that..,1647465156.0,8,:r_soccer_user:
Szczesny almost got it..,1647466574.0,9,:Rapid_Bucuresti:
Rugani said my job here is done,1647466581.0,8,:Real_Madrid:
how can you spend 300m in wages and still play with Rugani,1647466586.0,7,:AC_Milan:
How is Dybala 29? Wasn't he like 23 two weeks ago?,1647466699.0,8,
GIVE ME VILLARREAL BENFICA!!!,1647467042.0,8,:LA_Galaxy:
Morata is awful I wonder which club is he going to scam this coming transfer window,1647467108.0,8,:Real_Madrid:
Emery is goated,1647467190.0,9,:Chelsea:
Super League! Super League! Super League!,1647467231.0,9,:r_soccer_user:
Should have let the goal stood imo,1647467337.0,8,:c_Copa_America:
"3-0 for Juve at home against Villareal, my god that’s not embarrassing that’s just shamelessly awful",1647467366.0,7,:Argentina:
"Lmao, I think no one expected this score line.",1647467373.0,8,:Atletico_Madrid:
"See, losing to Villareal ain't that embarrassing! I demand an apology for all the banter last year for losing that final.",1647467417.0,7,:Manchester_United:
Super league is for the losers of Champions League,1647467437.0,8,:Kitchee:
The yellow submarine has sunk the Old Lady. This is hilarious at this point. Serie A isn't the league I once feared.,1647467467.0,8,:Olympique_de_Marseille:
So is De Ligt leaving this summer?,1647467501.0,7,:FC_Barcelona:
3rd consecutive season going out in the ro16 for Juve lmao,1647467614.0,14,:Real_Madrid:
ronaldo's fault.,1647467362.0,14,
We are actually creating a lot of trouble for villarreal. Much better than the first game,1647461871.0,7,:c_Juventus:
"We look pretty good so far, unlucky not to have scored",1647462410.0,6,
"Juve at every chance they get ;

 ""No... I don't think I will""",1647463025.0,6,:Olympique_de_Marseille:
But they said allegri only park bus 😭,1647463881.0,8,:r_soccer_user:
"Honestly good game so far, didn't find it boring as some are saying",1647463895.0,8,:FC_Barcelona:
GOL!!!!!!!!!!!,1647466517.0,7,:Villareal:
"How strange, you sub in your best player and it changes the game, I wonder if Allegri will learn from this",1647466531.0,8,:pride::Juventus:
La Liga clear,1647466965.0,7,:Real_Madrid:
Fuck a Super league,1647467002.0,8,:Olympique_de_Marseille:
[deleted],1647467056.0,6,
Villarreal out-Juventused Juventus,1647467059.0,6,:FC_Barcelona:
Juventus has been awful in the UCL ever since they changed their badge.,1647467072.0,8,
This night keeps on getting better ahahah,1647467265.0,7,:Napoli:
How the mighty juve was once steam rolling the league and was reaching finals of the champions league not so long ago . The fall from grace .,1647467288.0,7,:r_soccer_user:
If only we had Super League then these peasants from Villareal wouldnt be qualified,1647467311.0,8,
It's the history of the Juventus,1647467312.0,7,:c_AS_Roma:
0-3 HAHAHA,1647467369.0,7,:Inter_Milan:
"3 nil, couldn’t even score a fucking goal at home.",1647467419.0,8,:AS_Roma:
"Juventus just imploded, not saying I am not happy",1647467426.0,7,:AC_Milan:
"hats off to Villarreal, they played great over the 2 legs.",1647467464.0,7,:Juventus:
I just hope De Ligt and Dybala get out of there in the Summer,1647467480.0,7,:transpride::St_Pauli:
Come on Villarreal! Get another one!,1647467489.0,6,:Mexico:
Imagine watching the PR League over some prime terrorism,1647460866.0,6,:LA_Galaxy:
Christ they’re already talking about extra time and we haven’t even got to the 10 minute mark.,1647461432.0,7,:AC_Milan:
Didn't score because he was onside,1647461545.0,6,:New_Zealand:
Cuadrado slipped into another dimension there,1647461816.0,7,:FC_Barcelona:
We’re not winning,1647461937.0,6,:Villareal:
Doesn’t feel like Villarreal can hold the floodgates back much longer,1647463098.0,7,
Nice to see Allegri use coherent pressing traps rather than run backwards and inshallah,1647463401.0,7,:c_Juventus:
Having a left flank without a left foot has its limitations..,1647463592.0,6,:r_soccer_user:
"Juve should go for Pogba next summer, Vlahovic receiving his passes could be lethal.",1647463666.0,6,:Real_Madrid:
Have a bad feeling this will go to penalties 😬,1647463860.0,6,:Juventus:
Was it 8 players on Locatelli? Lmao,1647464823.0,5,:transpride:
"600 villarreal fans. The rest Juve, must be a bit overwhelming lol",1647466039.0,6,:c_Juventus:
It’s like watching chess,1647466043.0,5,:Juventus:
"Villarreal is so incredibly passive it borders on cowardice. I guess Emery is haunted by his UCL demons. Shame, because every time they tried to be more direct in the first half, it looked dangerous.",1647466179.0,5,:Dinamo_Zagreb:
The heavy artillery has arrived!!!,1647466288.0,6,:Villareal:
thats a pen in my book,1647466395.0,6,:Sevilla:
That’s a pen,1647466401.0,6,:Falkirk:
"That’s a pen, he exaggerates it but that’s a pen for sure",1647466403.0,6,:Croatia:
"Paramount + commentators suck. ""He got part of the ball"" while showing a reply of him getting no part of the ball whatsoever.",1647466447.0,6,:r_soccer_user:
Now park that submarine,1647466552.0,8,:Real_Madrid:
"Porto, Lyon and now Villareal lmao Juve",1647466824.0,4,:Denmark:
"are they singing ""como no te voy a querer"" lol",1647466854.0,6,:Real_Madrid:
Allegri has been Allegri-balled by Emery. Only fair really.,1647466985.0,6,:r_soccer_user:
You love to see it,1647466991.0,6,:Inter_Milan:
Let’s gooo Villarreal,1647466993.0,6,:Bayern_Munich:
"Damn I tune in, and it goes from 0-0 to 2-0 in 5 mins",1647467007.0,6,:FC_Barcelona:
Italian football is great. 🤭,1647467264.0,5,:Argentina:
"Bro. WHERE the fuck is Juve’s defense? De Ligt and Danilo back there alone for fucking ages. 

They’ve given up. Might as well not even try anymore. Ffs.",1647467305.0,7,:AC_Milan:
That should have been a red... Blocked a clear shot on goal.,1647467310.0,6,:Rapid_Bucuresti:
De Ligt loves playing keeper i swear. and a juve fan told me he didn’t hand ball it often lmao,1647467322.0,5,:Tottenham_Hotspur:
ref taking the piss,1647467324.0,6,
Not that it matters but why didn't he get a red ?,1647467338.0,6,:AC_Milan:
Ref is torturing them with this wait lmaoo sadistic psycho,1647467344.0,6,:FC_Barcelona:
"AND THREE, VAMOS",1647467363.0,6,:FC_Barcelona:
Excellent result for Villarreal,1647467430.0,6,:Mexico:
"cmon villarreal, we want more",1647467430.0,7,:AC_Milan:
Che figura di merda.,1647467432.0,6,:Real_Madrid:
"Shouldn’t that be a red for De Ligt?

Or does double jeopardy cover that too? Because that was a crazy handball",1647467448.0,5,:FC_Barcelona:
The crowd that stayed just wanted to whistle,1647467591.0,7,
Why's de ligt's handball not a red?,1647467623.0,6,:FC_Barcelona:
congrats my Villareal hermanos!,1647467680.0,6,:Real_Madrid:
Good job Villarreal. And Agnelli wanted to play in the Superleague. Why did he think that Juve was good enough haha? Congrats to Villarreal.,1647467692.0,10,:Sporting_Clube_de_Portug:
I thought la liga teams are trash..... How is this possible?,1647485423.0,12,
The state of Serie A in Europe,1647467551.0,15,:Spain:
"Juve at home, must win match. Dosnt press at all. Welcome back Allegri",1647461214.0,5,:AC_Milan:
"Emery never advanced in CL knockout, meanwhile did it 24 times out of 25 in EL.",1647461248.0,5,
This is going to be a long and boring game by the looks of it,1647461343.0,5,:AC_Milan:
Cuadrado is so goooood,1647461540.0,6,:c_Juventus:
What a save,1647461559.0,4,:Bayern_Munich:
In last year’s second leg game against Porto a free morata header was incredibly saved by the keeper early in the game… just like this one… pls let the rest be the same too lmfao,1647461602.0,4,:Real_Madrid:
no idea how Villareal are managing to hold atm lol,1647461746.0,5,
"What the fuck man, how did nobody shoot there…",1647461754.0,5,:pride::c_Juventus:
"Morata should’ve shot there, but cuadrado asked for chance. Bad idea",1647461922.0,6,:c_Juventus:
BT Sport: CUADRAYDOH,1647462100.0,6,:Bayern_Munich:
I thought that went in,1647462221.0,5,:FC_Barcelona:
"Jesus Christ, I thought that was in.",1647462291.0,6,:c_Juventus:
Rulli gonna have his sole on the ball for half the game if they don't pressure him.,1647463274.0,4,:r_soccer_user:
How have they not scored on a set piece yet.. just a right bounce away,1647463517.0,6,:r_soccer_user:
"Such a great game so far, let's hope it continues like this in the second half. Extremely entertaining.",1647463679.0,6,:AC_Milan:
There’s a reason why Vla out scoring Mbappé and Haaland this season dude is a beast. Watch the Oil clubs trying get him next year,1647464064.0,6,:r_soccer_user:
Is it just me or does Vlahovic kind of look like Patrick Bateman,1647464626.0,4,:pride::AC_Milan:
Dybala time.  We need to move the ball faster.,1647465748.0,6,:Juventus:
"I fucking love Pervis Estupiñán, shame the deal to Napoli didnt happen",1647465749.0,4,:Napoli:
"As much as I may not like Juve, I love me some Chiellini.",1647466093.0,6,:AC_Milan:
Shits about to get real,1647466306.0,5,:Juventus:
Clear penalty,1647466382.0,5,:Spain:
Should be a penalty imo,1647466399.0,5,:FC_Utrecht:
"Clear pen, VAR do something",1647466446.0,5,:Spain:
"Someone said Rugani would give away a pen, he was right on the money",1647466491.0,4,:Argentina:
What a huge penalty.  Villarreal will be parking the bus with all 11 now.,1647466572.0,5,:Real_Madrid:
The fuck Juve? Like this? Where's the legendary defense?,1647466614.0,5,:AC_Milan:
We are gonna get a taste of our own medicine. Zero shots on target yet they are winning,1647466655.0,5,:c_Juventus:
This ref is buff,1647466712.0,5,
Why I am embarrassed?,1647466936.0,5,:AC_Milan:
"That's my favourite player right there, PAU TORRES!",1647466968.0,6,:Villareal:
"Haha 


Well done Emery",1647466979.0,5,:Sevilla:
Villarreal are getting to the semifinal 100%.,1647467008.0,6,:Real_Madrid:
Oh my god Juve. How the hell did this happen?,1647467013.0,5,:Germany:
Vabbè porcodio a tutto il mondo buonanotte a tutti e fanculo la Madonna inculata da Satana,1647467045.0,5,:Juventus:
"Also, thanks Allegri for starting to sub players AFTER taking a goal at the 80th minute...",1647467107.0,6,:Juventus:
The guy smoking a cigarillo looked badass ngl,1647467182.0,3,:Chelsea:
"Wtf why did the ref whistle? Not gonna change the result but that's stupid, Milan-Spezia didn't teach anything?",1647467287.0,6,:c_AS_Roma:
Spanish teams love Europe,1647467303.0,4,:Manchester_United:
Juve fell apart completely,1647467315.0,5,:Argentina:
Oh dear Juventus,1647467319.0,4,:Manchester_United:
Juve falling apart lol,1647467319.0,6,:Mexico:
De Ligt THE GREAT,1647467326.0,6,:AC_Milan:
Watch Villareal knock out city,1647467334.0,6,:Real_Madrid:
Blow the fucking whistle lmfao,1647467341.0,6,:Real_Madrid:
"Wow, Juve completely shat their britches.",1647467351.0,6,:LKS:
So fucking aweasome!,1647467358.0,5,:pride::Girona_FC:
Allegri masterclass,1647467380.0,6,:AC_Milan:
"Why was the Var check so long lmao, my man diving at the ball with his arm",1647467404.0,5,
Insane the complete meltdown from Juve.,1647467465.0,4,:AC_Milan:
"Juventus somehow proving, that, in reality, you can get sucker punched 3 times even without doing anything...",1647467474.0,6,
... How Juventus? How?,1647467507.0,5,
"They are not even celebrating, they feel bad for it lol haha",1647467681.0,5,:transpride::St_Pauli:
I guess no team want to draw Villareal,1647467696.0,5,
"Time for a big rebuild, which was postponed back in 2018",1647467974.0,6,:Union_Berlin:
That Villarreal keeper did some serious work,1647492070.0,4,
Juve deserve to go through just to hear the stadium shouting THE CHAMPIONSSSSSS in QF,1647460764.0,8,:Real_Madrid:
This has to be the most deceiving result in history,1647467341.0,10,:FC_Barcelona:
Good ebening,1647467428.0,10,:Manchester_United:
love seeing juventues fail makes my day,1647468377.0,22,:Real_Madrid:
"Dude if Dusan doesn’t score today, god is an asshole",1647463019.0,9,:c_Juventus:
Is that not a penalty on De Ligt?,1647463682.0,8,:Juventus:
"vlahovic so good, make me worried if madrid or city want him lol",1647463834.0,8,:Juventus:
"Told ya Juve would get fucked. 

Honestly probably deserved something, but basically as soon as Villarreal decided to attack they scored, even if through luck.",1647466579.0,9,:transpride::Napoli:
How are Juve fans talking about shit game style? Their manager is Allegri.,1647466695.0,8,:Spain:
This match is like a game of chess.  Hard to believe Juve are playing so passively at home.,1647461310.0,4,:r_soccer_user:
"I hope Villarreal win and draw Benfica, would be cool to see either club in the semifinal",1647461531.0,4,:LA_Galaxy:
How Arthur is playing this season Juve fans? His passes are still great? Don't know if we can find a place for him between Casemiro and Fabinho in Brazil's mid.,1647461594.0,4,
Kwey-drado,1647461599.0,3,:Juventus:
WTF WAS THAT IDIOTS,1647461728.0,5,:Italy:
Danjuma absolutely loves his hips.,1647461771.0,5,:r_soccer_user:
That was a nice move by villareal,1647461780.0,4,:FC_Barcelona:
Villareal play some good football when they have the ball.,1647461796.0,3,
"Complete domination, lovely.",1647462090.0,4,:pride::c_Juventus:
"Villarreal play some nice football, but their build-up is so slow that Juve usually have all their defenders back in position by the time they get near the box.",1647462161.0,4,:r_soccer_user:
wooow i thought that was in,1647462219.0,4,
That's a great hit,1647462241.0,4,:Mexico:
Fuck I thought that went in,1647462279.0,4,:FC_Barcelona:
"My commentator shouted goal.  I mean thats how football works, 2-3 good juve shots, crossbar than Villareal have to score.",1647462320.0,3,
Fun game,1647462458.0,3,:c_Juventus:
De Sciglio watched Roberto Carlos tapes?,1647462487.0,4,:pride::Juventus:
Danilo got absolutely rinsed there my god,1647462746.0,3,:Italy:
Every Juve set piece is dangerous as fuck,1647462978.0,3,:r_soccer_user:
How has Vlahovic not scored yet,1647462984.0,5,:transpride::Real_Madrid:
Rulli with the hockey save,1647463027.0,4,:pride::Juventus:
Villareal want this to go to penalty now,1647463264.0,5,:Juventus:
How has Vlahovic been so far?,1647463520.0,4,:Balikesirspor:
"Evra asking the real questions in prime video

Why the fuck doesn't Arthur do the long pass himself instead of slowing the play down by passing it short to another.",1647464094.0,4,
who the hell cuts dybala's hair,1647464892.0,2,:r_soccer_user:
Kind of funny hearing the sound of 100 cameras click as Morata shoots into the top of the stands,1647464919.0,6,:pride::AC_Milan:
Vlahovic is a tank,1647465628.0,4,
That one fan staring at his phone and yawning 😅,1647465683.0,4,:r_soccer_user:
Tick tock,1647465948.0,4,:c_Juventus:
"This is what I want to see, tiqui taca",1647466015.0,4,:Villareal:
"Watching this game so far saying ""it's only 50 minutes until penalties"" feels justified.",1647466206.0,4,:LKS:
"Over 70 minutes in and no subs, fucking hell

Edit: never mind, maybe dybala's about to come on?",1647466317.0,4,:Juventus:
Yeah thats a penalty,1647466416.0,5,:Napoli:
That’s got to be a pen…,1647466432.0,5,:AC_Milan:
100% a pen lmao this is not up for discussion,1647466466.0,5,:FC_Barcelona:
LET'S FUCKING GOOOOO,1647466535.0,5,:Villareal:
Idk about that decision,1647466561.0,4,:FC_Barcelona:
Woj was inches from saving 4 penalties in a row.,1647466567.0,4,:AC_Milan:
You're kidding me. First shot on goal by Villareal... is from a penalty in the last 15 minutes.,1647466577.0,3,
haircut of a 13 year old,1647466579.0,4,:Algeria:
Well undeserving af but that's football for you,1647466594.0,3,:Olympiacos:
Kpop Dybala.,1647466627.0,5,:Real_Madrid:
💀,1647466664.0,4,:Bayern_Munich:
Juve in Champions League is heartbreaking.,1647466668.0,5,
I hate that haircut on Dybala,1647466754.0,4,
Only Bernardeschi can save Piemonte Calcio,1647466758.0,3,:AC_Milan:
"Oh well, it's over. Up to us and Atalanta now to keep Italy's coefficient up I guess.",1647466967.0,4,:c_AS_Roma:
VAMOS!!,1647466969.0,3,:Real_Madrid:
Juve is kill. Ded,1647466996.0,4,:AC_Milan:
GOL!!!!!!!!!,1647466996.0,4,:Villareal:
"Emery masterclass, started playing 3 attackers in the last 15 minutes causing chaos for Juve",1647467002.0,4,
I want to cry gollllllllll,1647467008.0,5,:Villareal:
Lol,1647467012.0,3,:Juventus:
Pau torres !!!  gotta be one of my favorite cb in the top 5 leagues .,1647467018.0,3,:r_soccer_user:
Who else remembers that ESPN special on that fan in California? Bless that adorable little guy. Can only imagine his reaction right now.,1647467030.0,3,:AC_Milan:
Hahahahahahahaha,1647467035.0,4,:r_soccer_user:
Honestly haven't watched Juventus that much this season but de Ligt has been extremely underwhelming these two games against Villarreal. Last game responsible for the goal and now this one as well. Also just bad passing at times and out of position.,1647467038.0,4,:FC_Utrecht:
my god Arthur is fucking garbage. Sideway pass merchant,1647467061.0,5,:Manchester_United:
Juve are fucking Ass,1647467096.0,4,
Group winner Juve not going thru ro16? Sheeesh,1647467112.0,2,:Chelsea:
Agnelli lol,1647467212.0,3,:FC_Barcelona:
Penalty again..........,1647467229.0,4,:Bayern_Munich:
"Moreno has destroyed Juve in just 15 minutes, incredible",1647467261.0,5,
Bruh wtf is happening Juve are down bad lmaoo,1647467266.0,4,:Argentina:
Noooo it would be a Chukwueze goal :(,1647467272.0,4,:Villareal:
Lmao wtf was that whole sequence,1647467288.0,3,:Bayern_Munich:
"De Ligt tripping over his feet, the man has no balance looks so awkward sometimes",1647467313.0,4,:FC_Utrecht:
"Emery deserves this, especially after the horror show he's had during his PSG spell",1647467348.0,4,:FC_Barcelona:
When's the last time Juve lost by 3 goals on aggregate?,1647467376.0,4,:r_soccer_user:
"Juve, what happened?",1647467379.0,4,
I can’t believe it’s 3-0 😭,1647467396.0,4,:Real_Madrid:
Emery is a legend,1647467413.0,4,:Sevilla:
"Bye Allegri, dinosaur hahahah",1647467458.0,4,:LA_Galaxy:
"Im gonna murder someone if I have to listen to that BT Sport bloke call Cuadrado ""Cuadraydow"" another fucking time",1647461871.0,7,:pride::Leicester_City_FC:
Villareal walrus,1647463446.0,7,:Juventus:
The white Juve seats(?) are looking like piano keys lol,1647463639.0,8,:transpride:
"THAT'SS LA LIGA FOR YOU, YOU BASTARDDSSSS!!!!!!!",1647467027.0,8,:FC_Barcelona:
"Hopefully Juventus lose to Lazio, Fiorentina and Inter to miss out on top 4 :)",1647467319.0,8,:Bayern_Munich:
Wtf happened to De Ligt?,1647467521.0,7,:Manchester_United:
"TIL City had Rulli at some point. He is such a cutie, i would never have guessed he is almost 30",1647463109.0,4,:transpride:
"These announcers are awful. 

“If Juve don’t put away one of their chances it’s gonna come back to bite them.”

Well yeah that’s what happens if you don’t score? Lmao. No insights at all. And another said someone wouldn’t score a penalty on Mendy? He’s a great keeper but notoriously terrible against penalties",1647464259.0,5,:Chelsea:
"Juve is IMHO playing good and yet can't shake the feeling they are going to get fucked. This is why imho Villarreal was a way worse matchup for them than Sporting which they drew the first time. They are a composed and organized team, weirdly comfortable both parking the bus and holding the ball. 

Hopefully they win, as fun as it would be to watch them lose I'd rather have them distracted at least for another month and it would be sad if every Italian team went out instantly.",1647465001.0,5,:transpride::Napoli:
Thats 1000% a penalty but the way he fell was like a sky diver lol,1647466481.0,7,:Napoli:
Villareal v Benfica in the next round for some real terrorist football,1647466646.0,6,:Abahani_Limited:
Honestly good riddance Juve has been so flat,1647466970.0,6,:New_Zealand:
Lololololol,1647467500.0,8,:Everton:
[removed],1647463682.0,9,
Cuadrado as good as ever,1647461529.0,3,:transpride::Real_Madrid:
Of course we’ll play like this until we score then terrorism starts.,1647461568.0,3,:pride::c_Juventus:
Does bald Allegri remind anyone else of Mike Dean?,1647461614.0,3,:r_soccer_user:
Shoot ffs,1647461708.0,3,:Olympiacos:
The Villarreal goal is living a charmed life.,1647461731.0,3,:r_soccer_user:
LMAOO Fifa IRL,1647461743.0,3,:FC_Barcelona:
We should be 2-0 up already,1647462178.0,3,:Juventus:
De Sciglio turned into a beyblade there,1647462258.0,3,:Real_Madrid:
why are the bottom 3 or 4 rows empty?,1647462267.0,3,:AFC_Bournemouth:
Love this game so far,1647462435.0,3,:Olympique_de_Marseille:
Rugadinho,1647462818.0,3,:r_soccer_user:
"Now that I think about it, we have no specialists for free kicks on the field. I guess cuadrado?",1647462917.0,3,:c_Juventus:
We're playing so good for once but the fucking ball doesn't want to go in.,1647462980.0,3,:c_Juventus:
FUCK OFF,1647462988.0,3,:pride::c_Juventus:
Rulli is crazy right now. Brick wall like,1647463021.0,3,:r_soccer_user:
All Villarreal players have sneakers on.,1647463089.0,3,:r_soccer_user:
"I can understand playing conservative, but wasting time ? Why",1647463421.0,3,:AC_Milan:
FML,1647463547.0,3,:Italy:
They are still slipping.. crazy,1647464740.0,3,:r_soccer_user:
Wtf did dybala do to his hair?!?!?,1647464891.0,3,:c_Juventus:
I think this is the first game i am watching where I am completely unbiased and i am finding it interesting lol,1647465232.0,3,:transpride:
Danilo got folded like a beach chair,1647465312.0,3,:Napoli:
"It's weird that Villarreal has both Coquelin and Capoue, right?",1647465564.0,3,:transpride::Napoli:
