text,time,upvote,flair
"I’m not sure who these announcers are for this game on Paramount+ but my god are they boring. 

There are some LONG pauses between sentences and they seem to talk without giving any informative information…",1647465569.0,3,:AC_Milan:
"Come on, we just need a goal. Someone do something.",1647466210.0,3,:c_Juventus:
I’m a simple man. All I wanna see is Vlahovic score,1647466224.0,3,
"Gerard is on, vamos Villarreal",1647466275.0,3,:Sevilla:
gotta be a pen,1647466412.0,3,:Benfica:
Penalty,1647466416.0,3,:Colombia:
"ajajaja thats pk unfortunately. come on tek 
magic",1647466420.0,3,:Juventus:
That looked like a PK,1647466421.0,3,:FC_Barcelona:
Has to be a pen,1647466452.0,3,:Bayern_Munich:
that's a pen!!!,1647466459.0,3,:FC_Barcelona:
Defy a pen. Rugani classic.,1647466464.0,3,:AC_Milan:
Smart by qocuelin. Rugani is a moron and he takes advantage of it.,1647466475.0,3,
"How did he miss that, clear pen",1647466478.0,3,:Inter_Milan:
Clear pen,1647466488.0,3,:pride::Juventus:
The rare dive **and** penalty.,1647466496.0,3,:Manchester_United:
Damn That’s a pen rugani messed up,1647466504.0,3,:r_soccer_user:
Weird dive but that looked a foul and so a pen,1647466521.0,3,:FC_Barcelona:
"Fuck, so close Woj.",1647466552.0,3,:LKS:
So close Szczesny. Now things are getting interesting,1647466554.0,3,:FC_Barcelona:
Damn Szczesny almost got there,1647466556.0,3,:Hull_City:
Sczenzy so close,1647466560.0,3,:Bayern_Munich:
"Damm straight away substituted haha, that's rough",1647466566.0,3,:FC_Utrecht:
Gotta do better with that pen,1647466594.0,3,
Big Bruhve Moment,1647466598.0,3,:AC_Milan:
"Oh Juve, how the fuck have you managed to lose this match?",1647466647.0,3,:Germany:
What a unlucky time for the pen. Just before his substitution,1647466693.0,3,:transpride:
Watch Allegri do something stupid like bring on Bernardeschi for Cuadrado now.,1647466725.0,3,:AC_Milan:
Rulli goddamnn,1647466733.0,3,:Real_Madrid:
Have to be calm there is still time,1647466775.0,3,:Villareal:
"When Rulli has his flashes of brilliance he's so good. With consistency he would've had a chance of starting for Argentina, when we didn't really have an established no. 1.",1647466897.0,3,:Argentina:
Hahaha,1647466917.0,3,:r_soccer_user:
VAMOSSSSSSSSSSSSS,1647466942.0,3,:FC_Barcelona:
Hahaha La Liga let's goooooo,1647466942.0,3,:c_Atletico_Madrid:
Welcome to the abyss Juve,1647466967.0,3,:Manchester_United:
Holy shit holy shit,1647466974.0,3,
Juve done lol. Fans are already leaving the stadium,1647466981.0,3,:FC_Barcelona:
Pau > Matthijs,1647466991.0,3,:r_soccer_user:
Beautiful,1647467000.0,3,:Celtic:
"I mean, can’t be too salty. We’ve won so many games exactly like this.",1647467001.0,3,:pride::c_Juventus:
Lovely goal,1647467005.0,3,:Mexico:
"That Dracula jog, master",1647467010.0,3,
Yessss!,1647467016.0,3,:FC_Barcelona:
Hahahahahahahahahaha,1647467020.0,3,:Real_Madrid:
I love Emery,1647467021.0,3,:Sevilla:
/u/AllegriLover in shambles,1647467071.0,3,:Real_Madrid:
It’s so evident that Allegri has no plan if Juve doesnt get a first half goal so they can park the bus,1647467073.0,3,:Denmark:
Man juventus has gone back alot,1647467081.0,3,
Spanish teams just never fail to show up in Europe you gotta respect it,1647467142.0,3,:r_soccer_user:
"Wrong cup emery, dont scare us",1647467153.0,3,:r_soccer_user:
LMAO,1647467218.0,3,:Real_Madrid:
Wtf?,1647467236.0,3,:Real_Madrid:
Shambolic,1647467247.0,3,:Orlando_Pirates:
Lmfaooooooo,1647467259.0,3,:Real_Madrid:
Morata is so shit,1647467266.0,3,:FC_Barcelona:
Just count the goal. WTF?,1647467274.0,3,
What a disaster for De Ligt,1647467276.0,3,:FC_Barcelona:
De ligt loves a handball,1647467292.0,3,:Real_Madrid:
HAHAHAHAHAHAHAHA,1647467295.0,3,:FC_Barcelona:
"De Ligt???

Bruuuuhhh what is that",1647467296.0,3,:FC_Barcelona:
3-0,1647467326.0,3,:Bayern_Munich:
GOL!!!!!!!!!,1647467389.0,3,:Villareal:
I want Juve to score two goals just so the hope hurts more.,1647467459.0,3,:AC_Milan:
"Gerard Moreno masterclass. Comes on for 20 minutes, Villareal scores 3.",1647467543.0,3,:Rapid_Bucuresti:
Would love to see Villarreal progress to the next round,1647460950.0,5,:Mexico:
Villareal lucky af rn,1647462227.0,5,:Italy:
This match reminds me of that cycling pursuit race where the two cyclists spend most of their time standing completely still.,1647463371.0,5,:r_soccer_user:
Don’t feel bad for Rugani.   He’ll get to go to his hot wife.  Feel bad for the rest of us juventini.,1647466676.0,6,:Juventus:
Vlahovic surely loves laying on the ground,1647466891.0,5,
Good ebening,1647467013.0,5,
"You wann hear a joke?

De Ligt ( ͡° ͜ʖ ͡°)",1647467283.0,6,:Legia_Warsaw:
[deleted],1647467301.0,5,
"What the absolute, literal fuck Juve. Were you jealous that PSG was getting all the headlines for their collapse and thought “hey what about us?”",1647467442.0,5,:Liverpool:
Ronaldo was clearly a problem in this club,1647466967.0,6,:Legia_Warsaw:
"ronaldo's fault, kills team chemistry and cancerous in the dressing room",1647467542.0,12,
"And they said Ronaldo was the problem.

Edit- P.S. Please don’t comment “Manchester United got out”. Manu is worse than Juve, just that Ronaldo saving their ass occasionally makes them look alright. Ronaldo got both of his transfers wrong. Man city would’ve been amazing but thanks to his old teammates and SAF, he wasted another year of his career, lol.",1647504780.0,9,
Vlahovic is FIRE,1647461716.0,3,:transpride::Real_Madrid:
"We could have easily got Lo Celso but instead, have Zakaria now. (Kinda irritated by that)

I gotta say that was a world-class finish from Vlahovic even though he didn't score on that.",1647462429.0,4,:c_Juventus:
Lo Celso not being a Juventus player hurts a lot🤧😢,1647463961.0,3,:c_Juventus:
[removed],1647465931.0,2,
"Thats clear penalty, no idea how people can think differently",1647466488.0,4,:FC_Barcelona:
Good Ebening,1647466951.0,5,:Serbia:
De Ligt should join Barca,1647467307.0,3,:Real_Madrid:
"So Juve are gonna dominate the whole match and Villareal are gonna shithouse a win, aren't they",1647462460.0,5,:transpride::Real_Madrid:
The history of Juventus.,1647467129.0,4,:Tottenham_Hotspur:
At least the Juventus fans that chat shit about Cristiano can go out the same round as him this year,1647467238.0,4,:Real_Madrid:
"PSG, Juve and ManU all getting knocked out in the most unexpected way",1647467537.0,5,:FC_Barcelona:
And apparently Ronaldo was “The Problem” and was “holding them back”,1647467440.0,8,
Allegri luring to sleep again?,1647460811.0,2,:AC_Milan:
Moreno on the bench lets go,1647461043.0,2,:pride::c_Juventus:
how many minutes can Moreno play today ?,1647461122.0,2,
[deleted],1647461236.0,2,
Rulli performing miracles again.,1647461530.0,2,:r_soccer_user:
How has Vlahovic been so far?,1647461538.0,2,
Alvarooo 😭😭,1647461563.0,2,
Morata should have left it fuck me,1647461853.0,2,:Italy:
There are only two possible outcomes for this match. Juve win 1-0 via scrappy penalty or Villareal win on penalties.,1647462097.0,2,:Celtic:
Rugani the GOAT.,1647462107.0,2,:c_Juventus:
"I was against taking the away goal rule but I think I was wrong. Teams seem to be playing much more ""relaxed"" and are willing to risk more.",1647462148.0,2,:America_de_Cali:
Saint crossbar right there man,1647462182.0,2,:Olympiacos:
JESUS CHRIST,1647462202.0,2,:Juventus:
OMG GRT IN THE FUCKING NET,1647462208.0,2,:c_Juventus:
Jahovic looks like a sexier gaston,1647462229.0,2,:Besiktas:
De Sciglio best player on the pitch,1647462511.0,2,:AC_Milan:
"Hey, thats Danilo. It took me 26 min to get he is playing tonight.",1647462554.0,2,
Lay that off sooner,1647462598.0,2,:AC_Milan:
where was all the Juve players there on the back post.. weird on the corner.,1647462605.0,2,:r_soccer_user:
So messy,1647462618.0,2,:c_Juventus:
nice pass by Lo Celso,1647462728.0,2,:Sevilla:
Hips don't lie.,1647462739.0,2,:r_soccer_user:
CALMA CALMA,1647462774.0,2,:c_Juventus:
"Rulli, I'm going to build you a statue",1647462804.0,2,:Villareal:
Rulli on a mad one today,1647462968.0,2,:AFC_Bournemouth:
"RULLI, I'M GOING TO BUILD YOU A GOLD STATUE",1647462968.0,2,:Villareal:
Insane save!,1647462991.0,2,:Real_Madrid:
Rulli!!!!,1647462997.0,2,
Rabiot is inspired,1647465393.0,2,:c_Juventus:
"Rulli, keep it up  so in the penalty shootout we have some chance",1647465478.0,2,:Villareal:
60 minutes. Dybala needs 20,1647465633.0,2,:c_Juventus:
Vlahovic ate his Wheaties this morning.,1647465649.0,2,:AC_Milan:
I really enjoy the way Marciniak is refereeing.,1647466065.0,2,:LKS:
Pregunta para los que hablan español: se pronuncia Capú o Capué?,1647466189.0,2,:Argentina:
Villareal are awful at counters,1647466226.0,2,:r_soccer_user:
There’s no space lmfao,1647466241.0,2,:c_Juventus:
Finally Dybala in!,1647466319.0,2,:pride::Lazio:
Ooooh,1647466402.0,2,:FC_Barcelona:
It has to be penalty,1647466408.0,2,:Legia_Warsaw:
That's tough,1647466408.0,2,:pride::Argentina:
???,1647466421.0,2,:Real_Madrid:
"The ref is not going to ignore this penalty, is he?",1647466431.0,2,:pride::Girona_FC:
Not like this…not like this,1647466433.0,2,:pride::c_Juventus:
Come on VAR.,1647466437.0,2,:r_soccer_user:
Pen,1647466442.0,2,:Portland_Timbers:
Im not buying it..,1647466446.0,2,:r_soccer_user:
Good var,1647466466.0,2,:Real_Madrid:
Let’s goooooo,1647466477.0,2,:Real_Madrid:
He’s definitely looking for it but still a pen,1647466479.0,2,:pride::AC_Milan:
Oh my,1647466479.0,2,:Real_Madrid:
That was close,1647466506.0,2,:Spain:
Grazie Rugani 👍,1647466511.0,2,:Juventus:
"fk me, every year man godam, I knew it",1647466511.0,2,:Juventus:
Juventus are fucking shit,1647466512.0,2,:New_Zealand:
VAMOOSSSS VILLARREAL,1647466539.0,2,:Real_Madrid:
oof that was quite close,1647466544.0,2,
GET IN,1647466547.0,2,
FFS Juve,1647466553.0,2,:Liverpool:
Gerard Moreno just needs to be on the pitch for 2 minutes and scores wow,1647466559.0,2,:Valencia:
Park the bus time now,1647466561.0,2,:AC_Milan:
Nice try by Sczcezny,1647466565.0,2,:c_Juventus:
"If hes there, he should almost keep that out.. good try though.",1647466569.0,2,:r_soccer_user:
Was Dybala injured?,1647466584.0,2,
Dybala has to take this shot,1647466607.0,2,
Dybalaaa,1647466616.0,2,
Rulli is saving their ass big time.,1647466760.0,2,:AC_Milan:
Come on man,1647466785.0,2,:c_Juventus:
How did Villarreal get 48%?,1647466827.0,2,:Real_Madrid:
"i just wanna say:

ÑÑÑÑÑÑÑ",1647466832.0,2,
 holy shitttttt,1647466921.0,2,:AFC_Bournemouth:
Lmao,1647466926.0,2,:Spain:
What a collapse.,1647466930.0,2,
Fucking lmao,1647466938.0,2,:Olympiacos:
VAMOOOOOOOOSSSSS,1647466950.0,2,:Napoli:
LETS GOOOO CMON VILLARREAL,1647466951.0,2,:Real_Madrid:
HOLY SHIT THEY DID IT,1647466953.0,2,:FC_Barcelona:
Que rico,1647466967.0,2,:Napoli:
That was so sloppy leading up to the corner too lol,1647466977.0,2,:USA:
Oh shit well then,1647466982.0,2,:Hull_City:
Allegris DAIs gotta be numbered at juventus,1647466982.0,2,:AC_Milan:
Nice one,1647466983.0,2,
every year,1647466987.0,2,:Juventus:
"Emery, it's a wrong cup, come on.",1647466997.0,2,:LKS:
Wow...shocking!,1647467003.0,2,:Real_Madrid:
"Welp, bye bye juve",1647467036.0,2,
What a cutieee,1647467042.0,2,:transpride:
Juve gtfo,1647467045.0,2,
"Now focus, there is still time left",1647467055.0,2,:FC_Barcelona:
Cursed,1647467094.0,2,
Lfg!!!!!!,1647467106.0,2,:Chelsea:
Please bring Zidane next season for fucks sake.,1647467207.0,2,:pride::c_Juventus:
De Ligt,1647467239.0,2,:r_soccer_user:
😂😂😂😂😂,1647467244.0,2,
lol wtf pen but he was scoring haha,1647467253.0,2,
High spike in tobacco companies’ stocks.,1647467255.0,2,:Real_Madrid:
absolute lol,1647467255.0,2,:AC_Milan:
LMFAO what is happening,1647467258.0,2,
This is too fucking funny,1647467260.0,2,:Croatia:
Messy Juve shit mentality,1647467261.0,2,:pride::Lazio:
This is awful.,1647467264.0,2,:AS_Roma:
Danjumerr,1647467283.0,2,
Can we just throw in the towel for them?,1647467287.0,2,:FC_Barcelona:
Juve's falling apart,1647467289.0,2,:Hull_City:
Absolute joke of a team lmaoo,1647467299.0,2,
Lol,1647467336.0,2,
GOLLLLLLLLLLLLLLLLLLLLLLLLLLLLLLLLLLLLLLLLLLLLLLLLLLLLLLLLLLLLLLLLLLLLLLLLLLLLLLLLLLLLLLLLLLLLLLLLLLLLL,1647467345.0,2,
GOALLLLL,1647467362.0,2,
NOT A FUCKING RED?,1647467372.0,2,
been watching this thinking howard webb looks mad small these days,1647467373.0,2,:Real_Madrid:
This is as bad as PSG's disaster,1647467398.0,2,
Super league master class,1647467400.0,2,
Netherlands getting exposed again.,1647467408.0,2,:Real_Madrid:
Juve in the mud,1647467416.0,2,
Danilo and Cuadrado are not champions league material. Plain and simple.,1647470095.0,6,
[removed],1647460806.0,3,
Allegri telling his players to calm down. Dude if they calm anymore they will die,1647462898.0,4,:AC_Milan:
"Vlahovic 5 mins ago: Absolutely bodies Estupian

Vlahovic now: falls over after being slightly touched",1647465861.0,4,:AC_Milan:
VAMOOOOOOS,1647466525.0,4,:Napoli:
 only juve can buy the leagues most exciting forward and then play absolutely negative football resulting in an absolute shit attack,1647466738.0,5,:AC_Milan:
Villareal has a decent lineup,1647460944.0,3,:r_soccer_user:
"My eyes are hurting, I can't distinguish between yellow and white anymore",1647463434.0,2,
Please get a penalty or an own goal or some bullshit goal,1647465268.0,4,:pride::c_Juventus:
"I wonder how often Dybala is mistaken for a ballboy by the ground staff. The ""mom cuts my hair"" haircut does not help.",1647465500.0,5,:LKS:
"Looks a bit divy to me, but maybe contact",1647466436.0,1,
Dive but also a penalty,1647466469.0,3,:Juventus:
This is hilarious. A team like Juventus should never concede a goal like that from a corner kick.,1647467002.0,2,:Argentina:
Juve getting juve’d,1647467099.0,3,:FC_Barcelona:
Since Allegri couldn’t get further than Pirlo with Juve does that mean Pirlo = Allegri in terms of managing?,1647467155.0,4,:AC_Milan:
Juventus are bad,1647467308.0,3,:FC_Barcelona:
"And I thought we had the most dramatic fall from grace. Fucking hell, at least we're doing well now can't see this Juve team improving anytime soon",1647467471.0,4,:FC_Barcelona:
Deligt dropping a shittier performance than Maguire did,1647467553.0,3,:Real_Madrid:
This commentary is awful,1647467319.0,3,:Sevilla:
🤣🤣🤣The women announcers on CBS didn't realize that was a penalty.  Handball in the box wtf how do they have a job,1647467409.0,2,
[removed],1647465740.0,3,
Last time Juve looked so dominant was in 1921,1647462390.0,2,:c_AS_Roma:
[deleted],1647467449.0,3,
"Bruv, what is this luck for Juve right now",1647462202.0,2,
"There it is!! That Spanish sazón!! The Villarreal dick assery begins. Calma, calma Locatelli.",1647462352.0,2,
I fckn love how Marciniak is letting all Players lay down on a field. Top ref this year in CL.,1647462646.0,2,
the shot was straight at him tbh,1647463001.0,2,
"Danjuma needs Gerard or Boluyae to score, and that's a fact",1647463662.0,2,:Villareal:
Is it international women's day today?,1647464121.0,2,:FC_Barcelona:
[removed],1647464151.0,2,
Why tf is De Sciglio playing instead of Pellegrini?,1647464164.0,2,:Italy:
"So many empty seats, how is that even possible on a CL knockout round",1647464708.0,2,:FC_Utrecht:
arthur literally scared to move the ball 1mm forwad wtf is this,1647465479.0,2,
"It’s a pen, but I almost wouldn’t give it with the way he fell",1647466488.0,2,:Feyenoord_Rotterdam:
Anyone besides me keep thinking (for a split second) the players are in a penalty box behind that glass?  Too much hockey I guess...,1647466767.0,2,:Real_Madrid:
Football is cruel sometimes LOL,1647466936.0,2,:c_Juventus:
What a time to be alive,1647466955.0,2,:AC_Milan:
"Tenim que guanyar, que estos pareixen del Castelló i no podem perdre contra el Castelló (o pareguts)",1647463320.0,1,:Villareal:
"That's not a pk, never.",1647466498.0,2,:c_Juventus:
Pathetic. Grazed his shin and he threw himself to the ground,1647466508.0,1,:Juventus:
Has Dybala done anything,1647467497.0,2,
VAMOS GERARD,1647466494.0,1,:Real_Madrid:
"I want Villa-real to pass, but come on. this was supposed to be the match where we were getting penalties!",1647466802.0,1,:pride::Girona_FC:
Boring game as expected. Whoever goes through will get their ass kicked in the quarters,1647465037.0,0,:Denmark:
Time wasting is ridiculous.  You'd think they're playing prime Barcelona,1647464954.0,1,:Juventus:
I said it before and will say it again. I’ve seen more shit games from Deligt than I have seen good games from him.,1647467401.0,1,:Real_Madrid:
Vamos Villarreal!!!!,1647460900.0,1,:Villareal:
"Villareal, why did you hire Lo Celso? So far he still shows he's too slow in his decision-making and making the wrong choices often - so not so different from what he showed at Tottenham.",1647462283.0,1,
Did Lo celso and aurier upgrade?,1647464253.0,1,:transpride:
Rulli hates catching. Not PL-compatible.,1647465456.0,1,:r_soccer_user:
"It’s just a PK, doesn’t mean it’ll be a goal.",1647466518.0,1,:FC_Barcelona:
It's obviously a pen but part of me almost wants them to give an indirect freekick in the box instead when it's simultaneously a blatant dive like that.,1647466561.0,1,:Aarhus:
"Fuck, they are going to shithouse us and kick us out with a super soft penalty kick, aren't they?",1647466562.0,1,:c_Juventus:
"Was watching the Pool match, saw the score and the first thought was wtf is happening here. Final 10 minutes was gold. Hate Agnelli and his pretentious know it all demeanour",1647469803.0,1,:r_soccer_user:
Why am i watching this instead of Arsenal vs Liverpool?!,1647461514.0,1,
DAMNNNN SO CLOSE,1647461541.0,1,:c_Juventus:
Doesnt touch him,1647466463.0,1,:Juventus:
Eastern European Collina givin the penalty,1647466474.0,1,:AC_Milan:
Game strategy: Park the bus and win with pen,1647466479.0,1,:United_States:
🤣,1647466557.0,1,
"Never count Juve out, they have that special something occasionally",1647466808.0,1,
Vlahovic been diving a lot lately,1647466929.0,1,:FC_Barcelona:
"Inzaghi should watch this and take some notes. 

How to Chase a Lead in the Last Leg of a Knockout Tournament. 

Juve might concede, but at least they’re going for it instead of trying to rely on some fluke set piece goal.

E: aaaand within 30 seconds of me writing this, Villarreal score again.",1647466936.0,1,:AC_Milan:
Co come mai came early this year,1647467042.0,1,:AC_Milan:
Lol pk?,1647467282.0,1,:FC_Barcelona:
Adios Juve!,1647467580.0,1,
"Juve needs to score and wrap this up quickly if they don't want to suffer in the second half.    
Villarreal are called the yellow submarine, because their shithousery will drag you to the bottom of the ocean.",1647462607.0,-2,:Bayern_Munich:
Control the game for 75 and give away a pen this sport is cruel,1647466562.0,0,
I love the girls pundits but the girls commentary not it bruh,1647461296.0,0,:r_soccer_user:
English obsession with dull former players as analysts is annoying. You learn zero,1647464666.0,0,:r_soccer_user:
"That's an amazing dive Coquelin,who shot you",1647466405.0,0,:Olympiacos:
Lessssgoo,1647466563.0,0,:FC_Barcelona:
Paramount got all the sexy ladies out. Get the lotion boys,1647461203.0,-1,:r_soccer_user:
How's that a penalty though?,1647467304.0,-1,
[deleted],1647466569.0,-2,
How often did Arthur started in first eleven? I think every time I saw Juve's game he was on a bench.,1647460981.0,0,:LKS:
How did the ref miss that hand ball?,1647461373.0,0,
Cuadrado better watch his tone with morata before his shit his pants or kill his confidence. 🤣🤣😂,1647461985.0,0,:r_soccer_user:
Omg guys there it is…. the signature Dybala finisher!!!!,1647464990.0,0,:Liverpool:
Lesssgo!,1647466535.0,0,:Real_Madrid:
Frauds smh,1647467010.0,0,
uff,1647467020.0,0,:transpride::St_Pauli:
I just want Juventus to lose because of Danilo,1647462733.0,-4,:Real_Madrid:
Im i the only one who thinks Vlahovic was not worth the money Juve paid for him?,1647461474.0,-2,:AC_Milan:
"Both teams seem way too dependent upon individual brilliance.

They're not bad, but not exactly half final Champion's League material either...

Of course the philosophy of both coaches makes the other seem worse than they are, but neither team is really persistently through team play able to break the other down.

Juventus at least has some pace within their offensive play, but Villareal... Is this supposed to break the Juventus defense down as long as Juventus' defense doesn't make the wrong choice?",1647463074.0,-3,
completely undeserved wtf,1647466565.0,-2,:Juventus:
"Villarreal really looking dangerous, but need Moreno to come on for the second half",1647463865.0,-8,:Mexico:
"De Sciglio is so bad man. 

Dude can’t even beat the first defender with his crosses and his defending has always been sus.",1647462482.0,-2,:AC_Milan:
"Every contact in the box is not a penalty, that wasn't a penalty. The defender is trying to dispute the ball and the striker extends his legs to look for the contact.",1647466643.0,-3,:River_Plate:
That Juve sponsor makes me cringe every time I see it,1647461559.0,-1,:Celtic:
Nah no contact,1647466411.0,-1,:c_Juventus:
DIVE,1647466414.0,-1,:Virtus_Lanciano:
Not gonna lie. That chocolate and sweet vanilla blonde chick can get it. Imagine seating in between them on a 18hours plane ride Straight up suicide 😂😂🤣,1647464652.0,-7,:r_soccer_user:
That gets reviewed but Albiol on vlahovic doesn’t alright,1647466679.0,-2,
"bullshit penalty, he didn't even touch him",1647466615.0,-10,:Juventus:
[deleted],1647462173.0,-3,
fucking pathetic most undeserving shit i ever seen,1647466567.0,-4,:Juventus:
how is rabiot playing,1647460989.0,1,:LA_Galaxy:
"Rabiot and De Sciglio, we're toast.",1647460997.0,1,:Italy:
Can someone explain what happend to dybala? Havent warched Juve in a while besides seeing him in the Champions League on the Bench,1647461165.0,1,:Ajax:
"This os the type of match, Morata scores a hat trick or 1 goal+ 2 off sides.",1647461226.0,1,
Close,1647461293.0,1,:c_Juventus:
Ahhhh there’s the De Sciglio I know,1647461389.0,1,:AC_Milan:
This game is putting me to sleep,1647461502.0,1,:FC_Barcelona:
MORATA NOOOOOo,1647461536.0,1,:Italy:
What are they doing,1647461791.0,1,:Real_Madrid:
"Juve gets to a chance too easily, no way they wont score (*soonish*)",1647462080.0,1,:r_soccer_user:
wow that finish..,1647462153.0,1,:r_soccer_user:
BROOO COME ON,1647462165.0,1,:c_Juventus:
I'm gonna cry bro,1647462192.0,1,:Italy:
"Pino is very strong there, Impressive.",1647462209.0,1,:r_soccer_user:
Noo so close glc,1647462215.0,1,:Real_Madrid:
Ffs,1647462220.0,1,:pride::Juventus:
Encouraging so far,1647462453.0,1,:Italy:
That is twice Villarreal was sooo close,1647462799.0,1,:Real_Madrid:
important save,1647463050.0,1,:Mexico:
How is Arthur doing this season?,1647463052.0,1,:FC_Barcelona:
Ahhh Matta so close,1647463071.0,1,:N_E_C:
And now Aurier is slipping again..,1647464874.0,1,:r_soccer_user:
He's being ordered to stand on the ball from Emery.,1647465709.0,1,:r_soccer_user:
here we go. some excitement.,1647466414.0,1,:r_soccer_user:
That's a penalty,1647466420.0,1,:FC_Barcelona:
If it was Legia referee wouldn't have any doubt ( ͡° ͜ʖ ͡°),1647466427.0,1,:Legia_Warsaw:
Clearlt a pen,1647466428.0,1,:Real_Madrid:
Pennnnn,1647466429.0,1,:Real_Madrid:
VAAAAAAAR,1647466430.0,1,:FC_Barcelona:
wtf!!,1647466468.0,1,:FC_Barcelona:
I dont care anymore LOL,1647466483.0,1,:c_Juventus:
why is rugani playing?,1647466487.0,1,:Brazil:
"Oh my fucking god, please save another one",1647466488.0,1,:pride::c_Juventus:
YESSSS!!!!,1647466493.0,1,:FC_Barcelona:
trashcan for a heart,1647466496.0,1,
Must be a pen,1647466501.0,1,:AC_Milan:
He did it against Samp!,1647466501.0,1,:AC_Milan:
That looks like a pen,1647466503.0,1,:transpride:
HAHAHAHHA,1647466514.0,1,:Argentina:
Fucking rip,1647466539.0,1,:c_Juventus:
Fuck me...,1647466541.0,1,:Juventus:
Every year,1647466572.0,1,:Juventus:
Goodbye Juve,1647466636.0,1,:Real_Madrid:
Bring in Bernardeschi,1647466647.0,1,:AC_Milan:
Let’s goooooooooo,1647466928.0,1,:Spain:
Vamos!! Villareal a cuartos,1647466929.0,1,:Real_Madrid:
Ref blind?,1647466930.0,1,
"Welp, that's it",1647466930.0,1,:pride::Argentina:
GOLLLLLLLLLLLLLLLLLLLLLLLLLLLLLLLLLLLLLLLLLLLLLLLLLLLLLLLLLLLLLLLLLLLLLLLLL,1647466931.0,1,
2-0,1647466931.0,1,:r_soccer_user:
RIP Juventus,1647466935.0,1,
PAAAAAAAAAAAU!,1647466940.0,1,:pride::Girona_FC:
Damn off that Danilo mistake. Yikes,1647466946.0,1,:Portland_Timbers:
WOW,1647466948.0,1,
Yikes de ligt,1647466955.0,1,:Feyenoord_Rotterdam:
Game set and match,1647466959.0,1,:Real_Madrid:
[deleted],1647466963.0,1,
Poor from de Ligt,1647467020.0,1,:Juventus:
Penalty? Lol,1647467258.0,1,
Lmaoooo,1647467287.0,1,:Arsenal:
Lmfao,1647467288.0,1,:Bayern_Munich:
Loooolll,1647467328.0,1,:FC_Barcelona:
LOL,1647467331.0,1,:LA_Galaxy:
Lol,1647467384.0,1,
balleeeerrrrrrr,1647467386.0,1,
No way,1647467392.0,1,:FC_Barcelona:
Who was the defender Moreno stole the ball From?,1647467401.0,1,:transpride:
Bruh,1647467412.0,1,
4 and 0 or Villa just beat a weak team.,1647467523.0,1,
"What am I going to be when I grow up, wise soothsayer",1647467167.0,12,:AS_Roma:
Lol,1647466796.0,2,
"Not really, he is extremely good and has a great foundation for the future. But, he has issues in his game 100%. His ball control in tight spaces to clean it 1st touch and beat the man in vertical is lacking and also his footwork/creativity in the last 3d is minimal.

Ffs, Reddit... the guy has his issues, he isn't perfect. I didn't say he was bad or just good or even very good. I literally said that he is extremely good. You can find issues with every player even Ronaldo or Messi, no player is 100% complete.",1647463923.0,4,:AC_Milan:
"Yeah. I honestly haven't watched him much, but he is actually pretty good",1647463726.0,2,:transpride:
I think its more a Juve regression.,1647467136.0,5,:Chelsea:
