text,time,upvote,flair
"TBH, I could easily see all three being eliminated in the quarter-finals if they get an unfortunate draw.",1647467181.0,1,:r_soccer_user:
Villarreal v. Benfica final.,1647467632.0,14,:Argentina:
One of my favourite coach,1647495263.0,3,
It’d be hard for them to not regard him as one. He’s bailed them out so many times from assists to goals. These kind of games scream for him.,1647461715.0,15,:AC_Milan:
100%,1647461805.0,3,:c_Juventus:
"Someone had to fill in for us

Didn’t expect so many takers tho",1647467626.0,8,:FC_Barcelona:
Or even just Pellegrini,1647464025.0,5,:Juventus:
"It's Juves hymn they play it every time, regardless of the result!",1647468105.0,6,:AC_Milan:
Maths checks out. Upvoted,1647467452.0,6,
He 180’d so quick you just knew.,1647466616.0,3,:AC_Milan:
Where does it rank compared to PSG last week?,1647467542.0,4,:r_soccer_user:
Italian psg,1647467528.0,5,:r_soccer_user:
"Either way, we get to blame Italians for it.",1647467731.0,8,:Real_Madrid:
PSG for sure. Their worth way more than juve,1647467574.0,4,:FC_Barcelona:
"Juve, no doubt.",1647467602.0,2,
"Psg was more of a defense flop, juve didn't create anything and didn't deserve to win over Villarreal",1647467625.0,1,:r_soccer_user:
2-0...,1647466921.0,4,:Bayern_Munich:
"Same, he deserved it after so many great performance",1647467384.0,3,:Villareal:
only hope for the league is if milan dont get drawn in pot 4 next season,1647467588.0,-6,:AC_Milan:
the four Iberian horseman!,1647467803.0,6,:Benfica:
"Every team wants Atleti, Villarreal and Benfica in their bracket. City, Liverpool, Chelsea, Real and Bayern are the teams to dodge.",1647471175.0,5,:Bayern_Munich:
how does the draw work for Quarters?,1647467924.0,2,
Waiting defensively and giving up chances left and right are not the same thing.,1647462484.0,3,:Italy:
Lahm remembers.,1647462748.0,3,:Bayern_Munich:
How is he seen among Juve fans? Has he redeemed himself for that stamp on Ramos?,1647462907.0,1,:Colombia:
[removed],1647463896.0,-3,
Legit haha,1647465299.0,1,:c_Juventus:
Everyone else injured,1647466609.0,4,:c_Juventus:
He's 28 and like 8 months away from his birthday,1647466779.0,3,:Argentina:
Hes 600months old,1647466861.0,3,:AC_Milan:
"He and I both, I swear it.",1647466745.0,2,:Germany:
i remember him tearing Barcelona apart in the first leg of the 2017 QF's,1647466753.0,1,:c_Copa_America:
Kind of my life,1647466788.0,1,:Feyenoord_Rotterdam:
And a semifinal upset by one of them?,1647467118.0,3,
Seeing one of them in the semis would be nice,1647467190.0,2,:Mexico:
"Subscribe, would be fun to watch",1647467579.0,1,:Villareal:
Smells like a 60m transfer to ManU.,1647467218.0,5,:Atletico_Madrid:
Barcelona enters the chat.,1647467149.0,2,:pride::Girona_FC:
I don’t know but this useless player is like a tourist he is touring all the clubs and no one notices what a conman he is his entire career.,1647467152.0,2,
Juve.,1647467190.0,2,:AC_Milan:
Hopefully Xavi has space for him,1647467206.0,2,:Real_Madrid:
"Hes got about 200goals, i wonder how",1647467252.0,0,:AC_Milan:
Barcelona. He runs in full circle,1647467168.0,1,:Real_Madrid:
Thank god they didn’t let Barcelona take him,1647467184.0,1,:FC_Barcelona:
"He whistled too early, should've let it play out",1647467565.0,2,:FC_Barcelona:
"Can't do that if the whistle was blown. Rules are _very_ clear about that. It's not something that the ref can ""decide"" after the fact.",1647467481.0,1,:Real_Madrid:
This is what I love about the Champions League!,1647467403.0,3,:Chelsea:
"I expected it, Villarreal are strong",1647467444.0,1,:FC_Barcelona:
Makes sense that City is in it,1647467520.0,7,:Bayern_Munich:
"Who cares, he is overrated shit",1647467758.0,0,
Yea we need another CB,1647467592.0,1,:FC_Barcelona:
"It's possible. Juve is going to overhaul the squad, which might take a few year.    
I don't think the De Ligt will want to wait for a few more years. And if he does stay, Raiola will make sure that both will be compensated accordingly.",1647467730.0,1,:Bayern_Munich:
like real doesn't know what thats like...short memory u must have. Real did 7 round of 16 exists back to back not that long ago,1647467923.0,5,:Juventus:
Cries in Barça :'(,1647467064.0,1,:FC_Barcelona:
always has been,1647467080.0,1,
553 vs 362 according to transfermakt.,1647467292.0,2,:Chelsea:
"At least it's not Bodo fucking Glimt.

Dreadful performance anyway... I hope it will serve as some kind of wake up call.",1647467654.0,0,:Juventus:
"Juve play well—all I see is praise for De Ligt, Dybala, and Cuadrado

Juve play bad—They all need to be sold

which one is it haha",1647491962.0,2,:r_soccer_user:
"Neither are we, it’s 0-0!",1647462032.0,9,:c_Juventus:
Emery can pull off a gritty masterclass. I still believe.,1647462097.0,2,:Real_Betis:
I think they can,1647463144.0,5,:transpride:
Pellegrini should play instead of DeSciglio.,1647463916.0,3,:r_soccer_user:
The one who has missed 423 days due to injury in the past 3 seasons?,1647463802.0,7,:AC_Milan:
"If he was 2 years younger, maybe",1647463847.0,3,:c_Juventus:
It would be weird for a 50/50 to go our way this season so I really don’t like the idea of PKs,1647464258.0,3,:Italy:
[removed],1647464877.0,5,
"I remember some Lazio away fixtures where we were less than a hundred, it felt like we were going to watch an amateur game",1647466164.0,4,:pride::Lazio:
It's like watching golf,1647466101.0,4,:FC_Barcelona:
"Hey watching chess is great, with a GM commentating and explaining everything",1647466527.0,1,:c_Atletico_Madrid:
"Literally the minute they get Moreno on, and actually try to get forward they get a penalty. Fortune favors the bold.",1647466482.0,1,:Dinamo_Zagreb:
"Italian football is not serie a, Italian football just won the Euros",1647467336.0,-1,:pride::Lazio:
I imagine all of them sitting there just starting lol even the Villareal players showed up first.,1647467457.0,1,
"Isn’t it part of the double jeopardy rule or whatever. 

You can’t give a red + a pen?",1647467395.0,3,:AC_Milan:
It didn't seem intentional,1647467374.0,2,:FC_Barcelona:
not sure if it was intentional,1647467359.0,1,
Keeper is in the goal,1647467392.0,1,:pride::Lazio:
Everytime. You get used to it eventually... Sigh,1647467747.0,1,:Juventus:
Maybe they decided it wasn't intentional since he tripped?,1647467607.0,1,:Ajax:
The rule changed so teams don’t get triple penalized for a simple foul.,1647467783.0,1,
Not intentional,1647467821.0,4,:FC_Barcelona:
"La Liga has the most Champions League titles and Europa League titles. How can their teams be trash, if they have won more European trophies than anyone else???",1647519703.0,2,
TBF inter gave Liverpool two tough games.,1647467605.0,12,:r_soccer_user:
0 italian team vs 3 spanish in CL,1647467627.0,6,
Imagine allegri vs cholo next round,1647461395.0,1,:r_soccer_user:
So you want Juve to win 3 - 2 and advance to QFs.,1647461666.0,3,:Real_Betis:
Why are you so against us?,1647461723.0,3,:Juventus:
"was gonna watch this game to see how Vlahovic plays, gonna have to watch Liverpool Arsenal instead

Can't stand commentators who persist with their pronunciation of names even after their partners say the name correctly a million times.",1647462259.0,1,:pride::Leicester_City_FC:
Haaland has missed like 3 months lmao,1647464372.0,4,:r_soccer_user:
He looks like Rollo from Vikings,1647464820.0,3,
Great name too,1647465940.0,5,:pride::Argentina:
Si li dice el Rafa es verdad,1647466435.0,1,:Villareal:
Bro they’re focusing on the league apparently.,1647466652.0,1,:AC_Milan:
Looks like Collina but hes been hitting the gym,1647466771.0,5,:AC_Milan:
S(PAIN),1647467027.0,1,:Real_Madrid:
"Allegri decided to take extra courses in Narniastan during his sabbatical, because he’s taking his shit football to a new low. Sad for Vlahovic, Cuadrado and Locatelli.",1647467122.0,1,:Borussia_Dortmund:
Arrivederci,1647467107.0,3,:AC_Milan:
Benfica knock out Bayern,1647467395.0,1,:FC_Barcelona:
yes,1647460811.0,5,:Juventus:
why? juventus are ass,1647467404.0,2,
probably the team i hate the most after united,1647468519.0,7,
"I didnt see it, but either way the referee ended it insanely fast",1647464020.0,2,:c_Juventus:
"no, the ref has been spot on so far.",1647464180.0,2,:Juventus:
Worry about that in 2 years. For now he’s pur player,1647463944.0,8,:c_Juventus:
"He would never go to City, only maybe Madrid and that's only if we still suck in 2 years",1647464078.0,3,:Italy:
I don’t think we need him for a few years so you’re still good lol,1647464121.0,3,:Real_Madrid:
I think city enquired about him,1647463884.0,1,
Is this your first time watching juve all season?,1647461361.0,2,
We play passive against bottom table teams,1647461392.0,1,:Italy:
It's exceedingly easy to believe.,1647461407.0,1,
I'm shocked. Shocked I tell you.,1647461440.0,1,:Juventus:
Allegriball,1647461516.0,1,:Canada:
"Emery 8W 2D 1L against italian teams. To be honest that 1L happened against Allegri Juve in today's stadium, emery coached Sevilla at that time",1647461759.0,2,
Rulli being jesus and the crossbar kept him from being on at least a brace,1647463571.0,9,:Juventus:
unlucky.,1647463546.0,8,:Juventus:
Pretty good imo,1647463548.0,4,:FC_Barcelona:
I think someone cursed him.,1647463668.0,1,:c_Juventus:
he is really not that good with long passes.  Locatelli is much more accurate with those in my opinion.  Also Arthur is just finding a bit of confidence and consistency.,1647464215.0,4,:Juventus:
His grandma,1647465156.0,2,:AC_Milan:
His hair stylist probably,1647465100.0,1,:Real_Madrid:
"A tank made of papier mache, apparently.",1647466024.0,2,:Argentina:
Most low intensity knockout game ever,1647466464.0,1,:c_Atletico_Madrid:
Looks like it was cut by his gf after a night of drinking,1647466897.0,3,:pride::Argentina:
looks so bad i got angry when i saw it on twitter the other day,1647466898.0,2,:Boca_Juniors:
"Thank god we are basically guaranteed the 4 spots in CL, we have been making no coefficient points lately",1647467042.0,3,:pride::Lazio:
And also one of the very best.,1647467078.0,4,:Atletico_Madrid:
Elaborate please,1647467153.0,2,:Real_Madrid:
Barca dna,1647467120.0,2,:Real_Madrid:
Does the final against Real Madrid (4-1) count?,1647469097.0,2,
"November vs Chelsea, lost 4-0 and was 4-1 aggregate",1647469772.0,1,:Boca_Juniors:
He also pulled out the Moratey.,1647462192.0,1,
I dont get it?,1647463492.0,1,:transpride:
Not sure what you mean? He didn't play great but the 1st and 2nd goal weren't his mistakes or something.,1647467828.0,0,:Netherlands:
You had a part of his rights I think but we ended up buying it,1647463243.0,3,:Real_Sociedad:
I tought he was 22 or something,1647463361.0,3,
"Replying to myself so i can find the thread
E: Oof reddit doesn't give you notification to your own reply. It's a L for me",1647463199.0,2,:transpride:
Don't think he actualy played a game for City though.,1647463347.0,2,:AC_Milan:
If Villareal scores then Juventus is losing.,1647464603.0,6,:Bayern_Munich:
Should have brought Kepa on for the pen.,1647464591.0,3,:Juventus:
Typical commentary really,1647464583.0,1,:c_Juventus:
Football is about outscoring your opponent. If we cant score and they can then that’s that. We have won playing “worse” for years,1647465086.0,3,:c_Juventus:
"I actually think if we go through this would give us more confidence in the league. If we lose it's better for you because we might lose motivation, that's what happened last season with Pirlo",1647466809.0,1,
What does sit rep mean?,1647463802.0,3,:transpride:
He isn't a very good Goalie tbh,1647463275.0,0,:Arsenal:
Tryna look like bully Maguire,1647464952.0,3,:Juventus:
You've never watched a game which did not include the team you support?,1647465349.0,5,:transpride::Napoli:
That was me watching Man unt vs Atlético,1647465315.0,2,:Villareal:
Yes,1647465654.0,1,:Villareal:
Why?,1647465734.0,1,:transpride:
"Bro, you’re preaching to the choir. I have nothing on the ladies being there but since they replaced literally every male, trying to almost “prove us wrong” instead of just delivering proper commentary on the match, they just look unprofessional. They were talking about shootouts in the 7th minute for f sake.",1647465815.0,1,:AC_Milan:
"It seems like I hardly see refs ever give penalties, always Var",1647466536.0,1,:pride::Lazio:
"To score a second?

Edit: LMAO called it",1647466901.0,3,:Borussia_Dortmund:
"stay calm brother, you're almost there",1647466947.0,1,:Real_Madrid:
He never had the chance tbh,1647466950.0,1,:pride::Argentina:
Can't do that after the whistle. Very clear in the rules.,1647467317.0,2,:Real_Madrid:
Min 40 villa wasting time. Wtf,1647463456.0,2,:AC_Milan:
Now I’ve gotta google.,1647466743.0,5,:AC_Milan:
a bald fraud with no CL's,1647467360.0,1,:Bayern_Munich:
"They were 4th in Serie A after 29 games last season, they're 4th now while paying A LOT less money.",1647467164.0,1,:Bayern_Munich:
how did united do yesterday?,1647467591.0,1,
Yes that's why United are in the dumps,1647467645.0,-4,:Liverpool:
They were very well balanced before she came in so yeah,1647467649.0,-4,:FC_Barcelona:
Rent free huh?,1647467633.0,-1,:Benfica:
isn't he basically a Dybala? not sure how injury prone is he though,1647464045.0,3,:Juventus:
Penalty is close enough.,1647466586.0,1,
From Cl to Europa league music? That’s downgrade,1647467387.0,2,:r_soccer_user:
"A back 3 of Lenglet, E.Garcia & De Ligt would like you. wouldn't it?",1647467452.0,1,:pride::Girona_FC:
Pls no,1647462498.0,5,:Juventus:
Coming from a spurs fan 🤣😂,1647467182.0,1,:r_soccer_user:
I have seen more CR7 fans chatting shit about Juve than the other way around when he signed for Man U - in the end Juve are more likely to qualify to CL than Man U.,1647467449.0,0,:Bayern_Munich:
It was expected with United tho,1647467720.0,6,
"Juve are still qualifying to CL without Ronaldo, where is he with Man U? :)",1647467495.0,5,:Bayern_Munich:
He is the problem with United lol,1647467609.0,2,:Liverpool:
"Yes, they could have fallen from grace earlier.",1647467528.0,1,:Olympique_de_Marseille:
Welcome to corto muso,1647461311.0,2,:r_soccer_user:
"He's a fundamentally chaotic player. Which is why he's almost always useless, but that one time can be great.",1647465474.0,3,:transpride::Napoli:
"There's also extra time, dybala will be saved for that I think. Bernardeschi in earlier imo",1647465756.0,2,:Juventus:
French commentators say capú,1647466228.0,2,:Algeria:
ni puta idea,1647466268.0,1,
Él es Francés no? Es 'Capú',1647466290.0,1,:Malaga:
"El es francés, casi mejor preguntar a los que hablan francés no?",1647466356.0,1,:FC_Barcelona:
C'MON,1647466465.0,2,:Villareal:
Did he play in City?,1647466861.0,1,:pride::Girona_FC:
They spent a lot of time in the first half passing the ball around while Juve just watched.,1647466876.0,4,:r_soccer_user:
Pau Torres?,1647467088.0,2,:Real_Madrid:
The rule changed so teams don’t get triple penalized by a single foul.,1647467472.0,1,
He had an error that kept Netherlands out of the 2016 Euro's and then a handball and red card that knocked us out of the 2020 Euros. And somehow there's still Bayern fans that want him.,1647467645.0,1,:Netherlands:
It's why we got rid of Danilo a loooong time ago,1647471928.0,6,:Real_Madrid:
Cuadrado was arguably motm last year against porto and had 19 assists in all comps. Solid this season too just a bad game.,1647477597.0,5,:r_soccer_user:
">I’m on my knees

Interesting",1647460883.0,6,:transpride::Real_Madrid:
"they say if you can master the allegri's way, you'll be able to  stop your heart at command.",1647463062.0,4,
Parejo is the 3rd best player of La Liga by stats.,1647461254.0,1,
Just need a striker.,1647461394.0,1,:r_soccer_user:
and their best player is not in the pitch,1647465397.0,1,
Activate night mode,1647463489.0,6,:c_Juventus:
"The black magic is only in the league.  If you want both get Zidane, noob.",1647465414.0,7,:transpride::Napoli:
Done,1647466671.0,1,
"Fuck off lol, no it's not a dive. It's not a good move to keep your feet planted when you get tackled.",1647466523.0,1,:Real_Madrid:
[deleted],1647467520.0,-2,
"She saw the ref give a yellow to De Ligt and didn’t have a clue it was a penalty, she was genuinely surprised",1647467553.0,4,:FC_Porto:
"If we get the ball, then maybe",1647465863.0,4,:Villareal:
Or against Roma two months ago,1647462496.0,12,:Juventus:
"It's kinda bewildering tbh, our best performance I think when we looked both hungry and well drilled was against you guys",1647462671.0,1,
">	Fucking can’t wait to see teams spank Villarreal though

It’s not like Villarreal had any kind of bad behavior for you to say something like this.",1647467738.0,4,
Cry about it,1647467508.0,5,:Villareal:
because he threw himself in front of it,1647463033.0,1,:AFC_Bournemouth:
[removed],1647463705.0,1,
Happened on 8th. Why?,1647464430.0,2,:transpride:
it’s so frustrating because this season he has been playing well and if he had that passing range it would make it even better,1647464516.0,2,
"He just did it! Challenge complete, i guess",1647464777.0,1,:c_Juventus:
"Because he's been good? Literally our main attacking outlet on the wings, as crazy as it may sound.",1647464386.0,2,:c_Juventus:
defensive reasons,1647464376.0,1,
Pellegrini better as a sub,1647464454.0,1,:c_Juventus:
[removed],1647464760.0,15,
Because the stadium isn't allowed to be full. There are still restrictions.,1647464756.0,3,:r_soccer_user:
So no improvement since he left barca? Kinda was his trademark here besides the C&H.,1647465617.0,5,:Mexico:
"It was tough. I don't think it's never a pen, but it could have been a no call too",1647466600.0,1,:pride::Argentina:
"Knee on shin, he made a challenge and never got the ball. It's a foul, no matter how Coquelin falls (shouldn't even need to fall).",1647466583.0,0,:r_soccer_user:
"He literally came on after we were a goal down, on the pitch for 10 minutes. Wtf is he supposed to do. Allegri is fucking clueless, he was clearly keeping subs for extra time instead of trying to win...",1647467646.0,4,:Juventus:
He got a haircut,1647467602.0,2,:FC_Barcelona:
You obviously don't watch many DeLigt games then,1647467496.0,3,
"He's been amazing this season, he was unlucky today with the penalty",1647468795.0,2,:c_Juventus:
"I think he tried to bend the ""supporting arm"" rule and it may have almost worked.",1647467682.0,1,:Netherlands:
He was good at Real Betis so they probably tought that they could bring that Lo Celso back.,1647462448.0,1,
No,1647464446.0,3,:Villareal:
"dont know but. playing against juve, everyone upgrades as we leave them the ball",1647464360.0,2,
Not everyone needs to be PL compatible lol,1647465623.0,3,:transpride:
Aged like milk,1647466546.0,5,
Because its better,1647461548.0,6,
CL KO,1647461553.0,2,:transpride::Real_Madrid:
Has Arsenal v Liverpool started yet?,1647461544.0,1,:r_soccer_user:
Not in champions we dont,1647466849.0,2,:c_Juventus:
Villareal have the spanish europa boost tho.,1647466898.0,1,
Unlucky,1647467006.0,1,:Real_Madrid:
villareal dont shithouse lol,1647462711.0,8,
"You do know scoring goals is actually a difficult thing to do for some of us, right?

Typical privileged Bayern fan with their 8 goals per game ""just score some goals dude"" smh",1647462920.0,5,:Olympique_de_Marseille:
They dont shithouse,1647462668.0,2,
Villareal plays better football than Juve,1647462867.0,1,:Palestine:
"Of the two teams, Villarreal are not the shithouse one",1647463053.0,-1,:Italy:
What control,1647466599.0,3,:AC_Milan:
"""Control""",1647466762.0,1,
"I would agree if it was just normal American pundits, but having Carragher, Richards, and Henry etc has been so great for a change.",1647461395.0,3,:c_Juventus:
Is there any good former player that is also a good analyst?,1647464756.0,1,
I’m immediately having End Game flashbacks with that only girl scene.,1647461328.0,0,:AC_Milan:
Least cringe teenage boy on r soccer,1647461472.0,1,:Juventus:
"of course it’s a pen, it’s literally a goalkeeper save",1647467333.0,5,
Handball,1647467327.0,3,:Sevilla:
"There's a rule that an outfield player cannot save a goal with his hands, weird right?",1647467421.0,2,:r_soccer_user:
Cos he literally saved it with his arm,1647467470.0,2,:r_soccer_user:
Maybe spend 70m on another striker so you can score,1647466725.0,5,:Inter_Milan:
Neither have Juve tbf,1647466708.0,2,:c_Atletico_Madrid:
Well they did played better on the first leg,1647466743.0,1,:pride::Argentina:
I just want Juventus to lose because they're Juventus,1647462820.0,0,:AC_Milan:
I just want juve to lose because i dont want them to win,1647463007.0,1,:AC_Milan:
"No there’s a bunch of clueless people out there, sadly",1647461587.0,4,:c_Juventus:
Wtf,1647461681.0,2,:Juventus:
Villareal are passing and not really relying on individuals at all.,1647463410.0,1,
"They’re really not looking dangerous, Juve was the best team in the first half.",1647463913.0,12,
Villareal are in the yellow jerseys,1647464006.0,12,
Wtf game were you watching?,1647464027.0,7,:Italy:
more in danger of De Sciglio slicing one into our goal under no pressure,1647464081.0,4,:c_Juventus:
[removed],1647462558.0,3,
aren't you describing every penalty ever besides handballs??,1647466712.0,5,:Bayern_Munich:
So going by your logic only a handball can be a penalty?,1647466795.0,2,
Lol look at the knee man that’s a clear contact,1647466468.0,2,:FC_Barcelona:
Cringe,1647464771.0,7,
Wtf did I just read.,1647465226.0,2,:AC_Milan:
Clearly refs favoring Villarreal 🙄,1647466851.0,2,:FC_Barcelona:
"He clearly touched him, still it's a 50/50 call",1647466681.0,6,:pride::Argentina:
It looked like he touched him but definitely didn't touch the ball,1647466723.0,3,:FC_Barcelona:
It was a close call but he quite clearly touched him,1647466785.0,2,:Scotland:
Hahaha you are not for real are you?,1647467102.0,1,:Real_Madrid:
Because they are the opposing team,1647462234.0,8,:Juventus:
Because they are Villareal????,1647462229.0,3,
Juve is lucky Villarreal only started attacking in the last 10 minutes honestly,1647466709.0,0,
De Sciglio is good. Can deliver a good cross at least,1647461101.0,1,:c_Juventus:
Injured,1647461195.0,5,
The past few games he is starting to show us why Barcelona bought him in the first place. I just hope he gets better at passing forward,1647463235.0,5,:Juventus:
"Better, has improved a lot, still has a long way to go as a regista though, too defensive minded in a way",1647463139.0,5,:c_Juventus:
They were eliminated by Lyon and Porto in the last two tournaments.,1647466999.0,2,:r_soccer_user:
Danilo,1647467447.0,2,:Bayern_Munich:
Danilo 😂,1647467568.0,1,
nah Spanish rebirth,1647467185.0,1,:Real_Madrid:
forgot the dives,1647462944.0,-2,
"I'd say this is worse, because in theory they were the strongest team and they were at home. PSG-Real Madrid was much more evenly matched, and PSG was playing in Madrid.",1647467673.0,3,:Argentina:
"This is worse. At least PSG crumbled to a massive team. Villarreal are good, but not that good.",1647467671.0,2,
Will we see him bottling the 2-0 in 10 minutes?,1647467061.0,1,:pride::Girona_FC:
"They do a draw this Friday, any team can play any team, then they also do a bracket for the semis and final so like the winner of Q1 v Q2 will play the winner of Q3 v Q4 in the semi and so on",1647468380.0,5,:Real_Madrid:
For sure. When Dybala isnt on Hes the one creating all the threats,1647463383.0,1,:c_Juventus:
"lol what? one ball on the woodwork, 2 incredible saves by Villarreal keeper, and a couple of other dangerous chances, meanwhile, they had 2 shots, how are we doing bad?",1647464149.0,3,:Juventus:
"Hey the one time I can say it I will. That said, we're clearly going to lose this game 🦉🦉",1647464056.0,2,:Juventus:
he shouldnt be part of the roster its what i mean the last option should be a better player,1647466661.0,1,:AC_Milan:
Thank god he didn’t come to barca,1647467218.0,1,
Xavi is a big fan of Morata,1647467253.0,1,:Real_Madrid:
"May i interest you in samuel umtiti, world cup winner",1647467969.0,3,:FC_Barcelona:
At least we have 4 trophies to make up for it. What do you have?,1647468121.0,8,:Belgium:
Lmaoo don’t care tbh we’ve won enough UCLs since then to make up for it,1647468060.0,0,:Real_Madrid:
"Nah, they play well, but they deserve to play at another club, thats my point",1647528228.0,2,:transpride::St_Pauli:
Juventus goes through on away goals !,1647462096.0,2,:Algeria:
Too many close calls already. Juventus is gonna convert something,1647463253.0,3,
J Medical is always looking for new clients,1647463912.0,3,:c_Juventus:
"Yeah, I don’t think it will end well if it gets to that 😐",1647464352.0,3,:Juventus:
Messi-like xD,1647465060.0,2,:transpride:
"It looked like a whole wave of Villarreal players were coming to the box and I don’t think I saw a single Juve shirt on the reverse angle replay. They were all just walking near the halfway line. Like, wtf? 

I understand you’re losing and not going through… but you can’t just give up like that, if so then just leave the pitch now. It’s a disgrace to the fans and everyone who has worn the shirt before them.",1647467601.0,1,:AC_Milan:
"Only if you make an attempt to play the ball, otherwise it would be a red",1647467971.0,1,:Real_Sociedad:
"It was intentional, he moved his arm to block the shot",1647467474.0,1,:FC_Barcelona:
"But how does that matter when it's a direct goal threat? Also, why not let the goal stand for an advantage?",1647468265.0,1,:FC_Barcelona:
Imagine being the ref for that game,1647461663.0,1,:AC_Milan:
The drama of it would be great so wouldn’t mind it tbf,1647463196.0,1,:Real_Madrid:
Lmao it’s nothing personal I promise I just like seeing smaller teams beat big teams plus Villarreal are a Spanish team,1647463117.0,2,:Real_Madrid:
Too bad for him.,1647464809.0,1,:r_soccer_user:
