,text,time,upvote,flair,phase
0,"I’ve won 9 Retro Bowls on mobile and I just won my first on Switch. 

Desperate NFL teams, I’m willing to start doing interviews.",1644785188.0,163,:Packers: Packers,1
1,I’m a ball of fucking nerves and there’s still 3 hours until kickoff.,1644784339.0,593,:Bengals: Bengals,1
2,This day has been the longest month of my life,1644784732.0,263,:Bengals: Bengals,1
3,Watching the NBC pregame and just heard Sean talk for the first time. Not gonna lie didn't expect that voice to come out.,1644784316.0,95,,1
4,Ochocinco died for this.,1644784287.0,291,,1
5,Feels like people aren’t talking about how this is probably going to be a defensive slugfest. Low scoring game incoming,1644784405.0,262,:Bengals: Bengals,1
6,My anus could snap a steel beam in half rn,1644785845.0,54,:Bengals: Bengals,1
7,"We're in the fucking Super Bowl and it's one of the coolest culminations to one of the coolest seasons I have ever seen from my city's team. 

Still hard to believe but we. are. here!",1644784673.0,135,:Bengals: Bengals,1
8,Go Average Joes Gym,1644784266.0,93,:Chiefs: Chiefs,1
9,Damn the Chainsmokers suck,1644784967.0,89,:Chargers: Chargers,1
10,Oh boy the chainsmokers,1644784936.0,46,,1
11,"Yall knees ready for the “funny” super bowl commercials?

My grandad lost his knees to the superbowl of 03 to excessive knee slapping. 

Protect your knees people",1644790373.0,46,,1
12,"“The crowd is loving it out here”

The crowd was just kinda standing there",1644785120.0,38,,1
13,"Really love the stark difference in the energy each team seems to be bringing to this Super Bowl.

LA: We're happy to be here, Stafford deserves a shot.

Cincinnati: I WILL NAME MY FIRST DAUGHTER BURROW, I WILL CHUG THE MEAT SLOP, WHEN WE WIN THE KEENING WAIL WILL STOP THE SUN IN ITS TRACKS AND WE WILL HAVE THREE DAYS OF DARKNESS SO THAT WE CAN CELEBRATE WHERE GOD CAN NOT SEE OUR SINS.

Anyway, as a Cincinnatian, very stoked for the city and especially the die hard fans.

WHO DEY",1644784819.0,379,,1
14,Honestly insane that the Bengals are in the freakin Super Bowl lol,1644791076.0,36,:NFL: NFL ,1
15,"Over/Under number of times Cris Collinsworth cums in his pants comparing Joe Burrow to Tom Brady: 4.5

I’m taking the over.",1644788248.0,33,:Jets: Jets,1
16,My heart is pulling for the Bengals but my brain says Rams.,1644788564.0,33,,1
17,[deleted],1644792062.0,31,,1
18,"I was at Walmart earlier and passed a guy all decked out in Rams gear, so I said ""go Rams"". He saw the Falcons hoodie I was wearing and said ""the Atlanta Falcons?"" and I said ya, then he responds with ""Oh I'm sorry"". Fuckin lol. I will never ever forgive Shanahan for that game. Never. Not even Walmart is safe.",1644787694.0,62,:Falcons: Falcons,1
19,the Chainsmokers? what year is it?,1644784904.0,58,:Bears: Bears,1
20,"NBC: Just so everyone knows, we hired a Deaf actress to sign the song.

Deaf viewers: That’s great! Are you going to broadcast her signing in the corner?

NBC: Whoa, let’s not get too crazy with this! We got her. We acknowledge that we got her. We think that’s enough. And a thank you wouldn’t kill ya.",1644794405.0,26,:Steelers: Steelers :Bills: Bills,1
21,Drew Brees is the white guy in the racism conversation 🤣,1644786138.0,50,:Vikings: Vikings,1
22,My dream of being a Super Bowl champion was hindered by the fact I never played organized football and don't like to work very hard,1644787897.0,25,,1
23,"I actually don’t mind either team, but I do prefer the Bengals win so they can give hope to the fanbases that have had mostly historically terrible franchises that never got to see their team win it",1644784668.0,120,:Jets: Jets,1
24,"I got the last 12 pack of bud my walgreens had, the jungle is ready",1644788532.0,23,:Bengals: Bengals,1
25,Can't believe The Rock found time away from doing his 500th movie about being in a jungle.,1644789897.0,21,,1
26,"You know who my favorite member of Who Dey Nation is?

Who Dey and the Blowfish",1644791100.0,23,:Packers: Packers,1
27,DJ Zedd knows how to play some ACDC. 😂,1644791216.0,21,:Vikings: Vikings,1
28,"#*Make Dan Sell the Team*

Go Super Bowl",1644787558.0,21,,1
29,They’re called the Chainsmokers because they cause cancer,1644789045.0,21,:Broncos: Broncos,1
30,#The Amount Of Dan Snyder’s Owning NFL Teams Is Too Damn High,1644790498.0,21,,1
31,Watching this pregame show has been a complete waste of time but I don't care enough to move from the couch,1644791012.0,20,:Bears: Bears,1
32,We get it we suck,1644791484.0,19,:Lions: Lions,1
33,lol they put the camera on the wrong woman.,1644794302.0,18,:Rams: Rams :Rams: Rams,1
34,I really don't think Jeff Goldblum was acting in Thor Ragnarok. Dude straight up was just being himself.,1644786594.0,18,:Chargers: Chargers,1
35,If the Bengals win today I’m getting Zac Taylor tattooed on my ass,1644788321.0,19,,1
36,"If you go to Applebee's so much that they know your name, please seek help, there are resources out there to assist you.",1644792333.0,18,:Bengals: Bengals,1
37,If you drive drunk you’re an irredeemable piece of shit.,1644793002.0,19,:Ravens: Ravens,1
38,Who are these people who finish watching a commercial online?,1644790348.0,17,:Bears: Bears :Bengals: Bengals,1
39,"I may be a bit biased but this ""Joey Cool"" narrative is driving me insane",1644791837.0,19,:Steelers: Steelers,1
40,Oof this song is really not a good sounding one,1644792791.0,18,:Bills: Bills :Packers: Packers,1
41,They're really making the players stand for this rn?? There's 40 mins before the game lmao,1644792797.0,19,:Colts: Colts :Lions: Lions,1
42,"Stop patting yourself on the back Hollywood, you out of touch fucks.",1644793195.0,18,:49ers: 49ers,1
43,"Not sure who she is but she did a good job.

And I loved that NBC just confirmed they think all brown woman look alike by getting the graphic wrong.",1644794390.0,18,,1
44,"Bengals win, multiple one-point safeties, Scorigami achieved",1644784919.0,15,:Bears: Bears,1
45,"Lmao what if Jeff was like 

""The begals uhh.. found a way..""",1644786529.0,16,:Bengals: Bengals,1
46,"If I'm nervous, I imagine regular Bengals fans are fucking sweating",1644788302.0,17,:Lions: Lions,1
47,"The fact that 4K TVs have been widely available for YEARS now and nbc still doesn’t broadcast the Super Bowl in 4K, is absolutely ridiculous. Why aren’t more people upset about this?",1644791570.0,15,:Titans: Titans,1
48,Bro the performers couldn’t even afford an inside ticket 😭,1644792826.0,16,:Dolphins: Dolphins,1
49,"NBC is greatly overestimating the fucks people give about celebrities. I mean, fuck, no one wants to watch the Oscars. What makes them think we want more star fucking in football?",1644793216.0,17,:Steelers: Steelers :Bills: Bills,1
50,Did Brees just broadcast some tampering footage? Lol,1644786599.0,15,:Raiders: Raiders,1
51,Today marks one month since I had my last soda....and today will be my toughest test,1644789733.0,16,:Rams: Rams :Lions: Lions,1
52,Fuck you NBC & the NFL for not broadcasting the game in 4k. You multi billion dollar cheap fucks couldn't pony up the money to get 4k cameras? Europe has had 4k sports for years ON BROADCAST TELEVISION.,1644790104.0,15,:Falcons: Falcons,1
53,If Eli Apple gets a pick six me and my buddy will dock.,1644790900.0,15,,1
54,"Death, taxes, and making it socially acceptable to run an entire segment taking a public shit on Detroit.",1644791667.0,16,:Steelers: Steelers,1
55,[deleted],1644791950.0,17,,1
56,That wasn’t Jhene Aiko. Fucking embarrassing,1644794297.0,17,:49ers: 49ers,1
57,Is this the NFL or XFL championship game?,1644795245.0,16,:Saints: Saints,1
58,#Bingo Bengo,1644784434.0,33,:Bengals: Bengals,1
59,Let’s go Bengals!,1644784244.0,96,,1
60,“Dj Zedd” bro it’s just Zedd haha,1644791240.0,15,:Giants: Giants,1
61,Huge missed opportunity to not have this game exclusively on Nickelodeon with ManningCast as the only option.,1644792395.0,14,:Cowboys: Cowboys,1
62,"I know it’s cool to be cynical, but I was genuinely touched when those two robots dropped a giant Lombardi trophy onto the field.",1644793545.0,15,,1
63,"Sea to shinning sea

> Shows inland Cincinnati",1644794371.0,14,:Dolphins: Dolphins,1
64,"I'm really feeling now how long the 5 hour pre game is. They've talked about the game already, all the breakdowns, all the matchups, all the stories. Even got the race issues out of the way. Still 2 hours until kickoff. What else is there to talk about besides more stories unrelated to football?",1644787701.0,14,:Giants: Giants,1
65,Kate McKinnon needs a new agent. She’s talented and funny but just doesn’t stop getting put in crap,1644789752.0,16,:Giants: Giants,1
66,OH FUCK DJ ZEDD PREGAME SET- ITS POPPING OFF YALL,1644791216.0,14,,1
67,"“Let’s throw it over to Grammy award winning DJ Zedd”

Proceeds to play an unmixed “Thunderstruck”",1644791254.0,13,,1
68,"""I'll go wherever you go."" Bro she wanted to leave before the trade was even a thought.",1644791472.0,13,:Lions: Lions,1
69,Heard they’re going to rap Gruden’s emails at Halftime,1644793144.0,14,:49ers: 49ers,1
70,20 bucks Collinsworth somehow finds a way to mention Mahomes today.,1644793453.0,14,:Chargers: Chargers,1
71,People saying they can’t wait for the commercials like they don’t say fuck commercials 364 days out of the year.,1644793456.0,14,,1
72,"> **THE** Oregon State university

Who are you trying to impress?",1644793869.0,15,:Bengals: Bengals,1
73,"National anthem: Mariah Carey 

Ode to joy played on the piccolo: Pete Davidson 

Beethoven’s 5th symphony: Antonio brown 

Mambo #5: will Smith 

Then at 8:47 we’ll kick off",1644794051.0,13,:Buccaneers: Buccaneers,1
74,"Our flyover this evening: F-22, P-51, A-10, F-16, F-35",1644794418.0,12,:Bengals: Bengals,1
75,Anyone ready to die tonight?  Let's play a drinking game - drink every time Collinsworth finds a way to bring up Mahomes or Brady.,1644794751.0,13,:Bills: Bills,1
76,Chase just beat Ramsey in the Super Bowl. No questioning that pick ever.,1644797312.0,15,:Eagles: Eagles,1
77,Imagine being the guys tasked with stopping Aaron fucking Donald,1644807871.0,14,:49ers: 49ers,1
78,It's the Year of the Tiger. Bengals win. Bank on it.,1644784326.0,59,,1
79,Is there a bet on Putin invading Ukraine during the game?,1644788289.0,14,:Chiefs: Chiefs,1
80,Not the chain smokers,1644788834.0,15,:Vikings: Vikings,1
81,If Eminem doesn't perform Lose Yourself I'm sending a strongly worded letter..,1644789547.0,14,:NFL: NFL,1
82,"Peacock, Tiger King was fun the first time because the people were real and trashy and we were all bored as fuck, I really don’t need it again but fake.",1644789684.0,13,:Packers: Packers,1
83,"Wait, Top Gun still hasn't come out? Fucking a 'Rona...",1644790933.0,12,:Raiders: Raiders,1
84,Stafford gotta be holding up like 70% of the Rams likability,1644791687.0,14,,1
85,What am I watching,1644792767.0,13,:Vikings: Vikings,1
86,"https://imgur.com/a/uBmL9Bd

It’s a beautiful day for football",1644793010.0,14,:Chargers: Chargers,1
87,The only thing missing from this glorious event is a dance number from Jackson Mahomes,1644793642.0,13,:Bears: Bears,1
88,"The stache on that long snapper.

Fuck we're in trouble.",1644793944.0,12,:Rams: Rams :Rams: Rams,1
89,Super Bowl commercials don’t hit as hard anymore. We’re all so bombarded with ads everywhere now they’ve lost most of their impact.,1644794143.0,14,:49ers: 49ers,1
90,"NBC is like a kid at their first buffet.  They just try to fit every thing on the plate, pouring hot gravy over the salad and scooping jello on the fried chicken.

Frick.",1644794287.0,14,:Bengals: Bengals,1
91,Jhene Aiko?! That’s actually a good pull NFL,1644794315.0,15,:Dolphins: Dolphins,1
92,They showed Mickey Guyton instead of Jhene Aiko for a second there,1644794317.0,14,:Texans: Texans,1
93,"Damn, Madden spent his whole life on the game and the NFL gave him 10 seconds during the super bowl",1644794339.0,13,:Seahawks: Seahawks,1
94,"Always wonder what foreign audiences think when they see all this. The pageantry, the stadiums, etc",1644794440.0,12,:Ravens: Ravens,1
95,Why the fuck is the Rock cutting a Super Bowl promo?,1644795183.0,12,:Steelers: Steelers,1
96,"I hate refs but got to ask...

&#x200B;

WTF was that hail mary at 2nd @ 3 with 40 seconds on the clock and 2 timeouts? If they didn't fuck that call up so epicly the end might've been different",1644808709.0,14,:49ers: 49ers,1
97,"I know it’s a pregame thread but I’m going to treat it like a complaint thread. 

I would like to make some prop bets on the game today but I can’t because California is stupid.",1644784444.0,25,:Steelers: Steelers,1
98,"AJ Green left the Bengals because he wanted a chance at a ring. The year he leaves, the Bengals are in the Super Bowl. Ouch.",1644784819.0,24,,1
99,"Im just real happy to be here :) Im so happy for the City of Cincinnati, we deserve this boys. We deserve this!",1644788634.0,14,:Bengals: Bengals,1
100,"Everyone look (insert celebrity name) is at the super bowl!

Who the fuck cares",1644789088.0,12,:Titans: Titans,1
101,I'm so nervous and sweaty,1644789325.0,13,:Bengals: Bengals,1
102,Damn so many negative people in this thread lol. I loved that squares analysis. Play every year.,1644789567.0,13,:Bears: Bears,1
103,"Oh right the Olympics. 

I dont care about the Olympics at all this year.",1644789804.0,14,:Browns: Browns,1
104,This whole production is just cringe,1644791192.0,11,:Bears: Bears,1
105,Please no more DJ Zedd,1644791232.0,11,:Bengals: Bengals,1
106,I don’t care who wins I just want Kendrick to drop a new song,1644791545.0,11,:Bears: Bears,1
107,Yay love all this shit talking about Detroit.....,1644791557.0,13,:Lions: Lions,1
108,"Take a drink every time someone posts, ""The NFL just want the Rams/LA to win and told the refs to call it in their favor.""",1644791918.0,12,:Raiders: Raiders,1
109,"I really don’t want to see Aaron Donald win a Super bowl. If he was any better at choking, I’d call him Kyle Shanahan",1644791986.0,13,:49ers: 49ers,1
110,people doing door dash right now have to be making some bank today and this evening. good for them.,1644792182.0,11,,1
111,My condolences to the A-Listers who get cornered by Crypt Damon.,1644792466.0,12,:Broncos: Broncos,1
112,My first ever Superbowl. it's 4:20 am here. Lesgo!!!!,1644792614.0,13,,1
113,"NBC already having sound issues, wonderful.",1644792646.0,10,:Patriots: Patriots,1
114,It’s probably me being a cynic but this all just seems like the league shouting SEE WE CAN’T BE RACIST,1644792812.0,12,:Cowboys: Cowboys,1
115,What song was that? Canadian here - No national anthem?,1644792836.0,13,,1
116,"NFL: ""dont like the national anthem? Fuck you heres 2 of them""",1644792842.0,12,,1
117,LA sucks for the super bowl though lol,1644793136.0,13,:Patriots: Patriots,1
118,As someone who’s lived in LA this self-jerking off is pretty common,1644793223.0,12,:Raiders: Raiders,1
119,"“Super Bowl should only be in LA”

Non-LA residents: _no_

LA residents: _no_",1644793229.0,11,,1
120,My God that cgi was bad,1644793478.0,13,:Jets: Jets,1
121,"OK Cincy, I love your long snapper",1644793976.0,12,:Rams: Rams,1
122,Wait..THAT'S ALL YOU DID FOR JOHN MADDEN,1644794201.0,13,:49ers: 49ers,1
123,Didn't have Title IX mention in my bingo card.,1644794840.0,12,:49ers: 49ers,1
124,this feels so weird lol is it just me?,1644795246.0,11,,1
125,r/WSB just got super triggered,1644795950.0,12,:49ers: 49ers,1
126,"Well, I’m glad Chevy finally gave a definitive ending for The Sopranos.",1644798309.0,13,,1
127,Kelly Stafford must really respect the medical and science community for saving her life,1644791472.0,23,:Giants: Giants,1
128,I would commit an unspeakable number of crimes if Joe Burrow asked me to.,1644786022.0,23,:Bengals: Bengals,1
129,What you guys drinking tonight?,1644785913.0,12,,1
130,Why the f is Kelly Stafford part of that interview?,1644786370.0,12,:Lions: Lions,1
131,"I'm glad she survived and all, but why is this relevant?",1644787745.0,12,:Cowboys: Cowboys,1
132,reddit's gonna break 10 times tonight,1644787803.0,13,:Colts: Colts,1
133,I feel sick and I haven't a drink yet 🙃,1644788669.0,11,:Bengals: Bengals,1
134,Ngl I haven’t watched one second of the Olympics,1644789792.0,10,:Ravens: Ravens,1
135,"Olympics would probably be talked about more if it wasn’t on shitty NBC coverage, and not in China",1644789926.0,9,:Giants: Giants,1
136,"Here’s my guess what the halftime show tracklist will be 

Cali love 3:00 (just the dre, middle verse, pac verse)

Humble 1:10 (everything until the 2nd beat drop)

Alright 1:55 (Till the end of 2nd verse)

Family affair: 1:35 (until Dre track pumpin)

Still Dre : 1:30 ( Dre verse + snoop chours)

Drop it like it’s hot/Nothin but a g thang mashup: 0:45

In Da Club: 1:30

Forget about Dre: 2:00
(Until Ems verse ends)

Lose yourself:  2:40
(Chours repeats until they run out of time)
Total run time: 16 minutes and 15 seconds)",1644791171.0,12,:Seahawks: Seahawks,1
137,"All NBC say has to say about the bengals is “HEY JOE BURROW IS COOL”

Like say SOMETHING about Mixon, Zac Taylor, the defense or anything else",1644792052.0,11,,1
138,What are they singing?,1644792783.0,11,:Lions: Lions,1
139,And the crowd goes mild,1644792817.0,10,:49ers: 49ers,1
140,Halle Berry still fine as ever.,1644793116.0,10,:49ers: 49ers,1
141,The obvious takeaway from this opening is that all NFL games are scripted,1644793357.0,10,,1
142,"Man, Mahomes has had a bunch of time to be in commercials since he lost I guess.",1644793609.0,11,:Broncos: Broncos,1
143,Cinci straight fuckin around with their intros,1644793878.0,12,:Titans: Titans,1
144,"Hell yeah brother, cheers from Kuwait",1644794310.0,10,:Lions: Lions :Steelers: Steelers,1
145,WNFL would prob be way more successful than the WNBA tbh,1644794900.0,12,:Eagles: Eagles,1
146,How the fuck do you get a celebration penalty when you aren't even active?,1644800071.0,12,:49ers: 49ers,1
147,#MOM’s SPAGHETTI,1644801593.0,10,:49ers: 49ers,1
148,Bengals 34-Rams 28,1644784298.0,60,:Chargers: Chargers,1
149,Wrong brown person NFL,1644794271.0,21,:Chiefs: Chiefs,1
150,Well at least we know he’s not lip syncing…,1644785049.0,8,:49ers: 49ers,1
151,A very fancy way of saying tampering.,1644786376.0,11,,1
152,"Is the pre-game shit just a few minutes of ""analysis"" on the star players then NBC going ""LOOK AT THESE B LISTERS IN OUR SHOWS""",1644788328.0,9,:Eagles: Eagles,1
153,"Yes, hundreds of years from now, scholars and historians will be waxing poetic about the once in a millennia event of the Super Bowl and Olympics occurring on the SAME DAY in the year of the Lord February 13th, 2022.",1644789930.0,11,:Giants: Giants,1
154,"No, not another Collinsworth. Please god no",1644790179.0,8,:Giants: Giants,1
155,Am I the only one who isn’t gambling on this game?,1644790207.0,10,,1
156,[deleted],1644790258.0,9,,1
157,Uncharted has to be a “Producers” style movie right? They have to be betting to lose money.,1644790418.0,10,:Packers: Packers,1
158,inb4 Tupac hologram at the halftime show,1644791199.0,10,:Buccaneers: Buccaneers,1
159,"Okay, differences aside, we can all agree that we don't need Kelly featured.",1644791407.0,9,:Eagles: Eagles,1
160,Tbh this game is so late for no reason.,1644791874.0,10,,1
161,Reminder that Mark Walhberg walked out of the Super Bowl when it was 28-3 Falcons,1644792459.0,10,:Eagles: Eagles,1
162,[deleted],1644792461.0,10,,1
163,Screw you predictors.,1644792574.0,10,:Bengals: Bengals,1
164,"Bengals fans how you doing? Stomach uneasy? Nervous sweating? Ahh the good times, enjoy.",1644793042.0,11,:Patriots: Patriots,1
165,"“Anything is possible” (shows a jets fan watching the super bowl) 


Not anything…",1644793250.0,9,:Eagles: Eagles,1
166,You can’t promise us Keanu and then not give us Keanu you sons of a bitches.,1644793260.0,9,:Steelers: Steelers :Bills: Bills,1
167,"""Look how cool LA is (if you are rich and famous)"" 
Thanks but ill pass",1644793261.0,10,:Saints: Saints,1
168,Lol Kevin Hart just put a bounty up for himself in his hometown selling out wearing a Steelers Jersey in the most viewed television event in the country,1644793281.0,9,:Vikings: Vikings,1
169,How are they gonna play when there is a 100 foot Lombardi trophy on the field? Smh.,1644793497.0,10,:Broncos: Broncos,1
170,I just hope both teams have fun,1644793633.0,10,:Raiders: Raiders,1
171,You guys remember the Creed halftime show,1644793636.0,9,,1
172,"Dicks out for Harambe?

I'm fulling expecting Harambe to descend from the heavens during the halftime show",1644794071.0,11,,1
173,John Madden John Madden,1644794132.0,9,:Commanders: Commanders,1
174,Good to see a harp getting some attention.,1644794319.0,10,:Bills: Bills,1
175,That fuckin harp tho,1644794321.0,10,:Packers: Packers,1
176,There's a sea in Cincinnati? TIL,1644794407.0,10,:Buccaneers: Buccaneers,1
177,P-51 makes my pilot boner go full staff,1644794532.0,9,:Commanders: Commanders,1
178,"NFL: We love women. We swear. 

Chris Collinsworth: Hey, can we do another 3 hour broadcast where I whitewash Ben Roethlisberger? That was pretty fun.",1644794882.0,9,:Steelers: Steelers :Bills: Bills,1
179,I wish Mankind would come out and put a fucking sock in his mouth...,1644795249.0,9,,1
180,"Ngl I was surprised it was that close. Was expecting a Rams blow out. If Bengala address the O line, they'll be back soon",1644823605.0,10,:Bears: Bears,1
181,"Casual fan here from Australia headed to the pub at 9am for beers and wings! 

Happy Super Bowl Day to you all!",1644786696.0,18,,1
182,This game is going to be a tale of four quarters. Really thinking the team that puts up the most points has a chance of lifting the trophy.,1644790934.0,19,,1
183,Someone brough guacamole with cottage cheese in it. Please someome help. What do i do.,1644791476.0,19,:Patriots: Patriots,1
184,Just a reminder: this is the same girl who sang “eat the booty like groceries”,1644794296.0,20,:Buccaneers: Buccaneers,1
185,I want the Chinese anthem.,1644792754.0,18,,1
186,"Yes, nothing gets me more in a football mood than this song",1644792754.0,17,:Buccaneers: Buccaneers,1
187,Wtf is going on???,1644792785.0,18,:Texans: Texans,1
188,I think System of a Down should do halftime show next time,1644794298.0,17,:Seahawks: Seahawks,1
189,[deleted],1644785160.0,11,,1
190,I’m predicting a Tom Brady run-in in the 4th quarter with steel chair in hand.,1644785775.0,9,,1
191,"The Super Bowl should be on a Saturday. 

Stugotz is right.

Stugotz is right? Holy bleep, Stugotz is right. HALLELUJAH!",1644786430.0,8,,1
192,this has been a magical ride and i hope it has a storybook ending but i'm lowkey bummed that the season is over in a few hours and we'll all be entering offseason hell.,1644787112.0,9,,1
193,"I am so excited. Win or lose, I am extremely proud of this team, and the future to become. We are all hungry. The Owner, Coach, our Young Bucks, and the Fans. 27-24 Bengals. Money Mac will kick a 54 yarder to glory. WHO DEY",1644787756.0,11,:Bengals: Bengals,1
194,"Chase catching tennis balls is a painful display of NFL vs my high school team WRs


I couldn’t catch shit, the tennis balls were nearly impossible. No one was good at catching them.

He makes it look effortless and he was said to have “bad hands” in pre season. Disgusting.",1644788205.0,11,:Buccaneers: Buccaneers,1
195,"God I wish Dre brings out ice cube to perform Natural Born Killaz, NBC and NFL sponsors would collectively shit themselves",1644788621.0,8,:Jets: Jets,1
196,Alot of zoomers are about to see their mom's twerk for the first time ever in a couple of hours.,1644788784.0,7,:Chargers: Chargers,1
197,Can someone please tell the Chainsmokers that we don't care?,1644788892.0,11,:NFL: NFL,1
198,This is the most awkward concert ever. Hip hop artists and the Chainsmokers performing for a small group of boomers and their families lmao,1644788907.0,9,:49ers: 49ers,1
199,Nothing says super bowl football like the fucking chain smokers,1644789000.0,10,,1
200,NBC can't be trusted with anything. Why would anyone give them the superbowl after we watch them fuck up the Olympics every 2 years?,1644789107.0,9,:Steelers: Steelers,1
201,"What’s everyone eating? The fam has Wings, Publix Subs, Buffalo Dip, Lamb Chops, Burgers, and Hot Dogs, think we have some Korean Corndogs coming too!",1644789669.0,7,,1
202,One hour left boys.,1644789730.0,9,:Seahawks: Seahawks,1
203,"Surprise, Surprise. Rock “The Dwayne” Johnson appears out of nowhere",1644789780.0,7,:Jets: Jets,1
204,Jesus Christ who gave nbc the super bowl during the olympics,1644789808.0,9,:Vikings: Vikings,1
205,"If the ball is returned on the first play, ill stick my balls in my asshole",1644790063.0,7,,1
206,bro I thought Jac Collinsworth was Jared Goff,1644790112.0,7,:Chiefs: Chiefs,1
207,I’m putting $250 on team fluff in the puppy bowl.,1644790149.0,11,:Cowboys: Cowboys,1
208,"Gentlemen

It's been an honor",1644790187.0,7,,1
209,I promise to feed my orange cat porkchops if the Bengals win tonight,1644790322.0,8,:Bears: Bears :Jets: Jets,1
210,No way Aaron Donald is retiring lol,1644790612.0,9,:Ravens: Ravens,1
211,"Did she really just say, “the vibes are high”",1644791200.0,9,:NFL: NFL,1
212,“DJ Zedd”,1644791241.0,9,:Vikings: Vikings,1
213,"So this stadium does not protect against rainfall/thunder and also is cooking the field because the roof is translucent. Probably the first ever Super Bowl with water breaks.

I'm more and more baffled by the planning of this stadium.",1644791324.0,9,:Cowboys: Cowboys,1
214,"Im English. I don't understand a lot of the rules of this sport. That being said my ex is from Cali and her family put me in a rams shirt a few years ago, so Ive been a fan ever since.

No idea whats going to be happening for the next few hours but lets go Rams!",1644791373.0,9,:NFL: NFL,1
