,text,time,upvote,flair,phase
2216,It had to be lose yourself. There is no universe where Eminem sings anything else at the super bowl.,1644801616.0,19,:Vikings: Vikings,2
2217,Lol Dre said the n word but Kendrick couldnt say police,1644801774.0,20,:Patriots: Patriots,2
2218,Something I can’t wrap my head around. There is an Olympic event that involves shooting and America sucks at it,1644802111.0,21,:Bears: Bears :Bills: Bills,2
2219,Evan McPherson is the giga chad,1644802115.0,20,:Bengals: Bengals,2
2220,"Aaron pushed him inbounds, I get protecting the QB but Donald wasn’t in the wrong",1644802804.0,19,:Dolphins: Dolphins,2
2221,"""Everybody deserves to be seen as they truly are""

*shows photoshopped pictures*",1644803077.0,19,:Patriots: Patriots :Patriots: Patriots,2
2222,"I dig the ad but a bit disingenuous because those other photos were just terribly lit in general. Pixel takes amazing photos tho.


*Comment post from my Google Pixel smartphone*",1644803128.0,20,,2
2223,I don’t wanna jinx anything but we haven’t seen a crypto commercial for like 6 blissful minutes,1644805826.0,18,:NFL: NFL,2
2224,"All the no calls and decide to call a no defensive holding.

Refs doing what they do best.",1644807806.0,21,:Saints: Saints,2
2225,"It was a good game. Not the greatest game, but better than many Super Bowls I’ve watched. There were some missed calls, but they were missed calls I could understand given the perspectives of the refs.",1644814642.0,55,:Steelers: Steelers,2
2226,"I gave my wife $50 to bet. 

I now have Matthew Stafford to catch the first pass of the game for $25

…and an offensive linemen touchdown for $25",1644794722.0,18,:Bears: Bears,2
2227,Still weird seeing the NFL going from “gambling is terrible” to playing footsie with them to basically just running a sports book with a football league on the side.,1644796524.0,17,,2
2228,It’s a fucking crypto commercial are you kidding me,1644797154.0,19,:Patriots: Patriots :Cardinals: Cardinals,2
2229,I'm not scanning that code out of pure spite. Fuck that bullshit.,1644797159.0,19,:Bengals: Bengals,2
2230,I'm not fucking scanning this shit,1644797170.0,18,,2
2231,Literally pulling jersey? Chris:Clean,1644797470.0,18,,2
2232,Is a shirt pull not a pi?,1644797482.0,19,,2
2233,Refs are letting them play so far. Not really that upset. I don't think that hold really played anything into the in-completion.,1644797498.0,19,:Browns: Browns,2
2234,"Cris, that's not a little tug, that's a pretty big tug and hold. His jersey was stretching lol

Just watch a hold decide the game at the end of the SB",1644797512.0,20,:Packers: Packers,2
2235,"“How do you do, fellow athletes?” - Steve Buscemi",1644798250.0,17,:Colts: Colts :Colts: Colts,2
2236,*woke up this mornin got some gabbagool*,1644798256.0,19,:Eagles: Eagles,2
2237,I think celebrity crushes are stupid.... except when it comes to Anna Kendrick,1644798920.0,19,:Broncos: Broncos,2
2238,Ugh Alex Morgan is too damn fine,1644798995.0,19,:Seahawks: Seahawks,2
2239,"Damn, I'm going to book Turkish Airways for my next trip to Milwaukee.",1644799693.0,18,:Packers: Packers,2
2240,"An old school bowling alley is the last place I'd expect to find someone who would drink a zero-carb beer, let alone find the dang thing in the first place",1644799695.0,18,:Seahawks: Seahawks,2
2241,Am I supposed to know who either of these guys talking about Michelob Ultra are,1644799746.0,19,:Bills: Bills,2
2242,What a fucking idiot lol,1644799750.0,20,:Giants: Giants,2
2243,Who was the non uniform guy Lmaoo they should kick him off the sideline just for that,1644799811.0,19,:Patriots: Patriots :Giants: Giants,2
2244,"""Ok tell everyone his name. Now zoom in on him sitting on the bench''",1644799858.0,19,:Cowboys: Cowboys,2
2245,if I'm wealthy and live in LA I easily drop $3500 to attend a local super bowl just to go,1644799923.0,20,,2
2246,That LA crowd sounds so indifferent to this thing. Like a bunch of people only there to be seen and flex.,1644800104.0,17,:Cowboys: Cowboys,2
2247,Ok now I know crypto is over,1644800161.0,20,:Lions: Lions,2
2248,Larry David shilling crypto is tragic,1644800171.0,19,,2
2249,"Say what you want, but crypto sites know their demographic. Larry David was an excellent choice",1644800235.0,21,,2
2250,Both of these teams lost to the Jets last time they played them,1644800238.0,19,:Jets: Jets,2
2251,Joe and Carole looks fucking terrible lmaoooo,1644800480.0,20,:Browns: Browns,2
2252,"Snoop really looked back like ""why the fuck she touching me?"" 💀",1644800708.0,20,:NFL: NFL,2
2253,Kyler Murray the only one in Orginal size,1644800984.0,18,:Ravens: Ravens,2
2254,Fuck crypto so hard bro 😭,1644801949.0,21,:Rams: Rams,2
2255,Cable Guy is the most underrated Jim Carrey movie and I will die on that hill,1644801987.0,19,:49ers: 49ers,2
2256,Wasn't expecting Jim Carrey..wasn't disappointed,1644802007.0,18,:Packers: Packers,2
2257,"2022 Dre

2021 Weeknd

2020 JLo

2019 Maroon 5

2018 JT

2017 Lady Gaga

2016 Cold Play

2015 Katy Perry

2014 Bruno Mars

2013 Beyoncé

2012 Madonna",1644802186.0,19,,2
2258,Whoever in charge of the cameras saw Kelly Stafford’s stiff nipples and decided to keep the view for himself. Not a single shot since. Definitely not a bro.,1644802924.0,18,,2
2259,lmao they really showed the wrong girl,1644794294.0,18,,2
2260,She legit got a round of applause in the bar lol.. Well done.,1644794555.0,18,:Packers: Packers,2
2261,Browns fans screaming into their pillow,1644796270.0,17,,2
2262,Cleveland showed him the door? Fuck off,1644796307.0,18,:Browns: Browns,2
2263,Selma looking guuuuuuud,1644796450.0,20,:Seahawks: Seahawks,2
2264,Okay. Little Pegasus is awesome.,1644796472.0,17,:Titans: Titans,2
2265,Who wants to scan a random QR code?,1644797135.0,19,:Lions: Lions,2
2266,I'm not scanning that shit someone do it for me,1644797146.0,18,:Eagles: Eagles,2
2267,Did anyone scan that stupid qr code? I refuse,1644797160.0,19,:Bills: Bills,2
2268,No holding because they’ve decided the narrative is Ramsey is too good,1644797458.0,19,:49ers: 49ers,2
2269,Lol that shirt grab.,1644797482.0,16,,2
2270,"That was more than a ‘little bit’, Cris.",1644797484.0,16,:Buccaneers: Buccaneers,2
2271,"Chris Collinsworth: ""it's clean. Just a little hold. Part of the Superbowl. Ignore it.""",1644797510.0,16,:Cardinals: Cardinals,2
2272,If they were deadass about to do a FNAF parody lmao,1644797726.0,20,,2
2273,FUCK FACEBOOK,1644797727.0,19,:Cowboys: Cowboys,2
2274,"Just when I thought I couldn't hate Meta more, they found a way",1644797758.0,20,:Bears: Bears,2
2275,Meadow’s lucky she didn’t have to parallel park,1644798266.0,18,:Giants: Giants,2
2276,"What did I learn from that commercial batch?

Beer makes your bowl with celebrities and the Sopranos drive Chevys.",1644798326.0,18,:Cowboys: Cowboys,2
2277,"I ate too fast, I'm already full 🤢",1644798448.0,17,,2
2278,"there are no real rams fans, they all got left behind in St Louis",1644798654.0,17,:Bears: Bears,2
2279,JoeJoe's Bizzare Offense,1644798872.0,18,:Bears: Bears,2
2280,Cash Offer Carl is a rapist,1644798873.0,18,:Jaguars: Jaguars,2
2281,Joe Burrow was the cool kid in high school that was nice to the geeks and nerds,1644799035.0,19,:Patriots: Patriots,2
2282,Why. Why the vagina candle. Why.,1644799249.0,19,:Chargers: Chargers,2
2283,Can we talk about the fact I just saw a commercial where Gwyneth Paltrow took a bite of her vagina candle,1644799315.0,18,:Vikings: Vikings,2
2284,GET OFF THE FIELD IDIOT,1644799730.0,18,:Patriots: Patriots,2
2285,Who the fuck joined the celebration?,1644799753.0,18,:Lions: Lions,2
2286,The guy in the hoodie just lost his job,1644799761.0,18,:Jets: Jets,2
2287,Who the fuck is that moron that cost them a penalty?,1644799773.0,19,:Vikings: Vikings,2
2288,"lol tht nonuniform guy bout to be sent to the locker room the rest of the game, dumb penalty",1644799774.0,17,:Cowboys: Cowboys,2
2289,Imagine getting your team a penalty when you aren't even playing.,1644799851.0,18,:Vikings: Vikings,2
2290,LMAO they flaming this dude,1644799861.0,18,:Cowboys: Cowboys,2
2291,Think i'm with Larry on this one.  Everything i've heard about crypto tells me to stay as far fucking away as possible.,1644800168.0,19,,2
2292,Fuck crypto and all their annoying ass ads,1644800321.0,17,,2
2293,"oh my god that tiger king thing looked like a youtube parody what the fuck, the trash never ends lol",1644800587.0,18,:Packers: Packers,2
2294,Greatest halftime show of all time? My fucking ass. PRINCE,1644800665.0,18,:Patriots: Patriots,2
2295,This show is 20 years to late lol,1644801363.0,19,:Panthers: Panthers,2
2296,"This game has to end on a McPherson ""Fuck you, I'm a Super Bowl champ"" 50 yarder. It just has to.",1644802138.0,17,:Browns: Browns,2
2297,"This new Bel Air show is going to do a really fucked up version of the ""why doesn't he love me"" episode.",1644802179.0,18,,2
2298,That was offensive p.i.,1644802497.0,18,:Cowboys: Cowboys,2
2299,Missed facemask,1644802509.0,17,:Vikings: Vikings,2
2300,A camera can't fix harshly backlit photos.,1644803043.0,17,:Seahawks: Seahawks,2
2301,I’m here for the Lindsay Lohan comeback,1644803121.0,18,:Patriots: Patriots,2
2302,Players should get the trophy first. NHL does it right.,1644808486.0,17,:Ravens: Ravens,2
2303,"I want to remind everyone that Salma Hayek prayed for big tits  when she was young.

God listened to her.

She could've chose world peace.

She could've chose so many problems as one of the few people that can talk to God.

But she chose big tits.

Can't blame her.",1644796528.0,38,:Buccaneers: Buccaneers,2
2304,Imagine being unsuited for the game and still costing your team yards by running on the field lol,1644799758.0,36,:Patriots: Patriots,2
2305,"4th & 1, less than a minute left, Superbowl game on the line, let's go for a pass. Yea, that's right, let's trust our offensive line who has allowed the most sacks this season to protect our QB for a pass.
Worst play call they could have made.",1644818521.0,126,,2
2306,WHAT A STACHE ON THAT MAN,1644793936.0,17,:Lions: Lions,2
2307,"Bruh, they couldn't even get the camera on the right girl",1644794302.0,17,:Bears: Bears,2
2308,Sick play on 3rd and 17 when you have Stafford,1644795504.0,17,:Lions: Lions,2
2309,These commercials fucking suck,1644796453.0,15,:Chiefs: Chiefs,2
2310,Who the fuck expects us to scan this shit,1644797135.0,17,:Bills: Bills,2
2311,I’d love to see the metrics on how many peoples scanned that code,1644797211.0,17,,2
2312,Isn’t a jersey grab considered holding ?,1644797430.0,17,:NFL: NFL,2
2313,Thought that should be DPI,1644797470.0,18,:Bengals: Bengals,2
2314,He beat Ramsey on the route and then grabbed jersey,1644797490.0,16,:Packers: Packers,2
2315,How was that not called??,1644797495.0,18,,2
2316,Finally some weird ass super bowl commercials,1644797644.0,19,:Colts: Colts :Lions: Lions,2
2317,That vr commercial is actually kinda depressing,1644797706.0,17,:Bengals: Bengals :Packers: Packers,2
2318,We don’t care Facebook,1644797712.0,18,:Dolphins: Dolphins,2
2319,meta commercial might be the most nonsensical piece of shit i’ve ever seen,1644797729.0,17,:Chiefs: Chiefs,2
2320,"Super Bowl MVP rankings:

1. Odell Beckham Sr

2. Kelly Stafford

3. Odell Beckham Jr",1644797947.0,17,:Patriots: Patriots,2
2321,God damn she still fine as hell,1644798244.0,17,:Cowboys: Cowboys,2
2322,RIP James Gandolfini,1644798244.0,17,:Patriots: Patriots,2
2323,"Can't believe it, Meadow finally was able to parallel park! 

That Chevy is super ugly though",1644798259.0,18,:Patriots: Patriots,2
2324,Meadow can still get It,1644798299.0,17,:Titans: Titans,2
2325,Anna Kendrick is super cute,1644798878.0,17,:Falcons: Falcons,2
2326,Do you think they pumped in crowd noise to the rams practice this week? To get them used to a fully attended game?,1644799101.0,17,,2
2327,She... She ate her vagina candle,1644799244.0,17,:Chargers: Chargers,2
2328,"Oh my god they had the candle

The good commercial counter is now at 1",1644799283.0,17,:Giants: Giants,2
2329,Poor OBJ. Terrible transition to that horrific T Mobile ad,1644799283.0,17,:Seahawks: Seahawks,2
2330,What a poor time to show the Ambulance commercial,1644799352.0,16,:49ers: 49ers,2
2331,"NFL: “Aw man, not an injury. It’s a shame we’ll have to play some more ads.”",1644799383.0,15,:Vikings: Vikings,2
2332,I can't believe Uber eats had the audacity to put the Gwenyth Paltrow candle in the commercial.,1644799744.0,17,:Commanders: Commanders,2
2333,Why would you think that’s a good idea to come on the field if you’re not an active player? WTF?,1644799751.0,19,:Packers: Packers,2
2334,Are you fucking serious who is that moron,1644799779.0,17,:Bengals: Bengals,2
2335,Imagine not even playing and still fucking up your team,1644799781.0,15,:Seahawks: Seahawks,2
2336,My child's eyes almost saw a non-uniformed player celebrating,1644799789.0,17,:Ravens: Ravens,2
2337,LMAO THAT ILLEGAL CELEBRATION.,1644799816.0,17,:Rams: Rams,2
2338,[removed],1644799846.0,18,,2
2339,His ass is gonna be glued to that bench the entire game lol,1644799854.0,17,,2
2340,"I know we all hate the taunting rules, but my guy you are inactive get the hell off the field lmao",1644799887.0,16,:Titans: Titans,2
2341,emmitt smith looks the absolute coolest of everyone in that montage,1644799955.0,17,:Colts: Colts,2
2342,Lol every sack that happens they are like WOW AARON DONALD OMG,1644800011.0,17,,2
2343,I think it's cool LeBron came to say hi when his teams is fighting for that 10th seed 😤😤😤😤😤,1644800126.0,18,,2
2344,"“Even the stupid ones?” 

I feel you, Larry.",1644800177.0,16,:Seahawks: Seahawks,2
2345,"these crypto commercials remind me of the late 90's, early 2000's when the internet was new and random garbage internet sites were advertising during the Super Bowl.  That ended when the bubble popped.",1644800196.0,17,:Bengals: Bengals,2
2346,If I were a Rams fan I’d get a dog and name it Pooper Pupp,1644800291.0,15,:Packers: Packers,2
2347,"Sean McVay: ""We're fucked, Michelle. We are fucked. What do you want from me?""",1644800442.0,17,,2
2348,Yeah no one wants to revisit Tiger King,1644800515.0,17,,2
2349,Man. The commercials have been mostly a miss this year.,1644800516.0,17,:Jets: Jets,2
2350,Snoop wondering who the fuck is touching his high ass,1644800659.0,18,:Chargers: Chargers,2
2351,50 cent looking more like a full dollar,1644801248.0,16,:Bears: Bears,2
2352,Dre and Snoop still definitely got it.,1644801787.0,17,:Jets: Jets,2
2353,That was absolutely one of the better half time shows.,1644801853.0,17,,2
2354,Ads for crypto gotta be illegal soon,1644801951.0,18,:Eagles: Eagles,2
2355,"Oooof, that one was a facemask......",1644802493.0,17,:Buccaneers: Buccaneers,2
2356,Thats huge OPI!,1644802509.0,16,:Eagles: Eagles,2
2357,Wonder if that camera will make my white ass look a little darker,1644803119.0,16,:Cowboys: Cowboys,2
2358,You know Aaron Donald is getting a boner thinking about spear tackling Burrow's knee right now,1644805882.0,17,:Buccaneers: Buccaneers,2
2359,NFL wants the Rams to win and there’s nothing we can do about it,1644807205.0,17,:Patriots: Patriots,2
2360,Im depressed,1644808068.0,17,:Bengals: Bengals :Jaguars: Jaguars,2
2361,These crypto ads are making the case for regulating the shit out of crypto.,1644800216.0,35,:Commanders: Commanders,2
2362,St. Louis Rams > L.A. Rams,1644793775.0,108,:Ravens: Ravens,2
2363,"I’m at a Super Bowl party and someone brought Skyline chili. This is the first time I’ve ever had it, and I was excited to try it.

Sorry Cincinnati, I’m sure you have a fine city but this is fucking disgusting. Weird, weird, WEIRD flavor combination.",1644796231.0,34,:Packers: Packers :Bills: Bills,2
2364,The most dumbest taunting penalty of all time. Deserve to ger cut. Make him wear a clown hat,1644799830.0,37,:Patriots: Patriots,2
2365,"Hingle McCringleberry, Penn State",1644793887.0,17,:Patriots: Patriots,2
2366,Did they confuse Jhene Aiko for that other lady? Lmfao,1644794317.0,17,:Steelers: Steelers,2
2367,Uhh… this isn’t a coin toss…,1644794798.0,16,:Seahawks: Seahawks,2
2368,Now girls can get cte too,1644794813.0,16,:49ers: 49ers,2
2369,Just start the fuckin game please,1644795264.0,16,:Lions: Lions,2
2370,"Just some guy in New Zealand taking day off work, cooking BBQ in the rain drinking beer watching.
Reporting In.",1644795790.0,16,:NFL: NFL,2
2371,Never felt older than seeing how many don’t remember the E*Trade baby.,1644796048.0,16,:Buccaneers: Buccaneers,2
2372,"“Halfway thru the season they showed him the door at Cleveland.”

That’s one way to put it.",1644796291.0,15,:Bengals: Bengals,2
2373,Browns fans in shambles,1644796322.0,15,:Ravens: Ravens,2
2374,"“They show him the door?”

Revisionist history at its finest.",1644796337.0,15,,2
2375,Salma is such a smoke. God bless her.,1644796449.0,15,:Rams: Rams,2
2376,I want a baby pegasus,1644796458.0,16,:Browns: Browns,2
2377,Zeus selling out just fucking despicable,1644796462.0,16,:Packers: Packers,2
2378,"That was the most accurate commercial so far. Salma Hayek is, in fact, a goddess.",1644796523.0,16,:49ers: 49ers,2
2379,Polestar throwing that Tesla shade,1644796770.0,17,,2
2380,"Damn Volvo. You might as well have said fuck Musk in big, red, times new Roman font",1644796786.0,16,:Bears: Bears :Bengals: Bengals,2
2381,I wonder how many blunts are being smoked back stage right now.,1644796883.0,14,,2
2382,"Of I took a drink every time Collingsworth works Brady into the broadcast, I'll be passed out by halftime.",1644796980.0,14,:Eagles: Eagles,2
2383,C'mon hit the corner,1644797141.0,14,:Vikings: Vikings,2
2384,🖕qr code,1644797155.0,16,:Panthers: Panthers,2
2385,Coinbase for those wondering,1644797157.0,17,:Packers: Packers,2
2386,This code is 100% malware.,1644797165.0,16,:Dolphins: Dolphins,2
2387,Just when you thought crypto ads couldn't get any more annoying,1644797221.0,16,:Bills: Bills,2
2388,They usually call that outstretched shirt,1644797458.0,17,:Eagles: Eagles,2
2389,“He grabs his shirt a little bit”,1644797468.0,16,:Bears: Bears :Bengals: Bengals,2
2390,Grabbed his shirt a little bit????,1644797490.0,16,,2
2391,"Tugs jersey, ""pretty physical""

Lmao",1644797492.0,15,:49ers: 49ers,2
2392,“It’s the super bowl hahahahaaaa they’re gonna let ya play!!!!” Why? Call it how you always call it tf,1644797500.0,16,:Browns: Browns,2
2393,"Fuck off Facebook.

No one wants to hang out with Antivaxxers in Meta",1644797724.0,16,,2
2394,Fuck Meta Quest 2 they killed my dog,1644797733.0,16,:Packers: Packers,2
2395,Lmao fuck off with this metaverse bullshit,1644797735.0,15,:Cardinals: Cardinals,2
2396,Crazy to think there are Packers fans who really didn't want OBJ because of the 'drama' lmao,1644797956.0,15,:Packers: Packers,2
2397,Rams should have let them run back the extra point. 13-5 would put us on the path to a scorigami.,1644798117.0,15,:Buccaneers: Buccaneers,2
2398,Why does Steve Buscemi look exactly like a bowling alley employee?,1644798261.0,15,:Ravens: Ravens,2
2399,Sopranos commercial best one so far,1644798262.0,16,,2
2400,"Finally, a good commercial. Can't go wrong with Sopranos.",1644798271.0,16,,2
2401,Pre-ordering cars is 1000x stupider than pre ordering video games,1644798322.0,15,:Steelers: Steelers,2
2402,Got some Gabagool,1644798327.0,18,:Browns: Browns,2
2403,I just drank a case of bud light in the metaverse and still sober. This sucks,1644798354.0,15,:Giants: Giants,2
2404,What are the odds Kanye bought a superbowl ad to diss someone,1644798463.0,16,:Eagles: Eagles,2
2405,#THE CINCY SPECIAL,1644798762.0,15,:Dolphins: Dolphins :Panthers: Panthers,2
2406,Whoever had Mixon throwing the Bengals' first Superbowl TD in decades is a rich person right now...,1644798827.0,17,:Bengals: Bengals :Seahawks: Seahawks,2
2407,Someone made some money on a prop bet that a non qb would throw a TD.,1644798832.0,17,:Saints: Saints,2
2408,So now we're joint advertising Barbie and Rocket Mortgage.,1644798853.0,15,,2
2409,Barbie had me in the first half.,1644798854.0,16,:Buccaneers: Buccaneers,2
2410,Omg they convinced Mattel to allow this. Legendary,1644798872.0,16,:Chargers: Chargers,2
2411,Whose the newly minted millionaire that took “mixon throws first Bengals TD” on the sports book bet?,1644798874.0,16,:Steelers: Steelers,2
2412,Where's the doll offering 20% over asking in cash,1644798904.0,17,:Chiefs: Chiefs,2
2413,"Rocket Mortgage isn’t beating a full cash offer, WTF is this nonsense?",1644798916.0,16,:Patriots: Patriots,2
2414,ALEX MORGAN😍😍😍😍,1644798981.0,16,,2
2415,that’s ACL,1644799155.0,16,,2
2416,LMAOOOO THE PALTROW CANDLE,1644799228.0,17,:Bears: Bears,2
2417,not this fucking song,1644799238.0,17,:Chiefs: Chiefs,2
2418,[deleted],1644799263.0,16,,2
2419,"Any company that needs a ""if this product is ruining your life, call #"" that company should look long and hard in the mirror...",1644799333.0,15,:Chargers: Chargers,2
2420,"Gweneth Paltrow likes the taste of her own vagina confirmed
Lmaooo",1644799408.0,17,,2
2421,LMAO THAT GUY ON THE SIDELINE BALLIN OUT,1644799442.0,16,:Dolphins: Dolphins,2
2422,"Turkish Airlines: We're Bringing Back Pangaea which will disrupt global trade and weather patterns and we'll take over the world because of it.

And you thought it was merely an ad",1644799703.0,15,:Bills: Bills,2
2423,Stafford aint blameless but Jefferson needs to fight for that ball.,1644799709.0,16,:Lions: Lions,2
2424,Bruh who the hell is the fucking moron celebrating in shorts. Get the hell off the field man,1644799742.0,15,:Seahawks: Seahawks,2
2425,Man was an absolute clown,1644799766.0,16,:Colts: Colts,2
2426,That shit head needs to be removed from the bench,1644799768.0,15,:Patriots: Patriots,2
2427,What a mother fucking dipshit,1644799768.0,15,:Giants: Giants,2
2428,Lol who was that guy in the end zone,1644799774.0,16,,2
2429,Not suiting up and still getting a flag is pretty impressive. Like getting fired on your day off.,1644799779.0,16,:Patriots: Patriots,2
2430,Shoutout to Morgan Freeman for coming out of de facto retirement to pitch an authoritarian government’s flagship airline,1644799818.0,16,:Eagles: Eagles,2
2431,Get your dumbass back on the bench,1644799824.0,18,:Bengals: Bengals,2
2432,Imagine not being able to play in the super bowl and still finding some way to hurt your team,1644799836.0,16,,2
2433,Bet he thought he looked a lot cooler in the moment,1644799849.0,16,,2
2434,A penalty against a inactive player...that's some shit,1644799864.0,15,:Cardinals: Cardinals,2
2435,Lmaooo. He made sure he got his moment in the super bowl. Made a real impact on the game.,1644799881.0,16,,2
2436,lmfao al michaels couldn't give less of a shit about the celebrities at the stadium,1644799922.0,17,:Jets: Jets,2
2437,Why do they keep showing the game when we could be seeing which celebrities are here?,1644799991.0,17,:Bills: Bills,2
2438,"So we are totally getting a Kanye run in in the half time show where he'll rant about Billie Eilish and Kid Cudi before the security interferres, right?",1644800011.0,17,:Buccaneers: Buccaneers,2
2439,They really got Larry David for another Crypto ad smh,1644800129.0,17,:Giants: Giants,2
2440,Don't miss out on the Ponzi Scheme!,1644800135.0,17,:Bengals: Bengals,2
2441,Whyyyyy Whhhyyyy Larry David don’t do crypto commercial,1644800139.0,16,:Eagles: Eagles,2
2442,"love me some larry david, hate me some crypto.",1644800174.0,16,:Bills: Bills,2
2443,Kupp needs to get out of bounds there,1644800234.0,17,:Giants: Giants :Lions: Lions,2
2444,Love LD but crypto isn't it chief,1644800280.0,15,:Patriots: Patriots,2
2445,Time for Eminem to whip his dick out,1644800478.0,18,:Patriots: Patriots,2
2446,"Already calling it the best halftime ever? Get fucked, Maria.",1644800702.0,16,:Chiefs: Chiefs,2
2447,REST IN POWER MEE-MAW,1644800968.0,14,:Patriots: Patriots :Lions: Lions,2
2448,Kyler Murray in real lie size.,1644800971.0,18,:Bears: Bears,2
2449,That house is $3 mil in LA,1644801127.0,15,,2
2450,The halftime show looks so weird during the day. I’m so used to it being dark from night or inside so they can do lighting stuff.,1644801150.0,16,:NFL: NFL,2
2451,Fat upside down 50 Cent lmao,1644801209.0,16,:Buccaneers: Buccaneers,2
2452,50 cent is a full dollar bill right now,1644801213.0,16,:Bengals: Bengals,2
2453,Fellas.......I don't think thata 50 cent is really singing about an actual shop that sells candy,1644801269.0,16,:Buccaneers: Buccaneers,2
2454,"All this needs is Eminem, D12, and Nate Dogg and bam you got the 2000s dream team",1644801304.0,15,:Chiefs: Chiefs,2
2455,Joe Rogan at home filling in the lyrics,1644801799.0,16,:Bears: Bears,2
2456,"I actually liked that, but my musical tastes haven't been relevant in 20 years, so...",1644801855.0,16,:Packers: Packers,2
2457,Everything is a surprise crypto ad.,1644801958.0,16,:Vikings: Vikings,2
2458,Weird al popping out at the end doing Amish paradise or something would have made it the best,1644801990.0,16,:Eagles: Eagles,2
2459,All the people in their 30-40s... now we know how our parents felt watching guys like Keith Richards & Rod Stewart with puffy old faces realizing they're old,1644802015.0,15,:Bills: Bills,2
2460,The kicker stayed out there for the halftime. Nice.,1644802089.0,15,:Panthers: Panthers,2
2461,"""they're just letting them play"" -Rams Fans an hour ago. 

Shocked Pikachu.gif -Rams fans now.",1644802526.0,16,:Patriots: Patriots,2
2462,"Google is really comparing pictures from a Motorola Razr 2006, to a perfect lighting, posed, model appointed pictures.",1644803101.0,16,:Cowboys: Cowboys,2
2463,Congrats ~~Rams~~ Refs,1644807547.0,16,:Bengals: Bengals,2
2464,Hearing the announcers just ignore the ghost penalty and act like that was an epic final drive is really gross.,1644807625.0,17,:49ers: 49ers,2
