,text,time,upvote,flair,phase
6326,"Missed the game today because I had to work…. 

As a Vikings fan, and probably speaking for all the NFC North.. I’m super happy Stafford got a ring. Dude deserved it after the 12 year beat down he got in Detroit. Ha",1644811899.0,5,,4
6327,Im drunk watching ice dancing. Whose with me?,1644812041.0,6,:Seahawks: Seahawks ,4
6328,Quick question. How did the spotters not take Cupp out of the game for a bit? If that wasn't a concussion idk what is.,1644812450.0,4,:Patriots: Patriots,4
6329,Tough break Bengals you'll always have skyline chill and well... I'm sure some other things.,1644813253.0,5,:Ravens: Ravens,4
6330,Can we all agree the commercials were terrible this year? Getting worse and worse tbh,1644813934.0,5,:Jaguars: Jaguars,4
6331,At least the kids in cincy get tomorrow off,1644816238.0,6,,4
6332,So was that Bengals TD a facemask or what?,1644816756.0,5,,4
6333,"Rams bet the house the past few years and finally won the Superbowl. I wish teams who are on the cusp would do this more. I mentioned that to my friends on Slack, and they're saying Rams trading Goff and two 1st for Stafford and 2nd and 3rd for Miller was not betting the house. If that's not definition of going all in, I don't know what is.",1644819799.0,5,,4
6334,"A close game but honestly one of the most anticlimactic Super Bowls I’ve seen. Between the game itself, how fast they cut to the Olympics 😂, and how the stadium was just absolutely dead at the end of the game it barely clicked with me that the season was over on that Donald QB tackle",1644822937.0,6,,4
6335,Run on 3rd&1 than pass on the 4th is one of the stupidest thing I see on weekly basis in the NFL.,1644824934.0,6,:Patriots: Patriots,4
6336,So obviously NBC wanted to move onto the Olympics because they just brought the trophy out without any fanfare. So what was their plan if the game went into OT?,1644825281.0,4,:Patriots: Patriots,4
6337,Team subs are so toxic right now,1644826595.0,4,:Bengals: Bengals,4
6338,"Is it me or did Al Michaels witness the SB-sealing play by being all like ""and it's an incomplete pass, it looked like the receiver had a shot, but it's incomplete, and the Rams are celebrating.""",1644828938.0,6,:Broncos: Broncos,4
6339,The Bengals terrible play calling on their final drive and inability to force overtime kept me from walking away with almost 2 thousand dollars. I'll still not over it.,1644850635.0,5,:Eagles: Eagles,4
6340,Best thing about the game?   It didn’t end after midnight.   College football should take a note.,1644851079.0,4,:Panthers: Panthers,4
6341,"Eric Weddle just hopped off the couch and decided to win a Super Bowl…


Shoutout to the Dallas boy Stafford, you fuckin did it, you’re a world champ dude.  Congrats Rams fans!",1644807880.0,20,:Cowboys: Cowboys,4
6342,"ref ball for sure, but are we gonna ignore the fact that cincy was gifted a TD on that missed face mask?",1644807879.0,13,:Patriots: Patriots,4
6343,Fuck Kroenke,1644808463.0,14,:Seahawks: Seahawks,4
6344,"May be an unpopular opinion with many, but this was probably one of the best overall Super Bowl evenings in years.

Two teams that no one really expected to get here, both having great players and stories (Joe Burrow/Jamarr Chase bromance, Matthew Stafford's escape from Detroit, etc.), a very close game,  ref involvement wasn't all game (though there were some missed and bad calls), a halftime show that highlighted some huge, influential artists out of the area (and almost entirely rap/R&B, which years ago would have been taboo).

Outside of this evening, I would say it has been definitely a good year for football. There are things we should still demand more of, including better refereeing/higher standards of refs, reassessment on OT rules, and overall change in certain rules that are ridiculous (""taunting"",  lightly grazing the QBs arm and getting a RTP), but for our first year back to ""normalcy"", this was a very successful year.",1644822562.0,12,:Cowboys: Cowboys,4
6345,Good game a couple bad calls both ways but the difference was OL they need to protect Burrow,1644807871.0,95,,4
6346,"Well. 

That was a football game.",1644807898.0,21,,4
6347,"Refs bail the Rams out on a phantom holding call on a 3rd down stop to give them 4 more tries at a TD.

Collins worth: That will go down as one of the all time great Super Bowl drives.

....what?",1644808450.0,22,:Bengals: Bengals :Bengals: Bengals,4
6348,I hate how I feel like I got robbed of a real ending. But that's our new NFL...,1644808099.0,7,,4
6349,I'm mad OBJ got a ring out of his shenanigans,1644808192.0,8,:Lions: Lions :Patriots: Patriots,4
6350,This was a helluva game and Michaels and Collinsworth did it no justice. Even now they seem bored with it. NBC needs to revamp production at every level next season.,1644808316.0,10,:Steelers: Steelers :Bills: Bills,4
6351,#KUPP SUPERBOWL MVP!,1644808617.0,7,:Packers: Packers,4
6352,"I love how refs making bad calls isn't enough of an explanation for so many. 

The game is ""rigged"". The NFL is so good at rigging games they ""gave"" the Bengals a 75 yard TD and was sure that both offenses would play like ass and keep the game close. 

Not to mention the logistics needed to rig a multi billion dollar organization while keeping everyone quiet.

I shouldn't be surprised about people's ability to think through their positions but I am.",1644808692.0,9,,4
6353,"Not a fan of either team.

Hell, not really a fan of football in general. 

But the fact that the refs decided to just stop in at the last play that actually matters and potentially changed the outcome of the entire game? This was not a good Superbowl, and it isnt the Rams fault, or the Bengals fault. Something has to change here. Why would I even want to watch more of this sport when issues as fucked up as that can just happen at the drop of a dime? Forget the other missed call people say they made on the bengals this game, these are not the same. They don't even hold close to the same amount of worth to them. It's so frustrating watching blatantly bad shit to go this way",1644809150.0,7,,4
6354,No the officiating did not decide the game. The worst officiating mistake by far went against the team that won,1644809741.0,9,,4
6355,Imma be honest the second half of that game was really fucking boring.,1644811466.0,10,,4
6356,Everyone complaining about the end (valid calls) is forgetting about the no call facemask that gave the Bengals 7 free points,1644811219.0,18,,4
6357,Having the owner get the trophy first is so gross,1644808428.0,14,:Steelers: Steelers,4
6358,No more Joe Burrow /Brady comparisons awesome,1644808919.0,13,:Titans: Titans,4
6359,"So if the Bengals take that free TD in the 2nd half, then capitalize on that INT after and go on to win the Super Bowl, people would claim the refs wanted the Bengals to win. 

How could the refs simultaneously want the Rams and the Bengals to win? Doesn’t really make sense at all",1644811353.0,11,,4
6360,Good job refs. Enjoy your pay day.,1644807892.0,174,:Bills: Bills,4
6361,"The Rams finally got their Super Bowl win, and all the NFL had to do was fuck over four different fanbases (St Louis, San Diego, Oakland, and now Cincy), flaunt how fixed the officiating is, and sacrifice any remaining integrity to do it.",1644808413.0,42,:NFL: NFL,4
6362,"Phantom call to extend the drive and hand the Rams the win. Absolute bullshit. But hey, the NFL got what they wanted. The market they desperately want to grow win the game….",1644807902.0,59,:Eagles: Eagles,4
6363,I don’t think I’ve ever seen a team not deserve to win 3 times in a row as hard as the rams,1644807886.0,30,:Patriots: Patriots,4
6364,Wilson didn’t hold,1644807887.0,22,:Seahawks: Seahawks,4
6365,Ref ball ruining a good game.,1644807883.0,11,:Buccaneers: Buccaneers,4
6366,The refs threw one bad flag. That’s it. Saying that the refs inserted themselves into the game doesn’t make a lot of sense. You people just have an irrational hatred of yellow flags and zebra uniforms.,1644811027.0,11,,4
6367,Congratulations Stafford!,1644807876.0,9,:Bears: Bears,4
6368,NBC literally was so greedy that they skipped the trophy walk out,1644808456.0,10,:Packers: Packers,4
6369,Rams getting the Lombardi trophy. this really hurts the chances of the Bengals winning the Super Bowl.,1644808550.0,8,:Eagles: Eagles,4
6370,"Stan Kroenke really fucked the entire Rams fanbase over the course of a decade and moved them to LA just for nobody to give a shit when they won the Super Bowl. Motherfucker saw the plot of Major League and thought, ""Huh, I can do that!""",1644808704.0,9,,4
6371,I fucking hate Collinsworth. Discount Mr. Mackey looking motherfucker.,1644808892.0,9,:Bills: Bills,4
6372,"I just now got the stomach to talk. 

Hell of a game, Ram. Y’all were the better team. I felt like we had our chances but couldn’t finish. I hate so bad that OBJ got hurt too. Might’ve been a bigger loss if he stayed healthy, but y’all got the W regardless. I’m happy for Stafford and super happy for Whit. This feeling does suck though. Good fans, good respect from what I saw. Love y’all.",1644809604.0,9,:Bengals: Bengals,4
6373,"The hold was questionable for sure, but I've seen it called before. The DPI was absolutely a good call.

People acting stupid in here.",1644809711.0,8,,4
6374,"Lots of no-flairs in there tonight whining about the refs and claiming that the NFL is rigged.  

Love to see it.",1644809865.0,7,:Chiefs: Chiefs,4
6375,Congrats to all the Rams fans and hope they enjoy their offseason,1644811233.0,8,:Seahawks: Seahawks,4
6376,"As a neutral, this was fun to watch! Congrats LA Rams and to an extent, Detriot!

See you all next season for epic sequel of Mac Jones: Electric Boogoloo.",1644814097.0,8,:Patriots: Patriots,4
6377,"SEVEN SACKS.

SEVEN.

Bengals, get an Oline",1644816887.0,7,:49ers: 49ers,4
6378,"Lol.  The top 2 posts on NFL are about penalties.  I cry about penalties, but never seen KC get that level of support from /nfl",1644819403.0,8,:Chiefs: Chiefs,4
6379,People complaining that the refs decided the game: did you forget the free touchdown they gave the Bengals earlier? It’s a wash.,1644808819.0,17,,4
6380,Fuck this league. I can’t handle this officiating anymore.,1644808063.0,33,:Bengals: Bengals,4
6381,Kupp MVP?,1644807877.0,3,:Eagles: Eagles,4
6382,WHITWORTH HAS A RING,1644807880.0,3,:Eagles: Eagles :Chargers: Chargers,4
6383,"The refs just had a bad game overall. Letting the players play including missing that face mask call and then calling ticky tack calls at the end of the game. If you’re gonna let the players play, call it consistently through out. If you’re gonna put your foot down, do it from the start. Players need to figure out how you’re calling the game early on.",1644808078.0,4,,4
6384,This is the closet I’ll ever get to a super bowl,1644808162.0,5,:Lions: Lions,4
6385,Seems like the refs really wanted to be involved in the 4th quarter. That holding call on Wilson was terrible. Refs saved the Rams for sure,1644808179.0,2,:Seahawks: Seahawks,4
6386,I've followed the Lions for years. I'm just happy for Stafford. Making all the doubters eat a dick.,1644808203.0,3,:49ers: 49ers :Lions: Lions,4
6387,"Grats to the Rams.

That said, the reffing at the end of that game and the ticky tack bullshit that was called after the refs let them play line that all game was dog shit.",1644808226.0,6,:Patriots: Patriots,4
6388,[I fucking called it.](https://www.reddit.com/r/nfl/comments/srvjzq/super_bowl_lvi_game_thread_los_angeles_rams_125/hwugoeu/?utm_source=share&utm_medium=ios_app&utm_name=iossmf&context=3),1644808342.0,3,:Bengals: Bengals :Falcons: Falcons,4
6389,[deleted],1644808364.0,4,,4
6390,Fuck this guy,1644808457.0,2,:Chiefs: Chiefs :Lions: Lions,4
6391,Satan Kroenke being interviewed,1644808462.0,3,:Commanders: Commanders,4
6392,[deleted],1644808473.0,5,,4
6393,This audio is ass but that’s good because nobody needs to hear what Goodell or Stan fucking Kroenke have to say.,1644808506.0,2,,4
6394,Kroenke only thinking about money and return on investment right now. Fuck him.,1644808513.0,5,,4
6395,Stan Kroenke wearing that hat is proof the NFL gods hate us all,1644808517.0,5,:49ers: 49ers,4
6396,This guy is such a snake,1644808521.0,5,:Jets: Jets,4
6397,I hope a small helicopter lands on Stan Kroenke right now.,1644808522.0,3,:Patriots: Patriots,4
6398,"Bengals you have the winning formula man. Fix the O line Whether through draft, trade, FA or everything and keep Joe Burrow from harm. That guy can get you far",1644808522.0,5,,4
6399,"I hate how in america they're giving the trophy to the owner. Like he matters at all. It should be like in Europe. Giving it to the players, since they won it. I don't want to hear about him...",1644808535.0,5,:Patriots: Patriots,4
6400,I hate how the team owner gets interviewed first over the head coach or key players. Pretty much every owner except Jerry Jones just signs the checks.,1644808539.0,5,,4
6401,Matt Stafford gets his ring and all is right in the world.,1644808543.0,4,:Browns: Browns,4
6402,"I didn't really have a dog in the fight, but I'm glad that if the Rams won they at least did it by scoring a touchdown on Eli Apple.",1644808544.0,4,:Giants: Giants,4
6403,Fuck Stan Kroenke,1644808555.0,5,,4
6404,"Most unenthusiastic owner ever  ""rams houseeee""",1644808556.0,4,:49ers: 49ers,4
6405,"If we’re gonna keep the fix going for California sports, take care of my Anaheim Ducks and Mike Trout.",1644808556.0,4,:Eagles: Eagles,4
6406,I'm like 50x more of a mcvay fan seeing how fast he handed the trophy to the players.,1644808576.0,5,:Eagles: Eagles :Lions: Lions,4
6407,Cooper Kupp has no clue where he is rn,1644808586.0,4,:Jets: Jets,4
6408,Kupp well deserved MVP!,1644808590.0,6,:Giants: Giants,4
6409,"So the “home team” wins the Super Bowl two years in a row after it had never happened before, let alone a team playing in their own stadium",1644808593.0,5,:Patriots: Patriots,4
6410,Lmao.  Thst stafford stare.  Right into my soul :(.  Miss ya buddy.,1644808595.0,4,:Lions: Lions,4
6411,SEAN WITH THE WWE VOICE BABY,1644808595.0,4,:Titans: Titans,4
6412,Congrats Rams fans. Your owner is still a piece of shit but I won't hold that against yall. A damn good dawg won his Super Bowl & I'm very happy about that....,1644808597.0,4,:Falcons: Falcons,4
6413,Kupp getting MVP is how it should be.,1644808598.0,4,:Vikings: Vikings,4
6414,Proud of my Bengals.  Played a great game.  Happy for Stafford and Whitworth.  Hopefully just the first SB for Burrow and the boys.,1644808601.0,5,,4
6415,The OBJ injury and the Refs really but a damper on me enjoying this game. Just felt flat compared to all the great games we got during the playoffs.,1644808609.0,3,:Packers: Packers,4
6416,"I feel like culture wise, the more insignificant team won, hell if Cincinnati won the whole city would go crazy for a week, I feel like LA is barely gonna be excited haha",1644808612.0,4,:Titans: Titans,4
6417,Cooooooooop,1644808621.0,3,,4
6418,Blame the un-uniform Bengals dude,1644808624.0,4,:Seahawks: Seahawks,4
6419,COOOOOOP,1644808629.0,4,:Rams: Rams,4
6420,Soccer has virtual referees and automatic replays. WHY NOT FOR THE SUPERBOWL,1644808644.0,3,,4
6421,That ending ruined my high,1644808658.0,3,:Panthers: Panthers,4
6422,Jared goff got sent to the shadow realm for this,1644808663.0,3,:Commanders: Commanders,4
6423,I’ll never understand how Kupp sounds like a country boy,1644808664.0,3,:Patriots: Patriots,4
6424,I have never seen an owner so unenthusiastic about winning the Super Bowl ever lol,1644808677.0,5,:Vikings: Vikings :Broncos: Broncos,4
6425,The real winner was the NFL we made along the way.,1644808714.0,4,:Browns: Browns,4
6426,Kroenke couldn't have sounded less interested in being there lol.,1644808719.0,4,:Patriots: Patriots,4
6427,Felt like aaron donald should have got the mvp,1644808742.0,6,:Chargers: Chargers,4
6428,Fuck peacock,1644808747.0,4,,4
6429,Honestly I am glad this ended at a reasonable time. Unlike the CFB National Championship,1644808761.0,4,:Browns: Browns,4
6430,"NFL AND NBC HAVE NO IDEA HOW TO TREAT A SUPER BOWL WITHOUT BRADY. 

SOFTEST VICTORY EVER.",1644808791.0,5,:Bills: Bills,4
6431,Lebron's hairline will be remembered more in LA over the Super Bowl win,1644808796.0,4,,4
6432,No words from Matthew wtf,1644808798.0,3,,4
6433,Lmao Apple getting VIOLATED on twitter,1644808810.0,3,:Raiders: Raiders,4
6434,[deleted],1644808828.0,4,,4
6435,"However many draft picks the bengals have, use them all on offensive linemen. I know that doesn’t make sense but do it anyways.",1644808839.0,3,,4
6436,"Welp. 

I think this is the start of a new era for this team though, even Burrow didn't expect to get here this quickly. I can't be that mad about Stafford and Whitworth getting a ring either, they earned it.",1644808877.0,4,:Bengals: Bengals,4
6437,It would be pretty cool if: they stopped calling the owner first and giving him/her/then the trophy before the coach or players AND stopped saying world champs for a competitions that is played in one single country,1644808877.0,3,:Falcons: Falcons,4
6438,"Is it just me or does the entire NFL trophy presentation suck? Like I can't help but think compared to just about any other sport it always seems to lack. 

Obviously having the owner be the first person with it but the fact they don't have a big team presentation or anything is weird.",1644808904.0,5,:Patriots: Patriots,4
6439,Kroenke winning a championship just leaves such a bitter taste especially since there's a lot of players I'm happy for.,1644809038.0,5,:Patriots: Patriots,4
6440,A game that apparently had both bad reffing for calling penalties as well as bad reffing for not calling penalties because people can't be happy,1644809045.0,4,:Bills: Bills,4
6441,"I know it was a low-scoring game, but I really enjoyed this one. I can't remember a Super Bowl where I honestly wanted both teams to win. There's really nothing to dislike about either team.",1644809046.0,3,,4
6442,[deleted],1644809069.0,5,,4
6443,Where can I get a Bengals Superbowl shirt?,1644809108.0,4,,4
6444,MATTHEW STAFFORD SUPERBOWL CHAMPION,1644809177.0,4,:Lions: Lions,4
6445,I lost my last 3k. Anyone has a job opening in nyc. I can start tomorrow,1644809178.0,5,:Chiefs: Chiefs,4
6446,The Rams got infinite tries at the end there.  Props to Bengals for stopping them so many times in a row like that.  Was almost 2 series worth of stops there but I guess based on the circumstances it was more or less inevitable for the Rams.,1644809181.0,4,,4
6447,Nahhh not watching your awful Olympics coverage NBC,1644809229.0,4,:Bengals: Bengals,4
6448,"Hey bengals fans, this hurts. A lot. But it's gonna be okay",1644809319.0,3,,4
6449,I can’t believe Stafford has won a Super Bowl. Holy shit I feel like the Lions just won,1644809333.0,4,:Lions: Lions,4
6450,"Remember everyone, support competition to the nfl, like the xfl, because this type of shit cannot continue.",1644809359.0,3,:Bears: Bears,4
6451,Glad Stafford proved he wasn't the problem in Detroit.,1644809530.0,4,,4
6452,MATTHEW STAFFORD IS A SUPER BOWL CHAMPION,1644809641.0,4,:Steelers: Steelers,4
6453,Vegas Wins Again,1644809666.0,5,,4
6454,The bungles showed up lol,1644809730.0,4,,4
6455,At least the kids in Cincy don't have to worry about school tomorrow.,1644809750.0,4,:Panthers: Panthers :Commanders: Commanders,4
6456,Bengals are back to anal massages next year,1644809869.0,5,,4
6457,"Is Matt Stafford a HOFer?

I’m still going to say no.",1644809900.0,3,,4
6458,"Crazy how people forgetting about Higgins OPI TD, the most egregious reffing decision in the game",1644809957.0,5,:Chiefs: Chiefs,4
6459,For the first 54 Super Bowls no team won it in their home stadium. Now it's happened in back to back Super Bowls.,1644809980.0,4,:Eagles: Eagles,4
6460,That missed facemask call that should have been against the Bengals though...,1644810146.0,3,,4
6461,I don’t believe in the we’ll be back thing afc a gauntlet,1644810189.0,4,:Cowboys: Cowboys,4
6462,Legitimately VERY impressive that Mike Tirico was just on the podium after Super Bowl ended and now he is already hosting Olympics coverage,1644810231.0,5,,4
6463,Pahaha fuck Eli Apple,1644810259.0,4,:Chiefs: Chiefs,4
6464,"Warms my heart to see a billionaire asshole yank a team out of its city and move to indifferent LA, and then triumph in the end. No one does feel good stories like the NFL",1644810344.0,4,:49ers: 49ers,4
6465,"The AFC is about to be great football to watch over the next 10+ years with Herbert, Burrow, Allen, Mahomes & Jackson",1644810735.0,4,:Chargers: Chargers,4
6466,That was fun.,1644810771.0,4,,4
6467,Watched the whole game on the plane let’s go la,1644811165.0,4,,4
6468,"Okay, see you guys in two weeks when Brady unretires.",1644812006.0,5,:Buccaneers: Buccaneers,4
6469,Man guck the refs really but that was also absolutly terrible defensive calls in the final rams drive. Kupp is the only one that can catch a damn ball all game for them and no other threat is even on the field and you let Eli apple play him 1 on 1 for like 8 straight plays and watching him lose every single one of them?,1644812243.0,4,:Bengals: Bengals,4
6470,I hope Jared Goff is ok 😕,1644812913.0,4,:Browns: Browns,4
6471,"I’m sad to see my team lose after being so close to it, but watching all of the players on the rams that were so deserving of it actually made me feel better. But my hatred for Chris Collinsworth will prolly never be greater than it was tonight, all he did was state things we already know and make asinine takes on things. Get Al someone competent, if I ever have to hear Chris again it’ll be too soon.",1644813470.0,4,,4
6472,Eli apple🤡 (yes I am a giants fan),1644813689.0,5,,4
6473,Leaves Detroit and immediately wins a ring. This is Verlander all over again,1644814291.0,4,:Lions: Lions,4
6474,Great playoffs capped off by a great game.,1644814411.0,3,:Lions: Lions,4
6475,"Can’t believe the Bengals ran the ball with their backup running back to lose the game, it didn’t work before it wasn’t going to work on 3rd and 1 to win the game, it’s the super bowl, play your star RB Mixon on the most important plays. Incompetent coaching call by Zac Taylor.",1644832159.0,6,,4
6476,I’m not super well versed in football.. but why didn’t Cincinnati just kick a field goal to tie the game when they had possession at 20-23? Thanks,1644845415.0,5,,4
6477,Joe B played is heart out even after his knee got torn to shreds. The Bengals should be drafting heavy o-line this year to protect their guy.,1644849348.0,5,,4
6478,"This was a strange game. Low-key, this was more of a defensive battle despite the final score. Neither offense was ever clicking the entire game. The Bengals seemed to grab all the momentum off of 2 consecutive plays to start the 2nd half, the Burrow TD pass and then the subsequent Stafford INT. They basically rode those 2 plays for as long as they could the rest of the game, but it just wasn't enough. The Rams' defense would not let the game get out of hand. Bengals management needs to get Burrow an O-line like yesterday!

On all those flags in the last 2 minutes, I think the first one was the only bad one, which if that doesn't even get thrown, the other flags might not ever happen since it would have been 4th down and the defense had all the momentum at that point. I feel like the Bengals' D was primed to win the game the way the Rams' D ended up doing. It's a ""what could have been"" moment.",1644859277.0,4,:Eagles: Eagles,4
6479,Most iconic duo in NFL history: McVay's Rams and Super Bowls that are an assault on the game of football,1644807875.0,24,:49ers: 49ers,4
6480,Rigged,1644807883.0,25,,4
6481,[deleted],1644807876.0,36,,4
6482,Bengals got robbed,1644807881.0,76,:Patriots: Patriots,4
6483,"Imagine having a superbowl with such a blatantly rigged ending after a bombshell accusation of the Miami owner rigging games.

I wasn’t even rooting for the Bengals but that was obvious as hell.",1644807971.0,51,:Packers: Packers,4
6484,Neither a Rams or a Bengals fan... but what is  with the massive amount of flags at the last minute to help the rams win lol.. with there being NO FLAGS all game.  Such obvious fuckery.,1644807973.0,10,,4
6485,Anyone in here who thinks Stafford was never good; Fuck you!,1644810161.0,10,:Lions: Lions,4
6486,"Here’s my take on it as a Bengals fan:

1. Bengals got away with that TD in early 3rd, obvious PI
2. Burrow’s O-Line once again folds under pressure
3. Cooper Kupp proved that WRs should have a better chance of winning MVP

But, honesty, the ending fell flat. Could have been more appealing to watch on both ends if there wasn’t flags everywhere late in that last Rams drive. In the end, GG, Rams, you played well when it mattered, and I’m happy to see Stafford finally get a ring. It hurts to see Joe Burrow go down like that after coming so close but with the hope of a new o-line this team will come back again.",1644811325.0,11,,4
6487,"If the Bengals won. Would there be this much outrage over the facemask free TD no call?

Lol",1644811476.0,11,:Rams: Rams,4
6488,"Well LA, you got your NFL mandated win! Needed one for a big market I guess",1644807971.0,10,,4
6489,Congratulations to the 0 rams fans out there,1644808306.0,60,:Packers: Packers,4
6490,Underrated stat: SB teams are undefeated when leading at the end of the game,1644807875.0,18,:Cardinals: Cardinals,4
6491,https://i.redd.it/g2rpsxbhp1f81.jpg,1644807874.0,16,:Steelers: Steelers,4
6492,St Louis deserved it,1644807879.0,8,:Vikings: Vikings :Vikings: Vikings,4
6493,STAFFORD GOT HIS RING,1644807880.0,7,:Lions: Lions,4
6494,"I just cannot get over that 3rd down call. 

There's less than a minute left, you only have 2 timeouts, and you decide to run at Aaron Donald with your BACKUP running back. My goodness",1644807885.0,6,:Packers: Packers,4
