,text,time,upvote,flair,phase
4526,Hahaha totally worth the flag if I’m the Bucs,1612752882.0,15,:Titans: Titans,3
4527,It was worth it. Chiefs need to relax.,1612752892.0,15,:Cowboys: Cowboys,3
4528,It's Hill so I'd say it wasnt enough taunting. Fuck him.,1612752894.0,16,:Steelers: Steelers,3
4529,LOL Winfield flashy the peace to Tyreek Hill. What a great game,1612752895.0,16,:Ravens: Ravens,3
4530,Winfield taunting on all around nice guy Tyreek Hill,1612752947.0,15,:Steelers: Steelers,3
4531,"Romo: “That is a DISGUSTING ACT by Antoine Winfield, Jr.”",1612752952.0,17,:Bears: Bears,3
4532,Poor Tyreek oh nooooooooo,1612752962.0,16,:49ers: 49ers,3
4533,Winfield did the disgusting act of doing the same thing hill does every time he burns someone for a td,1612752963.0,16,,3
4534,"Well Tony, it's better than kicking women when they're down",1612752973.0,16,:Patriots: Patriots,3
4535,"“Hi I’m a major company, and in these trying times we paid for a Super Bowl ad even though we laid off tons of our staff to remind everybody that we are in this together”",1612752986.0,17,:Lions: Lions :Patriots: Patriots,3
4536,Oof that's wasted money from Robinhood,1612752988.0,16,,3
4537,That Robinhood commercial is going to trigger Reddit so hard hahaha,1612752990.0,16,,3
4538,Robinhood really gonna advertise during the Super Bowl after all they did huh?,1612752991.0,18,:Chargers: Chargers,3
4539,Fuck Robinhood,1612752992.0,16,:Patriots: Patriots,3
4540,Lmfao totally worth it to taunt Hill. Fuck that piece of shit.,1612753005.0,15,:Seahawks: Seahawks,3
4541,The entire Kansas City Chiefs team owes Mahomes an apology.,1612753070.0,16,:Steelers: Steelers,3
4542,"Brady up 3-2 on Mahomes, 1-0 in Super Bowl. Gonna be a legendary 20 year rivalry.",1612753165.0,16,:Chiefs: Chiefs,3
4543, Tom Brady now has four rings since Deflategate,1612753223.0,15,:Buccaneers: Buccaneers,3
4544,Brady is gonna be pissed when everyone else is too hungover to come to his players practice tomorrow,1612753225.0,17,,3
4545,"Britt Reid degenerate piece of shit, silver spoon baby",1612753257.0,17,:Dolphins: Dolphins,3
4546,"I mean yeah Tom Brady may be about to have seven super bowl rings, super model wife, three kids he loves, more money than we can imagine, and he's pretty damn handsome too

But I can eat a BLT with extra mayo with a strawberry milkshake on the side so

Who's really winning here",1612753284.0,15,:Patriots: Patriots,3
4547,Why not mention that the dick head was drunk? Fuck him.,1612753287.0,16,:NFL: NFL,3
4548,Lmao that’s a pick that bounced off his hand,1612753304.0,16,:Patriots: Patriots :Cardinals: Cardinals,3
4549,That was a pick lol.,1612753314.0,15,:49ers: 49ers,3
4550,That was a pick,1612753318.0,17,:Patriots: Patriots,3
4551,"Here's a hot take, this is the last Super Bowl Mahomes will be in for the next 5 years.",1612753321.0,16,:Eagles: Eagles,3
4552,"Why are they not saying he was drunk, they make it sound like an accident. He was drunk. He should go to jail.",1612753321.0,16,:Ravens: Ravens,3
4553,Just gunna skate right past the DUI part of that... wonder if they would have bright it up at all if they were winning,1612753324.0,14,,3
4554,That looked like it bounced off his hand,1612753333.0,16,:Browns: Browns,3
4555,Chiefs gonna get a sympathy TD bc they didnt want to challenge that int,1612753343.0,18,,3
4556,Brady’s jawline gets better with age,1612753466.0,16,:Patriots: Patriots,3
4557,"Remember folks, there are people that unironically don’t believe Tom Brady is the greatest player in NFL history",1612753488.0,16,,3
4558,Mahomes running for his life immediately after the snap is getting kind of sad at this point,1612753507.0,16,:Vikings: Vikings,3
4559,I bet rob gronkowski is not regretting his decision to get the band back together,1612753522.0,15,:Jets: Jets,3
4560,Just for some reference here. Brady won his first SB when I was in 7th grade. I’m 31 now.,1612753536.0,16,,3
4561,A single man has more Super Bowl rings than any franchise. love him or hate him....he is the GOAT.,1612753557.0,16,:Patriots: Patriots,3
4562,If Eli Manning wasn’t born Tom Brady would be 9-1 in superbowls.,1612753559.0,15,:Giants: Giants,3
4563,"yo shoutout to the ""Kansas City -3 is easy money"" posts I saw earlier",1612753568.0,16,:Giants: Giants,3
4564,If KC comes back I’ll remove half of my ass,1612753595.0,16,:Ravens: Ravens,3
4565,“Way to wet around here” 👀,1612753622.0,17,:Falcons: Falcons,3
4566,This Alexa commercial is some black mirror shit,1612753655.0,16,:Falcons: Falcons :49ers: 49ers,3
4567,Brady saw that Peyton had a Superbowl with 2 different teams and he took that personally.,1612753683.0,17,:Vikings: Vikings,3
4568,That alexa ad was great,1612753687.0,16,:Patriots: Patriots,3
4569,LOL ONE LAST INDIGNITY,1612753798.0,16,:NFL: NFL,3
4570,Not a single touchdown for KC. That’s wild,1612753823.0,16,:Buccaneers: Buccaneers,3
4571,"Chiefs fans... welcome to the ""2nd SB trip killed by Brady"" club.",1612753885.0,16,:Seahawks: Seahawks,3
4572,"“What team has the most Super Bowl wins in NFL history?”

“Tom Brady”",1612753912.0,16,,3
4573,"Ah yes, 31-9 as we all expected",1612753980.0,17,:Lions: Lions :Bills: Bills,3
4574,No one else in football can make that throw and the receiver drops it. Brutal for KC,1612751541.0,32,:Bears: Bears,3
4575,"If anyone deserves that, it's Hill.",1612752854.0,31,:Raiders: Raiders,3
4576,Taunting Tyreek should be legal tbh,1612752862.0,34,:Commanders: Commanders,3
4577,Winfield Jr. lucky he ain't a child or a woman or else Hill might actually do something.,1612752925.0,31,:49ers: 49ers,3
4578,Tom Brady is a hero. He saved us from having to hear Mahomes girlfriend screaming and seeing a stupid tiktok dance from his brother,1612753663.0,32,:Patriots: Patriots,3
4579,Chiefs look like they're imploding. A lot of toxic characters on that defense.,1612749600.0,31,:Bengals: Bengals,3
4580,SHOW THE STREAKER,1612752515.0,30,:Browns: Browns,3
4581,"Just made 700k off a streaker prop bet ama

Edit: all will be going towards my legal fees for trespassing.",1612752586.0,31,:49ers: 49ers,3
4582,Anyone who taunts Tyreek Hill should get a pass IMO,1612752824.0,30,:Vikings: Vikings,3
4583,"best commercial so far goes to cheetos , who had that on their bingo card",1612750557.0,45,:Texans: Texans,3
4584,All these takes just trashing Mahomes and he’s not even playing badly given how much the Tampa D is dominating. Can’t say I’m mad tho lol. Big fat slice of humble pie for Chiefs fans tn,1612752029.0,41,,3
4585,"I remember thinking Tom Brady was too old 10 years ago. Then I stopped doubting him and slightly rooting for him. Just like LeBron or Jeter, sometimes you just need to sit back and appreciate greatness in front of your face no matter the team.",1612750935.0,45,:Browns: Browns,3
4586,"He's older than your dad

Unless you're a Chiefs fan. Then he is your dad",1612747362.0,74,:NFL: NFL,3
4587,All four TDs for the Bucs thus far were scored by players not on the team last year.,1612749584.0,16,:Patriots: Patriots,3
4588,Wow this KC defense is getting creamed in the ass right now,1612749588.0,15,:Cowboys: Cowboys,3
4589,So are we blaming the ref's for that Tampa Bay touchdown as well?,1612749622.0,15,:Falcons: Falcons,3
4590,"Why every hating the commentators, if chiefs did something exciting maybe they show more enthusiasm to the chiefs too",1612749661.0,15,:Jets: Jets,3
4591,"So like Tom’s 100% the GOAT if he wins this game right? Like he already is, but it has to be  literally undisputed after this",1612749705.0,13,:Ravens: Ravens,3
4592,I guess super star quarterbacks still need linemen huh,1612749954.0,14,:Seahawks: Seahawks,3
4593,So that happens when you adjust Mahomes stats to league average,1612749957.0,14,:Lions: Lions :Lions: Lions,3
4594,Barrett was held and he still destroyed that olineman.,1612749957.0,14,:Cardinals: Cardinals,3
4595,Four Seasons total landscaping AND a cybertruck shoutout? Topical!,1612750060.0,15,:Dolphins: Dolphins,3
4596,Game’s already in hand and Brady showed more effort on that ball than Ben did,1612750404.0,13,,3
4597,Does anyone else remember like early 2000s when 50 yard kicks were rare and it was only in specific situations they would attempt them?,1612750482.0,15,:Dolphins: Dolphins,3
4598,Cheetos commercial was great,1612750533.0,14,:Chiefs: Chiefs,3
4599,Ashton Kutcher is the second worst singer today thank god for the Oatly guy,1612750541.0,15,:Commanders: Commanders,3
4600,KC can win this if they score 35 points on this drive.,1612750701.0,14,:Saints: Saints,3
4601,Good lord y’all are some judgey fucks about these celebrities. People get old. It happens. To everyone.,1612750727.0,16,:Panthers: Panthers,3
4602,That Shaggy commercial is the best one yet. I didn’t expect to see him in 2021 lmao,1612750734.0,15,:Jets: Jets,3
4603,Latest false start penalty in the history of the NFL,1612750777.0,16,:Ravens: Ravens,3
4604,This is the worst I’ve ever seen Mahomes play,1612750905.0,15,:Ravens: Ravens,3
4605,"I listened to a lot of nfl podcasts at work.

Nobody thought they could shut down Hill.

Hill has almost been a complete non factor. (minus that last play)",1612750940.0,15,:Colts: Colts,3
4606,Robert Saleh said don't believe the limping Mahomes does.,1612750979.0,15,,3
4607,Tom Brady's blue steel look making me NUT,1612750990.0,14,:NFL: NFL,3
4608,"And to think, if Buffalo just knew how to defend Kelce, it could be US in here looking stupid and losing to Tom Brady again",1612750991.0,13,:Bills: Bills,3
4609,I feel like this is the first time Mahomes has had a bad game,1612750995.0,15,:Falcons: Falcons,3
4610,CGI Lombardi is freaking me out,1612751005.0,16,:Bears: Bears,3
4611,"CBS actually accepted a Scientology add

Really",1612751208.0,15,:Texans: Texans,3
4612,How did mahomes get that that far,1612751358.0,16,:Titans: Titans,3
4613,Holy fuck he almost caught it,1612751368.0,15,:Bears: Bears,3
4614,HOLY SHIT IT HIT HIM IN THE HANDS HOLY SHIT MAHOMES,1612751369.0,13,:Vikings: Vikings,3
4615,[deleted],1612751403.0,16,,3
4616,"Holy **SHIT**. Mahomes is a fucking *beast*.

That arm strength is unreal",1612751438.0,14,:Buccaneers: Buccaneers,3
4617,HOW THE FUCK WAS THAT BALL THROWN THAT WELL??  Another face ball drop in the end zone also from KC.,1612751546.0,13,:Lions: Lions,3
4618,"That fucking throw, jesus. He was parallel to the ground, unreal.",1612751589.0,14,:Patriots: Patriots,3
4619,"Those were two of the best throws I've ever seen in my life on back to back plays. I know he missed, but Mahomes is incredible",1612751618.0,16,:Patriots: Patriots,3
4620,Mahomes is an actual wizard. He's literally hitting his dudes in the face with the ball while running for his life.,1612751619.0,14,:Texans: Texans,3
4621,"Man, my coaches were ripping me apart in fucking junior high if I was missing a catch that literally hit my face. 

KC receivers have no excuses. They’re making it impossible for Mahimes to get the job done.",1612751621.0,15,,3
4622,Mahomes did everything in his power to not get sacked. You can’t blame him. Ran for his life and made two crazy throws no other QB would make. Not his fault his OL been trash and his receivers can’t catch.,1612751626.0,14,:Giants: Giants,3
4623,The real winners tonight are all the o-line draft candidates,1612752064.0,15,:Lions: Lions,3
4624,"Bucs plan: 

rush 4 players who almost get a sack every play
 
Everyone else in coverage",1612752402.0,15,:Panthers: Panthers,3
4625,IDK why KC kept the long drop backs when the tackles aren't good. It just makes it easier for the DE to win and harass Mahomes.,1612752405.0,15,:Browns: Browns :Lions: Lions,3
4626,"\*Puts guy into sleeper hold\*

""That's kind of a soft call.""",1612752474.0,13,,3
4627,"Love how Romo says ""idkkk"" when it was obviously a chokehold lmao",1612752476.0,14,,3
4628,STREAKER LETS GOOOOOO,1612752494.0,15,:Dolphins: Dolphins,3
4629,"lmao dude has an arm wrapped around his head ""eh that's kind of a soft call""",1612752495.0,15,,3
4630,Streaker is best part of the game so far,1612752505.0,15,:Dolphins: Dolphins,3
4631,"Hey alright, they usually cut away before the fan makes it on camera",1612752515.0,15,:Packers: Packers :Packers: Packers,3
4632,Super Bowl Streaker,1612752515.0,14,:Patriots: Patriots,3
4633,Brady checkin out that guy,1612752517.0,15,:Patriots: Patriots,3
4634,Streaker!!!!! Finally something to keep me engaged in this game,1612752523.0,15,:Chiefs: Chiefs,3
4635,That's a clear hold. Why is Romo calling it soft? That's exactly what refs need to be calling more often to help offset the ridiculous bias in favor of offenses.,1612752524.0,15,,3
4636,"Don't worry folks, that fan is vaccinated.",1612752524.0,16,,3
4637,[deleted],1612752528.0,15,,3
4638,What are the chances that dude posts in here ?,1612752530.0,15,:Buccaneers: Buccaneers,3
4639,“They should sign him” LOL,1612752535.0,15,:Cardinals: Cardinals,3
4640,SHOW HIS BOOBS YOU COWARDS!,1612752536.0,15,:Cowboys: Cowboys,3
4641,BOOOOOOOO SHOW THE STREAKER,1612752543.0,15,:Broncos: Broncos,3
4642,Not showing streakers is bullshit.,1612752546.0,16,:Steelers: Steelers,3
4643,vaccinated health care professional on the field!,1612752558.0,15,:Bears: Bears,3
4644,CHIEFS NEED TO SIGN THAT MAN. LOOK AT THAT SPEED,1612752559.0,15,:Jaguars: Jaguars,3
4645,"SHOW THE STREAKER, YOU COWARDS!",1612752570.0,13,:Texans: Texans,3
4646,Someone post a video of the fan!!!,1612752576.0,15,,3
4647,“One of the great runs of the night.”,1612752600.0,13,:Lions: Lions,3
4648,That fan was a plant just to serve as an excuse for more ads,1612752607.0,15,:NFL: NFL,3
4649,"""weak holding call"" literal choke hold",1612752628.0,15,:Raiders: Raiders :Saints: Saints,3
4650,"""when I was in my drinking prime, I ran on the field that Brady and Mahomes played on.""


They'll be telling their kid one day.",1612752636.0,15,:NFL: NFL,3
4651,That guy got to the endzone before the chiefs lol,1612752639.0,15,:Patriots: Patriots :Jaguars: Jaguars,3
4652,damn that streaker making us watch more terrible commercials,1612752642.0,15,:Cowboys: Cowboys,3
4653,Florida Man strikes again,1612752647.0,14,,3
4654,"Tom Brady should wrap up his final 30 years of his career by winning a Super Bowl for every franchise and solidifying his status, as the G.O.A.T.",1612752751.0,14,:Bears: Bears,3
4655,"There's a free rusher EVERY DOWN.
 
I feel bad for Mahomes. He's got no chance to do anything.",1612752831.0,15,:Bengals: Bengals,3
4656,✌️✌️✌️✌️,1612752833.0,15,:Rams: Rams :Cowboys: Cowboys,3
4657,Suh going after mahomes like he’s Aaron Rodgers,1612752839.0,14,:Lions: Lions :Lions: Lions,3
4658,"*Peace bitch*

That's great hahaha",1612752841.0,14,:49ers: 49ers,3
4659,">Shouldn't do that

Nah, he threw the peace sign to Hill. He fucking should taunt that piece of shit",1612752848.0,14,:Broncos: Broncos,3
4660,Eh taunting tyreek is fine,1612752861.0,15,:Ravens: Ravens,3
4661,That was worth 15 yards all damn day,1612752862.0,14,:Titans: Titans,3
4662,"No, we want taunting. Let's get spicy people!!",1612752863.0,14,:Steelers: Steelers,3
4663,FUCK TYREEK HILL,1612752864.0,13,:Bengals: Bengals :Patriots: Patriots,3
4664,Lmaooo Winfield like ✌🏻,1612752864.0,15,:Vikings: Vikings,3
4665,Lol that was pretty funny though xD,1612752865.0,15,:Seahawks: Seahawks,3
4666,🤣✌️,1612752866.0,15,:Giants: Giants,3
4667,"It's actually pretty funny, Tony",1612752874.0,16,,3
4668,"""I dont like or condone that at all""

\*shows slowmo upclose replay of the taunt*",1612752880.0,16,,3
4669,The 2 signified the number of assaults Hill will commit this year,1612752892.0,14,:Lions: Lions,3
4670,"Mahomes has more super bowl losses than Trubisky.

Mahomes has thrown more interceptions in the Super Bowl than Trubisky

Trubisky had taken less sacks in the super bowl than Mahomes. 

Trubisky has never let anyone score 30 points on him in a super bowl.

Trubisky never let Tom Brady win a super bowl. 

And finally, Trubisky has NEVER lost to the Tom Brady Buccaneers.

EAT YOUR HEART OUT, NFL GRAPHICS.",1612752918.0,15,,3
4671,"""Kicking a guy while he's down""

Kareem hunt: 👁👄👁",1612752924.0,15,:Seahawks: Seahawks,3
4672,That was absolutely worth the penalty.,1612752933.0,14,,3
4673,I'll only accept it because it was Tyreek Hill.,1612752945.0,14,:Vikings: Vikings :Chiefs: Chiefs,3
4674,Wow people seriously get upset about taunting?,1612752960.0,15,:Seahawks: Seahawks,3
4675,Yeah that’s normally a bad penalty but fuck Tyreek Hill that’s definitely worth it,1612752965.0,16,,3
4676,FUCK ROBINHOOD,1612752977.0,13,:Patriots: Patriots :Patriots: Patriots,3
4677,Video of the streaker who has more rushing yards than the Chief's offence: https://twitter.com/djmogg/status/1358608935301898242?s=09,1612752979.0,15,:49ers: 49ers,3
4678,#FUCK ROBINHOOD,1612752981.0,14,:Chiefs: Chiefs,3
4679,Fuck Robinhood all my homies hate Robinhood,1612752982.0,15,:Steelers: Steelers,3
4680,Robin Hood has some baalllllls to take out a Super Bowl commercial,1612752983.0,15,:Eagles: Eagles,3
4681,LMAO Robinhood trying to do some damage control,1612752992.0,15,:Panthers: Panthers,3
4682,It just feels good to see the chiefs get called for the penalties they commit all the time.  Cathartic,1612753006.0,14,:49ers: 49ers,3
4683,Fuck Robinhood,1612753108.0,16,:Broncos: Broncos :49ers: 49ers,3
4684,"At the beginning of the game:

Mahomes: *""Come on guys, LET'S FUCKING GO!""*

Everyone else on the offense: *""Aight, I'mma head out""*",1612753115.0,15,:Patriots: Patriots,3
4685,Mahomes isn't going to last 7 more years behind that offensive line unless they get a lot better. Let alone making 7 more Super Bowls.,1612753124.0,16,:Bengals: Bengals,3
4686,"Mahomes ain't winning 8 Super Bowls, Tony.",1612753134.0,16,:Panthers: Panthers,3
4687,"Tom Brady has more super bowl wins than any single franchise

What the fuck",1612753141.0,14,:Ravens: Ravens :Ravens: Ravens,3
4688,holy shit they mentioned the britt stuff,1612753202.0,15,,3
4689,Thoughts and Prayers **Just to the kids**... That's how you do it Nantz,1612753228.0,15,:Vikings: Vikings,3
4690,"Wow, they actually addressed it. Shocking",1612753229.0,15,:Browns: Browns,3
4691,[deleted],1612753231.0,17,,3
4692,Britt's gonna be in the slammer for a long time,1612753233.0,14,:Vikings: Vikings,3
4693,[deleted],1612753234.0,16,,3
4694,CBS conveniently leaving out the DUI part.,1612753256.0,14,:Cowboys: Cowboys,3
4695,Robinhood really had the guts to put an ad in Super Bowl,1612753280.0,15,,3
4696,"Chiefs, welcome to the ""Brady ruined our repeat"" club. We have cookies.",1612753282.0,15,:Seahawks: Seahawks,3
4697,I don’t think that ever hit the ground...,1612753315.0,15,:Lions: Lions,3
4698,It didn’t hit the ground lol,1612753317.0,16,,3
4699,That was a pick,1612753331.0,15,:Patriots: Patriots,3
4700,That looked like a clean INT to me.,1612753337.0,16,:Browns: Browns,3
4701,Well KC got a lucky call there...,1612753349.0,17,:Patriots: Patriots,3
4702,"No challenge on that?

WTF you're up in the SB, challenge that bitch it was a pick!",1612753359.0,15,:Dolphins: Dolphins,3
4703,Can't believe they'd give air time to Britt Reid and the accident without saying how much of a piece of shit he is,1612753386.0,15,,3
4704,I feel like tonight is the Mahomes we get if Chicago had drafted him. Him running around all night trying to do it all himself.,1612753504.0,14,:Bears: Bears,3
4705,#Don’t forget Todd Bowles went 10-6 his first year with the Jets with a shot to get in with a win before Fitz threw 3 ints in the 4th quarter vs buffalo,1612753537.0,16,:Bills: Bills,3
4706,somewhere Bill Belicheck is sitting angrily eating his subway.,1612753560.0,17,:Bengals: Bengals,3
4707,Just imagine if Brady stayed on the Pats and everyone called him washed this whole season lmao.,1612753592.0,17,:Titans: Titans,3
4708,Well at least now I know how Mahomes would look playing for the bears,1612753606.0,14,:Bears: Bears,3
4709,"""Things are getting way too wet around here """,1612753638.0,15,:Patriots: Patriots,3
4710,Lol this amazon is wild,1612753682.0,15,:Titans: Titans,3
4711,Wow that commercial came outta nowhere,1612753688.0,16,,3
4712,"Brady winning another super bowl by beating brees, rodgers and mahomes and...HEINICKE",1612753697.0,15,:Patriots: Patriots,3
4713,"> why did a blind man conquer Everest

Well it certainly wasn’t for the views lol",1612753722.0,15,:Patriots: Patriots,3
4714,Tom Brady and Jason Pierre-Paul both minutes away from having Super Bowl rings for nearly all their fingers.,1612753762.0,15,:Patriots: Patriots,3
4715,The Chiefs scored 0 touchdowns this game. Unbelievable,1612753813.0,14,,3
4716,Gronk literally might be Super Bowl MVP a year out of retirement lmao,1612749585.0,29,:Patriots: Patriots,3
4717,Brady got on the ball. Peyton didn't. That's why he is the GOAT,1612750436.0,31,:Seahawks: Seahawks,3
4718,This Shaggy commercial lmao,1612750520.0,32,:Bears: Bears,3
4719,For all that Hill has done that shit was worth it,1612752849.0,29,:Packers: Packers,3
4720,"Tony Romo: “this kid is gonna play in a ton of Super Bowls”

Lol sure they said that about Russell Wilson too. Getting to SBs ain’t as easy as Brady does them",1612753101.0,32,,3
4721,"Fuck drunk drivers



And here's 20 beer commercials!",1612753306.0,32,:Steelers: Steelers,3
4722,"The Wayne’s World one is the first one that got me to audibly laugh, but that may have been the nostalgia laughing.",1612749256.0,30,:Panthers: Panthers,3
4723,At this point all I can hope is that Brady winning another Super Bowl is a necessary ritual to reset the world back to normal.,1612749649.0,30,:Falcons: Falcons :Commanders: Commanders,3
4724,Taunting one of the biggest pieces of shit in the league. Winfield Jr. is my new favorite player.,1612752893.0,29,:Lions: Lions,3
4725,Don't fucking mention that girl and her family if you're not gonna call out that piece of shit for driving drunk. He admitted to it.,1612753289.0,28,:Packers: Packers :NFL: NFL,3
4726,I 100% condone that taunt. That is hilarious.,1612752843.0,41,:Raiders: Raiders,3
4727,"These guys talking about Britt Reid is pretty disgusting.  
  
""Car was struck""  
  
""were involved in an accident""  
  
""were injured""  
  
The phrasing is important to how we internalize thoughts. Language is important. They're phrasing this in a way that makes it seem like a total accident, act of fate or some shit. A dude drove drunk and nearly killed two people who aren't guaranteed to survive, and all they can say is, ""were involved in an accident."" It's sad.",1612753539.0,41,:Patriots: Patriots,3
4728,"Chiefs: “Alright we can’t hold or we’ll get called for it switch to plan b.”

“What’s plan b?”

Chiefs defense: ........😐😐😐😐😐",1612749638.0,52,,3
4729,Honey Badger talking shit when he’s been bent over like a fuckin beach chair all game,1612751993.0,37,:Patriots: Patriots,3
4730,"Brady paid the Weeknd dancers to tear up the field so Kelce would slip 

The fix is in",1612749102.0,14,:Commanders: Commanders,3
4731,Can't believe Brady paid The Weeknd to step on the grass :(,1612749105.0,15,:Chargers: Chargers,3
4732,"Me: Imagine thinking Mahomes won't make a comeback

Also me: Imagine thinking Tom Brady will blow this lead",1612749385.0,15,:Browns: Browns,3
4733,"People who bet against Brady are literally dumb 

The amount of people who though the chiefs would blow them out is comical",1612749606.0,14,:Chargers: Chargers,3
4734,Kinda glad I just ordered an escort for myself instead of watching this superbowl,1612749628.0,15,,3
4735,This Bucs DLine is monstrous. You literally see Chiefs OLine holding in every play still,1612749943.0,15,,3
4736,Turns out winning multiple SBs is really hard unless you’re Tom Brady,1612749998.0,15,:Eagles: Eagles,3
4737,"Yeah, no the refs aren't the reason we're getting murked.",1612750138.0,13,:Chiefs: Chiefs :Bears: Bears,3
4738,"""Fuck State Farm"" ~ Brady",1612750216.0,15,:Seahawks: Seahawks,3
4739,Chiefs picked an awful time to get blown out for the first time in the Mahomes era,1612750464.0,15,:49ers: 49ers,3
4740,lmao his shaggy commercial,1612750474.0,15,:Cowboys: Cowboys,3
4741,holy shit ashton can't sing,1612750475.0,15,:Bears: Bears,3
4742,Shaggy is still a fucking G,1612750478.0,14,,3
4743,That shaggy ad legit made me laugh,1612750529.0,15,,3
4744,This song still bumps.,1612750530.0,13,,3
4745,"Ok Cheetos wins, they got fucking shaggy",1612750535.0,15,:Cowboys: Cowboys,3
4746,Ashton Kutcher is not a good singer lol,1612750543.0,14,:Patriots: Patriots :Patriots: Patriots,3
4747,Never knew I needed a shaggy-Cheetos remix until now.,1612750563.0,14,:Vikings: Vikings :Bills: Bills,3
4748,Mila Kunis still pumps my nads,1612750651.0,15,,3
4749,Mahomes doesn't break 100 yards until there's 1:00 left in the 3rd. Just as we all predicted.,1612750960.0,15,:49ers: 49ers,3
4750,A Brady team ruining two potential dynasties the last decade in the Seahawks and Chiefs,1612750966.0,13,:Colts: Colts,3
4751,Down 3 scores and the Chiefs playing with no urgency.  They look like they’re ready to go home,1612750980.0,14,:Raiders: Raiders,3
4752,Mahomes acting like he hasn't made like 8 flawless scrambles with 0 limp.,1612750981.0,13,:Lions: Lions :Steelers: Steelers,3
4753,This Vince Lombardi lookalike thing is really falling flat for me,1612751004.0,15,:Vikings: Vikings,3
4754,"Mahomes woke up feeling dangerous 

148yrds 🤮
0Tds 😳
1Int 🔥",1612751206.0,13,:Bills: Bills,3
4755,HOWS THAT NOT A HOLD,1612751282.0,14,,3
4756,Normal Toe Mahomes > Turf Toe Mahomes,1612751287.0,15,,3
4757,Josh Allen made the Super Bowl after all lol,1612751362.0,14,:Bills: Bills,3
4758,That might have been the most insane throw I have ever seen. He was being spun around by a defender and dropped in in the back corner of the end zone and gave his guy a chance.,1612751368.0,12,:Vikings: Vikings,3
