text,time,upvote,flair,sport,phase,category
We build goalkeeping androids here in germany btw,1369509481.0,409,,Soccer,2,N
"Dortmund's strategy of giving all the best chances to Robben is working to perfection.

Edit: the plan backfired!!",1369510195.0,542,,Soccer,2,N
"[Robben kicks ball to Weidenfeller's face](http://i.minus.com/iWhxmuYOFY25R.gif)

[Mandzukic's goal](http://i.minus.com/i1mpUi1jFzVjm.gif)

[Gundogan goal](http://i.minus.com/ibhEeurWgPZ19U.gif)

[Subotic's save](http://i.minus.com/ibaxyY6ZKfvHho.gif)

[Lewandowski steps on Boateng](http://i.minus.com/iNU08VkV97w4w.gif)

[Robben's goal](http://i.minus.com/ifW43yRU3nEr6.gif)",1369510376.0,291,:Real_Madrid:,Soccer,2,N
Cheeky save from Weidenfeller,1369510340.0,126,,Soccer,2,N
"turkish commentator: ""Italians are good defenders, even their referees""",1369509094.0,262,,Soccer,2,N
"Time added on: 0 seconds

German matches are efficient.",1369510311.0,493,:USA:,Soccer,2,N
What if it ends up on penalties?germans vs germans itll go on forever,1369509811.0,90,:Everton:,Soccer,2,N
"Thank god that this is a final and it was robben on that breakaway.


Edit: GODDAMNIT THE IRONY BURNS! FUUUUUUUUUCK! ",1369509502.0,422,,Soccer,2,N
"Is anyone's broadcast on Fox having issues? When the ball is going in the air it seems to split into three balls, and the video sometimes stutters. ",1369508507.0,149,,Soccer,2,N
"Man, Robben can probably bang a billion chicks and not get a single one pregnant today.

EDIT: Robben should never take my advice when it comes to family planning. Congrats, Bayern!",1369510334.0,327,,Soccer,2,N
I fucking hate how much I care about this stupid fucking sport. ,1369510582.0,378,:r_soccer_user:,Soccer,2,N
"Boateng will not be substituted today until one of his legs comes right out of its socket. Even then, the others will have to drag him off the field.",1369513404.0,74,:Hungary:,Soccer,2,N
"Two things in the world are certain; the sun rises in the east, and Robben will try to cut inside.",1369509888.0,634,,Soccer,2,N
"THAT'S IT,

1v1 CAGE FIGHT, 

Neuer vs Weidenfeller

Last man standing takes the cup!",1369510286.0,260,,Soccer,2,N
Replay shows how. amazing this save really was. Neuer has insanely amazing reflexes!,1369508617.0,62,:Hungary:,Soccer,2,N
Redditors who were saying Robben should be subbed are furiously deleting their comments,1369513883.0,220,,Soccer,2,N
"If it were Kahn in goal, his throat would be sore from screaming at his team so much by now.",1369508944.0,58,,Soccer,2,N
Both goalies have been amazing. Feels so good to watch such beautiful saves.,1369509204.0,60,:Manchester_United:,Soccer,2,N
If bayern had lost this final robben would have been on suicide watch. I think te best team of the year won. They were the best team in Europe this season. ,1369514384.0,53,:CD_Guadalajara:,Soccer,2,N
"**HEADSHOT**
",1369510439.0,52,:r_soccer_user:,Soccer,2,N
"Neuer: ""What do we say to the goals?""

Weidenfeller: ""not today""",1369509914.0,517,:Argentina:,Soccer,2,N
Dortmunds cheapest adult season ticket apparently works out £11 a game.  A Wembley match programme for this game £10. Talk about value for money.,1369507981.0,103,:r_soccer_user:,Soccer,2,N
"Let's raise the stakes. If Dortmund wins, they get to keep Götze.",1369508013.0,220,:Portland_Thorns:,Soccer,2,N
No yellow for that one? What is this? WC 2010 final?,1369509193.0,283,:Borussia_Dortmund:,Soccer,2,1U
"OMG Robben can [pass it](https://fbcdn-sphotos-b-a.akamaihd.net/hphotos-ak-ash4/395117_279791658808501_577055073_n.jpg) for an open goal......

Edit: [bollocks](http://i.minus.com/iOCG9jGZAfHo5.gif) he sure showed me :/",1369509595.0,211,:Arsenal:,Soccer,2,N
"uhh....guys, remember when you hated Robben like 5 seconds ago",1369513838.0,135,:Borussia_Dortmund:,Soccer,2,1U
"As a neutral, I am enjoying this. Now 4-4 and penalties please.",1369509364.0,43,,Soccer,2,N
This is going to be a football game.,1369507585.0,124,,Soccer,2,N
Ref with the best tackle for Bayern so far,1369509065.0,45,:Manchester_United:,Soccer,2,N
"GIF of Weidenfeller's face save. 
http://assets.sbnation.com/assets/2678151/FACE.gif",1369510545.0,43,:r_soccer_user:,Soccer,2,N
Gotze doing his best beiber impression with his outfit. ,1369508269.0,732,:Manchester_City:,Soccer,2,N
"http://i.imgur.com/boRg88b.jpg

",1369510854.0,804,:Manchester_United:,Soccer,2,N
"people complain about Robben, but Ribery is almost invisible ",1369511791.0,76,:Borussia_Dortmund:,Soccer,2,1U
Anyone else notice Neuer fall over just then?,1369508018.0,38,,Soccer,2,N
"German TV now showing ""best of Klopp"" clips gesturing at the sideline.",1369509582.0,39,:Arsenal:,Soccer,2,N
"> [Götze] didn't come with the team yesterday. He had a dentist appointment.

Yeah, I remember having ""dentist appointments"" in Secondary too.",1369508485.0,187,:Portland_Thorns:,Soccer,2,N
"This opening ceremony is cheesy as fuck.

-- twitted from the Holy Roman Empire",1369506968.0,338,,Soccer,2,N
what kind of stupid shit is this. just play the CL anthem and let them play.,1369506994.0,196,,Soccer,2,N
Holy shit... He saved it with his fucking face.,1369510166.0,32,:r_soccer_user:,Soccer,2,N
[deleted],1369507208.0,119,,Soccer,2,N
[deleted],1369512558.0,90,,Soccer,2,N
Oh god seeing Reus cry breaks my heart :(.,1369514209.0,29,:c_Manchester_United:,Soccer,2,N
"Mr. Lineker's take on this match: ""Football is a simple game; 22 men chase a ball for 90 minutes and at the end, the Germans always win.""",1369507179.0,242,,Soccer,2,N
"I love Reus' hair. Not that I would ever walk around town looking like that, but I would totally rock something  like that if I was a famous athlete. It's cool, but not too crazy flashy.",1369511407.0,81,,Soccer,2,N
[deleted],1369509326.0,124,,Soccer,2,N
NEUER 99 rated,1369508456.0,97,,Soccer,2,N
Robben going one on one with the keeper and having his shot blocked? Must be a final.,1369509448.0,76,,Soccer,2,N
I wonder why the commitee didn't decide to drive some Tiger Panzers onto the pitch right now... I mean they're halfway there already.,1369507240.0,72,,Soccer,2,N
"Good luck Dortmund, I wouldn't want to face anyone else in this final.",1369506061.0,22,:Germany:,Soccer,2,N
I can't help thinking that Robben has a slowly decaying picture in an attic. He looks younger than when he was at Chelsea ,1369509922.0,23,,Soccer,2,N
"I am sure this has been mentioned already, but damn do the Dortmund squad have awesome hair. And on the other end... there's Robben.",1369511571.0,23,,Soccer,2,N
http://i.minus.com/ik4Uwhh5IpqQD.gif,1369512979.0,22,:r_soccer_user:,Soccer,2,N
Robben is just a left foot with a face on it,1369509788.0,41,,Soccer,2,N
WTF is going on the field right now?,1369506998.0,60,:r_soccer_user:,Soccer,2,N
Neuer already had more to do than in the last 4 games combined.,1369508799.0,20,:Borussia_Dortmund:,Soccer,2,1U
"Get it together ITV, at least go to ads when Robben is 1v1 with the keeper, so we don't miss anything! 

Unlike Robben..",1369511648.0,19,:Arsenal:,Soccer,2,N
3 goals include Robben taking 9 days to celebrate and the whole Lewa / Boateng fiasco and we get 3 MINUTES OF EXTRA TIME? WHAT THE FUCK,1369514081.0,104,:r_soccer_user:,Soccer,2,N
Shouldn't Ribery have seen red for that? ,1369509166.0,58,,Soccer,2,N
GET OFF THE LAWN YOU CUNTS; YOU'LL RUIN IT,1369507186.0,127,:FC_Barcelona:,Soccer,2,N
[deleted],1369507156.0,124,,Soccer,2,N
"At this moment Javi Martinez is: world champion, euro champion, champions-league champion and Bundesliga Champion.

He has the chance to win this year: the german cup and the uefa super cup.

So if he wins the last tow he holds every titel (besides europa league champion) there is or am I missing something?",1369517275.0,18,,Soccer,2,N
That Klopp fist pump montage was sweet,1369509569.0,34,:r_soccer_user:,Soccer,2,N
German girls are pretty,1369511707.0,54,,Soccer,2,N
My daughter says Ribery reminds her of Scar from The Lion King.,1369512953.0,50,:Manchester_United:,Soccer,2,N
gotze is confused..,1369512094.0,18,:Indonesia:,Soccer,2,N
"Well, so far Dortmund is more dangerous than all of Bayern's CL opponents combined 

Edit: except Arsenal : ) ",1369508456.0,131,:Borussia_Dortmund:,Soccer,2,1U
"Nice little interview with Jurgen Klinsmann, the second best ""Jurgen Kl"" manager in the world right now.",1369506426.0,101,:USA:,Soccer,2,N
"[Never forget](http://i.imgur.com/5B5e2n2.jpg)  
 [the agony](http://i.imgur.com/oo4iKAt.jpg)  
[of defeat.](http://i.imgur.com/BpJTk63.jpg)   

Bonus: [Robben at the team dinner after the loss](http://i.imgur.com/JVQKO.jpg)    
Time to make up for last year. **Mia San Mia!**",1369505855.0,178,:Bayern_Munich:,Soccer,2,1F
"OP, put the time stamp before your comments so it's easier for people to follow.


EG

0' - The game has begun!

10' - The pace is electric. End to end!

---

EDIT: And please add more commentary. You chose to make what is arguably the most important match thread of the year. Many people are probably reading this match thread for updates (we had multiple people ask about live streaming, and since they got little/no answers, they will most likely come here). Please do not waste this opportunity.",1369508434.0,252,:Sanfrecce_Hiroshima:,Soccer,2,N
[deleted],1369512952.0,35,,Soccer,2,N
Fox Soccer has a [Champion's League Bingo](http://msn.foxsports.com/foxsoccer/event/champions-league-final-bingo) on on their site,1369507065.0,16,:Houston_Dynamo:,Soccer,2,N
Robben aaaaaargh. ,1369509369.0,16,,Soccer,2,N
"Weidenfeller is gonna need that dentist's contact number, Götze",1369510228.0,16,,Soccer,2,N
"Okay, now I can pee",1369510370.0,15,:CD_Guadalajara:,Soccer,2,N
"KEEPER LEVEL: MAX, wow these guys bringing it",1369509165.0,44,,Soccer,2,N
LEWA LEWA LEWAN....EUER,1369508403.0,16,,Soccer,2,N
I wonder if they'll put lahm in the cup and carry him around,1369514802.0,15,,Soccer,2,N
"I'll be cheering for Dortmund. Not because I'm afraid of a potential bavarian vengeance vs. Chelsea in the supercup, but uhm... well Dortmund's jersey reminds me of bees, with their yellow and black. bees look funny. I like bees. so that's that.

Edit: well shit",1369505953.0,336,:Chelsea:,Soccer,2,N
what a way for the american audience to be introduced to european football. holy shit what a game,1369513210.0,42,:Tottenham_Hotspur:,Soccer,2,N
"Hahaha, the whole entire moment and the lead up to Robben's shot was hilarious. 

Hummels and Robben just jumping around, looking clumsy trying to find the ball, then Robben gets it, Hummels tries to reach the ball but can't and ends up with a hilarious face. 

Then Robben shoots the ball and hits Weidenfeller right in the face. 


It was even funnier in slow motion. ",1369510277.0,13,,Soccer,2,N
Couldn't ask for a better 45 minutes of champions league final football except maybe a goal or two. Two incredibly entertaining teams.,1369510367.0,14,:Chelsea:,Soccer,2,N
"Very smart, Budweiser. Use a FIFA 13 song in your commercial during the UEFA CL Final.",1369510502.0,30,:Borussia_Dortmund:,Soccer,2,1U
[deleted],1369513976.0,29,,Soccer,2,N
That was surely intentional from Lewandowski. He just walked on it.,1369513297.0,58,:r_soccer_user:,Soccer,2,N
Robben just needs Jesus in his life,1369510149.0,47,,Soccer,2,N
[Bad luck Robben](http://i.imgur.com/x6p2Q2R.png),1369510883.0,59,:r_soccer_user:,Soccer,2,N
"If it's up to the keepers, there will be penalties tonight. And they will save them all.",1369509746.0,12,:Hungary:,Soccer,2,N
Feel so bad for Reus and co. Painful to see them crying on the pitch.,1369514210.0,14,,Soccer,2,N
Dortmund has nothing to be mad/sad about. They played amazing.,1369514214.0,46,:Borussia_Dortmund:,Soccer,2,1U
I keep finding myself supporting for and against both teams,1369509714.0,25,:Arsenal:,Soccer,2,N
"Looks like the Germans bought some good weather with them, this is the first time in a a few weeks we've had clear skies in London.",1369506176.0,23,:transpride::Wealdstone:,Soccer,2,N
"Congrats to Bayern Munich fans, you were terrific this season and I hope we meet here again someday.

P.S. I want to murder Ribéry",1369514596.0,26,,Soccer,2,N
Ribery is lucky to get away with that.,1369509213.0,12,:Italy:,Soccer,2,N
Absolutely amazing game by both keepers today,1369514659.0,10,,Soccer,2,N
LETS MOTHERFUCKERS,1369506189.0,41,:Everton_13-14:,Soccer,2,N
"Best HD stream right here: http://popstreams.eu/stream2.html

You're welcome.

Password is pops.

Edit: stream seems to not be working anymore. Download an unblocked (Hola is the one I have), install it to google chrome or Firefox, go to ITVs website and use one of the  zip codes from here: http://www.londontown.com/LondonPC/

You can now watch ITV without being in England. 
 
Edit: Upvote so people see this. If you're in UK, watch it on ITV using a zip code. 

If you're in US, watch this on Fox's main channel. 

If you can't, then watch it here. 

I just don't want bunch of people to come to the stream because it will slow it down for a lot of others that don't have a chance to watch it anywhere else in this quality.",1369506162.0,67,,Soccer,2,N
"""Arjen Robben, feline quickness.""    

Oh gosh.",1369513083.0,22,:Lazio:,Soccer,2,N
Well done both sides. I still don't understand why Dante was kept on. Just makes no sense.,1369514223.0,20,,Soccer,2,N
Weidenfeller..beautiful save.,1369509188.0,11,,Soccer,2,N
"Wow, that was a pretty bad sell of an elbow to the head.",1369511901.0,12,:Swansea_City:,Soccer,2,N
explain why that wasn't another card?,1369512559.0,11,,Soccer,2,N
We actually won.... YEAHH!!!!,1369516094.0,10,,Soccer,2,N
"Hm, Ribery clearly with an intentional elbow.. That's at least a yellow, surely?",1369509157.0,36,:Arsenal:,Soccer,2,N
ok the goal keepers are clearly using cheat codes.,1369510152.0,22,,Soccer,2,N
I can't believe how nervous I am for this game. I want it so bad after last year.,1369505721.0,53,,Soccer,2,N
If Lewa scores a hattrick I'm buying everyone person on /r/soccer donuts!,1369508016.0,53,,Soccer,2,N
"Is Bayern really Dortmund's biggest rival and vice versa, or are the commentators just playing that up?",1369507960.0,9,,Soccer,2,N
Keep going Robben just keep going prove em wrong,1369510144.0,11,:Arsenal:,Soccer,2,N
"Alright people, I'm going to need a slo-mo gif of Weidenfeller getting hit in the face ASAP.",1369510275.0,10,,Soccer,2,N
So why didn't Dante get a second yellow?,1369512567.0,9,:Manchester_City:,Soccer,2,N
"BORUSSIA: HEADS UP MY FRIENDS, YOU GUYS ARE ALL WARRIORS!",1369514218.0,9,,Soccer,2,N
"Pep vs. Mourinho in the Super Cup, haha.",1369514516.0,11,,Soccer,2,N
I swear.. comparing Dortmund's handsomeness to Bayern's isn't even fair,1369508733.0,33,,Soccer,2,N
"as shitty as this has been so far, it is awe-inspiring watching neuer have to *play* for once

and by god he is",1369508966.0,19,:r_soccer_user:,Soccer,2,N
The only reason they scored is because nobody expected Robben to pass,1369512245.0,18,,Soccer,2,N
"For some reason, I am really, really stressed.",1369513431.0,32,,Soccer,2,N
"For someone who's really good at football Arjen Robben is really shit at football.

EDIT: Ah balls. Sorry guys.",1369513611.0,60,:Hibernian:,Soccer,2,N
The fuck is up with this medieval sideshow before the game? As soon as there's football and Germany you guys are about war,1369507200.0,11,:r_soccer_user:,Soccer,2,N
"17 minutes in, completely flawless refereeing.",1369508677.0,9,,Soccer,2,N
"Pace. Pace. Pace. What is this, FIFA Ultimate Team? ",1369508726.0,9,:Portugal:,Soccer,2,N
I cant tell you how frustrating it is reading these comments and not being able to see the game,1369510216.0,8,,Soccer,2,N
"Crazy that there hasn't been a goal yet. Seems like both teams are getting great opportunities, but great goalkeeping has kept it scoreless.",1369510368.0,9,:Swansea_City:,Soccer,2,N
Friedel has spent so much time in England that he basically has an English accent now.,1369510967.0,8,:r_soccer_user:,Soccer,2,N
Javi Martinez has been a one man wrecking crew in the midfield. Has singlehandedly brought equilibrium to the midfield battle that Dortmund was dominating for the first 30 minutes of the match. His work on defense has freed up Schweinsteiger to create. MOTM for me.,1369512161.0,9,:FC_Barcelona:,Soccer,2,N
"There it is! What a match. Very exciting for the neutrals, i'd say. Congrats Bayern.",1369514207.0,9,,Soccer,2,N
Pep Guardiola's first game in charge of Bayern will be the Cup Winners' Cup against Mourinho's Chelsea. [Nice.](http://i357.photobucket.com/albums/oo17/MageOfTheOnyx/LouisBalfour.jpg),1369516014.0,9,:r_soccer_user:,Soccer,2,N
Dante shoulda been off. easy second yellow,1369514219.0,51,,Soccer,2,N
Little known fact: Robben lost his right leg in WWII,1369509787.0,37,:r_soccer_user:,Soccer,2,N
I don't think Weidenfeller knew anything about that save,1369510150.0,18,:Dundee_FC:,Soccer,2,N
"[GIF: He saves with his face, he saves with his face! Roman Weidenfeller, he saves with his face!](http://i.minus.com/inLZskDcs4ISM.gif)",1369510350.0,17,:Portugal:,Soccer,2,N
i used to be indifferent towards ribery and now i just want to see him get punched in the face.,1369512959.0,16,:Manchester_City:,Soccer,2,N
BAAAYERRRNNN!!!!! PROOF TO ALL ROBBEN HATERS HES STILL GOT IT,1369514479.0,16,,Soccer,2,N
No bitching about commentators please!,1369505743.0,125,,Soccer,2,N
"Finals are Robbens kryptonite!!! 

edit - Well, HE FINALLY DID IT!!! ",1369509798.0,49,,Soccer,2,N
"Not sure if Reus' hair is like that because of gel, or because he moves so fast it's always windswept.",1369510113.0,6,:Arsenal:,Soccer,2,N
"As a neutral fan and goalkeeper, I am loving the game so far.",1369510215.0,7,,Soccer,2,N
"To be honest, Robben's highly visible fuck-ups have really made him the scape goat. Muller, Ribery and Mandzukic have barely been sighted at all. They all need to lift, but at least Robben has had the ball.",1369510876.0,7,,Soccer,2,N
YES FUCK YES,1369512057.0,8,,Soccer,2,N
ARJEN FUCKING ROBBEN created that!,1369512091.0,8,,Soccer,2,N
ROBBEN PASSED,1369512096.0,8,,Soccer,2,N
WHAT A CLEARANCE,1369512810.0,7,:Manchester_United:,Soccer,2,N
Ribery really fucks me off. Hes such a dirty fucking player.,1369512950.0,9,:Dundee_FC:,Soccer,2,N
Subotic clearance: http://i.minus.com/ibgapqYocP946.gif,1369513016.0,8,,Soccer,2,N
That was low from Lewandowski,1369513290.0,8,,Soccer,2,N
What a time to unchoke from Robben!!,1369513939.0,9,:Estonia:,Soccer,2,N
[deleted],1369514472.0,9,,Soccer,2,N
"Calling it now.. The game is gonna go to penalties, Schweinsteiger will hit the post on the 5th attempt, Drogba will run unto the field from the stands, rip his shirt and reveal a Dortmund jersey with the number 11 on it.. He then proceeds to take the final penalty and score to give Dortmund the Champions League!",1369506775.0,423,:Chelsea:,Soccer,2,N
"Robben made me cry, he deserves it so much despite everything. I saw him loose the WC final, the CL final and he missed match winning chances in each. 

Tonight scoring for the win is so fitting, finally he gets his trophy. ",1369514410.0,29,:r_soccer_user:,Soccer,2,N
[deleted],1369509489.0,36,,Soccer,2,N
Still wondering what the humidity is...,1369510792.0,21,,Soccer,2,N
"This is some FIFA shit. Dortmund dominate, have a bunch of shots, but Bayern will score with 1 random shot.",1369509198.0,70,:r_soccer_user:,Soccer,2,N
It's ridiculous that Dante stayed on the pitch. Too bad for Dortmund. They didn't play well enough in the 2nd half though. ,1369514215.0,27,,Soccer,2,N
"Ugh, jump cut from hottie to Merkel. Danny Boyle is certainly not directing this.",1369511730.0,15,,Soccer,2,N
"Okay, now it definitely feels like last year's DFB Pokal final.",1369508508.0,7,,Soccer,2,N
NO TO RACISM,1369508553.0,6,,Soccer,2,N
WHOA! Monster save by Weidenfeller!,1369509141.0,9,:Arsenal:,Soccer,2,N
If only Klose was there..,1369509166.0,7,:Chelsea:,Soccer,2,N
Ribery http://i.minus.com/ibxd8dQMuw5dDN.gif,1369509356.0,7,:r_soccer_user:,Soccer,2,N
A game of two goal keepers by the looks of it. ,1369510505.0,7,,Soccer,2,N
Go weidenfeller! Can even save without his hands... only needs his face aha,1369510522.0,8,:r_soccer_user:,Soccer,2,N
"Lads I'm away down the shop for some Gazprom at half time, anyone want some?",1369510904.0,5,,Soccer,2,N
Mandzukic's reflex time is 2 seconds.,1369511903.0,5,,Soccer,2,N
Just noticed most dortmund players have a 1930s haircut,1369512056.0,8,:Juventus:,Soccer,2,N
Fuck.,1369512086.0,6,,Soccer,2,N
Jürgen Klopp has entered rabies mode. Watch out London!,1369512423.0,5,,Soccer,2,N
Now how is that not a foul?,1369512462.0,6,:r_soccer_user:,Soccer,2,N
"Holy shit, Weidenfeller just had his casting for the new Superman movie.",1369513070.0,7,,Soccer,2,N
"If Dortmund manages to win this, Subotić's clearance will go down as the stuff of legend",1369513135.0,7,,Soccer,2,N
When I started watching this match I would say that I preferred Dortmund to win.  Now I desperately want Ribery to lose.,1369513151.0,9,:Manchester_United:,Soccer,2,N
These German goal keepers man...,1369513751.0,7,:Arsenal:,Soccer,2,N
it fucking had to be him,1369513827.0,6,:r_soccer_user:,Soccer,2,N
"best game i've seen i a long, long time. ",1369514233.0,7,,Soccer,2,N
What's sad is that BVB is continually going to get stripped of talent from the big boys until they can't find anymore talent sufficient to make another final,1369514256.0,6,:Arsenal:,Soccer,2,N
Looks like Robben has redeemed himself from last year's penalty miss against Chelsea. ,1369514335.0,7,:Mexico:,Soccer,2,N
So great to see Dortmund players standing up while Bayern players celebrating. No collapsing to the floor. They know how well they did in the game and getting this far. ,1369514908.0,7,:Portugal:,Soccer,2,N
Who was that blonde woman in the stairs?,1369515405.0,8,,Soccer,2,N
So where is the post-game simulation of the Bayern knights beating the Dortmund knights? ,1369515475.0,7,,Soccer,2,N
"WIR SINGEN UND TANZEN AUF DEM FUSSBALLFELD! EIN SCHUSS, EIN TOR, DIE BAYERN!",1369516634.0,7,,Soccer,2,N
Wow. How did Dante not get another card? ,1369512553.0,24,:c_Manchester_United:,Soccer,2,N
The goalkeepers are unbelievable. ,1369509165.0,14,,Soccer,2,N
"Well, i'm kinda happy for Schweinsteiger, Müller, Robben and Heynckes. 

Bayern fans be a bit more kind to your players, Robben gets so much critique, and he gave everything this game

Thanks to all the foreign guys for your support for my club! It's really amazing to be the center of all this (circlejerk:-)attention. The last three years were a fairy tail for me and probably every other BVB fan, being part of this club is the most amazing thing I could imagine.

We will come back next year! Resistance is futile ",1369514586.0,14,:Borussia_Dortmund:,Soccer,2,1U
"streams (will be updated, links from top might be the best at the sec, last links [best ones] will be placed 1-2 min before kickoff):  

the most fresh:  
http://atdhe.so/watch.php?id=693547  
http://atdhe.so/watch.php?id=693548  
http://atdhe.so/watch.php?id=693552  
http://atdhe.so/watch.php?id=693553

update  
http://atdhe.so/watch.php?id=693541  
http://atdhe.so/watch.php?id=693531  
http://atdhe.so/watch.php?id=693540  
http://atdhe.so/watch.php?id=693532  
http://atdhe.so/watch.php?id=693536  
http://atdhe.so/watch.php?id=693533  

http://atdhe.so/watch.php?id=693520  
http://atdhe.so/watch.php?id=693525  
http://atdhe.so/watch.php?id=693522  

Pregame show: http://atdhe.so/watch.php?id=693511  
or http://atdhe.so/watch.php?id=693518  
or http://atdhe.so/watch.php?id=693512  

http://myp2p.la",1369505715.0,20,,Soccer,2,N
This has been one of the best halves of CL football I have ever seen.,1369510224.0,17,,Soccer,2,N
I want BVB to win mainly because Ribery has spent the game being a massive cunt.,1369512974.0,16,,Soccer,2,N
"21st birthday today, had to make this shit fancy!

http://imgur.com/rvfaLV7

HEJA BVB!",1369507098.0,64,,Soccer,2,N
"Fuck.

They earned it. Good match, Bayern.

But seriously fuck Dante.",1369514196.0,26,,Soccer,2,N
Ribery is begging for a red card...infact a few players are,1369513199.0,18,,Soccer,2,N
Schweinsteiger taken a knock by the looks of it! Worrying... ,1369506202.0,12,,Soccer,2,N
The only thing worse than this opening ceremony is that they're trampling all over the pitch.,1369507232.0,12,,Soccer,2,N
This game is amazing and there hasn't even been a goal.,1369509975.0,11,,Soccer,2,N
Why the fuck is Gomez still not in? Almost all our attacks are coming from crosses.,1369513427.0,12,,Soccer,2,N
"In term of handsomeness , Dortmund wins. I mean come on, their hair is shiny as fuck.",1369515141.0,11,:Juventus:,Soccer,2,N
"my hearts all a flutter. I started watching soccer only during last years champions league. It's been an amazing ride watching the last CL, EURO, the end of the BPL with Aguero's goal and everything since. Ive loved watching these two teams from the start. Solid strong defense with with quick decisive attacks",1369507831.0,5,,Soccer,2,N
Lewandowski is fucking insane,1369508408.0,7,,Soccer,2,N
As a neutral this is AMAZING,1369508478.0,6,,Soccer,2,N
where the fuck is our backline,1369508880.0,4,:r_soccer_user:,Soccer,2,N
"Okay, Neuer 5 or something, now Weidenfeller 1.

The goalie duel is heating up.",1369509167.0,7,,Soccer,2,N
"This referee is straight out of FIFA, ball almost hit him again.",1369509524.0,8,:Celtic:,Soccer,2,N
"Why is it still 0-0, i can't believe it.",1369509705.0,6,,Soccer,2,N
FUCK! I forgot Neuer is world class. ,1369509706.0,5,,Soccer,2,N
If I could change my last name to anything it would be Błaszczykowski.,1369509986.0,5,:r_soccer_user:,Soccer,2,N
I have to use the bathroom but I'm afraid I'll miss something. ,1369510188.0,5,:CD_Guadalajara:,Soccer,2,N
you're supposed to aim for the goal not the face Robben,1369510204.0,6,,Soccer,2,N
Couldn't have picked a better game for one of the very few to be on a major network in the US. Great introduction for those newer to soccer.,1369510228.0,8,,Soccer,2,N
Gifs of all those angles of Weidenfeller's save?,1369510254.0,6,:Arsenal:,Soccer,2,N
