text,time,upvote,flair,sport,phase,category
DAT PASS DOE,1369512286.0,2,,Soccer,2,N
That has to be at least a yellow. That's 2 players for Bayern that should be off.,1369512569.0,2,:Houston_Dash:,Soccer,2,N
"GOOOOOOOAAAALLLLLL!
",1369512612.0,2,,Soccer,2,N
"At this pace this game might find itself out of hand. This official should have sent off 2 Bayern players by now.

Also, GGGGGGOOOOOOOOAAAAAAALLLLLLLLL",1369512615.0,2,,Soccer,2,N
HOW DID THAT HAPPEN SCIENCE,1369512814.0,2,:USA:,Soccer,2,N
"I don't believe it.  I do not believe it.  How did that not go in?

^Also, ^why ^didn't ^Robben ^slide ^in ^to ^try ^to ^beat ^Subotic ^to ^the ^ball?",1369512869.0,2,,Soccer,2,N
to think subotic could have been on the usmnt =(,1369512904.0,2,:Arsenal:,Soccer,2,N
Ribery is a major cunt.,1369512911.0,2,,Soccer,2,N
"Holy shit do Bayern Munich and especially Ribery look like self righteous cunts this match.
",1369512939.0,2,,Soccer,2,N
Ribery flop.,1369512940.0,2,:r_soccer_user:,Soccer,2,N
This game is fucking irresistible. It's had everything.,1369513025.0,2,:Manchester_United:,Soccer,2,N
"Muller needs to stop being mad, he slipped.",1369513172.0,2,:Portugal:,Soccer,2,N
Boateng on ground nearly 1000 times now,1369513247.0,2,,Soccer,2,N
INTENTIONAL,1369513267.0,2,,Soccer,2,N
What the fuck was that Robben?,1369513570.0,2,:Portugal:,Soccer,2,N
WHAT A SAVE,1369513734.0,2,,Soccer,2,N
fuck this shit. undeserved. Bayern should've been down to 10 or even 9 men and now they win it right at the end,1369513845.0,2,,Soccer,2,N
"Robbery, right through Hummels, Subotic and Weidenfeller.",1369513939.0,2,:Bayern_Munich:,Soccer,2,1F
Ahhhhh shitsticks.,1369513973.0,2,,Soccer,2,N
Did Gus Johnson just say Robben has been the best player on the pitch today? ,1369514050.0,2,:Portugal:,Soccer,2,N
Robben scoring the winner goal in the last minutes of a Cup final. Oh ghe the irony. ,1369514131.0,2,:Arsenal:,Soccer,2,N
"http://www.gomezbutton.de/
http://www.gomezbutton.de/
http://www.gomezbutton.de/
http://www.gomezbutton.de/
http://www.gomezbutton.de/
http://www.gomezbutton.de/",1369514132.0,2,,Soccer,2,N
"One of the most clutch, crucial, professional goals I have ever seen. Rob, oh Rob, you have done something truly special.",1369514169.0,2,,Soccer,2,N
That is possibly the quietest Champions League final crowd I've watched in a while... ,1369514179.0,2,,Soccer,2,N
3rd time is the charm!,1369514188.0,2,:r_soccer_user:,Soccer,2,N
I think they deserve it.. after two finals they lost in the past few years.,1369514202.0,2,,Soccer,2,N
I am oddly devastated,1369514232.0,2,,Soccer,2,N
Now I need heart surgery,1369514267.0,2,:Arsenal:,Soccer,2,N
CHAMPIONS!!!!!!!!!,1369514351.0,2,:USA:,Soccer,2,N
"As a Chelsea fan, see you in the UEFA Super Cup! ",1369514414.0,2,,Soccer,2,N
Welcome to the FiveTimeEuroChampions Club Bayern!,1369514441.0,2,:r_soccer_user:,Soccer,2,N
:'),1369515107.0,2,:Bayern_Munich:,Soccer,2,1F
Does anyone know the name of the song they are playing during the winner ceremony? Sounds a bit like an epic movie theme... :),1369515207.0,2,,Soccer,2,N
"What the fuck is Redknapp talking about?

He doesn't half babble.",1369515638.0,2,:Blackburn_Rovers:,Soccer,2,N
">in Bremen gebaut

ouch, ouch, ouch",1369515909.0,2,:Werder_Bremen:,Soccer,2,N
"Congrats, see you in the Super Cup!",1369516255.0,2,:Chelsea:,Soccer,2,N
Bayern were diving and bitching like little girls all game,1369514336.0,3,:Borussia_Dortmund:,Soccer,2,1U
If you are in America it is on Fox. Not Fox Soccer.,1369505938.0,2,:Chelsea:,Soccer,2,N
VAGINNNNNAAAAAAS,1369507448.0,3,:Arsenal:,Soccer,2,N
"Turned on FOX, was promised football damnit. ANGRY AMERICAN!

Kidding, I know the right football. LET'S GO!! So excited for this!",1369507503.0,1,,Soccer,2,N
"To all the people complaining how their HD isn't completely crystal clear, while I'm sitting here on my laptop watching a shitty stream, I have only one thing to say: Fuck you. ^^^:(",1369508331.0,1,:Arsenal:,Soccer,2,N
THEY JUST USED MONDAY NIGHT FOOTBALL SONG FOR CHAMPIONS LEAGUE.....................,1369510337.0,4,,Soccer,2,N
"As a Dortmund fan, let's not give Bayern any more corners...",1369511016.0,1,:r_soccer_user:,Soccer,2,N
Missed the first half but I'm here for the 2nd,1369511265.0,1,,Soccer,2,N
Does anyone else think Pep shouldn't bring his tippy tappy to Bayern's ruthless Panzer?,1369511768.0,4,,Soccer,2,N
"I take it all back Robben.  The flood gates are open!
",1369512182.0,2,:r_soccer_user:,Soccer,2,N
"I can't see Dortmund coming back from this, Bayern are just too strong and will be oozing confidence now. Well done Bayern. ",1369512395.0,2,,Soccer,2,N
"Honestly, Bayern are beyond lucky to still have 11 on the pitch. Dante and Ribery should both have been sent off.",1369512653.0,1,:r_soccer_user:,Soccer,2,N
"Dante should be off. 

Also Gotze celebrating is a weird sight to see.",1369512680.0,2,,Soccer,2,N
[deleted],1369512987.0,2,,Soccer,2,N
"Nice stamp Lewandowski.

EDIT: as in 'nice stamp, you fuckhead'",1369513345.0,1,:Melbourne_Victory:,Soccer,2,N
"In terms of overall quality of play, and respective quality of the teams, this is the best CL final I've seen. That Robben goal is some serious catharsis.",1369513880.0,3,,Soccer,2,N
Congratulations Robben. Congratulations Bayern. ,1369514189.0,2,,Soccer,2,N
great job updating the last game in final mins. /s,1369514336.0,2,,Soccer,2,N
IM SO HAPPY TO SEE ROBBEN SO HAPPY,1369514367.0,2,,Soccer,2,N
The season isn't even over we have the German cup next week for the treble!,1369515717.0,0,:Bayern_Munich:,Soccer,2,1F
"Lewandowski had to free his ankle. That should have been a foul in the first place.

That being said, the last thing this game needs is a Red. It's a great match.",1369513306.0,3,,Soccer,2,N
"How amazing to see a final where both teams go for it, isn't it Chelsea fans? ",1369514383.0,2,:FC_Barcelona:,Soccer,2,N
Come on you Bee's!,1369505813.0,4,,Soccer,2,N
Good luck from Canada! Hope Bayern gets destroyed!,1369507618.0,2,,Soccer,2,N
I can feel a Bayern goal coming...,1369509916.0,1,,Soccer,2,N
Adrian Chiles shouldn't be allowed to talk.,1369510748.0,4,:Newcastle_United:,Soccer,2,N
"One more first half comment:  ""Day-vid Al-uh-buh"" aside, I've been much more impressed with Gus in this match vs the FA Cup final.  Given that right after that match Fox showed a CL final preview from Wembley, I suspect they assumed Man City would.maul us and didnt give him much chance or info to research.",1369511314.0,4,:Wigan_Athletic:,Soccer,2,N
"""...TURKISH PARENTS!""",1369512608.0,1,,Soccer,2,N
lewa..i used to respect this player.....,1369513274.0,2,,Soccer,2,N
Lewandowski....I'm notsure if he stepped on boateng on purpose.,1369513294.0,2,,Soccer,2,N
TAKE THAT HATERS! ROBBEN! ,1369513866.0,2,:Liverpool:,Soccer,2,N
I HATE YOU ROBBEN ,1369513907.0,1,,Soccer,2,N
[deleted],1369513921.0,4,,Soccer,2,N
And the Robben haters sink back into their hole.,1369514079.0,1,,Soccer,2,N
Can that over rated spanish bloke beat that season?,1369514236.0,2,,Soccer,2,N
"""DIE BESTEN VON .....  ÜRRRRROOOOOOOOOOOOOPA!"" 

- Louis van Gaal",1369514315.0,4,:TSV_Kleinrinderfeld:,Soccer,2,N
"Bayern over the 2011-2013 period is a better team than Barca 2008-2009.  Barca had nowhere close this match's worth of resistance when running through the competition.  Arguably the best team since AC 80s-90s Milan.
Well deserved victory.

I actually think that signing Guardiola hurts them.  He won with a team that would have had no business ever losing to anyone they faced.  I'm not sure he can manage the personalities on this team.  ",1369514490.0,4,:Wigan_Athletic:,Soccer,2,N
"Robben: ""We won Ribery! High five!"" Ribery: *dives*",1369514518.0,3,,Soccer,2,N
YESSSS ROBBEN. He hinted at it alllllll game. Mia san mia,1369514769.0,2,,Soccer,2,N
[deleted],1369509208.0,1,,Soccer,2,N
[deleted],1369514554.0,2,,Soccer,2,N
"See, there can be a big crowd reaction in an english stadium (you just need 2 german teams playing).",1369509036.0,1,:Borussia_Dortmund:,Soccer,2,1U
Needs more Chelsea 2012 references,1369509480.0,1,,Soccer,2,N
[removed],1369513178.0,2,,Soccer,2,N
"Match commentary sucks, didn't even add the second bayern goal!",1369514202.0,3,,Soccer,2,N
It had to be him... Why did it have to be him?,1369514204.0,1,,Soccer,2,N
Shitty situation for Gotze. ,1369514222.0,2,:r_soccer_user:,Soccer,2,N
but lewandowski is a saint.  Right guys?,1369513278.0,-1,:r_soccer_user:,Soccer,2,N
Any High Definition links (beside russians),1369505852.0,1,,Soccer,2,N
Pack ma's Bayern! ,1369505919.0,1,:Germany:,Soccer,2,N
"Who are you chaps (and lady-chaps) backing tonight? The bookies (in the UK, at least) are backing Bayern heavily. ",1369505931.0,1,,Soccer,2,N
"Checking in from East Midlands, UK. 

Where is everyone at? ",1369506017.0,1,:r_soccer_user:,Soccer,2,N
Hopefully someone told the Bayern players not to touch the trophy this time,1369506035.0,1,,Soccer,2,N
"Is anybody else having an issue with Fox in the US having the wrong aspect ratio?  My source has black bars above and below and the aspect ratio for the content is wrong, with everything squashed.",1369506064.0,1,,Soccer,2,N
"I'm excited to see what the Dortmund fans have in store. They are almost as exciting as the players themselves!
",1369506067.0,1,,Soccer,2,N
[deleted],1369506151.0,1,,Soccer,2,N
AUF GEHTS BVB!!!!!,1369506217.0,1,:Hamburger_SV:,Soccer,2,N
Forza Bayern!,1369506264.0,1,:Italy:,Soccer,2,N
Schweinsteiger injured? Any news?,1369506281.0,1,:Cerezo_Osaka:,Soccer,2,N
Go Dortmund! Show Bayern that they aren't invincible. ,1369506314.0,1,:FC_Basel:,Soccer,2,N
This thread is probably 65/35 rooting for BvB?,1369506372.0,1,:USA:,Soccer,2,N
LETS GO BVB,1369506377.0,1,,Soccer,2,N
"As much pumped up I am for this match, watching as a neutral is a bit dull. But problem is I am having a difficult time choosing whom to root for, as I have enjoyed the way both of them played so far. Well, guess it's time to flip a coin ....",1369506377.0,1,,Soccer,2,N
IRC pls.,1369506399.0,1,:Celtic:,Soccer,2,N
[deleted],1369506415.0,1,,Soccer,2,N
Even as a neutral my blood hasn't gotten this hot for a game in a long time. I hope its a hell of a game.,1369506441.0,1,,Soccer,2,N
Klopp is awesome. If Chelsea don't get Jose I'd love to bring him in... don't see it happening though.,1369506489.0,1,:Chelsea:,Soccer,2,N
"Bayern Jersey on, cocktail in hand. Let's go FCB! Pack ma's!",1369506494.0,1,,Soccer,2,N
"I predict a 3-1 for Bayern. Goals from Robben, Schweinsteiger, and Mandzukic",1369506506.0,1,:r_soccer_user:,Soccer,2,N
"2:2 after 90 minutes, Sahin to score the winner in the 114th. Yes, I'm a wizard. ",1369506508.0,1,,Soccer,2,N
[deleted],1369506529.0,1,,Soccer,2,N
Both teams are about to put on a clinic out there. Let's hope for a match to remember!,1369506545.0,1,:r_soccer_user:,Soccer,2,N
anyone know any torrent stream links?,1369506587.0,1,,Soccer,2,N
"As a neutral who enjoys watching both teams play, I am *seriously* excited for this game. ",1369506593.0,1,,Soccer,2,N
"Best of luck to Munich and Dortmund. They both deserve to be at Wembley. Also, they can both go to hell.",1369506603.0,1,:New_York_Red_Bulls:,Soccer,2,N
"Oh god. I'm dying.

I don't know what to do if we can't pull it off this time :/",1369506635.0,1,:Bayern_Munich:,Soccer,2,1F
https://www.youtube.com/watch?v=wvFk_E8PfFg,1369506663.0,1,,Soccer,2,N
"Borussia Dortmund 1 (Lewandowski) - 2 Bayern Munich (Muller, Ribery) is my prediction for this. My wallet hopes it becomes true.

Regardless of the result, super excited for this match! ",1369506676.0,1,:Manchester_United:,Soccer,2,N
Guys I'm sure schweinsteiger is fine. Calm down. ,1369506693.0,1,,Soccer,2,N
"FOX: I love the NFL on FOX music. Love it, love it, love it. Please stop playing it during baseball, soccer, presidential inaugurations, cooking programs, or when there's a slight chance of hail. Stop it.",1369506727.0,1,:USA:,Soccer,2,N
Did anyone else see the Will Smith and Jaden Smith ad on TV3? ,1369506780.0,1,,Soccer,2,N
"What a great weekend of sports,  this match then boxing then the Monaco grand prix! ",1369506809.0,1,:Bolton_Wanderers:,Soccer,2,N
"It would be a disaster for Bayern to lose the final again, but I'm gonna support Borussia today because the team is so awesome.",1369506835.0,1,:c_Manchester_United:,Soccer,2,N
MIA SAN MIA,1369506863.0,1,:r_soccer_user:,Soccer,2,N
Bayern München!!! Sie müssen gewinnen!!! ,1369506884.0,1,,Soccer,2,N
Someone's spiked my drink. ,1369507002.0,1,:FC_Barcelona:,Soccer,2,N
Looks like there going to war.,1369507021.0,1,,Soccer,2,N
"Really looking forward to seeing the displays and atmosphere from the Dortmund fans. 

Going for a 2-1 Dortmund win.  ",1369507051.0,1,,Soccer,2,N
General Ricken and lieutenant Breitner!,1369507064.0,1,:Bayern_Munich:,Soccer,2,1F
I say 2-0 Bayern,1369507071.0,1,,Soccer,2,N
"Hearing Will Smith trying to pronounce ""Borussia"" was hilarious.",1369507079.0,1,:r_soccer_user:,Soccer,2,N
"I'm loving this battle theme they have 
:)",1369507083.0,1,,Soccer,2,N
Mia san mia!,1369507084.0,1,:Nottingham_Forest_FC:,Soccer,2,N
It is kind of stars against talents tonight. Let us see who has the edge. ,1369507084.0,1,,Soccer,2,N
"It's relaxing watching this from home after coming back from college in a large home theatre setup. As a neutral, this should be a brilliant final. 
I'd be lying if I don't say that Bayern is my personal choice to win this. They've been in 3 finals in the last 4 years. They deserve to win one for all their hard work. ",1369507116.0,1,:r_soccer_user:,Soccer,2,N
Paul fucking Breitner!!?,1369507117.0,1,:Werder_Bremen:,Soccer,2,N
I like this whole thing that's going on right now. I would have loved to be one of the soldiers on the pitch right now.,1369507119.0,1,:Deportivo_Toluca_FC:,Soccer,2,N
"The Fox stations song that transfers between coverage and commercial, which I believe is english children singing ""champions"" or something, sounds a whole lot more like their high pitched choir is singing ""vaginas"".",1369507128.0,1,,Soccer,2,N
Recreating this mornings brawl ,1369507137.0,1,:Republic_of_Ireland:,Soccer,2,N
Cmon lads make dortmund proud,1369507140.0,1,:Manchester_United:,Soccer,2,N
Not sure what to feel about the opening medieval thingy!,1369507147.0,1,:r_soccer_user:,Soccer,2,N
Anyone know any iphone friendly Streams?,1369507155.0,1,,Soccer,2,N
Just beat the shit out of each other already,1369507156.0,1,:Wolverhampton_Wanderers_:,Soccer,2,N
Game of Champions ,1369507160.0,1,:Arsenal:,Soccer,2,N
"It's a great evening for some football in London, perfect conditions.",1369507185.0,1,,Soccer,2,N
Strange show,1369507233.0,1,:VfB_Stuttgart:,Soccer,2,N
Would be funny if one of the armies actually won.,1369507251.0,1,,Soccer,2,N
"My Kiddo asking me, why are they fighting on football pitch.....",1369507265.0,1,,Soccer,2,N
Javi Martinez has made 39 interceptions; more than any other player in the Champions League this season. Where's that Bilbao fan when you need him? ,1369507268.0,1,:Spain:,Soccer,2,N
"I loved the ceremony, to be honest. It was a bit silly, but it was also awesome as fuck.",1369507321.0,1,:Liverpool:,Soccer,2,N
Good luck everyone!,1369507342.0,1,,Soccer,2,N
"If you had a £50 free live in-play bet what would it put it on?

I think I am going to wait 20-30 mins to see how the game settles then decide...",1369507397.0,1,:r_soccer_user:,Soccer,2,N
Looking forward to watching Gundogan. Always excellent.,1369507475.0,1,:r_soccer_user:,Soccer,2,N
[deleted],1369507510.0,1,,Soccer,2,N
I can't fucking handle this. Oh Jesus Christ. ,1369507541.0,1,,Soccer,2,N
Damn Weidenfeller is huge,1369507545.0,1,,Soccer,2,N
Lets go dortmund!!!!1,1369507564.0,1,,Soccer,2,N
This is going to be an incredible game for the neutrals. Both semi-finals were amazing to watch ,1369507583.0,1,,Soccer,2,N
Die Rotennnnnnnnnnn!,1369507587.0,1,,Soccer,2,N
[removed],1369507739.0,1,,Soccer,2,N
Bayerns new kit looks great. ,1369507741.0,1,,Soccer,2,N
"Sopcast stream: acestream://77f0f13eea47fd72b25b4cc68f82d1faf43b266b

Skysports",1369507763.0,1,,Soccer,2,N
It's gonna be a physical game.,1369507935.0,1,:Portugal:,Soccer,2,N
zdf mediathek 60 seconds off..... fuck,1369508003.0,1,:r_soccer_user:,Soccer,2,N
That was a fucking throw in and a half by Neuer,1369508006.0,1,,Soccer,2,N
I never get tired of seeing those throws.,1369508013.0,1,,Soccer,2,N
Caiu como abacate maduro!!!,1369508066.0,1,,Soccer,2,N
"Seriously, this feels a bit like the DFB Pokal final last year. Just a tiny bit.",1369508107.0,1,,Soccer,2,N
a shot,1369508186.0,1,,Soccer,2,N
Kuba! Kuba! Kuba!,1369508191.0,1,:r_soccer_user:,Soccer,2,N
"BVB started out brightly at the start of halves against RM before receding, too. It's surprising FCB has had so little of the ball, but I don't think it's going to last.",1369508205.0,1,:Transpride:,Soccer,2,N
The Bayern defence is doing well so far. Great last minute tackles ,1369508207.0,1,:Liverpool:,Soccer,2,N
"Beautiful football by both teams, at the moment. I fear for Dortmund, I don't feel they can keep this pace for 90 min.",1369508210.0,1,:Chelsea:,Soccer,2,N
Can anyone tell me what Pack Ma's translates too? I haven't seen it a lot until now.,1369508220.0,1,,Soccer,2,N
come on bayern look alive,1369508229.0,1,:Arsenal:,Soccer,2,N
The way Bayern move the ball around is amazing.,1369508256.0,1,:Rosenborg:,Soccer,2,N
Ah! Lewa!,1369508368.0,1,,Soccer,2,N
Mother of god Lewa!,1369508373.0,1,,Soccer,2,N
How many tickets were sold to each club?,1369508373.0,1,,Soccer,2,N
What a stinging shot from Lew,1369508380.0,1,:Portugal:,Soccer,2,N
"Are the Dortmund fans singing a version of that ""Best midfield in the world"" song? Anyone know the lyrics?",1369508390.0,1,:r_soccer_user:,Soccer,2,N
Good refereeing to play the advantage there.,1369508396.0,1,,Soccer,2,N
Great kick great save!,1369508414.0,1,,Soccer,2,N
" Lewandowski was really close on that one, corner. Had to tipped over with fingertips by Neur.  ",1369508415.0,1,:r_soccer_user:,Soccer,2,N
Lewadonski is awake,1369508416.0,1,:Liverpool:,Soccer,2,N
Yeah BVB!!,1369508433.0,1,,Soccer,2,N
And that's why Neuer is one of the best in the world. ,1369508446.0,1,,Soccer,2,N
Any chat rooms out there?,1369508450.0,1,,Soccer,2,N
"it is pure joy to see two German teams playing a CL final. the pace is insane, no bullshit, just pure, unadulterated attacking football. Even the neutrals are in for a treat now!",1369508466.0,1,:Hungary:,Soccer,2,N
Bayern need to get their shit together ,1369508467.0,1,:Arsenal:,Soccer,2,N
Neur is a beast!!!,1369508467.0,1,,Soccer,2,N
"Honestly, Bayern is already in the summer break.",1369508467.0,1,,Soccer,2,N
Great attempt by....however you spell his name.,1369508478.0,1,:Newcastle_United:,Soccer,2,N
Wow,1369508480.0,1,:SC_Freiburg:,Soccer,2,N
This is too intense... I love it.,1369508481.0,1,,Soccer,2,N
"Man, thought Dortmund got the first goal there.",1369508494.0,1,:Swansea_City:,Soccer,2,N
the way this has started.. it's going to be a classic!,1369508496.0,1,:Norwich:,Soccer,2,N
"To anyone complaining about their streams: 

http://popstreams.eu/

Choose between stream 1,2 and 3.",1369508552.0,1,:Chelsea:,Soccer,2,N
"Work on your posture, Hoeneß!",1369508613.0,1,,Soccer,2,N
Ouch,1369508681.0,1,:r_soccer_user:,Soccer,2,N
I'm really just looking forward to someone getting doused in beer.,1369508692.0,1,:Portland_Thorns:,Soccer,2,N
Dortmund are looking like scoring a lot more than Bayern,1369508718.0,1,,Soccer,2,N
how many corners are there already??,1369508719.0,1,,Soccer,2,N
Rues' pace though!,1369508726.0,1,,Soccer,2,N
Neuer seem a little shaky to anyone else?,1369508732.0,1,:Celtic:,Soccer,2,N
"C'mon BVB
",1369508745.0,1,:Manchester_United:,Soccer,2,N
When is Bayern going to unclench? ,1369508848.0,1,,Soccer,2,N
NEUER.,1369508873.0,1,,Soccer,2,N
"oh goddamn, neuer's gonna be in for a long one",1369508886.0,1,,Soccer,2,N
"Haw many saves is that for Neuer already? 3, 4, 5?",1369508889.0,1,:Portugal:,Soccer,2,N
Dropping schweinsteiger deeper than the CB's  to play around the pressing is very clever.,1369508894.0,1,,Soccer,2,N
"Stream lagspiked when Bender shot, it looked like a goal! Game has been really good so far.",1369508895.0,1,:r_soccer_user:,Soccer,2,N
OMG...Neur's had like 4 important saves so far.,1369508924.0,1,,Soccer,2,N
You're getting nothing easy off Neuer ,1369508927.0,1,:Liverpool:,Soccer,2,N
The way Dortmund is playing reminds me of the Real Madrid game ,1369508938.0,1,,Soccer,2,N
I won't survive that D:,1369508963.0,1,,Soccer,2,N
Glad I found a good stream while away from home! Thank you german public television,1369508969.0,1,,Soccer,2,N
Hopefully Bayern plays the strategie of Chelsea and International and the better team will loose.. GO FCB ,1369508996.0,1,,Soccer,2,N
Bayern is Chelsea and Dortmund is Bayern? It's seems fairly similar to last year.,1369509020.0,1,:Detroit_City_FC:,Soccer,2,N
"please dear god, don't let this be another *bayern munich final :/*",1369509048.0,1,,Soccer,2,N
REF!!,1369509063.0,1,,Soccer,2,N
"if that ref error led to a goal I'd be so bitter, but that was the most dangerous Bayern has looked so far",1369509079.0,1,,Soccer,2,N
Ref wants to play.,1369509082.0,1,:r_soccer_user:,Soccer,2,N
What a touch by Muller,1369509091.0,1,,Soccer,2,N
23rd minute and the Dortmund supporters are trying to break Wembely.,1369509092.0,1,,Soccer,2,N
Put me in coach - Referee 2013,1369509093.0,1,,Soccer,2,N
"what the hell man, any unlagging streams????",1369509094.0,1,,Soccer,2,N
Imagine the situation if they had scored the only goal of the game from that touch by the ref there.....,1369509094.0,1,:Arsenal:,Soccer,2,N
Wtf Ribery,1369509110.0,1,:r_soccer_user:,Soccer,2,N
that's the ribery we all know and love,1369509114.0,1,:r_soccer_user:,Soccer,2,N
Caaareful Ribery...,1369509118.0,1,:Manchester_United:,Soccer,2,N
desperado...lewando,1369509120.0,1,,Soccer,2,N
"Move ref, get out the way! Get out the way, ref, get out the way!",1369509125.0,1,,Soccer,2,N
"Are bayern over-awed by the occasion and the fact that they've lost finals in the recent past, or are they trying some kind of rope-a-dope strategy? I have no idea. ",1369509126.0,1,:Arsenal:,Soccer,2,N
What a game!!,1369509134.0,1,,Soccer,2,N
"That easily could have been yellow, if not red. Soft refereeing.",1369509138.0,1,:r_soccer_user:,Soccer,2,N
WEIDENFELLER,1369509140.0,1,:Arsenal:,Soccer,2,N
On one fucks with Ribéry,1369509145.0,1,,Soccer,2,N
Ribery! Lewandowski just wants a hug!,1369509148.0,1,:Detroit_City_FC:,Soccer,2,N
Amazing header and save,1369509148.0,1,:Arsenal:,Soccer,2,N
What a save ,1369509151.0,1,:Portugal:,Soccer,2,N
Save Made,1369509152.0,1,,Soccer,2,N
"Soooo close. Come on Bayern, get in the game. What a save from Dortmund though.",1369509153.0,1,,Soccer,2,N
WEIDENFELLER. WHAT A SAVE,1369509155.0,1,,Soccer,2,N
Finger tip save from Wiedenfeller!,1369509156.0,1,,Soccer,2,N
great save by weidenfeller,1369509156.0,1,,Soccer,2,N
he got a thumb on it.. a thumb,1369509161.0,1,,Soccer,2,N
WHAT A SAVE,1369509162.0,1,,Soccer,2,N
"WOAH BABY. Awesome save from dortmund. 
",1369509166.0,1,:pride:,Soccer,2,N
"Wow, that was a close one. Momentum seems to have changed in Bayern's favor at the moment.",1369509185.0,1,:Swansea_City:,Soccer,2,N
Some great saves on both sides already.,1369509197.0,1,,Soccer,2,N
"If this match continues at this pace, it may end as the best football match of this year.  ",1369509299.0,1,,Soccer,2,N
Oh just Reus on another power run of his. ,1369509299.0,1,,Soccer,2,N
That's good referring there....,1369509317.0,1,:Arsenal:,Soccer,2,N
this is the hardest neuer has had to work all season,1369509343.0,1,,Soccer,2,N
Bayern don't look the like the best team in the world. Is Klopp a great tactician or are Bayern bottling it again?,1369509344.0,1,,Soccer,2,N
wow müller was lucky he couldnt grab him there,1369509364.0,1,,Soccer,2,N
Greedy fucker,1369509375.0,1,:Dundee_FC:,Soccer,2,N
Robben such a fucking choke.,1369509382.0,1,:FC_Schalke_04:,Soccer,2,N
Weidenfeller again! Great game so far.,1369509385.0,1,:Arsenal:,Soccer,2,N
Did that Bayern player just kick the post? XD,1369509392.0,1,,Soccer,2,N
He will cry for days for missing that chance....mark my words.,1369509395.0,1,:France:,Soccer,2,N
These keepers!,1369509402.0,1,,Soccer,2,N
"Robben - ""what's a right foot?""",1369509404.0,1,,Soccer,2,N
Fucking FirstRow stream choppy as hell,1369509406.0,1,:Jordan:,Soccer,2,N
"Terrible finish by Robben that, straight onto Weidenfeller. ",1369509406.0,1,:Juventus:,Soccer,2,N
That was a stupidly sexy pass by muller,1369509407.0,1,:Manchester_City:,Soccer,2,N
WOW these two keepers are in great form.,1369509408.0,1,:r_soccer_user:,Soccer,2,N
Big chance of what looked like a deflected pass for Robben. Hope he doesn't have the Final Blues that he's been having in his last few ones.  ,1369509411.0,1,:r_soccer_user:,Soccer,2,N
Come on Dortmund ! Robben I love that you dont pass,1369509413.0,1,:Arsenal:,Soccer,2,N
Such composed defense by BVB on that corner,1369509418.0,1,,Soccer,2,N
Robben missing a crucial 1v1? no way,1369509499.0,1,:Real_Madrid:,Soccer,2,N
"robben is giving me heart attacks. so glad bayern has gotten into the game. and ive never been more proud to wear my neuer shirt, this guy is a fucking beast. i dont think hes ever been worried about anything in his life.",1369509553.0,1,,Soccer,2,N
"For those in Australia you can stream it online from SBS.
Not sure if they region lock, but HD stream for free.",1369509591.0,1,,Soccer,2,N
Schweinstiger going too HAM on that one,1369509622.0,1,:Wigan_Athletic:,Soccer,2,N
Lol that 2nd ball...trolls everywhere,1369509627.0,1,,Soccer,2,N
Poor Schweinsteiger.,1369509648.0,1,,Soccer,2,N
"Typical Hummels, trying too much :@",1369509662.0,1,,Soccer,2,N
Neuer.. omg.,1369509672.0,1,,Soccer,2,N
"Bayern, what the fuck are you doing?",1369509677.0,1,,Soccer,2,N
Both keepers have been incredible.,1369509679.0,1,,Soccer,2,N
