text,time,upvote,flair,sport,phase,category
"Phew, good think you remembered the head scratcher",1369507153.0,57,,Soccer,2,N
Happy Birthday! Regardless of whether you guys win or lose.,1369507865.0,3,,Soccer,2,N
"Diggin the hookah, I've got a 36"" KM myself",1369510856.0,3,:Real_Madrid:,Soccer,2,N
Glückwunsch!,1369507979.0,2,:r_soccer_user:,Soccer,2,N
Warka! Nice.,1369508929.0,2,,Soccer,2,N
[deleted],1369511209.0,1,,Soccer,2,N
Xbox games and a playstation ?,1369515086.0,1,,Soccer,2,N
[deleted],1369506255.0,4,,Soccer,2,N
He'll be fine.,1369506633.0,3,:Manchester_United:,Soccer,2,N
"During the pregame show on Fox Deportes, the guys were talking about how the pitch was in excellent conditions since so few matches were played there and had been warned that any person to set foot on it would be escorted out. And here we were seeing a mock battle on that same pitch. O.o",1369507691.0,3,,Soccer,2,N
Have you seen 3 circles in penalty areas in EL final? They bothered me the whole game.,1369511184.0,1,,Soccer,2,N
Probably waiting for OT.,1369513542.0,2,,Soccer,2,N
Look at Hummels... Like Orlando Bloom but even better-looking! And Reus.. Lewa...,1369516326.0,3,,Soccer,2,N
"Seriously, they all look like they are from the early 90's. Is Dortmund the Portland of Germany or something?",1369519441.0,2,,Soccer,2,N
Reus? Really?,1369516419.0,1,,Soccer,2,N
"Awesome man. Just a tip though, no one calls it the BPL. Most call it the premier league and at a stretch, the EPL.",1369507961.0,2,:Chelsea:,Soccer,2,N
I think Bayerns backline is suffering because they aren't making anything happen in offense ,1369508930.0,1,:Arsenal:,Soccer,2,N
"TBH, I was looking forward to that just as much as anything else in this match.",1369509276.0,2,,Soccer,2,N
[New Game](http://footballtainment.files.wordpress.com/2012/07/fifa13-referee-mode.jpg),1369509601.0,4,:Borussia_Dortmund:,Soccer,2,1U
Ya.....,1369509745.0,5,:Bayer_04_Leverkusen:,Soccer,2,N
I've had to piss since the 5th minute..,1369510290.0,3,,Soccer,2,N
He's playing really well outside of the misses,1369510488.0,6,:Arsenal:,Soccer,2,N
"More, because everyone would keep shooting from a distance. Thankfully football has goalkeepers. If I wanted to watch constant scoring I'd watch the [American hand-egg](http://wallpapersget.com/wp-content/uploads/2012/08/Baltimore-Ravens-american-football-team-Rashard-mendenhall.jpg).",1369511228.0,1,:r_soccer_user:,Soccer,2,N
"He's been one of my favorites this CL season. Such a smooth touch and clever play, love watching him.",1369512774.0,1,,Soccer,2,N
Gundogan and Lewa are two of my favorite non Tottenham players. Gundogan has been so damn good whenever I see him. ,1369513489.0,1,:Rochester_Rhinos:,Soccer,2,N
Should of been a yellow,1369512904.0,3,:r_soccer_user:,Soccer,2,N
There's a case for Dante also,1369513310.0,3,:Manchester_United:,Soccer,2,N
[deleted],1369513302.0,1,,Soccer,2,N
http://www.gomezbutton.de/,1369513700.0,4,,Soccer,2,N
Extra Time super sub?,1369513704.0,1,,Soccer,2,N
that time Müller got stoped and the ball got to Mandzukic... Gomez would have scored there... I am somehow 100% certain of that,1369513834.0,1,,Soccer,2,N
I feel for you bro..,1369514093.0,2,,Soccer,2,N
Arteta shared his hair secrets with them,1369514106.0,2,:Arsenal:,Soccer,2,N
That's quite egocentric of you.,1369514098.0,2,,Soccer,2,N
I don't support either and i'm crying :'D,1369514288.0,1,,Soccer,2,N
"Begun?

It's already well underway. ",1369515430.0,2,:Blackburn_Rovers:,Soccer,2,N
Prost!,1369507260.0,3,,Soccer,2,N
You forgot the beer!,1369509207.0,3,,Soccer,2,N
Mermaider! Mermaider! Mermaider! Mermaider! Mermaider! Mermaider! ,1369521972.0,1,:FC_Ryukyu:,Soccer,2,N
Of course they can play like this all game. That's how they won the league two years in a row.,1369508616.0,6,:Portugal:,Soccer,2,N
Is this from the Monaco Grand Prix?,1369514944.0,2,:transpride::Manchester_United:,Soccer,2,N
I still find this relevant ,1369514683.0,1,:Arsenal:,Soccer,2,N
"He was the MOTM. 

Not his biggest fan, but he literally willed them to victory.

Ribery saw what was going on early, and made sure Robben had the ball, and the room he needed.",1369517837.0,2,,Soccer,2,N
Neuer had a awesome match too.............,1369515029.0,3,,Soccer,2,N
One of the best UCL finals in a while. ,1369514887.0,5,:r_soccer_user:,Soccer,2,N
Hmmm Barça vs. United 2011,1369514851.0,1,:Club_Africain:,Soccer,2,N
why do people keep saying that . Last year was more enjoyable and put you on the edge of your seat more,1369514976.0,-13,,Soccer,2,N
"Watch out, he's going for triple digits!",1369511082.0,4,,Soccer,2,N
Make that 1 goal now. ,1369517385.0,1,,Soccer,2,N
"Sure it was dick move, but leave something for Boateng the hell he was thinking there holding his leg?",1369514431.0,-4,,Soccer,2,N
Congrats. It was really about time! ,1369514611.0,2,:Arsenal:,Soccer,2,N
*hugs,1369519915.0,1,,Soccer,2,N
"SHE'S A BIT FLIGHTY, LEWIS",1369507401.0,7,,Soccer,2,N
A match between these two teams without a card..?,1369509389.0,1,,Soccer,2,N
German Vs. German and you took that bet?  OUCH.,1369509408.0,1,,Soccer,2,N
that fella i tell ya,1369510267.0,2,,Soccer,2,N
a few Weidenfeller Man.,1369510442.0,1,,Soccer,2,N
Ich werde unterhalten! But this sounds rather stupid.. ,1369510521.0,3,,Soccer,2,N
"""Ich bin begeistert.""",1369510514.0,2,,Soccer,2,N
Das geht ab. = That rocks.,1369510506.0,2,,Soccer,2,N
"Gomez & Shaqiri for Mandzukic & Robben

I would say Mandzukic hasn't done that badly, Heynckes might be giving him a chance.",1369511748.0,2,:Borussia_Dortmund:,Soccer,2,1U
"i hope we get into penatly, so you can drink 3 beers tonight :)",1369512352.0,1,,Soccer,2,N
"that's one of the key points, our defense off sets isn't much to write home about",1369512390.0,2,:r_soccer_user:,Soccer,2,N
All of them.,1369512765.0,1,:Jordan:,Soccer,2,N
He knows he should be off so he's being sporting and just acting like he's not there,1369512980.0,1,:Houston_Dash:,Soccer,2,N
 Champion's League winners and runners up medals?,1369513242.0,0,:r_soccer_user:,Soccer,2,N
Oddly enough it was the exact opposite in the WC Final 2010.,1369513331.0,2,:Wigan_Athletic:,Soccer,2,N
Van Buyten?,1369513376.0,1,:Borussia_Dortmund:,Soccer,2,1U
he's not 100 percent either i don't know why he's still in,1369513431.0,1,:r_soccer_user:,Soccer,2,N
"I heard it once when they got some momentum in the first half. It should be Dortmund's home game, they had 500,000 ticket requests. Bayern had 200,000.",1369513498.0,1,:Borussia_Dortmund:,Soccer,2,1U
More like beh than bee.,1369513545.0,1,:r_soccer_user:,Soccer,2,N
Na needs a broken leg and some fresh :),1369513638.0,1,,Soccer,2,N
Weidenfeller?,1369514440.0,1,,Soccer,2,N
"Yeah, and this game didn't have Götze or Kroos. And Gomez didn't get to play much.",1369514410.0,2,:Borussia_Dortmund:,Soccer,2,1U
"They'll deserve it when they hold the trophy up. They're either favorites or equal with Spain moving into the WC, but Spain has had their number for the last five years. ",1369514409.0,1,,Soccer,2,N
Why does Germany deserve the World Cup?,1369514547.0,1,,Soccer,2,N
Oh wow. First time ever I am looking forward to the super cup.,1369514531.0,1,,Soccer,2,N
Incredible Manager! This is true charisma!,1369516503.0,2,,Soccer,2,N
Gotze?,1369509264.0,2,:Chelsea:,Soccer,2,N
Welcome to the party!,1369513092.0,5,,Soccer,2,N
"Are there any Dortmund fans right now acknowledging that Lewa should have been dismissed? I mean, **of course** the supporters of the team will try to not make a fuzz about their team's players mistakes, I'm not sure why people are surprised by this.",1369513649.0,6,,Soccer,2,N
and they seem to have forgot the muller dive 2minutes prior,1369513402.0,13,:r_soccer_user:,Soccer,2,N
">titanic bitch

Hahahha, that's fantastic.",1369519660.0,1,:Dundee_FC:,Soccer,2,N
You're saying Javi Martinez is going to win. Fuck Yeah!! Let's go Bayern.,1369510939.0,1,:Deportivo_Toluca_FC:,Soccer,2,N
Javi Martinez holding down the fort?,1369511024.0,1,,Soccer,2,N
I smell javi martinez winning goal,1369511699.0,1,,Soccer,2,N
I actually thought it *was* Justin Bieber until they put up the name tag...,1369508601.0,3,,Soccer,2,N
He would definitely have been off if the ref saw it clearly. Just hope he doesn't contribute if Bayern win.,1369510983.0,1,:Rangers:,Soccer,2,N
"Yes, very hard to watch.",1369514782.0,1,,Soccer,2,N
He's well compensated,1369514882.0,1,,Soccer,2,N
"Respect to Dortmund and their supporters! 

We demand a rematch next year in the final in Lissabon!",1369516795.0,3,,Soccer,2,N
and the commentators later say the ref has been nearly perfect this match...,1369514496.0,1,,Soccer,2,N
Fuck yes we will. But we will be Götzeless.,1369514343.0,2,,Soccer,2,N
Great performance. You should be very proud of your team!! :),1369519969.0,1,,Soccer,2,N
"Neither one was deserved, so perhaps you should get over it. ",1369514294.0,3,,Soccer,2,N
What about Lewa?,1369514106.0,5,,Soccer,2,N
Yeah just because its a final is not a reason for the kid gloves when it comes to cards,1369514426.0,1,:r_soccer_user:,Soccer,2,N
I think he hit Weidenfeller in the head to weaken him/scare him. Expect a hat trick next half.,1369510925.0,3,,Soccer,2,N
He's definitely starting out like he is.,1369509894.0,5,:Houston_Dynamo:,Soccer,2,N
"Unintentional as it was, the real reason was probably be that the referee's line of vision was blocked. ",1369514493.0,4,,Soccer,2,N
that would have massively changed the game,1369514461.0,1,:Tottenham_Hotspur:,Soccer,2,N
my thoughts exactly. he literally booted the guy in the nuts. ,1369514468.0,0,:r_soccer_user:,Soccer,2,N
"""Kick to the balls""",1369515950.0,0,:AS_Monaco:,Soccer,2,N
What did he contribute?,1369514319.0,-1,,Soccer,2,N
Be sure to wrap it up guise!! :D ,1369514745.0,6,:Houston_Dynamo:,Soccer,2,N
"This sounds interesting,road trip?",1369507116.0,1,,Soccer,2,N
"do you speak german? go to http://www.90elf.de/

they have apps for [Android](https://play.google.com/store/apps/details?id=com.rcd.radio90elf) and [iOS](https://itunes.apple.com/de/app/90elf-fussball-bundesliga/id543119770?mt=8), too.",1369507824.0,1,,Soccer,2,N
I wish I had a radio stream myself so I wouldn't have to listen to Gus Johnson,1369510028.0,1,,Soccer,2,N
What's a postcode that works?,1369508023.0,2,:Arsenal:,Soccer,2,N
"whats a postcode that will work?

edit* W11 2BQ works for me",1369508179.0,1,:Arsenal:,Soccer,2,N
Well I don't know if he can run; he has a hamstring injury,1369508417.0,1,,Soccer,2,N
That would be a complete cunt move to celebrate with Bayern. ,1369508469.0,1,:Chelsea:,Soccer,2,N
The hot blonde chick ratio seems highest with German teams ,1369509103.0,1,,Soccer,2,N
Keeping the ball on the back line and can't get through. Definitely nervous.,1369508815.0,1,,Soccer,2,N
Flair up!,1369509279.0,1,:Liverpool:,Soccer,2,N
can't get it to work.  ITV keeps asking for my postcode despite the fact that I've added Hola Unblocker,1369510262.0,1,:Manchester_United:,Soccer,2,N
"maybe [these guys](http://25.media.tumblr.com/tumblr_leyxzuSZnZ1qa6r3yo1_500.jpg) 

Edit: I'm far from an expert but I can't actually think of a more one footed player at the top level maybe alvaro recoba.",1369509980.0,3,:Arsenal:,Soccer,2,N
"This sentence is really underestimated.
I bet it's 5x more than OP predicted.
",1369510705.0,1,,Soccer,2,N
And Chelsea.,1369511394.0,1,,Soccer,2,N
"It happens to a lot of players actually... they start to pick up an accent of the country they play in. So it's a ""progression toward British"" accent",1369510996.0,4,:r_soccer_user:,Soccer,2,N
"I wonder if he says ""lift"", ""lorry"" etc.",1369511505.0,1,,Soccer,2,N
Wtf is that terrifying thing?,1369511276.0,2,,Soccer,2,N
someone was leaning on the 'ad' button,1369511527.0,2,:Manchester_United:,Soccer,2,N
"Glad someone else posted about that, I looked away for a sec and when I turned back there was some bloke in a suit gawking moodily into the sky. Then the football just carried on as normal and the commentators didn't mention it. Spooky, and I thought I was going a bit peculiar.",1369511583.0,2,,Soccer,2,N
"Wow, I would expect that for Formula 1 or so. but not on a soccer match.. especially in a final.",1369511557.0,1,,Soccer,2,N
It's happened more often that you might think with ITV. Happened during the last world cup as well as England's last friendly.,1369511647.0,1,:Liverpool:,Soccer,2,N
He's great. Worth every penny they payed for him.,1369511683.0,2,:r_soccer_user:,Soccer,2,N
I'm pretty sure both teams bring their PA announcer's the final:P,1369512429.0,2,:r_soccer_user:,Soccer,2,N
i think both teams have their respective announcers with them,1369512414.0,1,,Soccer,2,N
Absolutely. This kind of challenge is a yellow card. Usually.,1369512822.0,1,,Soccer,2,N
[deleted],1369512776.0,0,,Soccer,2,N
[deleted],1369513164.0,1,,Soccer,2,N
He knew exactly what he was doing. Definitely intentional.,1369513380.0,2,:Aston_Villa_80s:,Soccer,2,N
Clearly intentional,1369513265.0,0,,Soccer,2,N
It was not one of his trademark goals... but did you cry anyway?,1369514290.0,2,,Soccer,2,N
Balding? You mean bald,1369513651.0,2,:c_Manchester_United:,Soccer,2,N
"Well on the replay Gundogan went down awful easy.  Undoubtedly a foul and I was expecting a card until the replay, from there it was certainly a foul and Gundogan wanted to make damn sure it got called.",1369513683.0,1,:r_soccer_user:,Soccer,2,N
I am blown away by the saves he has made today!,1369513790.0,2,,Soccer,2,N
Frustratingly... yes,1369513811.0,1,:Arsenal:,Soccer,2,N
Cool is the rule.,1369514104.0,1,:r_soccer_user:,Soccer,2,N
A bayern fan.,1369514106.0,1,:r_soccer_user:,Soccer,2,N
And another 3 of Ribery on the ground.,1369514107.0,4,,Soccer,2,N
"This one's for Hoeneß and Heynckes and Badstuber

FTFY",1369515493.0,1,:TSV_Kleinrinderfeld:,Soccer,2,N
Champions of Europa we know what we are haha good on Munich!,1369515117.0,2,,Soccer,2,N
Presumably in German though.,1369515305.0,2,,Soccer,2,N
The elbow on Lewa + the attempted punch at Grosskeutz. He really should have been sent off this game.,1369515595.0,3,,Soccer,2,N
cheese eating surrender monkey,1369512963.0,2,,Soccer,2,N
^^ this.,1369514449.0,-2,,Soccer,2,N
HAHAHAHA THE LINESMAN HAILING THE HITLER !,1369511124.0,4,,Soccer,2,N
"It's Führer, not Fürher.",1369511171.0,3,,Soccer,2,N
What am I missing here..?,1369515294.0,1,:Liverpool:,Soccer,2,N
AHAHHAHHA DAE GERMANY = HITLER,1369511110.0,0,:Hamburger_SV:,Soccer,2,N
"Good luck! You guys are enjoying London right? You could stay a while and you know do a little sight seeing, soak up the English culture, sign some papers :) .... You don't have to leave in a hurry.",1369507526.0,2,,Soccer,2,N
both dortmund players have been incredible,1369513255.0,2,,Soccer,2,N
I'd say Reus is up there too.,1369513299.0,2,,Soccer,2,N
"Talking about all finals, the last four.",1369509477.0,6,,Soccer,2,N
"I used to think his signature move was cutting in, now I think it's missing one on ones in finals",1369509557.0,3,,Soccer,2,N
fixed:how many times has robben chocked in finals now,1369509472.0,2,:r_soccer_user:,Soccer,2,N
"That's how he plays in every match, to be fair",1369509503.0,2,:Houston_Dash:,Soccer,2,N
"Or in any final, really.. I'm sure you remember 2010 WC..",1369509523.0,1,:Portugal:,Soccer,2,N
"To be honest he is playing well, but yeah finishing his chances has really become a problem for him in these big matches.",1369510638.0,1,:Red_Star_Belgrade:,Soccer,2,N
I hope you don't mind that I will steal this. lmao,1369516066.0,2,:Bayern_Munich:,Soccer,2,1F
Actually think that's the right decision.  It's clumsy but he's trying to play the ball.  You're not giving a yellow card for that anywhere else on the pitch.,1369514701.0,7,:Wigan_Athletic:,Soccer,2,N
Why didnt lewy get sent off? Why didnt muller get a penalty kick when he got pulled from behind. ,1369515245.0,2,,Soccer,2,N
Weidenfeller has some impressive competition.,1369510244.0,4,,Soccer,2,N
"Kahn, Lehmann, Neuer, Wieso, Hildebrand.",1369510303.0,1,,Soccer,2,N
Well he just assisted the goal...,1369512187.0,1,:r_soccer_user:,Soccer,2,N
"i for one would like to see gotze run on the field streaking with shaqiri, steal the ball and then have butt sex to celebrate the fact that they will be playing together next season. live,too.",1369510554.0,-1,,Soccer,2,N
"It really didn't look intentional to me, to be honest.",1369513273.0,3,,Soccer,2,N
Typical ,1369514771.0,2,:VfB_Stuttgart:,Soccer,2,N
we'll do that at the WC in brasil ,1369515347.0,5,:Borussia_Dortmund:,Soccer,2,1U
Same lol I want to see him sent off already ._.,1369512986.0,2,,Soccer,2,N
I can bet you that there's more than one. For 100€? 200€?,1369507006.0,1,,Soccer,2,N
London Olympics?,1369507125.0,2,,Soccer,2,N
I haven't been able to relax in 2 years!,1369507530.0,0,:Bayern_Munich:,Soccer,2,1F
They were displaying the CL titles they had already won. In that context it indicates that they will win it today again.,1369507549.0,1,:SC_Freiburg:,Soccer,2,N
I think they had a similar one in 2001. And won ;),1369508487.0,1,,Soccer,2,N
"What is this, *Desperate Housewives* ?",1369508123.0,1,,Soccer,2,N
"A reenactment of the Battle of Britain, you mean?",1369508123.0,1,,Soccer,2,N
agreed,1369508268.0,2,:r_soccer_user:,Soccer,2,N
I bought 12 bottles of beer and I've got my absinthe waiting in case I need it,1369508476.0,1,:c_Manchester_United:,Soccer,2,N
They're the only good ones on the Polish national team. The whole left side is weak. ,1369508576.0,1,:r_soccer_user:,Soccer,2,N
I don't think you understand just how much pressure is on them,1369508565.0,0,,Soccer,2,N
Best keeper in the world imo,1369508634.0,2,,Soccer,2,N
"You don't watch a lot of our games, right? We have stamina hacks ",1369508713.0,2,:Borussia_Dortmund:,Soccer,2,1U
http://www.youtube.com/watch?v=uA15sxDc3ko,1369508792.0,1,:r_soccer_user:,Soccer,2,N
He actually does... quite a bit,1369508819.0,1,:r_soccer_user:,Soccer,2,N
So you went running for 0 minutes? Impressing... ;-),1369508988.0,1,:Germany:,Soccer,2,N
Pau Gasol?,1369509380.0,1,:Manchester_United:,Soccer,2,N
Diego Lopez is an inch or two taller,1369509451.0,1,,Soccer,2,N
You're asking for too much!,1369509451.0,1,:r_soccer_user:,Soccer,2,N
Who's Robben?,1369509488.0,1,,Soccer,2,N
"    *Error...Error!...INSUFFICIENT DATA TO RUN PROGRAM

      rightfootshoot.exe ",1369510313.0,1,,Soccer,2,N
"My god yeah... I said out loud ""I'm sorry robben""...",1369509473.0,1,:Arsenal:,Soccer,2,N
"same for BVB though, very physical game",1369510013.0,1,:r_soccer_user:,Soccer,2,N
"As a doctor, facial nerve block immediately came to mind. As a human being, it could also have been porn.",1369510612.0,2,,Soccer,2,N
"I love these types of games.  Great attacking football, great defending (or at least goalkeeping), just great football all around.",1369510952.0,1,,Soccer,2,N
zie germans. no diving. no letting in balls. if they go tho penatlies it's going to be 89-90 ,1369510882.0,3,,Soccer,2,N
And FIFA didn't put Neuer on the Bundesliga TOTS...,1369510859.0,1,:Borussia_Dortmund:,Soccer,2,1U
No alcohol allowed at european matches.,1369511353.0,2,:Newcastle_United:,Soccer,2,N
/r/britishproblems for you.,1369511425.0,2,,Soccer,2,N
"No, he's just German.",1369511491.0,2,:Transpride:,Soccer,2,N
That chance early in the first half scared the shit out of me. He nonchalantly dribbled down to the left from the middle and casually smashed the ball with his weaker foot and then jogged away after Neuer punched it away,1369511520.0,1,,Soccer,2,N
"He was at Schalke, the arch rival of Dortmund.",1369511586.0,3,,Soccer,2,N
"A few reasons, really. Besides the normal whistling that goes on when a goalkeeper is taking a goal kick, Neuer most notably started his career with Schalke, Dortmund's local rivals. ",1369511665.0,3,,Soccer,2,N
"When they've gone bad they've gone really bad, though. Has me worried a bit but happy to have a great keeper.",1369512017.0,1,,Soccer,2,N
"You can download a browser called Skyfire. It can convert and play the flash-type streams on FirstRow. It's not the greatest and I'd recommend at least having a WiFi connection, but I've used it.",1369512051.0,3,,Soccer,2,N
Reminds me of the Larry david gif.,1369512161.0,1,,Soccer,2,N
Might as well call the game right now. Bayern has it in the bag.,1369512324.0,1,:r_soccer_user:,Soccer,2,N
"NOBODY JUCKING JINX THIS

jinx, you owe me a soda",1369512433.0,1,:Borussia_Dortmund:,Soccer,2,1U
"He was already booked, not even a yellow for it. Gary Neville said he bottled it haha.",1369512613.0,1,:Manchester_United:,Soccer,2,N
"He got nothing, the yellow was from before",1369512666.0,1,,Soccer,2,N
"It wasn't even a yellow, unless you missed a word! He should be off, no question.",1369512731.0,1,:Liverpool:,Soccer,2,N
"I feared it so much..

that guy is a psychic",1369512715.0,1,,Soccer,2,N
Dortmund scored a peno.,1369512686.0,6,,Soccer,2,N
Good one!,1369512801.0,2,:r_soccer_user:,Soccer,2,N
He wants a medal?,1369512753.0,1,,Soccer,2,N
why wouldn't he be?,1369512779.0,1,,Soccer,2,N
Wizards.,1369512808.0,2,,Soccer,2,N
Spidercam.,1369512792.0,1,,Soccer,2,N
www.gomezbutton.de,1369513200.0,2,:AS_Roma:,Soccer,2,N
USSF dropped the ball on that one.  We PASSED on him. ,1369513408.0,2,,Soccer,2,N
Tom Cruise ,1369513390.0,7,:Manchester_United:,Soccer,2,N
Mario 'Bieber' Götze,1369513344.0,4,:r_soccer_user:,Soccer,2,N
Mario Gotze,1369513327.0,3,,Soccer,2,N
"Not sure if trolling or not but that's Mario Gotze. Dortmund player who will be moving to Bayern Munich once the transfer window opens. Ruled out tonight by ""injury"".",1369513438.0,3,,Soccer,2,N
gotze,1369513343.0,2,,Soccer,2,N
Götze?,1369513345.0,2,,Soccer,2,N
Goetze,1369513354.0,2,,Soccer,2,N
 Götze,1369513358.0,2,:r_soccer_user:,Soccer,2,N
Goetze,1369513361.0,2,,Soccer,2,N
Götze being totally hip,1369513412.0,2,,Soccer,2,N
"Mario Goetze. He's one of Dortmund's star players that is hurt for this match, and he already announced that he's moving to Bayern next year.",1369513483.0,2,:r_soccer_user:,Soccer,2,N
"Götze. He is a Dortmund player who is being bought by Bayern, so many Dortmund fans hate him.

There's a lot of controversy and drama around him right now.


Actually, think of it as a german version of the Van Persie deal.",1369513528.0,2,,Soccer,2,N
"Goetze, Dortmund player who's been transferred to bayern next season.",1369513393.0,1,,Soccer,2,N
"Mario Gotze, plays for dortmund but recently signed a contract for bayern",1369513426.0,1,,Soccer,2,N
That would be Götze,1369513433.0,1,,Soccer,2,N
Gotze.,1369513452.0,1,,Soccer,2,N
mario gotze,1369513461.0,1,:r_soccer_user:,Soccer,2,N
Götze.,1369513464.0,1,,Soccer,2,N
Götze,1369513467.0,1,,Soccer,2,N
gotze,1369513343.0,1,,Soccer,2,N
Gotze.. Do you watch football?,1369513382.0,-1,,Soccer,2,N
"Seriously, bro?",1369513341.0,-2,,Soccer,2,N
"He's trying to fill in for Ribery as well, who seems to already be on vacation in France.",1369513751.0,2,:r_soccer_user:,Soccer,2,N
Dying swan?,1369513736.0,1,,Soccer,2,N
Mix between RW and CAM,1369513745.0,1,:Bayern_Munich:,Soccer,2,1F
Neuer is the main reason we are doing so well this game. His saves have been awesome and very necessary.,1369514025.0,2,,Soccer,2,N
Thought it would be at least 4,1369514905.0,1,:CD_Guadalajara:,Soccer,2,N
QPR,1369515038.0,3,:Manchester_United:,Soccer,2,N
"She said as German Chancellor she has to maintain neutrality and support ""Germany"". Good way to be on the winning side either way ;)",1369515045.0,5,:Arsenal:,Soccer,2,N
well he does have *alot* of free time,1369515531.0,1,,Soccer,2,N
Possibly featuring Pep vs. Jose 2: Electric Bogaloo. ,1369515838.0,3,:r_soccer_user:,Soccer,2,N
"Fuck Houston, We got your loss tomorrow right here!

Yes I know this isn't trashtalk, but we're in /r/soccer , where noone seems to give a shit about rules!",1369518988.0,1,,Soccer,2,N
"They did in this is the second leg against arsenal as well. If they're not up 3 goals, some of their players start trying some pretty twatish behavior",1369513796.0,0,,Soccer,2,N
THAT'S WHAT I SAID,1369515405.0,3,:r_soccer_user:,Soccer,2,N
"Heard that too, talk about a non sequitur.",1369515415.0,2,,Soccer,2,N
":(  ... I care...

stopped watching what happened",1369515605.0,1,,Soccer,2,N
Awful. The ball gets all choppy in the air. It's really strange.,1369508599.0,2,:r_soccer_user:,Soccer,2,N
I've seen a German team losing against an English team on penalties last year.,1369508587.0,5,,Soccer,2,N
Did you see last year's final?,1369508606.0,2,,Soccer,2,N
For Dortmund its 7 Germans and 4 Non German. For Bayern Munich its 5 Germans and 6 Non Germans. I'm giving it to Dortmund,1369508777.0,2,:Mexico:,Soccer,2,N
the world explodes,1369510447.0,1,,Soccer,2,N
"""i'm a professional runner-up, AMA""",1369510398.0,9,,Soccer,2,N
"""What does it feel like to miss several game winning opportunities in 3 different world class finals?""

""Well you know, I'm very happy in Munich :)""",1369510601.0,5,,Soccer,2,N
You only drink one beer a half? ,1369511274.0,4,:r_soccer_user:,Soccer,2,N
Only the second?,1369511257.0,2,,Soccer,2,N
"2nd half, 2nd heart attack for me.",1369511315.0,1,,Soccer,2,N
you cant be german,1369511428.0,1,,Soccer,2,N
the 6th  for me :),1369511560.0,1,,Soccer,2,N
two beers?,1369511302.0,1,:c_Manchester_United:,Soccer,2,N
Jumping on the train...weak.,1369511307.0,0,:r_soccer_user:,Soccer,2,N
"Nearly blew out my fucking speakers, my god.",1369513822.0,2,,Soccer,2,N
I love this,1369513763.0,1,:c_Manchester_United:,Soccer,2,N
Why not Dante?,1369508080.0,2,,Soccer,2,N
no,1369508077.0,1,,Soccer,2,N
Butt check or Shoulder thru the chest. idk one kinda seems worse.,1369510086.0,2,,Soccer,2,N
[deleted],1369514030.0,-1,,Soccer,2,N
9 if you include Ribery and Dante.,1369514198.0,1,:Liverpool:,Soccer,2,N
"9, Dante should have had a second card for the PK, and Ribery should have had at least a yellow for that elbow on Lewandowski.",1369514411.0,0,:Sporting_Kansas_City:,Soccer,2,N
