text,time,upvote,flair,sport,phase,category
"If he could only have done the same in 2010. 

He deserves it though. ",1369515021.0,16,,Soccer,3,N
"As I wrote in the match thread, it's a cheesy Hollywood script come to life. 

Amazing. ",1369515371.0,12,:Royale_Union_Saint-Gillo:,Soccer,3,N
Utterly amazing way to end this match. How many shots has he had in CL finals up until scoring? What's the stat?,1369514889.0,6,,Soccer,3,N
Truer words have not been uttered... AWESOME!!,1369514739.0,17,,Soccer,3,N
"He always got so close and now he finally got it, plus with the winning goal. ",1369515041.0,4,,Soccer,3,N
"I seriously thought it was going to be 2010 all over again, countless 1 on 1's and no goals. Then he scores on a 1on1 to win it all, fitting",1369522368.0,3,:Manchester_United:,Soccer,3,N
IT TASTES SO SWEET,1369515943.0,1,:Arsenal:,Soccer,3,N
https://pbs.twimg.com/media/BLI-2cjCAAENg3q.jpg:large,1369518150.0,1,,Soccer,3,N
He still scuffed it though,1369516068.0,0,:r_soccer_user:,Soccer,3,N
someday you'll get to experience that again ,1369516696.0,184,,Soccer,3,N
WHAT? WHAT? WHAT? WHAT?,1369514861.0,82,,Soccer,3,N
Arjen Robben is a very strange man. Very talented yet very strange.,1369516422.0,4,,Soccer,3,N
He finally scored a crucial goal in a final.,1369546023.0,1,,Soccer,3,N
the trophy high five girl.. come on man think ,1369517076.0,84,:FC_Barcelona:,Soccer,3,N
I think it was [Kathleen Krüger](http://www.bild.de/sport/fussball/bayern-muenchen/blonde-kathleen-organisiert-trainingslager-28031186.bild.html) (She organizes trips and whatnot),1369518540.0,26,,Soccer,3,N
Angela Merkel,1369520334.0,28,,Soccer,3,N
I assumed it was one of the players' wife/girlfriend based on how friendly they seemed with her. Maybe not?,1369518968.0,0,,Soccer,3,N
"It is kind of wierd because I would think the same if Dortmund won. I would rather beat someone else, because you deserved the cup very much.",1369522545.0,23,:r_soccer_user:,Soccer,3,N
Looked like a German Justin Bieber,1369514630.0,345,,Soccer,3,N
Why would he wear a hat with his glorious hair. ,1369516657.0,30,,Soccer,3,N
He looked about 13,1369514463.0,99,:Liverpool:,Soccer,3,N
looked like a member of a boy band,1369514604.0,35,,Soccer,3,N
pic?,1369515072.0,17,,Soccer,3,N
they were playing for his frail hand,1369514443.0,3,,Soccer,3,N
"Besides his appearance, how does he feel right now?",1369521713.0,1,,Soccer,3,N
Mario Goatse.,1369514902.0,0,,Soccer,3,N
Yes! Thank you! He looked like such a d-bag.,1369515227.0,-4,:Chelsea:,Soccer,3,N
To be fair not many people get to 27 shots. Plus Weidenfeller is a goddamn beast. He positions himself so well.,1369516420.0,13,:FC_Twente:,Soccer,3,N
...he also didn't do it when it counted... like last year,1369516687.0,1,,Soccer,3,N
"Are you making that number up? If not, that is ridiculous.",1369516997.0,0,,Soccer,3,N
Also credit to dortmund. Feel theyve done it the right way and will come back again despite losing their best players,1369516025.0,3,:r_soccer_user:,Soccer,3,N
should have gone for the giant monster ape.,1369523326.0,1,,Soccer,3,N
I think many refs hold back on red cards in finals/semi finals in general. ,1369514859.0,59,:r_soccer_user:,Soccer,3,N
"My guess is that he didn't want to make the Champions League final a 10v11 game. Keep it as level as possible.

EDIT: I disagree with the decision and believe Dante should have been sent off but the ref was reluctant, whatever.",1369514779.0,94,,Soccer,3,N
Bottled it. ,1369515832.0,5,:Blackburn_Rovers:,Soccer,3,N
I personally thought the first yellow was a little weak to hand out. Maybe the ref was trying to make up for it by not showing the second one. ,1369523740.0,3,,Soccer,3,N
shitty reffing in that regard. They let way too much go in terms of penalties. ,1369514886.0,2,,Soccer,3,N
"I actually thought it was the right call.

He tried to play the ball but Reus was too quick for him.  He didn't go in studs up, he immediately tried to pull out of the tackle once he realized the ball was gone but it was too late, and nothing about the foul was intentional or meant to injure.

Was it a foul? Yes. Was it a certain yellow card? No.

I feel the same people who will complain like crazy when a referee is throwing out yellow cards for anything are suddenly wanting a referee to throw out red cards for everything.",1369517864.0,4,,Soccer,3,N
"Hey dont give the ref to much hate now, long time ago ive seen such a solid ref preformance. But yes it should have been a send of for dante :/",1369523127.0,1,:Croatia:,Soccer,3,N
[deleted],1369515067.0,-5,,Soccer,3,N
or Jupps thinking for not sending him off?,1369514470.0,-4,,Soccer,3,N
"And so it begins, just like every other match. ",1369516321.0,58,,Soccer,3,N
"Well Lewandowski also, but anyways what a game!",1369514761.0,105,,Soccer,3,N
"Very true. Just like they do in the league all the fucking time, Rizzoli and the rest of the refs fucked up.

It was a studs up challenge, very similar to Nani's red.",1369514652.0,56,:r_soccer_user:,Soccer,3,N
I really don't feel a 10 man Bayern could've kept up with the pace that Dortmund would've played with. ,1369514993.0,21,:USA:,Soccer,3,N
"Can't help but feel that it was a yellow, but he didn't give it because it would have meant sending Dante off.",1369517262.0,3,,Soccer,3,N
Ribery too!,1369515139.0,37,,Soccer,3,N
Ribery should have being sent off too. ,1369519548.0,2,:FC_Barcelona:,Soccer,3,N
"That might be true, but the game was so wonderful and so free of reefering controversy (as opposed to the Copa del Rey final) that it's better this way, Dortmund still got a goal out of that penalty.",1369516483.0,2,,Soccer,3,N
"I disagree. I think the first yellow was far too soft. The man hadn't made any harsh tackles yet (or had any fouls up to that point if I remember correctly). 20 minutes into the game, that gets you a caution, not a card yet. I think the ref was hesitant to send him of for the penalty because of this, because that chalenge, I can agree, was a definite yellow. Comes flying in, studs up, foot at chest level. Dangerous play and should be carded for that, but the guy did not have an agressive game by any means and a red would have been very unfair. ",1369519256.0,2,,Soccer,3,N
Does anyone have that gif? I missed the challenge. ,1369515670.0,1,,Soccer,3,N
"For sure but Dortmund had it their way, way too much in previous rounds... See: Malaga",1369515802.0,0,,Soccer,3,N
I feel like the penalty was punishment enough,1369515056.0,-2,:r_soccer_user:,Soccer,3,N
Not every foul is a yellow.,1369562529.0,0,,Soccer,3,N
He did a Suarez.,1369516096.0,37,:Bosnia_and_Herzegovina:,Soccer,3,N
"I'm in no way doubting the fact that he should be punished for that stamp, but would Boateng also get anything for not letting go of his ankle? From what I recall, you could see his feet holding Lewandowski in place and not letting him move. Would they penalise both players?",1369521944.0,9,:Swansea_City:,Soccer,3,N
"Please don't ban him UEFA. We need him next season. 

;)",1369522237.0,-2,:TSV_Kleinrinderfeld:,Soccer,3,N
http://media.tumblr.com/2d3a9cbe45ef6a627b5daf2d34ad855a/tumblr_inline_mlihlk2Is31qz4rgp.gif,1369516080.0,5,:Manchester_United:,Soccer,3,N
"Aside from the goal, which is what it all comes down to in the end, he fucked up a lot of his chances. The dribbling at the end was EXCEPTIONAL but there were flashbacks with the constant shooting at Weidenfeller (who deserves a MOTM shout).",1369516106.0,-5,:Chelsea:,Soccer,3,N
"Nah, I have to disagree. He had a painfully mediocre game all things considered. ",1369515659.0,-20,,Soccer,3,N
"Here she is! 
http://24.media.tumblr.com/3e1dc5f5e2935105543d1d649eadf02d/tumblr_mndfkvMjL31ryssgno1_500.jpg",1369515103.0,27,,Soccer,3,N
"[Muller's wife is pretty hot too.](http://soccerlens.com/files/2011/05/lisa-muller.jpg)

edit: oops. try this [one.](http://imgur.com/h8qKyoR)",1369519561.0,1,:USA:,Soccer,3,N
My oh my... ,1369515832.0,1,,Soccer,3,N
"""Here comes Schweinsteiger, the captain. And there's Philipp Lahm.""",1369516551.0,7,:r_soccer_user:,Soccer,3,N
he should be,1369532989.0,0,,Soccer,3,N
Funny how I do not need to ask what C stands for after seeing it was Ribbery who got it.,1369514675.0,85,,Soccer,3,N
"Ribery created both goals for Bayern, can't discredit his influence.",1369514831.0,43,,Soccer,3,N
I would give MOTM to Weidenfeller,1369514573.0,147,:USA:,Soccer,3,N
"I can't fucking stand Ribery. But props to Robben, he deserves it. ",1369514633.0,56,,Soccer,3,N
I think Weidenfeller should be MOTM.  Played out of this world,1369514692.0,15,:LA_Galaxy:,Soccer,3,N
I don't think Ribery gets enough crap for his diving antics. The guy is easily one of the worst divers in the world.,1369514879.0,4,,Soccer,3,N
Someone who should have been send off of the field in half 1? really?,1369517501.0,1,,Soccer,3,N
MOTM - Javi Martinez,1369532189.0,1,,Soccer,3,N
Cunt of the match ? ,1369516748.0,0,:FC_Barcelona:,Soccer,3,N
"Despite getting the goal, Robben was next to useless today",1369514926.0,-12,:r_soccer_user:,Soccer,3,N
"What does the ""c"" stand for? C*nt?",1369518678.0,0,,Soccer,3,N
Same goes for Ribery and Lewandowski,1369516214.0,5,:Fortuna_Dusseldorf:,Soccer,3,N
"> Dante could have been sent off

FTFY.
     
It's about the ref's interpretation in this case. He thought it was a genuine challenge that was miss timed and the player was fouled. penalty was deemed a good enough punishment and it kept the competitive level of the game. but ur all screaming blue murder just cause you lost. You just could't win it 11v11",1369516123.0,1,,Soccer,3,N
"as well as Ribery, no ?",1369516004.0,1,,Soccer,3,N
Nicely said. We're football fans first.,1369519005.0,1,,Soccer,3,N
Definitely Dante. A kick in the gut that creates a penalty isn't a yellow card?! Crazy. ,1369514928.0,90,:USA:,Soccer,3,N
And Lewandowski.,1369514561.0,222,:Rosenborg:,Soccer,3,N
Same with Lewa.  Match should have finished 10 v 9,1369514696.0,28,:r_soccer_user:,Soccer,3,N
"Unbelievable that Ribery didn't get two yellows, completely shocking that Dante didn't get a second yellow. What the fuck was the ref thinking? ",1369514938.0,18,,Soccer,3,N
We will find whatever excuse fits the situation,1369526294.0,1,,Soccer,3,N
Subotic as well,1369514654.0,-12,,Soccer,3,N
i don't know about deserving it but it was a hell of a finish. sold the goalkeeper for a dime of a goal.,1369515688.0,1,,Soccer,3,N
He kept Dortmund in the game. ,1369514428.0,7,,Soccer,3,N
Is that an amazing photoshop? I never heard anyone mention he was in attendance and they showed Will Smith in the stands.,1369526688.0,2,,Soccer,3,N
SAF is not going to be denied that trophy in his final year haha,1369516028.0,2,,Soccer,3,N
Which day? ,1369516727.0,8,,Soccer,3,N
"I supported bvb today, but agreed, that's my positive takeaway. ",1369516097.0,4,,Soccer,3,N
[deleted],1369531115.0,0,,Soccer,3,N
Same here! It's crazy that he wasn't even starting for us for quite a significant period of time when Kroos was still fit! ,1369522364.0,2,:Bayern_Munich:,Soccer,3,1F
A fair number of people. he's a big goal threat isn't he. especially with bayern playing mostly on the counter.,1369515151.0,30,,Soccer,3,N
Hes the one man that the phrase 'hes got two left feet' is a compliment to,1369517542.0,2,:r_soccer_user:,Soccer,3,N
Yes. ,1369514846.0,-1,,Soccer,3,N
"He had a shit game apart from the goals, which, let's be honest, had a lot of luck involved. He missed a few clear cut chances and played a generally bad game. 

It's exactly as one commenter on the thread said ""Up until the goal -OMG Robben sucks!-, when the goals was score -He's redeemed  himself- , after the goal -He still sucks- "" 

Only that was before he scored. ",1369515590.0,-15,:Manchester_City:,Soccer,3,N
Obviously a lie. No sensible American would waste his time discussing the Bills.,1369515798.0,20,,Soccer,3,N
"Sorry guys, just blame it all on Fox Soccer",1369515651.0,8,,Soccer,3,N
"Hopefully Weidenfeller gets a lot more praises because of his performance tonight,he really is a really really underrated keeper.",1369517167.0,3,,Soccer,3,N
Kind of unrelated but all said and done would you have preferred keeping Robben or do you think shipping him out in 2009 was the right call for your team?,1369518722.0,3,,Soccer,3,N
"Neuer is very great but also very cocky. His attitude usually works out because he is in fact a brilliant GK but his cockyness irks me, a lot.

There's also usually one game at least once per season where the old adage confident - careless - cocky - dead becomes true and he royally fucks up a safe just because he needed to be fancy and it backfires.

Might not be a problem if it's just in a national team friendly aginst Khasachstan where the resulting goal doesn't really matter but his cockyness often get's the better of him.",1369522857.0,2,,Soccer,3,N
deleted  ^^^^^^^^^^^^^^^^0.5379  [^^^What ^^^is ^^^this?](https://pastebin.com/FcrFs94k/15244),1369518978.0,2,,Soccer,3,N
"Best keeper in the world. He showed why he isnt to be toted with, lots of point blank reaction saves. ",1369536080.0,2,,Soccer,3,N
Dante also wasn't a cunt about it after the foul. He calmed down. I think that's why he didn't get booked again. ,1369519187.0,5,:USA:,Soccer,3,N
Fuck that.  If someone deserves a red than you are altering the outcome by NOT giving it.,1369516430.0,14,:Liverpool:,Soccer,3,N
That deserved a yellow for me. He should have been off I feel. ,1369521540.0,3,:Rochester_Rhinos:,Soccer,3,N
"It shouldn't matter if it's a final, it's a yellow and that's the rule. There aren't exceptions just because it's a final, why would there be? 

Quit complaining about downvotes",1369533264.0,-1,:Chelsea:,Soccer,3,N
"I think the first yellow was a bit harsh. Maybe the ref was thinking the same. Anyway, terrible ref.",1369516338.0,4,,Soccer,3,N
It's actually the fox sports theme. They play it for every game on fox regardless of the sport.,1369516631.0,22,,Soccer,3,N
"Well it is *football* 


-Some Fox douche nozzle 
",1369515723.0,5,,Soccer,3,N
Stupid Fox some years ago decided they'd get rid of all their better music from the other sports (particularly the MLB one) and create some stupid pointless unified front where the NFL theme became the Fox Sports.  Worst decision ever.,1369516775.0,2,:Wigan_Athletic:,Soccer,3,N
"embarassing. NBC has iconic music for each event of their's, sunday night football, us open, olympics, and FOX uses the same music for EVERY event. EVERY SINGLE ONE. kind of a joke",1369516861.0,1,:Tottenham_Hotspur:,Soccer,3,N
Give it back :(,1369540319.0,-1,:Chelsea:,Soccer,3,N
"I thought the same for Subotic, but decided it was only fair considering what happened with Dante",1369514722.0,-14,,Soccer,3,N
We were champions...once :(,1369540298.0,1,:Chelsea:,Soccer,3,N
But there'll be hell to pay if so much as a drop of alcohol gets within ten feet of him.,1369520177.0,5,:Columbus_Crew:,Soccer,3,N
Stay classy Bunny_killer.,1369535676.0,-4,,Soccer,3,N
"Some poor bastard drunkenly bet a week's wages on BVB. Ouch.

http://www.reddit.com/r/soccer/comments/1f103x/prematch_thread_borussia_dortmund_vs_bayern/ca5r1g1",1369515542.0,1,,Soccer,3,N
Lewandowski played fantastically. What game were you watching?,1369532962.0,1,:Chelsea:,Soccer,3,N
"after the replay, it was clear that Neuer would have caught it.",1369546791.0,1,,Soccer,3,N
"Not to mention the fact that he blew a 1v1 in the World Cup final too...

He's been through a lot.",1369516833.0,5,:r_soccer_user:,Soccer,3,N
Mou wasn't Chelsea's manager last year in the CL,1369517973.0,-1,,Soccer,3,N
It'll be interesting to see if Pep can keep the dominance! ,1369522844.0,2,:FC_Barcelona:,Soccer,3,N
I thought that song seemed familiar but out of place.,1369528349.0,2,,Soccer,3,N
Martinez and Alaba are absolutely class. Going to love watching them in the coming years. ,1369516474.0,3,,Soccer,3,N
All of Bayern works hard. I think you could've paid attention to any player and think they did a great job.,1369516700.0,2,:FC_Twente:,Soccer,3,N
Best 40m ever. ,1369515557.0,3,:r_soccer_user:,Soccer,3,N
Lahm was all over the field today too. ,1369515498.0,3,:Bayern_Munich:,Soccer,3,1F
"It took him a few games to get comfortable with our squad, but he has definitely proven himself worthy of every penny since then. ",1369522207.0,1,:Bayern_Munich:,Soccer,3,1F
Good. We get money because judas won the CL.,1369527087.0,4,:FC_Schalke_04:,Soccer,3,N
"Always the way, which is why I don't like to do bets like that, I'd rather do like £10 on Bayern to win @ 5/6 than the bet you just done.

Because you won but you're gutted as you didn't do more, and then if you lose you're gutted because, well, you lost!
",1369518377.0,1,:Liverpool:,Soccer,3,N
"He hit him in the face first then stepped on his ankle. I just chalk that up to rivalry hate. Was a bit dirty, but I look past it. All part of an awesome rivalry.",1369515737.0,8,,Soccer,3,N
"Arsenal? 

^A ^man ^can ^dream, ^can't ^he?",1369516124.0,6,,Soccer,3,N
This is a pattern I can get behind,1369532889.0,3,:Chelsea:,Soccer,3,N
"France?

PSG?

",1369520295.0,1,,Soccer,3,N
"Don't mind Leed United winning it.

Edit: *I wouldn't mind ... thank you beer.",1369516080.0,0,,Soccer,3,N
Sorry. Can't keep up with all the classy lads you have.,1369525337.0,2,,Soccer,3,N
Yeah that's what my parents said too. Some great cunting by Ribery ,1369515024.0,20,,Soccer,3,N
"That says a lot about Bayern, then. Players foul when they get beat. No player fouls when they can cleanly dispossess another player on the ball. ",1369519560.0,2,,Soccer,3,N
"yea, that and almost everything else.",1369518637.0,1,,Soccer,3,N
"A. Because that really decided the game.

B. Happened sooooooooooo often...",1369516145.0,1,,Soccer,3,N
American Dortmund fans crack me up. ,1369515903.0,-2,:Blackburn_Rovers:,Soccer,3,N
"Red team is just way better ~~at falling~~

FTFY",1369532559.0,0,,Soccer,3,N
And dante for that cleats to chest ,1369515044.0,1,,Soccer,3,N
oh please. a yellow would have sufficed. no one wanted to see a red for that especially that early in the match. players lash out like that sometimes without punishment. no excuses. bayern took their chances and dortmund didnt.,1369515529.0,0,,Soccer,3,N
I've only seen five or so games from Dortmund this season but damnit Subotic has looked hotter than Hummels!,1369523144.0,2,:FC_Barcelona:,Soccer,3,N
"I do like hime, but people think he is so amazing because he is always sliding in to save the day so he looks amazing. The thing is that he's always coming in at the last second because he was slightly out of position to begin with.",1369538024.0,1,,Soccer,3,N
"To be fair, he constantly has injury troubles this year. Last year he was immense though. ",1369541219.0,1,,Soccer,3,N
[deleted],1369514509.0,-2,,Soccer,3,N
"It matters. Rules are rules and the ref officially has no discretion. A called penalty is an automatic yellow, Ribery should have been carded for the dive and the elbow to the face and Lewandowski should have been shown red for stepping on Boateng's ankle at least.

Both challenges vs. Müller were outside of the box btw. but I agree that he should have gotten at least one yellow for that.

It was a great game nonetheless but the refereeing was pretty bad and I hate it that the UEFA always pretends that the rules matter and should be enforced just to give out unofficial recommendations to the refs before important games because they are afraid to offend viewers or affect ratings.

I agree that refs should have the freedom to decide on a situation by situation basis but nothing stops the UEFA from adapting the rules to allow for just that.

As it stands the ref's call was against the rules and people aren't haters just for pointing that out.

If the ref had exercised more control over the game and actually enforced UEFA's rules he would pretty much  have had to send Ribery, Dante and Lewandowski off the pitch for their conduct.

This doesn't change even if the game turned out to be brilliant despite that",1369524114.0,-3,,Soccer,3,N
"Ribery should have been sent off, no doubt about it. But after that it would have become a completely different match, in which Lewandowski never stomps on Boateng's ankle, and Dante never commits a foul in the match.

The ref was terrible, and Dortmund should have had the majority. What would have happened after, no one knows. Maybe Bayern humiliates Dortmund through counter attacks.",1369520654.0,-4,,Soccer,3,N
"I know and lets not remember what happened to Benfica,the image of the manager dropping to his knees still hasn't gotten out of my head.",1369517062.0,1,,Soccer,3,N
I also would like to know this.,1369528321.0,1,,Soccer,3,N
"I would give MOTM to Neuer over Robben, for Bayern.  He just as well kept Bayern in the game as Weidenfeller did.  He stopped shots, and routinely in this game, that only a handful of other goalkeepers would've consistently been able to pull off at this level of football.",1369517852.0,3,,Soccer,3,N
"Don't forget Martinez. He dominated defensive midfield once again, flawless. ",1369521228.0,2,:Germany:,Soccer,3,N
"LOVED Alaba, he played a fantastic game.",1369537925.0,1,,Soccer,3,N
He looked damned worried. Looked like he cheered for BvB,1369522889.0,1,:FC_Barcelona:,Soccer,3,N
"Yanks 
¯\_(ツ)_/¯",1369516707.0,3,:Virginia_Beach_City_FC:,Soccer,3,N
[deleted],1369520291.0,3,,Soccer,3,N
No Dante and Ribery should have gotten the reds.,1369514677.0,-3,,Soccer,3,N
It's not his last game ever. He will be out for about 5 months.,1369517104.0,2,,Soccer,3,N
Aww...this is actually really sad.,1369516511.0,1,:r_soccer_user:,Soccer,3,N
"It was probably out of view of the referee, but most importantly it was obviously unitentional.  A second yellow, i.e. a red, requires some degree of malice and Dante had none in his mistake. ",1369517218.0,3,,Soccer,3,N
He really should have and it would have changed the game completely.Also the only reason I think he should have been sent off was because he fouled Reus inside the box.,1369516917.0,3,,Soccer,3,N
Same for Dortmund. ,1369516755.0,1,,Soccer,3,N
"10 after the Ribery elbow, 9 after that penalty. Lewandowski also had the stomp on Boateng but don't think the ref saw it. Fuck Boateng tho.",1369516206.0,-2,:Chelsea:,Soccer,3,N
take a selfie when you lift the trophy?,1369515105.0,2,,Soccer,3,N
"It's pitiful whenever any player does it - why should we turn a blind eye on your favorite club? Let's condemn it wherever it raises its ugly head. It deserves no place in modern football, and when Bayern does it, let's condemn it as loudly as we should when any other team commits the same acts. ",1369522729.0,2,,Soccer,3,N
So do you agree Dante deserved a second yellow and Ribery deserved some punishment for that elbow? Deliberate elbows can be a direct red. Referee seemed a little biased but then again I was supporting Dortmund. ,1369515775.0,1,:Manchester_City:,Soccer,3,N
"Why are they hateable ? When they're losing, they don't become assholes like Barcelona. Sure they buy top players from other teams, but what top team doesn't ?",1369514941.0,1,,Soccer,3,N
"The age of Germans is coming,and so far the Spanish aren't too happy.",1369515656.0,1,,Soccer,3,N
"I was neutral at the start of the match, but it seemed like a Bayern player was on the ground every two minutes.",1369517663.0,-1,,Soccer,3,N
It's the German way,1369514475.0,0,,Soccer,3,N
"I think I'll be calling them Bryan Munich from now on.

Also, my condolences on the loss. I really wanted your lot to win. :(",1369516231.0,2,,Soccer,3,N
problem is they may lose Lewandoski and Reus on top of Gotze. ,1369515841.0,1,,Soccer,3,N
THIS.,1369516976.0,-1,,Soccer,3,N
Why should that be an unpopular opinion? Everyone with just a bit if football knowledge knows that both players should have been send off. ,1369518532.0,1,:VfB_Stuttgart:,Soccer,3,N
He may have minimized the harm of his foul. But it was a foul. He deserved a second yellow(not a straight red for it).,1369515782.0,3,,Soccer,3,N
It's super effective!,1369523165.0,1,,Soccer,3,N
Right + wrong?,1369516719.0,1,,Soccer,3,N
You could argue that it was their fifth. Only Real (9) and Milan (7) have won this cup more often. The cup only got renamed in the 90s.,1369520266.0,2,:Germany:,Soccer,3,N
Paul Breitner and Lars Ricken if I am not mistaken.,1369515645.0,3,,Soccer,3,N
"one was Paul Breitner... the one with silver hair... former bayern player, so I guess the other is some sort of Dortmund Legend",1369515360.0,2,,Soccer,3,N
Shame our team was too busy loosing after leading 3-0 to City in America this time round. :(,1369518116.0,2,:Chelsea:,Soccer,3,N
"as a neutral my heart was pumping after the Robben goal, both you and Dortmund made it really hard to stay neutral, I just wanted to celebrate for someone after such a good game",1369519740.0,1,,Soccer,3,N
"I was neutral. More or less. I just wanted it so badly for Schweinsteiger. Still couldn't sleep last night. Finally, finally we don't have to talk about if our 2006 generation can win a big international title. Next step: Winning something with the national team - together with the new generation that is emerging in Munich and Dortmund",1369520190.0,1,,Soccer,3,N
"The latter. Dortmund is that good.

However, a second factor might have come into play: The fear of losing it. Honestly, that was one of worst performances of Bayern München I have seen recently.",1369537556.0,2,,Soccer,3,N
"We played our hearts out, the most you can ask of Dortmund.",1369515099.0,4,,Soccer,3,N
I'm just surprised he didn't send Dante off!,1369514694.0,1,,Soccer,3,N
Did you fuck him afterwards?,1369515444.0,2,,Soccer,3,N
So should have Lewandowski though too,1369529922.0,2,,Soccer,3,N
The elbow to get someone off of him? Don't think so...,1369538051.0,0,,Soccer,3,N
Don't we all!,1369517370.0,2,:Rangers:,Soccer,3,N
Relevant username,1369520055.0,0,,Soccer,3,N
He should have never gotten the first one though. That yellow was too harsh.,1369519903.0,3,:Germany:,Soccer,3,N
