text,time,upvote,flair
"Please please end 3-0

Give us the worst superbowl ever",1549245062.0,16,
I'm elbow deep in this onion dip,1549245162.0,16,
Puntbowl,1549245334.0,16,:49ers: 49ers
"McVay's got a fake punt in him. He's already done so many normal ones this game, a fake is imminent.",1549245355.0,15,
A 12B is not gonna be a manager making 100k lmao,1549245373.0,17,:Patriots: Patriots
My expert analysis leads me to believe that the Rams aren’t playing very well. ,1549245538.0,16,:Bears: Bears
Brady at the sidelines praying to the devil. ,1549245687.0,16,:Bears: Bears
[deleted],1549245733.0,16,
BRADY MODE ACTIVATED,1549245844.0,15,
My stream is 7 seconds behind the reddit comments fml,1549245845.0,15,
SCORING SPREE,1549245851.0,16,:Raiders: Raiders
This dog of a game is absolutely wasted on Jim Nantz.  Al Michaels would be roasting everyone and find a way to blame it on Goodell.,1549246071.0,16,:Texans: Texans
SB LIII: Battle of the Legs,1549246073.0,16,:Cowboys: Cowboys
Tony Romo is the best part of this Superbowl ,1549246157.0,16,
Oh good reddit is breaking again. ,1549246271.0,16,:Seahawks: Seahawks
"We're going to get to the end of this crap and then.....

""You think this is a garbage game, but, it's actually a Tide commercial!""",1549246276.0,15,:Saints: Saints
CBS is making me cringe,1549246309.0,17,
I don't have the desire to watch a single show on CBS other than football,1549246329.0,17,:Patriots: Patriots
CBS has more commercials for its own network.,1549246339.0,17,:Dolphins: Dolphins
3-3 at the end of the 3rd in Super Bowl 53 on February 3rd,1549246374.0,15,:Bears: Bears
When will I be old enough to like CBS comedies?,1549246402.0,16,:Falcons: Falcons
#make super bowl ads funny again,1549246430.0,17,
The punter battle is real,1549246468.0,15,:Patriots: Patriots
Sean Payton watching these offenses and injecting Ben & Jerry's into his veins.,1549246606.0,16,:NFL: NFL
[deleted],1549246619.0,17,
Can't even fumble properly FFS ,1549246720.0,17,
Owen is the man!,1549246774.0,14,:Eagles: Eagles
"I think it's time to end stereotypes

After all it's [current year]

Let's give the SB MVP award to the punter!

Both punters are superb today ",1549246801.0,16,:Buccaneers: Buccaneers
"I feel like Goff jumping early isn't getting enough press

That is next level incompetence",1549246823.0,15,
Bud light should start using the ingredients of their competitors. It would help.,1549246828.0,18,
Weathertech cup phone.  So you can FaceTime and drive with ease!,1549246855.0,16,
When both punters have a legitimate chance at MVP...,1549247033.0,15,:Rams: Rams
"""You could do anything"" - Tony Romo

Damn, thanks Tony, thank you for believing in me.

*cries*",1549247129.0,16,:Vikings: Vikings
What's the reasoning behind running a hand-off on 3rd & 23...? ,1549247286.0,15,:Giants: Giants
BK is probably the best fast food place to work at because its always dead,1549247298.0,16,:Raiders: Raiders
Someone at BK needs to lay off the drugs,1549247304.0,18,:Eagles: Eagles
I made buffalo chicken dip for this shit?,1549247309.0,16,
Gladys Knight really regrets taking that midnight train to Georgia right about now.  ,1549247333.0,14,:Vikings: Vikings
"If the Rams win, I will claim to do something crazy and not do it ",1549247371.0,18,:Eagles: Eagles
"Thank God the Big Bang Theory is finally ending, so I won't have to hear my parents talk about it every time I see them.",1549247435.0,15,
I haven't seen a td in so long,1549247591.0,17,:Vikings: Vikings
What happens when you get in the end zone again? I forgot.,1549247595.0,16,:49ers: 49ers
"This game isn’t that bad, I sat through the entire Seahawks/Broncos Super Bowl. ",1549247599.0,17,
Can we have a full time Gisele cam? ,1549247602.0,18,:Packers: Packers
"Ok, so, it was a boring game that had an undetermined outcome and now it's a boring game that has a pretty certain outcome.

Blech.",1549247605.0,16,:Packers: Packers
That's game. Goff can't do shit,1549247609.0,16,:Buccaneers: Buccaneers
Damn. I really wanted a 3-3 overtime. That would have been so exciting. ,1549247613.0,18,:Broncos: Broncos
That's game. ,1549247613.0,14,:Colts: Colts
"""Okay, let's start playing now"" - BB",1549247645.0,15,
If I just sat through the most boring ass Super Bowl in history only to watch the Pats win YET ANOTHER RING in a 10-3 game I will fucking riot. ,1549247662.0,17,:Steelers: Steelers
was that Princess Leia's dog? ,1549247727.0,16,:Chiefs: Chiefs
Don’t forget to vote Goff for Patriots MVP,1549247768.0,16,
If Goff doesnt score here its a wrap. They arent getting that ball back,1549247795.0,16,
It would take the Rams 14 more hours and 9 more maroon 5s to score 7 more points ,1549247804.0,16,:Rams: Rams
"Rams big mistake is trying to ""trick"" the Pats by still playing Gurley

Bench him. He's hurt.",1549247929.0,17,:49ers: 49ers
Gilmore such a stud,1549248075.0,14,
Jared Goof.,1549248097.0,16,:Broncos: Broncos
"Yay, we are giving little girls concussions now too. 

Equality has truly arrived",1549248209.0,16,:Eagles: Eagles
"That INT was half on Goff, half on the WR. You gotta look back for the ball, fam. ",1549248228.0,16,
You’re supposed to throw it to the guys on your team. ,1549248300.0,16,:Saints: Saints
GOFF IS PATS MVP,1549248347.0,17,:Chargers: Chargers
At this point I don’t want anymore points so it will be the lowest scoring super bowl ever. That way there is some sort of noteworthiness to the game ,1549248354.0,16,:Falcons: Falcons
That shot of the Rams dude just hanging his head really sums it up. Looking forward to that gif.,1549248392.0,16,
Sleepy Bowl.,1549248570.0,17,:Titans: Titans
The real climax of the playoffs season was definitely the ending to Saints/Rams. There are at least ramifications for the future to take from that.,1549248645.0,17,
"""WHAT THE FUCK IS GOING ON""",1549248720.0,17,:Bears: Bears
"The Patriots defense held the Rams to 3 points with Chung missing half the game.

Think about that.",1549249190.0,17,
Goff throwing like that one white girl in a high school gym class,1549249300.0,14,
3 points. Pathetic. ,1549249459.0,14,:Falcons: Falcons
lol what a way to end it.,1549249504.0,18,:NFL: NFL :NFL: NFL
The people who boycotted this game had a point ,1549249540.0,17,
damn they are swarming him,1549249586.0,14,:Eagles: Eagles :Bengals: Bengals
This is the worst timeline ,1549249652.0,17,:Colts: Colts
God dam the journalists are embarrassing themselves ,1549249660.0,16,
"""JESUS ARE YOU OKAY""",1549249690.0,14,
We can hear everything and also fuck the media,1549249701.0,17,:Giants: Giants
I have not seen such a postgame shit show. ,1549249716.0,16,:Patriots: Patriots
This was like getting a root canal at the dentist,1549249733.0,16,:Vikings: Vikings
Maybe time to rethink how many people ger onto the field. Pretty crazy. ,1549249772.0,16,
"Lol Rip Gronks interview, we know somewhere when the camera left in there he had to get cut off to stop

That was 2 minutes of disaster",1549249898.0,15,
See you next year Pats! ,1549250958.0,16,
Hopefully the Patriots beating the LOS ANGELES rams signifies that their dynasty is neatly over where it started ,1549251001.0,16,:NFL: NFL
Ok seriously though why is Gurley not playing hardly at all.,1549255804.0,16,
Is this the point of the game when we sub in the Chiefs and Saints? ,1549242277.0,31,:Chiefs: Chiefs
"Reddit: The servers die every year during the Super Bowl, maybe we should prepare for it.

< *Doesn't prepare for it* >

Reddit: https://i.imgur.com/FYHgcpb.jpg",1549243931.0,33,:Eagles: Eagles :Eagles: Eagles
That Netflix nature doc has me more hyped than anything else I've seen today,1549244764.0,35,
[Another reminder that Verizon throttled data for wildfire firefighters in California](https://arstechnica.com/tech-policy/2018/08/verizon-throttled-fire-departments-unlimited-data-during-calif-wildfire/),1549245010.0,32,:Seahawks: Seahawks
 Verizon throttled Fire Department's 'Unlimited' data during Calif. Wildfire,1549245107.0,30,
Don’t let this defensive slugfest distract you from the fact they only showed Spongebob for 2 seconds ,1549245897.0,36,
Question: Who the heck is winning MVP? The punter of the winning side?,1549246272.0,32,
"White people and black people living in the SAME neighborhood? What a crazy idea!

It's 2019, guys. Not 1964

Also, is saying ""the blacks"" allowed on TV?",1549246332.0,30,:Eagles: Eagles
"I skipped a few Super Bowl parties because I actually wanted to watch the football, lol fuck me.",1549247284.0,31,:Vikings: Vikings
So my civ 6 game I have been playing during this game has been going well!,1549247516.0,32,:Bears: Bears
See you guys next year lol,1549248077.0,34,:Chargers: Chargers
ASMR fans are freaking ,1549248168.0,30,:NFL: NFL
[deleted],1549248399.0,31,
Fuck. I haven't been this upset since the nfl half time show snubbed sweet victory ,1549248575.0,34,:NFL: NFL
[deleted],1549248740.0,32,
Refs didn't explain WTF went on lol.,1549248765.0,33,:49ers: 49ers
"Fucking embarrassing lmao, they gotta organize this better",1549249653.0,33,:Patriots: Patriots
"Drew Brees throwing pizza at TV.."" I could've hung more than 3 points on New England throwing in the opposite direction!”

Edit 1: holy shit was my grammar bad with the first effort",1549254456.0,32,
I still don’t understand why I’m supposed to care if a cheap beer has corn syrup or not.,1549245990.0,47,
Fuck ASMR commercials wtf 2019 ,1549248121.0,60,:Vikings: Vikings
Why even play the game?  Just let Romo call plays and results like some kind of dungeon master.,1549245687.0,29,:Bills: Bills
Can I just say that a KC vs NO super bowl would have been wayyy more interesting ,1549246461.0,30,:Chiefs: Chiefs
The Saints curse for a shit game is working really well,1549246761.0,31,
That assistive gamepad from Microsoft is genuinely a super fucking cool thing.,1549246920.0,33,:Steelers: Steelers
"This is the government shutdowns of Super Bowls. No one wanted it, and now that it’s happening it just won’t end. ",1549247131.0,32,:Steelers: Steelers
Why in the flying fuck would you try to run it on 3rd and 22?!,1549247240.0,34,:Eagles: Eagles
That commercial made me not want burger king 🤢,1549247271.0,30,:49ers: 49ers
"Maroon 5, Pats 10, Rams 3",1549247903.0,44,:Saints: Saints
"* Verizon commercial? ❌Nah
* BK commercial? 🤔No thanks 
* Bud light? ✋🏻Ehh I’m alright 
* Salmon sisters? 👩‍❤️‍👩🐟💦you fucking betcha mate ⛵️🐟",1549248132.0,42,:Cowboys: Cowboys
Stop trying to make ASMR mainstream ,1549248149.0,47,:Bears: Bears
r/nfl back on suicide watch ,1549248768.0,41,:Bengals: Bengals :Giants: Giants
Maroon 5 SOILED IT,1549252221.0,44,
America loses. ,1549247616.0,67,:Ravens: Ravens
"Okay, that controller is pretty cool. Nice job Microsoft.",1549246840.0,42,:Seahawks: Seahawks
This super bowl feels so weird. It’s like unsettling almost idk.,1549249869.0,44,
"I thought that the halftime show would make this super bowl better, but they won’t even do sweet victory. That song was the only reason the halftime show would ever be good.",1549242865.0,16,
"Sicko mode    ✅    
~~spongebob~~    
**1/2 of the meme team**",1549242903.0,17,:Eagles: Eagles
Feeling like a real Squidward right now ,1549242959.0,14,:NFL: NFL
[deleted],1549243054.0,16,
They killed like 29 squirrels for that coat ,1549243063.0,14,:Bears: Bears
Don't hire rappers that you'll have to censor on national TV.,1549243072.0,16,:Lions: Lions
"ATL HOE

(NO BLEEPS)",1549243103.0,16,:Browns: Browns
I regret missing the birth of my first child for this game.,1549243104.0,16,:Raiders: Raiders
"Okay, it went from alright to REALLY BAD.",1549243224.0,15,
Prince died for this shit.,1549243225.0,16,:Seahawks: Seahawks
[deleted],1549243330.0,14,
Adam Levine should be tried for war crimes for his snub of sweet victory ,1549243331.0,16,:Vikings: Vikings
Not enough spongebob. ,1549243351.0,13,:Packers: Packers
BOYS WE GOT JEBAITED BY THE NFL,1549243377.0,13,:Falcons: Falcons
Thats it? You play the whole sweet victory or dont show it at all. It was so dumb.,1549243439.0,15,:Cowboys: Cowboys
"I was so excited about seeing SpongeBob I thought my life would have meaning once more a sweet catharsis of years of wandering in the desert thirsty for memories of bikini bottom to cure me from the trials and tribulations of a lonely adulthood. 

Fuck the NFL.",1549243440.0,17,:Seahawks: Seahawks
"This feels like one of those Thursday Night games nobody gives a fuck about, but watched because it’s football and we’re addicted.",1549243494.0,14,:Seahawks: Seahawks
Shoulda been Outkast for halftime,1549243529.0,15,:Raiders: Raiders
https://m.imgur.com/jhoe9n6,1549243653.0,15,
"It’s up to Romo to salvage this game. Give the fans what they want.

 #Romodamus",1549243781.0,15,:Lions: Lions
What the ever loving fuck is Goff looking at,1549243853.0,15,:Falcons: Falcons
lol reddit is crashing hard,1549243956.0,14,:Raiders: Raiders :Eagles: Eagles
This commercial makes me want to kill myself. ,1549244052.0,14,:Eagles: Eagles
The Korean car company makes a Colorado named SUV in Georgia?  cool.,1549244069.0,15,:Vikings: Vikings
Thank Davé,1549244098.0,15,
Booblay,1549244111.0,15,:Dolphins: Dolphins
Kia's advertisement for end stage capitalism was amazing. ,1549244119.0,15,:Vikings: Vikings
This is arguably the worst year for commercials. They're basically just everyday commercials except longer,1549244143.0,15,
PERFORMED WITH AFTERMARKET SNORKEL,1549244163.0,16,:Patriots: Patriots
"My roommate’s girlfriend : “Oh he’s walking, he’s fine!”",1549244245.0,14,:Bengals: Bengals
the Best commercial tonight was the Banquet Football fumbleroosky ad for 100 years of NFL.,1549244323.0,15,:Falcons: Falcons
If the Patriots wins Edelman deserves the MVP big time.,1549244428.0,17,:Broncos: Broncos
nerf Edelman,1549244441.0,14,:Buccaneers: Buccaneers
PI WTF,1549244551.0,16,:Cowboys: Cowboys
They stole that fake text conversation. Saw it on Reddit a while ago.,1549244621.0,16,:Patriots: Patriots
What’s with all the robot commercials,1549244697.0,15,:Giants: Giants
"So far this Super Bowl's been pretty bad.  Anemic offenses, A horrible half-time show not even counting the SpongeBob tease.  Fairly average commercials.  Just not very good.",1549244730.0,14,:Seahawks: Seahawks
More puppies. Less robots.,1549244741.0,14,
I swear every commercial is about robots ,1549244754.0,16,
OH MY GOD RAMS IS FUCKING SHITE THERE I SAID IT ,1549244841.0,15,
Hekker goat,1549244893.0,13,
Hekker for MVP,1549244898.0,14,:Texans: Texans
Goff is making me irrationally angry now! Jesus fucking Christ! ,1549244912.0,14,:Eagles: Eagles
Hekker the clear MVP,1549244929.0,14,:Broncos: Broncos
"Call me crazy, but if the Rams manage to win, Hekker gets MVP
",1549244958.0,16,:Patriots: Patriots
I'm gonna lmao if the pats win 3-0,1549244961.0,15,:49ers: 49ers
Verizon: “We saved your fucking life. You’re welcome.”,1549244978.0,15,:Saints: Saints
Nantz just openly shitting on the game. ,1549244988.0,14,
"Keys to the Pats winning this game

1. Make Goff pass
2. Eh, #1 should be enough, just be at least below average on offense",1549244991.0,17,:49ers: 49ers
"ughhhhhh maroon 5, patriots, ""okurr"" i can't take anymore please just end this telecast

",1549245059.0,14,:Dolphins: Dolphins
I feel bad for everyone who bet over on the 55 ,1549245063.0,16,:Giants: Giants
McVay just do what Alabama did and switch QB's. They are 2-0 in games at Mercedes Benz Stadium using that game plan ,1549245083.0,13,:NFL: NFL
Super Lull 53,1549245116.0,14,
Is there any way to fast forward live stream? /s,1549245198.0,15,
This game is legit gonna end with less than 10 pts ,1549245261.0,16,:Eagles: Eagles
MORE PUNTING!!!!,1549245265.0,14,
I blame Maroon 5 for this atrociously bad super bowl ,1549245298.0,15,:Buccaneers: Buccaneers
This game sucks,1549245318.0,16,:Bears: Bears
is that jim from the office?,1549245319.0,14,
"Hey, what's another group we can mine to sell our products?

Veterans?

Genius!!!",1549245414.0,15,:Packers: Packers
FIRST DOWN!!!,1549245457.0,15,:Eagles: Eagles
JARED GOFF 3RD DOWN CONVERSION????!!!!!,1549245618.0,15,:49ers: 49ers
"Playing offense? 

Bold strategy, Cotton...",1549245628.0,15,:Colts: Colts
INB4 30+ points scored in the fourth Q,1549245659.0,15,:Packers: Packers
Brilliant defensive play.,1549245750.0,16,:Packers: Packers
That may end up being the defensive play of the game.,1549245753.0,14,:Broncos: Broncos
Now this is pod racing,1549245864.0,15,:NFL: NFL
If the rams win hekker deseres the mvp for pinning the pats balls deep every time,1549245867.0,15,
"Man, what a barn burner.",1549245894.0,15,:Packers: Packers
Imagine running into Tony Romo wearing sketchers ,1549245947.0,16,:Browns: Browns
"Son of a bitch.  The music and shot of stars, made me think it was going to be an Episode IX promo.",1549245977.0,15,:49ers: 49ers
I thought they killed off the whole Bud Light Cinematic Universe in the first half,1549246060.0,16,:Patriots: Patriots :Jaguars: Jaguars
Lmao Romo hating on kickers,1549246073.0,16,:Cardinals: Cardinals
These medieval barbers are very calm considering their kingdom's senior leadership has just been burned to a crisp,1549246077.0,14,:Ravens: Ravens
Plays of plus 4+ yards feel like 40 yard plays this game lol,1549246191.0,13,
3 - 3 after 3,1549246225.0,15,:49ers: 49ers
"Through 3 quarters, neither team has even made the red zone, let alone the end zone",1549246251.0,14,:Packers: Packers :Packers: Packers
So what happens to the bets on which team scores the first touchdown if there isn't a touchdown scored at all?,1549246252.0,13,:Colts: Colts
What’s the over/under on this game? The over people must be on life support. ,1549246276.0,16,
Man that is a well painted field. ,1549246519.0,16,
Did gurley fuck mcvays gf??,1549246576.0,15,
Wow dodged a fucking bullet. ,1549246616.0,14,:Lions: Lions :Jaguars: Jaguars
Longest punt of all time and lowest score after third really tells the whole story of this game. ,1549246645.0,15,
"McVay is just setting us all up for a last minute fake punt, and Bill's respect for special teams will let them score out of honor.",1549246724.0,16,:Falcons: Falcons
“I talked to Sean on the sideline and he totally fucking bullshitted me.”,1549246732.0,14,
[deleted],1549246809.0,15,
"I LOVE VIDEO GAMES, MY FRIENDS, MY FAMILY, AND FUCKING PUNTING EVERY 45 SECONDS",1549246822.0,15,:Panthers: Panthers
Imagine paying like 10 grand to go to this game,1549246854.0,14,:Seahawks: Seahawks
Do people really care if their beer has corn syrup?,1549246862.0,16,
The punter of the winning team should be the MVP,1549246862.0,15,:Jets: Jets
The [MVP ballot](https://www.nfl.com/super-bowl/mvp-vote) doesn't list Hekker or Allen as options. Greg Zuerlein is the next best option.,1549246877.0,15,
Prediction: 5-3 Rams in OT.  Suh gets the walk-off safety.,1549246891.0,15,:Packers: Packers
"What beers use corn syrup? Like seriously Bud Light's problem is that it sucks, not that we don't know what it's made from... ",1549246899.0,15,:Bears: Bears
I'm disappointed by the flag because I wanted to see some more of that excellent punting.,1549246954.0,14,:Dolphins: Dolphins
This should be officially named the punt bowl,1549247000.0,14,:Eagles: Eagles
Gotta make up for the Patriots flag. ,1549247074.0,14,:Eagles: Eagles
Goff wasn’t looking downfield at all...,1549247116.0,15,
"Throw the ball away, maybe?",1549247162.0,13,:Eagles: Eagles
He was still inbounds,1549247191.0,16,:Texans: Texans
"Oh, that was wide fucking open",1549247195.0,15,:Eagles: Eagles
Anybody know the betting odds on this being the lowest scoring super bowl?,1549247225.0,15,:Packers: Packers
Fourth quarter of the Super Bowl and you just run the ball on third and long?,1549247251.0,15,:Packers: Packers
Hey look it’s the OG ReportOfTheWeek,1549247277.0,14,:Giants: Giants
Is that ReviewBrah’s dad?,1549247306.0,15,:Buccaneers: Buccaneers
[deleted],1549247329.0,15,
"I know I'm wasting my time watching but I can't stop
",1549247335.0,14,:Jets: Jets
[deleted],1549247563.0,15,
Wow a td,1549247578.0,16,
how is gronk still alive,1549247591.0,14,:Texans: Texans
Guys nobody vote for MVP until they add Ryan Allen as the choice ,1549247859.0,16,:NFL: NFL
[removed],1549247954.0,16,
Where was this Patriots Defense during the regular season?,1549248099.0,17,
"Good punt Jared, nailed them inside the five",1549248106.0,16,:Seahawks: Seahawks
Goff you fucking idiot,1549248149.0,16,
*whispers* My piss. So pure. You can taste it.,1549248177.0,14,:Lions: Lions
Hello Darkness My Old Friend... ,1549248313.0,14,:Vikings: Vikings
Hm I think I don’t like the pats ,1549248337.0,14,:Cowboys: Cowboys
Yeah thats a super blatant call.,1549248392.0,17,:Bears: Bears
"""Worse case Ontario"" - Tony Romo, after a few beers",1549248446.0,16,:Steelers: Steelers
Goff looks like a deer in headlights out there. Got Brady lookin like Mufasa.,1549248563.0,14,
"I really want the punter to win MVP, but it’ll be Edelman ",1549248579.0,13,
Exciting season we had this year and it ends up with a patriots win. Fucking trash ,1549248677.0,14,:Vikings: Vikings
Imagine lucking out into the super bowl and shitting the bed this bad... Lol.,1549248694.0,16,
A Microsoft Surface Pro is about to get tossed by BB,1549248722.0,13,:Bills: Bills
"Bill yelling "" I wanna know what the fuck is going on"" lol",1549248724.0,15,:Browns: Browns
Accepting moves it out of field goal range. ,1549248760.0,16,:Bears: Bears
"I want the game to end on a series of kneel downs, cuz fuck this season",1549248834.0,14,:Packers: Packers
What a boring super bowl for Tony Romo to call,1549248965.0,15,:Cowboys: Cowboys
Guess only the NFCE can get it done,1549248976.0,15,
He hit the ground short,1549248986.0,14,:Packers: Packers :NFL: NFL
Why don’t they just kick a field goal and end this?,1549249031.0,15,:Colts: Colts
I'm actually fed up with this sport. ,1549249157.0,14,:Packers: Packers
I hope the African children enjoy their Rams hats at least.,1549249232.0,13,
Whole game they scored 3 like wtf,1549249261.0,16,:Ravens: Ravens
Commentators calling the Pats underdogs is a bunch of bullshit. Everyone knew the Pats were the better team,1549249321.0,15,:Chiefs: Chiefs
Goff is garbage ,1549249323.0,15,:Eagles: Eagles
this feels like a really shitty midseason MNF game,1549249374.0,15,:Dolphins: Dolphins
Hoyer the destroyer another ring 😭😭,1549249473.0,15,
That really sums it up,1549249518.0,14,:49ers: 49ers
Louisiana fans doing the big bad evil guy hand rub right now ,1549249576.0,15,
god the photographers are assholes,1549249651.0,15,
Holy fuck they’re vultures.,1549249656.0,16,:Seahawks: Seahawks
This fiasco is better than the super bowl,1549249660.0,15,
This sums up the season lmao ,1549249678.0,15,:Ravens: Ravens
Well so far this post-game is more entertaining than the actual game.,1549249700.0,15,:Seahawks: Seahawks
This is the most awkward after game press rush I've ever seen. lol,1549249710.0,14,:Bears: Bears
What the fuck is this?,1549249727.0,16,:Texans: Texans
What a shit show,1549249734.0,16,:Cowboys: Cowboys
Did Brady just kiss Kraft on the lips?,1549249735.0,15,:Cardinals: Cardinals
What the fuck am I watching,1549249754.0,16,
Is this what it was like to watch Michael Jordan?,1549249779.0,15,
Total security failure ,1549249820.0,13,
That was more entertaining than the game ,1549249838.0,17,:Texans: Texans
Was that Keegan-Michael Key as stuffed animal guy?,1549249945.0,13,:Vikings: Vikings
Did they just do 90 seconds of analysis and cut *back* to commercials? Fucking hell.,1549250449.0,15,:Patriots: Patriots :Lions: Lions
This walk is so fucking stupid...,1549250608.0,15,:Packers: Packers
love the boos,1549250774.0,14,:Patriots: Patriots
[deleted],1549250848.0,16,
The players look so weird with a shirt over their pads.,1549251030.0,15,:Steelers: Steelers
This isn’t Sweet VICTORY the FUCK,1549242538.0,30,
Well FUCK YOU TOO NFL!!!! I wanted Sweet victory and you gave me a pile of shit,1549243329.0,29,:Seahawks: Seahawks
I don’t care who wins. I just want whoever promised sweet victory to be punished.,1549244836.0,31,
We wait an entire season to be disappointed that the Patriots make the Super Bowl again only to be even more disappointed that the game sucks. God damnit. ,1549245187.0,28,:Eagles: Eagles
Last TD scored in the Super Bowl was by the Eagles,1549246242.0,29,:Eagles: Eagles
"Here are some white people, here are some black people, here are some young people, here are some old people. We literally have no idea who our target audience is. 

-Super bowl advertisers  ",1549246380.0,29,
Bob Dylan selling his song to fucking Bud? Eesh.,1549247329.0,30,:Eagles: Eagles
"Oh god 4th quarter Brady is here

100 - 3 here we come ",1549247589.0,29,:Bears: Bears
Saints fans gonna have a field day if the Rams lose on an uncalled PI,1549248174.0,30,:Patriots: Patriots
The amount of female empowerment in these commercials is super high,1549248231.0,29,:Panthers: Panthers
[deleted],1549248885.0,29,
Oh shit they just brought up Kashoggi!,1549248903.0,29,:Panthers: Panthers
Thanks NFL for fucking the Saints this badly. ,1549249489.0,30,:Browns: Browns
THE BEST THING TO COME OUT OF THIS PIECE OF SHIT GAME WAS THAT AVENGERS AD,1549249706.0,32,:Rams: Rams
Watching all of these reporters swarm them and shove each other makes me sick. ,1549249750.0,29,:Packers: Packers
Well I didn’t turn to ash and neither did my Ex-wife so I guess Tomhanos decided not to wipe out half of civilization after collecting his sixth infinity stone,1549250201.0,30,:49ers: 49ers
Puppy bowl was better,1549251425.0,31,:Buccaneers: Buccaneers
At least the Rams punter had a career day,1549254047.0,30,:Chargers: Chargers
[deleted],1549249947.0,41,
And now Tom Brady has completed the infinity gauntlet,1549254578.0,40,
Can we all just agree that was underwhelming to watch?,1549250265.0,64,
An ASMR commercial?,1549248131.0,54,:Patriots: Patriots
We could've had chiefs - saints ,1549245298.0,30,
