text,time,upvote,flair
Over-Under was 56 at game start. Vegas is weeping.,1549245643.0,29,:Cowboys: Cowboys
That’s got to be the worst way I’ve ever seen someone eat a burger.,1549247319.0,30,:Panthers: Panthers
Friendly reminder that the Rams scored 54 points in a game this year ,1549247459.0,28,:Packers: Packers
Romo has done such a good job calling games. I've really enjoyed listening to him. ,1549247717.0,31,
"Verizon we havent forgot about you throttling forest fighters data...
https://arstechnica.com/tech-policy/2018/08/verizon-throttled-fire-departments-unlimited-data-during-calif-wildfire/",1549247941.0,28,
You fucking suck Goff ,1549248099.0,29,:Raiders: Raiders
More comments should be praising the Patriots defense than trashing the Rams offense. They are crazy good tonight. ,1549248759.0,28,:Raiders: Raiders
Why isnt the punter in tge mvp vote? ,1549248800.0,31,:Saints: Saints
"To be fair, this is all Dee Ford’s fault ",1549248920.0,27,:NFL: NFL
Very forgettable Superbowl ,1549249300.0,28,
The reports got to Tom faster than the Rams Defense did,1549249747.0,28,:Eagles: Eagles
Tom's daughter is precious haha,1549250988.0,29,:Vikings: Vikings
"Glad I wasted my whole evening watching this garbage. Worst game of football I have seen in a while. I like defense but one team played defense, the other didnt know how to play offense.",1549248424.0,39,:Falcons: Falcons
"Terrible game, terrible halftime show, terrible tribute to Stephen Hillenburg. 0/10",1549248460.0,40,:Steelers: Steelers :Eagles: Eagles
"As if the Patriots being here wasn't awful enough.  This game was pure shit. Top to fucking bottom. 

",1549248743.0,39,
Game of Thrones/Bud Light commercial was da real MVP,1549250507.0,43,:Bills: Bills
"Players can't even celebrate in peace these days... How about waiting for 5 mins and let the guys enjoy winning after a long season

Honestly this ""access"" thing has gone way too far these days ",1549251832.0,55,:Bills: Bills
"CBS tackles racial politics. That should be good.
",1549246270.0,40,:Panthers: Panthers
Jesus how old was that commercial?,1549247298.0,42,:Vikings: Vikings :Ravens: Ravens
Its prerecorded and Maroon 5 still sounds like shit,1549242540.0,16,
Where my Sweet Victory at ,1549242600.0,15,:NFL: NFL
Bring the sponge out or we riot,1549242601.0,15,:Bears: Bears
WHAT A COCK TEASE,1549242692.0,14,
Wait that's not SpongeBob,1549242697.0,15,
**BIGGEST PRANK OF 2019**,1549242713.0,15,:Browns: Browns
The fuck is this shit? Where's SpongeBob?,1549242717.0,15,:Jets: Jets
Travis testing that 8 sec delay today,1549242740.0,15,:49ers: 49ers
Lol he keeps swearing so they’re cutting all audio lol,1549242786.0,15,:Giants: Giants
I’m sure my 53 year old mother at the game right now is just loving Sicko Mode,1549242789.0,15,
"Gonna be a ""No"" from me, dawg.",1549243215.0,13,:Lions: Lions
No spongebob. We Riot.,1549243337.0,15,:Packers: Packers
It’s annoying to think that Adam Levine is probably surrounded by yes men right now telling him how much he crushed it ,1549243814.0,14,:Vikings: Vikings
"Remember, spam F5 to help prevent reddit from crashing. ",1549243938.0,14,:Saints: Saints
Did I just watch a Kia commercial about the Tree of Life?,1549244053.0,13,
"This is a weird way to crap all over [West Point GA](https://en.wikipedia.org/wiki/West_Point,_Georgia) for being some backwater town.",1549244126.0,16,:Chargers: Chargers
That KIA made in America ad is so weird to me when KIA is so heavily advertised amongst Korean Americans as being a Korean company lmao,1549244160.0,14,
"Yo Reddit, can you maybe throw some extra servers at /r/nfl for a couple of hours?",1549244212.0,15,:Rams: Rams
"What happened to Spongebob at halftime might be the most diabolical thing the NFL has ever done

EVER ",1549244265.0,14,
Rams punter for MVP ,1549244300.0,14,:Titans: Titans
Romo needs to suit up for the rams damnit ,1549244321.0,14,:Bengals: Bengals
"Lmao Tony, he's been the only good thing about this entire game.",1549244360.0,13,
"""And obviously Reagan means run to the right."" Never change Romo.",1549244367.0,15,:Patriots: Patriots
"""They've got to double Edelman""

and... that happened",1549244404.0,15,
Did the Rams not watch the Chiefs game? wtf,1549244419.0,12,:Cowboys: Cowboys
"Romo: Gotta double team Edelman. 

* Edelman splits the defense for 25 yards. ",1549244483.0,15,:Seahawks: Seahawks
Edelman is like a dwarven warrior,1549244515.0,14,:Panthers: Panthers
Both offensive sides are playing scared as hell ,1549244554.0,13,:NFL: NFL
Did T-Mobile just recreate an old meme?,1549244604.0,14,:Colts: Colts
Has a game ever ended 3-0  in the modern era?,1549244608.0,14,:Cowboys: Cowboys
"Bill Burr wanted more defense in the league, he got it.",1549244643.0,14,
Karlie Kloss is smoking hot.,1549244653.0,14,:Falcons: Falcons
Damn T Mobile reposting memes on commercials ,1549244660.0,14,:Lions: Lions
FREE PORTNOY,1549244692.0,15,:Ravens: Ravens
"**SHEEPLE, DON'T ANTHROMOPHIZE ROBOTS, THEY'RE THE DOOM OF US ALL**",1549244719.0,15,
Did T-moblie just air a repost? ,1549244720.0,14,:Texans: Texans
But does Michelob Ultra have corn syrup? ,1549244737.0,16,:Lions: Lions
[deleted],1549244777.0,15,
Hekker for MVP,1549244893.0,15,:Packers: Packers
Longest punt in sb history. Most exciting part of the game,1549244903.0,14,
Good god this game must be shit for neutrals,1549244908.0,15,:Patriots: Patriots :Lions: Lions
This is literally the worst possible outcome for the Super Bowl as a neutral fan,1549244911.0,13,:Jaguars: Jaguars
Rams punter > Goff and their offense.,1549244922.0,13,:Bills: Bills
Could you imagine if the Rams somehow win 7-3 and they give the MVP to Johnny Hekker.,1549244929.0,15,
"""It's going to get exciting now!""

No, no it won't.",1549244930.0,15,:Bears: Bears
"""That punt is the highlight of the game!"" Really says everything it needs to huh",1549244944.0,15,:Packers: Packers :Ravens: Ravens
"Verizon sucks ass but that’s my coach.  Fuck Verizon, hoorah to the first responders there ",1549244976.0,13,:Chargers: Chargers
Good to see Verizon trying to salvage their image after the throttling reports surrounding the CA wildfires,1549244982.0,14,:Eagles: Eagles
"Didn’t Verizon shut off a bunch of firefighters data and then try to get them to upgrade when they were fighting a wildfire?  

",1549244985.0,14,
Fuck that was a good punt,1549244986.0,14,
MVP should be Rams D. This game should be 21-0,1549245035.0,14,:NFL: NFL
they really just say 'social justice' and throw up a picture of roger goodell?,1549245064.0,13,:Eagles: Eagles
Well I thought Super Bowl 51 was boring before the end of the third...,1549245119.0,14,:Panthers: Panthers
"All award shows are lame af tbh. Oscar's, Grammys, ESPYs.. fuck all that",1549245128.0,14,
The Chiefs and the Saints died for this nonsense,1549245130.0,13,:NFL: NFL
Mo bamba and sicko mode back to back,1549245156.0,14,
"couldn't post earlier because reddit is wigging out. 

&#x200B;

that att internet commercial earlier makes zero sense.  the overwhelming majority of people have zero choice what who their provider is because of collusion between all the big telecoms.",1549245167.0,12,
They are really skimping on the replays this game. ,1549245204.0,12,:Patriots: Patriots
At this point it would actually be more entertaining if it finished 3-0 than if they started scoring.,1549245234.0,14,
If you love punting boy do I have a game for you,1549245252.0,13,:Vikings: Vikings
MAKE IT STOP. NO JAGGER.,1549245273.0,14,:Vikings: Vikings
"Finally defense is back
All the bandwagon fans crying learn to watch the defense not just the scoreboard ",1549245307.0,13,
"here comes a run for 4 yards, a goff panicked throw in the dirt, a dropped INT, and then a punt ",1549245317.0,15,:Chiefs: Chiefs
Well they say defense wins championships,1549245332.0,14,:Rams: Rams
Finally they’re letting Romo call the plays!,1549245492.0,13,:Commanders: Commanders
Back to back first downs???? What????,1549245513.0,15,:49ers: 49ers
SBVII is the lowest scoring SB. I almost want this game to break the record. ,1549245658.0,14,:Cowboys: Cowboys
Amazing defense,1549245726.0,15,:Browns: Browns
Jason McCourty is fast as fuck.,1549245747.0,16,:Chiefs: Chiefs
TIL the McCourteys are faster than Goff's throws.,1549245752.0,14,:Eagles: Eagles :Eagles: Eagles
Would have been a TD if Goff did not throw that ball over the moon.,1549245782.0,13,:Browns: Browns
#3-3 WOOOO,1549245844.0,13,:Giants: Giants
Goffs performance has been the opposite of Foles ,1549245851.0,13,
Throw the fucking ball away holy shit ,1549245857.0,16,
Lmao Romo is great,1549245863.0,13,:Bills: Bills
That moment when your best players are your punter and kicker,1549245880.0,14,
"Whatever, chipshot for Legatron",1549245883.0,14,:Dolphins: Dolphins
PATS BLEW A 3-0 LEAD,1549245888.0,15,:Vikings: Vikings
Fuck what a cannon for a leg ,1549245891.0,12,:Patriots: Patriots
"I really don't want to make fun of Goff, but watching him play this game makes me wonder if there is a Least Valuable Player award.",1549245912.0,14,
"""3-3 and it looks like we've got a scoring spree going on!"" -Romo, the GOAT of CBS. I enjoyed a good chuckle.",1549245937.0,15,:Broncos: Broncos
Romo *would* wear Sketchers,1549245967.0,14,:Panthers: Panthers
"Of all the robots we've seen in this broadcast, Roger Goodell is by far the fucking creepiest",1549246009.0,13,:Chiefs: Chiefs
Those were the most exciting 3 points ever,1549246158.0,16,:Dolphins: Dolphins
They should just call this game the Bowl,1549246253.0,14,
Tie game in the sb and it's hard to be excited lol hopefully we get the best 4th quarter ever,1549246261.0,14,
This is going to be the most productive day of work after the Super Bowl in history.,1549246308.0,13,
"Guys...but imagine if at the end of the game, Maroon 5 plays *Sweet Victory* with the winning team on stage!",1549246330.0,16,:Vikings: Vikings
"Patriots: 3
Rams: 3
Maroon: 5",1549246372.0,16,
I severely underestimated the amount of beer i would need to get through this game,1549246407.0,16,
[deleted],1549246512.0,14,
GODELL SHOULD USE HIS POWER TO REPLAY THIS GAME.,1549246574.0,15,:Eagles: Eagles
It's apparently time for a Punter to win Superbowl MVP,1549246700.0,14,
Rams should sign Todd Gurley. I've heard he can run. ,1549246714.0,14,:Dolphins: Dolphins
Gurley just looks like he's kind of sad lol,1549246723.0,15,
This feels like a pre-season game ,1549246728.0,14,:Giants: Giants
Best commercial was the NFL commercial and that says a lot,1549246806.0,15,:Ravens: Ravens
[deleted],1549246823.0,12,
[deleted],1549246826.0,13,
But where's the Clydesdale commercial?,1549246844.0,16,
Commercials are a real downer,1549246845.0,14,:Cardinals: Cardinals
"I love defensive games, however as a neutral from the U.K. it’s much more of a struggle to stay awake than it was last year.",1549246910.0,13,
Do enough people actually give a fuck about corn syrup to make these commercials relavant? Or are they trying to start some sort of meme? ,1549246932.0,13,:Browns: Browns
"Fuck, Chung is back out in the stadium. +30 motivation to the Pats",1549246996.0,13,:Falcons: Falcons
friendly reminder the over/under on this game was 56.  i assume everyone who took the over is shithouse drunk at this point,1549247024.0,14,:Packers: Packers
Rip Goff,1549247133.0,14,:Broncos: Broncos
That's been called a late hit atleast a half dozen times this season. ,1549247152.0,14,:Dolphins: Dolphins
I don't even know what the fuck this game is lol,1549247198.0,15,:Steelers: Steelers
For fucks sake Goff. He's missed two potential wide open TDs because he can't read defenses fast enough,1549247205.0,14,:Rams: Rams
Show the fight you cowards,1549247229.0,14,:Cardinals: Cardinals
Why is Kashmir always the song they use to cut to commercial,1549247247.0,14,:49ers: 49ers
Jim and Tony really have their work cut out for them trying to make this game entertaining. ,1549247274.0,14,:Steelers: Steelers
Burger King ASMR,1549247284.0,14,
So has the Rams Oline been this bad all season? I thought they were ok.,1549247294.0,14,:Eagles: Eagles
"They paid millions for that shitty ass commercial? Might as well just been a black screen with a quick ""EAT BK"" for half a second at the end and it would have been better.",1549247296.0,15,:Browns: Browns
Wtf was that andy warhol commercial i dobt get it,1549247309.0,16,:Falcons: Falcons
"...did BK run that commercial for themselves, or did McDonald run that commercial for them?",1549247329.0,14,:Patriots: Patriots
3-3 seems like a soccer score. ,1549247342.0,15,
Andy Warhol folks. He was weird. That's the explanation of that.,1549247502.0,15,:Patriots: Patriots
69 YARD DRIVE,1549247596.0,14,:Titans: Titans
well I would say good game but hey you guys saw it,1549247664.0,14,
This is the darkest timeline,1549247692.0,15,:Eagles: Eagles
"RAMS DO FUCKING SOMETHING OR ELSE THIS WILL ALWAYS BE GOFF'S SUPER ""Oh shit Drew Brees should have been here instead"" BOWL",1549247719.0,13,
No way Harrison Ford lives in a house that small ,1549247727.0,13,
That woman broke her NDA and will be sent to a fulfillment center for a 5 year sentence,1549247751.0,13,:Falcons: Falcons
Harrison Ford is still great at being grumpy.,1549247814.0,13,:Packers: Packers
The first Touchdown in Superbowl 53 was scored exactly after 53 minutes playtime,1549247879.0,14,:Falcons: Falcons
Rams oline is awful,1549247944.0,16,
Didn't the Rams O-line just with the best O-line award to damn,1549247978.0,13,
Yikes ,1549248086.0,15,:Bills: Bills
what is this ASMR bullshit,1549248138.0,13,:Seahawks: Seahawks
Organic beer??,1549248177.0,12,:Patriots: Patriots
Fuck it’s over,1549248180.0,13,:Rams: Rams
Rams offensive plays all look like they have almost no chance of working from the snap. ,1549248251.0,13,:Bengals: Bengals
I took a whole day off work for this shit?,1549248280.0,14,:Cowboys: Cowboys
This kills the horned goat team,1549248336.0,13,:Cowboys: Cowboys
Michel has carried the Pats this postseason ,1549248336.0,13,:Packers: Packers
Sean McVay is carried by Wade Phillips.,1549248391.0,12,:Jaguars: Jaguars
"Even if the Pats have punt, Goff is not getting 80 yards.  Congrats to the six time champs",1549248482.0,14,
"I actually feel bad for Goff. Rams OL is made of sticks, Patriots were crashing through them to get to Goff every snap.",1549248500.0,14,:Giants: Giants
stupor bowl,1549248508.0,14,:Saints: Saints :Saints: Saints
"It's officially over, thanks Rams. Now this is all we'll fucking hear about forever.",1549248518.0,14,
McVays whole life flashed before him ,1549248640.0,15,:Bears: Bears
"How the fuck do you have one of the three best offenses in football, hold the Patriots to 10 and only score 3 fucking points?",1549248686.0,13,:Bears: Bears
Belichick is ANGERY,1549248700.0,15,:Eagles: Eagles
T-Mobile spamming us with ads.,1549248819.0,14,:Lions: Lions
Congratulations to Patriots Super Bowl MVP: Jared Goff.,1549248831.0,15,
Did romo just outcoach mcvay?,1549248896.0,13,
Triggered,1549249143.0,14,:Bears: Bears
I can’t wait for at least one Boston team to suck... in 4728,1549249181.0,14,:Rams: Rams
And that kick sets the record for most amount of televisions that changed the channel in an instant,1549249195.0,15,:Eagles: Eagles
LA on suicide watch,1549249195.0,15,:Colts: Colts
If Tom Brady wins the MVP we riot,1549249198.0,14,:Steelers: Steelers
Doesn't count he didn't hit the upright,1549249221.0,13,:Bears: Bears
Goff not being able to read the defense on his own was the difference maker tonight.,1549249334.0,14,:Seahawks: Seahawks
"LMAO, what a fitting end",1549249441.0,14,:Cowboys: Cowboys
Wasn't even close lmao,1549249463.0,13,:Chargers: Chargers
Rams were completely dismantled by Bill and the Pats ,1549249491.0,12,:Bears: Bears
That was just sad,1549249495.0,16,:Colts: Colts
"Only the second Super Bowl ever in which the losing team did not score a touchdown (the first being Super Bowl VI - Dallas 24, Miami 3).  Even with that missed FG, they should be thanking their kicker. If Zuerlein hadn't nailed a 53 yarder this would have been the first shutout ever.

Please give the MVP to somebody on defense, oh almighty media. Brady, Michel, or even Edelman as MVP in 13-3 game is just lazy ""pick the offensive star no matter what"".  It would be as dumb as giving it to somebody on the Denver offense against Carolina a few years ago.",1549249537.0,15,
"I just wasted several hours of my life. It's nothing new, but this particular case fucking sucked.",1549249550.0,12,:Packers: Packers
Why you trying to interview him 10 seconds after winning FOH,1549249570.0,14,:Cardinals: Cardinals
This interview attempt is more entertaining than the game,1549249583.0,15,:Eagles: Eagles
Lmao my girl Tracy really trying for that interview I respect the grind ,1549249592.0,16,
Kissing Julian like that Tom's son is going to get jealous.,1549249630.0,14,:Lions: Lions
Lol this is a shitshow,1549249664.0,12,:Bears: Bears
This is dumb. Why are they showing this to us?,1549249683.0,14,:Eagles: Eagles
what is cbs doing right now?,1549249686.0,13,
damn this whole post game scene with all the media crunch is pretty sickening,1549249688.0,15,:Seahawks: Seahawks
"Our watch party was cheering for the lowest scoring SB in history. 

We did it fellas 

History made 

Do you feel accomplished yet ",1549249689.0,15,:Vikings: Vikings
They can't even do the post game right,1549249699.0,14,:Buccaneers: Buccaneers
I HAVE HIM,1549249700.0,13,
CBS is killing it with this interview.,1549249712.0,14,:Raiders: Raiders
"This shit isn’t usually this awkward right?

Looks like a college court storming situation",1549249717.0,13,
"Did Brady just call Robert Kraft ""Kit Kat""?",1549249737.0,14,
Can they corral the linemen to push these assholes back?,1549249741.0,13,:Bills: Bills
Kudos to CBS for just running the audio ,1549249763.0,13,
Lmao is Tracy still alive!?!,1549249775.0,15,
"""They played so well"" lul",1549249794.0,14,:Bears: Bears
Media back the eff up Jesus ,1549249803.0,14,
Fell asleep during halftime and woke up to a Patriots win. What else is new?,1549249834.0,14,:Vikings: Vikings
Magic City is making money tonight. Not a single offensive player on eaither team broke a sweat. ,1549250129.0,15,:Packers: Packers
Aliens looking down on us kissing a piece of metal,1549250687.0,14,
Kraft is practicing these speeches in the bathroom with the shampoo bottle at this point. ,1549250811.0,14,:Seahawks: Seahawks
Kraft sounding very Tommy Wiseau-like,1549250842.0,14,
my family started using heroin and opiates by the time I was 7...that’s why i build Kia cars,1549244136.0,28,
Chiefs/Rams part 2 died for this.,1549244406.0,28,:Ravens: Ravens
Never forget that Verizon throttled service on first responders during one of the deadliest disasters in the history of California ,1549245008.0,28,:Bears: Bears
"That Anthony Lynn commercial hits home man. 

Used to be an EMT. Had a guy go into cardiac arrest  and crash his right as we got a call elsewhere. We disobeyed dispatch orders and jumped on the car crash and cardiac arrest. 

Our quick action and being surrounded by 500+ people made things so intense. And nothing made me relieved when the Medic said to stop doing CPR. The guy was gonna make it. 

Fast forward and we find out that it was the owner of a local diner. We go there for breakfast and introduce ourselves to him and his family. They all broke down and cried and hugged us. 

Needless to say got free food but the bill we topped it to the waiters. Never will forget that moment. ",1549245113.0,27,
"THE RAMS ARE ON THE BOARD 

I love tony so much WE GOT A SCORING SPREE",1549245881.0,28,
$45 cup phone holder from weathertech lol,1549246922.0,27,:Falcons: Falcons
End this game now and award next year's winner 2 Lombardis,1549247041.0,28,:Chiefs: Chiefs
"Bold strategy, Burger King...",1549247343.0,28,:Vikings: Vikings
Woke commercial overload ,1549248197.0,28,
An ASMR commercial in the Super Bowl. Whatta time to be alive ,1549248232.0,29,:49ers: 49ers
Shhhh everyone quiet Tom Hanks is talking,1549248910.0,29,:Panthers: Panthers
Im hoping the score stays im about to win some money,1549249301.0,29,:Texans: Texans
That’s how you get embarrassed on national television,1549249445.0,28,:Eagles: Eagles :Eagles: Eagles
Rams went All in this year just to fail,1549249445.0,27,:Bears: Bears
"Fucking horrible.  Gronk is giving an interview, but they are too busy waiting for BRady to stop hugging people.",1549249666.0,27,:Commanders: Commanders
Goff should retire ,1549249947.0,29,:Raiders: Raiders
"Between the boring game, horrible halftime show, and the terrible commercials... It was quite a disappointment to say the least 

Edit: Best part of my night was the chili and spicy queso mix I whipped up",1549250228.0,28,
[deleted],1549250426.0,30,
Tom Brady just kissed that trophy on the lips.,1549250791.0,29,:Chiefs: Chiefs
Omg Brady’s daughter is adorable,1549250960.0,27,:Packers: Packers :Bengals: Bengals
"This did not feel like a super bowl. Everything disappointed, especially Maroon 5 and the Rams",1549248777.0,68,:Ravens: Ravens
"3-3 tie, eagles remain champs ",1549247179.0,50,:Eagles: Eagles
"Washington Post: “The media is the most important thing in this country”

The media: “Lets gang bang Tom Brady four seconds after the super bowl ends”",1549249786.0,51,:Giants: Giants
Fuck you for cutting Sweet Victory,1549287127.0,59,
Goff is the reason the Rams aren't ahead. Dude has stunk out loud,1549247189.0,41,
There is no heterosexual explanation for The way Brady and Edelman look at each other ,1549249694.0,41,:Patriots: Patriots
Both these teams are playing like they don’t want to go to the White House. ,1549245169.0,71,
Adam Levine for sure jerks off to pictures of Adam Levine.,1549243510.0,27,
"3-3 into the 4th

Just like we all predicted ",1549246303.0,28,:Ravens: Ravens
"'Bazinga'

HAHAHAHAHAHAHAHAHAHAHAHAHAHHA
",1549246321.0,28,
If thats Brady there are like 20 flags on the field lmao,1549247116.0,28,:Jets: Jets :Jets: Jets
Imagine how much it hurts Romo knowing that he could be picking this Pats defense apart. ,1549247165.0,27,:Ravens: Ravens
Wish they could end in a tie. Neither team should win. ,1549247462.0,28,
"honestly I'm good with just ogling Giselle for the rest of the game, please go back to that CBS",1549247606.0,27,:Jets: Jets
"Is this the longest it’s ever taken for a TD to be scored in the SB?

Edit: ok thank you",1549247676.0,28,:Steelers: Steelers
"This really blows my mind, NE wasn’t even the best team in the AFC let alone the league. I just don’t understand how they do this year after year. I will cry tears of happiness when Brady’s ass retires. ",1549247727.0,28,:Colts: Colts
"Www.NFL.com/mvp 

Vote punters early and often ",1549247760.0,29,
"I mean, seriously, if New England wins, how could the MVP be anyone but Edelman?",1549247827.0,25,:Broncos: Broncos
There’s been a severe lack of Philly specials in this game.,1549247930.0,27,:Seahawks: Seahawks
Saints v. Chiefs would have been amazing. Instead we got the root cause of narcolepsy.,1549248650.0,27,:Chiefs: Chiefs
The Bud Knight died for this.,1549249316.0,29,:Saints: Saints
Saints offense wouldn’t have been embarrassed ,1549249329.0,25,:Seahawks: Seahawks
Fuck Verizon with the strength of a thousand suns.,1549250228.0,28,:Commanders: Commanders
"Well, I’ve been just been thinking a lot about my “journey” and what that means to me as a person and you as a person and I feel like my life is moving in slow motion and I don’t really know how to stop it or make it go fast. It’s INSANE. Hah. I feel like it all started back in 5th grade when my teacher asked me to “stop calling out answers.” She STUNTED me. She STUNTED my thirst for knowledge. Because now I feel like I want to “call out the answers” but I can’t and it’s my own life, you know??? So that got me thinking about fitness and I’m just so torn between PILATES and yoga and what’s best for me at this moment. In this time of my life. I feel like the challenge part of pilates is great but the soulful part of yoga is key. My mom said: FIND YOUR GUIDEPOSTS and I’m trying. That also got me thinking....what are guideposts? Are they man made? Are they physical objects? Or are they a feeling? An intuition? It’s not just going to say “hi, I’m a guidepost.” You know? I want to find my life’s passion....but where to start? Also before I forget, my diet: currently consisting of potato chips and CEREAL....but is it helping me on my journey? I’m happy when I eat those things, they bring me joy....but is it really SERVING me? I find lately that the things I know are bad for me, are serving me the best. So I guess you could ask how well are they reeeeeally serving me then? I think that brings me back to high school, even though the school colors washed me out (we were the TIGERS.... I look terrible in orange). This has been an ongoing trend in my life; I need to break it. The color orange represents so many things to me now which shows how I have an inability to LET THINGS GO! I need to be content in my own choices and find my own path. I read this amazing article the other day about what color your aura is, and I found out that mine is actually ORANGE. How strange I am for wanting to cut that color out of my life.",1549242866.0,118,:Eagles: Eagles
Fuck ASMR ,1549248130.0,36,
Big Dick Nick woulda thrown for 5 TDS by now,1549248398.0,39,
Why do professional journalists/reporters act like middle schoolers trying to get to school lunch,1549249912.0,39,
"10 points is the largest ever margin of victory for a Pats Super Bowl win, and it's in the lowest scoring Super Bowl ever, lol.  ",1549250520.0,40,:Patriots: Patriots
Both teams played like they had to go to the White House ,1549253410.0,202,
If the chiefs were in this game it would be 40-40 right now ,1549242234.0,25,:Cowboys: Cowboys
I can’t believe I laughed at a Michael Bublé commercial ,1549244083.0,27,:Steelers: Steelers
