text,time,upvote,flair
Many died in the great battle of the journalists at super bowl 53,1549249957.0,432,:Packers: Packers
What channel is the game on?  CBS is showing a feed from a male strip club.,1549243283.0,2169,:Vikings: Vikings
What's with all the robot commercials?,1549244688.0,240,:Ravens: Ravens
What the fuck Burger King,1549247274.0,432,:Broncos: Broncos
That NFL 100 commercial was football porn.,1549242489.0,2053,:Patriots: Patriots
Did I just watch an ad for a cupholder phone mount during the Super Bowl?,1549246814.0,591,:NFL: NFL
"Bud Light uses sugar from rice instead of corn. 

Who cares. ",1549246026.0,408,:Saints: Saints
In the UK and I'm so happy i stayed up and witnessed the longest punt in superbowl history.  I look forward to my grandkids asking me to tell the story again,1549245168.0,3122,
Todd Gurley rushed for more yards in this commercial than in the game.,1549242441.0,1548,:NFL: NFL
Wtf with the suicidal undertones in this Kia commercial?,1549244078.0,522,:Panthers: Panthers
imagine holding tom fucking brady to 3 points until the 4th quarter and still losing. Id be pissed TF off if i was the rams D,1549248369.0,352,:Jaguars: Jaguars
"""I CANT BELIEVE IT! WE GOT POINTS! IT FEELS LIKE A SCORING SPREE!"" Fuckin' Romo is too precious.",1549245902.0,172,:Texans: Texans
Day 22 of the Superbowl.  The score stands at 3 - 3 . The surviving fans have split into warring tribes and now line the outskirts of the field. Both quarterbacks know a loss means certain death by cannibalism. The concourse a barren wasteland. The gates have been blockaded to the outside world.  And still they play. ,1549246391.0,1061,:Vikings: Vikings
"""and obviously reagan means run to the right"" damn tony can do political satire too",1549244394.0,1111,:Broncos: Broncos
This is absurd.  They need to get some level of control over the media going forward.,1549249695.0,158,:Cowboys: Cowboys
"**Mr. Krabs:** We've been duped!

**SpongeBob:** Duped!

**Mr. Krabs:** Bamboozled!

**SpongeBob:**  
**WE'VE BEEN SMECKLEDORFED**

**Mr. Krabs:**  
That's not even a word and I agree with ya!",1549242804.0,2197,:Browns: Browns
"ADS

&#x200B;

PUNT

&#x200B;

ADS

&#x200B;

PUNT

&#x200B;

ADS

&#x200B;

REPEAT",1549244999.0,676,
Why didn't they use their timeouts at the end of the half and go for a safety? ,1549242166.0,749,
These T mobile ads are personally attacking me ,1549244611.0,140,
"YOU USED ME 


FOR SICKO MODE",1549243827.0,136,
**I SURVIVED THE 2019 REDDIT SUPERBOWL CRASH**,1549243851.0,604,:Chargers: Chargers
"If Patriots win, Edelman better win MVP. Don't force it to Tom Brady",1549244576.0,268,
"#VERIZON THROTTLED DATA SERVICES FOR FIRST RESPONDERS IN CALIFORNIA WILDFIRES.

#NEVER FORGET",1549245059.0,2496,
IS NO ONE GOING TO MENTION HOW MICHAEL BUBLÉ CAME OUT OF HIBERNATION TO DO THAT COMMERCIAL,1549244154.0,586,:Cowboys: Cowboys
Goff is playing how I play madden. Throwing to the guy I wanted to whether or not hes open,1549244216.0,483,:Giants: Giants
"I can just imagine the pitch room ""no no guys, you have no idea how much the ASMR fetish market has been overlooked, trust me on this""",1549251111.0,129,:Bills: Bills
Spongebob still on the field longer than the Rams offense. ,1549242770.0,1079,:Eagles: Eagles
\#EatLikeAndyReid,1549247312.0,119,:Seahawks: Seahawks
You know it's a shitty game when a 65 yard punt is a highlight,1549244931.0,237,:Seahawks: Seahawks
"Somewhere in an alternate universe....

The Saints and Chiefs are tied 28-28 at halftime. 

Update: Drew Brees just threw his 10th TD - it’s 70-70 

Final Update: What a call by Andy Reid - a screen pass on 4th and 5 to Damien Williams for the final play. 

He’s finally an NFL Champion. Chiefs win 77-70",1549242229.0,2637,
eatlikeandy what the fuck was that?,1549247298.0,107,
Andy didn't look happy with that Whoper wtf,1549247293.0,101,:Eagles: Eagles
Why did he take the top bun off if he was just going to put the ketchup on the side and dip it? ,1549247332.0,102,:Colts: Colts
The Andy Warhol Burger King ad accurately sums up the “...what?” mood surrounding this game.,1549247417.0,205,:Seahawks: Seahawks :Bills: Bills
Well that BK ad was weird as fuck,1549247324.0,98,:Texans: Texans :Broncos: Broncos
Nothing sums up this game better then the only record being broken is the longest punt.,1549245119.0,576,:Titans: Titans
"Even as a PlayStation gamer, Microsoft deserves a lot of credit for that adaptive controller.",1549246831.0,269,:Colts: Colts
Where was sweet victory ,1549253944.0,93,
“That’s the highlight of the game!” 😂 savage ,1549244901.0,186,:Eagles: Eagles
"I will run anyone in r/nfl through a DnD campaign set in the Bud Light universe  
Edit: oh my god what have I done.  
Edit 2: Let me home brew stuff and do some research and I’ll message people who commented on this. ",1549245975.0,341,
"I thought 2002 Tom Brady looked familiar
https://i.imgur.com/BZ8LLal.jpg",1549242523.0,414,
Watching Andy eat a burger with a lot of background noise and crinkling of the paper feels exactly like watching this game.,1549247328.0,93,:Colts: Colts
"best play of the game so far: the Mountain killing Bud Knight

sorry spoilers",1549242815.0,91,:49ers: 49ers
[deleted],1549242528.0,466,
Best commercial of the game so far just to see the NFL legends ,1549242471.0,251,:Seahawks: Seahawks
Lol Tom Brady is so done with dumb fucking questions,1549251128.0,81,
The 72 Dolphins sipping champagne was outstanding,1549242576.0,375,
This is the Fyre festival of half-time shows,1549243192.0,1032,:Jaguars: Jaguars
Took Goff 18 years to see a wide open guy deep lol,1549245746.0,83,:Eagles: Eagles
See you all next year for the patriots invitational. ,1549248140.0,83,:Broncos: Broncos
"sweet victory or we riot

EDIT: looks like we riot",1549242143.0,1198,:Raiders: Raiders
If the Patriots win and they give Tom Brady the MVP I'm going to have a stroke. I suspect Julian Edelman but it honestly should be a punter. ,1549246698.0,76,:Saints: Saints
"""Jesus are you okay? Just stay tight"" LOL",1549249714.0,80,:Seahawks: Seahawks
Why is every commercial robots? ,1549244703.0,76,:Eagles: Eagles
Glad Tony is breaking this all down.  Interesting clock management situation.  ,1549248706.0,81,:NFL: NFL
"Verizon throttled firefighters networks. Fuck you and fuck this commercial, they are not “friends”. This is goddamn offensive.",1549245013.0,869,:Bills: Bills
[deleted],1549247349.0,71,
Reagan Reagan!  Trickle down offense engaged. ,1549244323.0,147,:Steelers: Steelers
"> breaks arm

> out for game

Understandable ",1549244558.0,208,:Patriots: Patriots
Has a punter or kicker ever been named a Superbowl MVP? There might be tonight lol,1549246717.0,67,:Chiefs: Chiefs
Man sometimes I forget how fortunate I am that I’m able bodied. ,1549246775.0,69,:Rams: Rams
"How come your average college coach has a retinue of 4-6 state troopers for security, but Tom Brady can get mauled like he's Jon Snow at ""The Battle of the Bastards""?",1549249942.0,68,:Browns: Browns
Brady has so much experience and poise at this point in his career he knows to call an audible to switch his daughter to the other side away from the mic. ,1549251014.0,71,:Chargers: Chargers
"Honestly, this Rams offense is the worst I've ever seen in a SB. ",1549245134.0,138,:Colts: Colts
At least all those kids in Africa get to believe the Patriots lost again.,1549250154.0,70,:Dolphins: Dolphins
"""It's getting exciting now!"" lmao",1549244955.0,137,:Packers: Packers
THEY SOILED IT. ,1549242708.0,238,:Steelers: Steelers
"Has Reddit been slow for anyone else since halftime?

I think the Spongebob clip threw Redditors into meltdown mode",1549244228.0,67,
Pretty sure Brady got touched more in that media crowd than he had by defenses this whole postseason.,1549250002.0,63,
Julian Edelman totally does coke ,1549244281.0,65,:Vikings: Vikings
Dude this post game cluster fuck is hard to watch. Fucking vultures ,1549249728.0,61,:Cowboys: Cowboys
Does goff not know you can throw the ball away?,1549247135.0,63,
Someone paid millions of dollars for this commercial spot,1549247282.0,60,
"How much fucking dog food did that dog order, Christ",1549251166.0,62,
Who the fuck is driving their SUV through a literal fucking ditch?,1549244122.0,183,:Colts: Colts
If we just get the Spongebob cameo that’s almost worse than not doing anything at all... ,1549243040.0,125,:Broncos: Broncos
So Kia makes poor children from Georgia work in there factories lol,1549244116.0,177,
"""You said you want to play a lot of football, does winning a lot change your mind, Professional Footballman?""",1549249907.0,63,
NFL with the massive middle finger totally snubbing Sweet Victory. The intro doesn’t count you fuckfaces!,1549242822.0,719,:Eagles: Eagles
Oh not this ASMR shit. Someone go get wubby.,1549248135.0,125,:Giants: Giants
Remember when Verizon throttled the firefighters in California.,1549246866.0,174,
At least we can go to sleep soon ,1549248371.0,58,:Colts: Colts
The Rams really just scored THREE FUCKING POINTS.  In a fucking Super Bowl.  Christ.  Just fucking garbage. ,1549248551.0,57,:49ers: 49ers
harrison ford and his dog for MVP,1549251168.0,59,
She's getting run over lol,1549249710.0,54,
Reagan means run to the right! Love you Romo ,1549244355.0,108,
"No one cares about the Grammys

Not even the Grammys ",1549245012.0,53,:Packers: Packers
Bud Light is about to get a strongly worded letter from the American Corn Growers Association. ,1549246882.0,55,
"Definitely wasn't expecting to see an ASMR beer ad.

The internet was all over these ad agencies, what are we doing with our lives?",1549251984.0,55,
"How awesome would that 51-54 Chiefs-Rams game be right now
",1549242129.0,1399,:Chiefs: Chiefs
Rams offense choked to shit this game,1549249275.0,49,:Eagles: Eagles
This crowd around Tom is more entertaining than the game itself,1549249706.0,56,
Big Boi tried to put out the dumpster fire and then Maroon 5 sprinted in with a 5 gallon gas can.,1549243159.0,356,
Philip Rivers has more kids than points on the board,1549246012.0,109,:Cardinals: Cardinals
Fuck off Scientology.,1549246399.0,50,:Colts: Colts :Colts: Colts
"“Brady how happy are you about winning?” 

“Yeah uhhh this one wasn’t our best. I wish the offense was better.” ",1549249810.0,49,:Seahawks: Seahawks
"Roger Goodall,  getting 100x more boos than Vince McMahon for 20 years",1549251020.0,54,:Vikings: Vikings
[deleted],1549251583.0,53,
we were spoiled with two all time great super bowls before this. the rams offense looked like they didn’t even belong on the field. one of the worst super bowls in recent memory for sure ,1549253092.0,48,:Bears: Bears
I can't even feel bad for the Rams like that was just pathetic. You're in the superbowl and you didn't make a single touchdown. That's so fucking stupid hahahahaha,1549249948.0,103,
Verizon first responder commercials when they've been over charging local municipalities for data and cutting them off in the middle of emergencies makes me puke.,1549250330.0,104,:Dolphins: Dolphins
jesus christ the press are like piranhas,1549249636.0,48,
[deleted],1549243194.0,148,
"Fucking Romo is unreal, this dude needs to coach.",1549245647.0,46,:Rams: Rams
r/bikinibottomtwitter has declared war. ,1549252945.0,99,
We got duped. Fuck maroon 5,1549242712.0,503,
Didn't Verizon throttle data to firefighters in the California wild fires?,1549245060.0,293,:NFL: NFL
"Andy, why'd you take the top bun off and then pour the ketchup on the side?!",1549247351.0,51,:Eagles: Eagles
That media scrum in the end was more action packed ,1549251528.0,49,
"If the game ended now, Edelman would 100% deserve MVP. I hope they don't give it to Brady by default. ",1549244508.0,44,:Bills: Bills
ASMR... beer? ,1549248161.0,46,:Colts: Colts :Seahawks: Seahawks
[deleted],1549249762.0,47,
The unrelenting offensive pressure of the journalists really stole the show,1549250093.0,46,
Bud Light is really dead set on making us know there’s no corn syrup I guess,1549245979.0,96,:Broncos: Broncos
"Atlanta fans rejoice, the Patriots might be on their way to blowing a 3-0 lead in the Super Bowl",1549246052.0,206,:Panthers: Panthers
It's like neither of these teams wants that White House food,1549245264.0,208,
This game could not be going any worse for the NFL ,1549244603.0,95,:Chargers: Chargers
I only tuned in for Sweet Victory. I’ve been had. ,1549243332.0,306,:Colts: Colts
What a shitshow of a postgame show,1549249656.0,45,:Eagles: Eagles
"kia stop with the fucking feel good commercials

you build cars you dont save the fucking planet",1549244040.0,125,:Buccaneers: Buccaneers
You can't cry about refs when your offense puts up an astounding 3 points in the biggest game of the year and your qb throws a pick in the red zone. Those are the rules. ,1549251334.0,88,
The real losers were the 1.5 million fans who signed a petition to hear sweet victory.,1549254046.0,87,
Let's not forget Verizon wireless is the carrier that throttled the California firefighters during the forest fires because they were using too much data,1549246892.0,164,:Patriots: Patriots
Punter Bowl is what's on the menu boys.,1549244936.0,45,
Which punter gets Superbowl MVP?,1549245291.0,45,:Steelers: Steelers
"Madden gives special cards for whoever wins the Super Bowl MVP. 

Imagine if they end up having to release a 99 OVR Punter. ",1549246919.0,44,:Colts: Colts
[Fuck me Mercedes' straight savage.](https://twitter.com/MercedesBenzUSA/status/1092242359721562114),1549247675.0,46,:NFL: NFL
"From the game, the commercials, and the half time show, this is easily the worst super bowl I’ve ever watched in my lifetime ",1549248337.0,41,:Titans: Titans
[deleted],1549248722.0,43,
Rams went 13 and 3 to end their season and the super bowl,1549251150.0,46,
"Can we all agree that this game is shit

The actual game itself

The commercials

The half-time show

All shit",1549244284.0,477,:Patriots: Patriots
"Super Bowl Nipple Count: Janet 1, Levine 2",1549243405.0,44,:Chargers: Chargers
That’s one weird ass fetish,1549245039.0,46,:Saints: Saints
Super bowl record for most punts by a single punter is 11. Think we're going to shatter that.,1549245084.0,44,
Brady doesn’t give a fuck about the media ,1549249670.0,42,:Bengals: Bengals
Was Robert Kraft piss drunk in his post game interview?,1549252395.0,42,
Jared Goff did a better job in The Notebook than in the Super Bowl.,1549254913.0,43,
"This is so fitting for the NFL...

NFL: How can we make you happy?

Fans: Do “X”

NFL: How about “Y”?",1549243156.0,41,:Ravens: Ravens
We all remember what you did Verizon,1549245036.0,42,:Commanders: Commanders
It will go 3-3 into overtime and then somehow the Pats will win by 21,1549245993.0,41,:Eagles: Eagles
What up with this brewed with no corn syrup shit? Who fuckin cares? You don’t get points for something that should already be a thing ,1549246024.0,42,:Buccaneers: Buccaneers
Pats RB is NOT using Corn Syrup,1549246247.0,42,:Giants: Giants
"Can't vote for punters on nfl.com mvp ballot

Bullshit ",1549246839.0,41,:Ravens: Ravens
Wtf was that Burger King?????? ,1549247302.0,41,:49ers: 49ers
Tracy was in an empty room for the last 10 minute psyching herself up to take on the mob and get that god damned interview with Tom Brady,1549250047.0,42,
[deleted],1549278885.0,40,
Rams best play is a punt ,1549244898.0,85,:Cowboys: Cowboys
"Rule #1 of super bowl commercials: if a commercial seems like it's going to have any significant value, it's really just a car commercial lol",1549244107.0,43,:Colts: Colts
[deleted],1549243526.0,79,
Anyone else get physically sick from all the media swarming the players afterwards? ,1549254303.0,113,
Goff & Gurley looking like the monstars stole their talent,1549247227.0,38,:Broncos: Broncos
"Jesus, this is such a cluster fuck....",1549249685.0,40,:Colts: Colts
I don't like the patriots...but I am all for Troopers coming out of the field and making a perimeter. These reporters are fucking morons.,1549249793.0,37,
Why do they not escort these people with a barricade or something? The amount of media swarm they allow is insane.,1549249835.0,41,
Damn shoulda just had an OutKast half time show instead of this trash but Andre 3000 probably didn’t wanna sell out,1549243139.0,36,
Some truly remarkable post game coverage here,1549249716.0,41,
Fortnite concert was better.,1549242795.0,37,:Buccaneers: Buccaneers
What is that commercial? ,1549247288.0,36,:Broncos: Broncos
This is the best part of the game,1549249699.0,38,:Cowboys: Cowboys
This is kinda stressful to watch,1549249700.0,39,:Vikings: Vikings
AND THE WINNER OF THE TOM BRADY INVITATIONAL... TOM BRADY,1549249720.0,40,:Packers: Packers
"No joke, the Xbox adaptive controller doesn’t get enough recognition. Go to the Xbox sub and see. It’s life changing to people and is truly heartwarming. ",1549246820.0,38,:Titans: Titans
"Holy shit Amazon, how long was that ad?",1549247731.0,37,:Eagles: Eagles
"Wait, is this supposed to be an ASMR parody in a beer commercial?",1549248174.0,38,:Browns: Browns
No more parties in LA,1549249272.0,40,:Giants: Giants
"What a disgraceful performance by the Rams offense
 

They should be ashamed.",1549249447.0,37,:Ravens: Ravens
WHERE THE FUCK IS SPONGEBOB?,1549242541.0,271,:Vikings: Vikings
Twilight Zone commercial has been the best so far.  Not saying much...,1549242224.0,38,:Packers: Packers
is it possible to explain the 'eat like Andy' commercial from Burger King?,1549247321.0,40,
God bless Tony Romo. He explains it so well,1549248690.0,37,
This looks so ridiculous right now ,1549249632.0,39,:Ravens: Ravens
This is the most awkward post game walk around I've ever seen ,1549249665.0,34,:Colts: Colts
Tom Brady kisses Robert Kraft on the lips. ,1549249720.0,36,:Broncos: Broncos
THAT WAS YOUR SHOT AT REDEMPTION JARED,1549248108.0,35,:Ravens: Ravens
"Rams defense showed the fuck up

Too bad Rams offense died on the way here",1549248388.0,33,:Vikings: Vikings
I expected nothing and yet I am still disappointed.,1549242843.0,68,:Jets: Jets
The days of watching the superbowl for the commercials is officially dead,1549247788.0,68,
Was that supposed to be an ad *for* Burger King?,1549247293.0,35,:Bills: Bills
"Rams are going to score with 3 minutes left, tie the game, then the Pats are going to get the ball back, drive down the field and eat up the clock, and kick a FG with 4 seconds left to take the lead and win.",1549247800.0,35,:Buccaneers: Buccaneers
Beer ASMR? Weird,1549248149.0,37,:Patriots: Patriots
Who's ready to watch the Rams lose off of an Edelman slant route,1549248770.0,34,:Seahawks: Seahawks
Is this a comedy/sitcom?,1549249640.0,36,:Seahawks: Seahawks
What a fucking shit show.,1549249664.0,32,:Cowboys: Cowboys
"Verizon damage control, lol",1549250244.0,34,:Bills: Bills
Brian Hoyer has as many Superbowl rings as Drew Brees.,1549251039.0,32,
"Rams fans: “I hope we hold the Pats to 10 points”

*monkey’s paw curls*",1549248398.0,68,:Broncos: Broncos
"Much as Im disgruntled by them destroying us, then losing to the cowboys (im more upset about the second part) then knocking us out of the playoffs, I gotta say I feel like Saints-Patriots would have been an INFINITELY more entertaining game. ",1549259225.0,67,:Eagles: Eagles
Is that guy wearing the Legendary White Bison pelt from Red Dead Redemption 2? ,1549243106.0,125,
BigBoi would come in riding in an old caddy wearing a giant fur coat lmao ,1549243094.0,34,:Bengals: Bengals
You guys are taking the servers to town. Damn. ,1549244244.0,30,:Texans: Texans
"We believe there needs to be prison and police reform

Buy a Chrysler ",1549244748.0,33,
What kind of lame ass commercial was that ,1549247296.0,30,:Broncos: Broncos
Can I have what BK is smoking it might make this game interesting ,1549247302.0,35,:Panthers: Panthers
Whoooo exactly was that Burger King commercial supposed to appeal to?,1549247324.0,32,:Panthers: Panthers
"Goff's like ""shit now I have to do that""",1549247625.0,33,:Rams: Rams
Make sure to vote Romo for MVP,1549247893.0,35,
ASMR STOP,1549248114.0,34,:Seahawks: Seahawks
Throw Goff in the AD deal. ,1549248124.0,37,:Eagles: Eagles
They should play that nfl100 commercial a few more times so we at least get to see some exciting football today.,1549248687.0,33,
"Everytime he says michele, it reminds me of dodgeball. ",1549248762.0,35,
This is maybe the most boring Super Bowl I’ve ever watched,1549249548.0,33,
"You hold a team who averages 33 points per game to just 3 points, boy just pick someone from Pats D and make them MVP.

Gilmore would be my pick",1549250382.0,33,
Play of the game was Mccourtey breaking up that the TD ,1549252375.0,36,
Bruh this is garbage. Can’t believe they hyped up the Spongebob tribute for that shit. ,1549242933.0,147,:Eagles: Eagles
No sweet victory we riot,1549242771.0,91,
"""they're in the super bowl for a reason""

> No offense until 4th quarter",1549247625.0,65,:Eagles: Eagles
What is this shitshow we're watching?!,1549249710.0,65,:Steelers: Steelers
"Best commercial of the night. None can beat that.

Thanks, 100NFL.

#That Saquon hurdle in a suit was sexual ",1549242480.0,168,:Eagles: Eagles
"**VERIZON THROTTLED THE PHONE NETWORKS DURING EMERGENCIES, FUCK YOUUUUUU**",1549245049.0,263,:Vikings: Vikings
"Edelman putting in a SBMVP performance

Once of the best games from him. ",1549244474.0,31,:Patriots: Patriots
"Spongebob Squarepants now has more Super Bowl appearances than.....

...ah fuck it, the Jacksonville Jaguars :(",1549244822.0,33,:Jaguars: Jaguars
"~~**SUPER BOWL 53**~~

PUNT BOWL ",1549244975.0,29,:Patriots: Patriots
Tony Romo is not having any of that shit,1549246092.0,32,:Packers: Packers
Is this commercial advocating for people to take FaceTime calls while driving?,1549246827.0,30,:Vikings: Vikings
Did Amazon just confirm that Alexa is Hal?,1549247787.0,35,:Saints: Saints
That commercial was thoroughly annoying,1549248140.0,35,:49ers: 49ers
All them asmr just busted their nuts ,1549248161.0,29,
Was...was Brady about to kiss Robert Kraft?,1549249701.0,32,:49ers: 49ers
BK with the worst commercial of the night so far ,1549247291.0,61,
Severely disappointed in the lack of SpongeBob. ,1549243344.0,91,:Broncos: Broncos
"# B A Z I N G A

*audience laugh*",1549246302.0,87,:Broncos: Broncos
West Point Georgia- we have no dreams but we can build the shit out of this Kia,1549244030.0,30,:Panthers: Panthers
[deleted],1549244518.0,31,
Fuck I’m having punt withdrawals...HIT ME,1549246152.0,32,:Panthers: Panthers
I think they ran out of commercials,1549246338.0,30,:Rams: Rams
"Romo won’t be able to help himself, after a season or two as an announcer some team will offer him a fat check for a head coaching job and he’ll pull a Gruden. There’s too much passion there. ",1549248750.0,30,:Seahawks: Seahawks
"When the moon hits your knees

And you mispronounce trees

Sycamore",1549249009.0,31,:Dolphins: Dolphins
and the crowd goes mild,1549249523.0,31,:Seahawks: Seahawks
"Good god Rams that was embarrassing. That’s some cosmic fucking karma for Saints fans, hope that brings some relief. And that’s coming from a Panthers fan.",1549249577.0,29,:Panthers: Panthers
"Eat Like Andy

Reid",1549247285.0,62,:Lions: Lions
This is quite possibly the worst post game experience of all time,1549249773.0,64,:Steelers: Steelers
Fuck's sake. Put that Owen kid in at qb for the Rams. ,1549246805.0,60,:Eagles: Eagles
REAGAN SMASH,1549244336.0,28,:Browns: Browns
I want Romo to narrate my funeral,1549245171.0,28,:Eagles: Eagles
Fire that play caller holy fucking shit ,1549247188.0,30,:Steelers: Steelers
That was the worse bullshit Burger King commercial,1549247310.0,32,:Jaguars: Jaguars
There is no punter option for super bowl mvp,1549247902.0,30,
THEY WOULDN'T DO A SPONGEBOB SONG BUT A FUCKING ASMR COMMERCIAL WAS CONSIDERED A GOOD IDEA.,1549248212.0,31,:Panthers: Panthers :49ers: 49ers
https://i.redd.it/4pxwbe96lh521.jpg,1549248500.0,31,:Vikings: Vikings
Can you imagine how bad this game would have been without Romo.,1549248702.0,28,
Highlight of the entire Super Bowl: Tony Romo,1549249269.0,29,
This is just a cherry on top for this superbowl,1549249667.0,29,
Most disorganized post game I’ve ever seen lol,1549249681.0,32,:Jets: Jets
Lmao what an embarrassment of media ,1549249686.0,31,
let's hope this half isn't shit ,1549242140.0,60,:Giants: Giants
It’s gotta suck to win a championship and before you can celebrate with your family or teammates you get 40 cameras and mics surrounding you with people asking random questions. But I guess that’s why they don’t pay me the big bucks,1549249923.0,61,
[deleted],1549244243.0,29,
Did t mobile just rob r/badfaketexts?,1549244620.0,31,
Zurlien could hit a 70 yarder. Too bad the Rams will never be that close,1549244935.0,31,:49ers: 49ers
"Defense wins championships, but SHOULD defense win championships? 

*thinking face*

*proceeds to blast a hail mary toss*",1549246474.0,31,:Broncos: Broncos
We finally get Romo to a Super Bowl and he has to call this heap of garbage of a game.,1549247239.0,30,:Cowboys: Cowboys
But Andy Warhol hasn't eaten anything in years.,1549247310.0,30,:Lions: Lions
Pretty sure most of America is confused on who Andy Warhol is. ,1549247327.0,30,:Raiders: Raiders
Consider this:  Old Sheldon.  Hire me CBS I just made you another smash series,1549247386.0,30,:Steelers: Steelers
[deleted],1549247909.0,30,
TIL about the 15 second headset communication thing,1549247983.0,29,:Saints: Saints
Ballgame.,1549248085.0,29,:NFL: NFL
Why is this chick fucking whispering.  It’s creepy. ,1549248131.0,30,
ASMR ads now?,1549248210.0,30,:Seahawks: Seahawks
I want to fucking die and this game doesn't help.,1549248337.0,28,:Bears: Bears
"If it wasn't for Romo, I wouldn't even be watching this shit. ",1549248575.0,29,:Bears: Bears
I just want to see another commercial where the dilly dilly people get murdered. ,1549248626.0,30,:Seahawks: Seahawks
