text,time,upvote,flair
3 points....what an embarrassment.,1549248587.0,21,:Chiefs: Chiefs
At least McVay gets to go back to his hot girlfriend and have pity sex tonight.,1549248824.0,22,
I totally feel bad for this rams defense. Too good for this shitty rams offense ,1549249037.0,22,:Chargers: Chargers
Tom Brady is about to finish his Infinity Gauntlet,1549249239.0,21,:Lions: Lions
"Romo: 'You're never gonna see anything like it again.'

Do you promise, Tony? Because that is the best thing I could every possibly imagine.",1549249257.0,21,
Imagine the guy putting 7-figure bet on the Rams right now.,1549249300.0,21,:Seahawks: Seahawks
"If Brady wins MVP, then it's complete bullshit.",1549249434.0,21,:Seahawks: Seahawks
Fitting ending really,1549249460.0,22,:Packers: Packers
Lol and he missed. That pretty much sums up this whole game.,1549249477.0,24,:Chiefs: Chiefs
And another Patriots record! Lowest scoring SB EVER! ,1549249503.0,22,
The Fans shoud be MVP for watching that halftime show.,1549249561.0,21,:Cowboys: Cowboys
MOSH PIT!!! ,1549249664.0,22,:Falcons: Falcons
Jesus Christ back the fuck up damn,1549249688.0,23,
“Jesus are you okay?”,1549249691.0,23,:Packers: Packers
This is a cluster fuck lmao,1549249707.0,22,:Cowboys: Cowboys :Cardinals: Cardinals
Reporters can’t even get to Brady ,1549249722.0,23,:Titans: Titans
#BACK THE FUCK OFF I HAVE HIM,1549249738.0,22,:Packers: Packers
"Who cares what they have to say, fuck them...   give him some space!",1549249749.0,22,:Colts: Colts
Jesus! Are you ok?,1549250062.0,21,:Broncos: Broncos
[deleted],1549250199.0,20,
Bill has 8 rings,1549250983.0,24,:Patriots: Patriots
Verizon throttled firefighters ,1549244959.0,41,:Ravens: Ravens
First touchdown of the game. Might also be the only one. It feels really premature calling game here but I just don't see the Rams scoring a touchdown. ,1549247614.0,41,:Giants: Giants :Ravens: Ravens
[deleted],1549249724.0,43,
"""YOU JUST WON YOUR SIXTH SUPERBOWL."" ""Oh thanks I had no idea, we really won?""",1549249892.0,46,:Packers: Packers :Lions: Lions
"Goff didn't show up.

Gurley didn't show up.

Rams lose.",1549248553.0,42,:NFL: NFL
This media scrum is giving me anxiety,1549249637.0,44,:Patriots: Patriots
Tom Brady just kissed Kraft on the lips.,1549249694.0,44,
"In such an ugly rock fight of a game, it's a challenge to decide which was the best play. I submit that Jason McCourty's endzone pass breakup must be it.

It was basically the game in miniature: What looked to be a well-laid offensive plan (What separation! What a throw!) being demolished by a sudden surge of incredible defense. If you needed to summarize the tone of this game for posterity, show them that play.",1549258979.0,45,:Patriots: Patriots
Fuck you Verizon. You throttled those firefighters no ones forgetting.,1549244964.0,60,
"Idk what’s worse, the Rams offense or their attempt to do Sweet Victory at half time",1549251750.0,61,
F in the chat for sweet victory,1549254434.0,62,
Gurley's best run of the day was in this commercial,1549242464.0,20,:Eagles: Eagles
Tired of these car commercials trying to sound inspirational and tug at heart strings. YOU’RE TRYING TO SELL US SOMETHING! ,1549244063.0,22,:NFL: NFL
What the fuck Kia,1549244072.0,21,:Cowboys: Cowboys
these car commercials lol,1549244077.0,21,
This is the maroon 5 of Superbowls,1549244466.0,22,:Chargers: Chargers
Eagles are the last team to score a touchdown in the Super Bowl,1549244637.0,21,:Eagles: Eagles
Punter about to win MVP,1549244935.0,20,
Verizon care so much about first responders they will throttle their data,1549245030.0,20,:Broncos: Broncos
"SOILED IT 
SOILED IT
SOILED IT",1549245121.0,23,
"*Brady looking for a man open after play breakdown*

*Rams D leaves Edelman open*

*Brady throws to Edelman for 1st down*

Rams: ""shocked Pikachu face""",1549245290.0,22,:Vikings: Vikings
i want the final score to be 3-0 so bad. i'd also take a 6-3 OT game though,1549245291.0,21,:Giants: Giants
Really hope this ends 3-0 ,1549245297.0,22,
This is really shaping up to be the Maroon 5 of Super Bowls,1549245314.0,21,:Steelers: Steelers
This is like a Big 10 football game,1549245438.0,22,:Packers: Packers
"Is that a, a completion?",1549245605.0,19,:NFL: NFL
Let's keep in mind that thus far the lowest scoring Super Bowl ever was 14-7. ,1549245653.0,20,:NFL: NFL
Goff looks like Michael Cera,1549245667.0,21,:Browns: Browns
"G R E G

T H E 

L E G ",1549245884.0,22,:Bears: Bears
That missed FG looking big right now.,1549245919.0,20,:Vikings: Vikings
"The only way this game can be redeemed is by having them play ""Sweet Victory"" during the trophy presentation.",1549246070.0,21,:Titans: Titans
"*puts butt ontop of head*

*Loud cheering*",1549246087.0,21,
Imagine paying $4K for a nosebleed seat for this superbowl,1549246194.0,21,:Eagles: Eagles
Oh god this is gonna go to overtime and we're gonna lose our shit about the garbage OT system again.,1549246273.0,21,:Packers: Packers
This superbowl is a test by skynet. Between the boring entertainment filled with ads and all the robots...,1549246404.0,22,:Eagles: Eagles
"""If there isn't a laugh track, how am I supposed to know when to laugh?""",1549246463.0,21,:Packers: Packers
tfw a first down to your own ~20 feels like a win,1549246664.0,22,
Romo is a time traveler,1549246708.0,21,:Bears: Bears
Where is Nick Foles?,1549246948.0,23,:Colts: Colts
"Refs had a meeting before the 4th ""Not enough holding calls""",1549247060.0,20,:Rams: Rams
What hold?,1549247091.0,23,:Cowboys: Cowboys
Has a punter ever been MVP?,1549247232.0,21,
Wtf was that bk?,1549247291.0,21,:Patriots: Patriots
I think a man slowly inefficiently eating a burger is exactly what this superbowl deserves for a commercial,1549247312.0,20,:Cowboys: Cowboys
Some of these commercials are just terrible ,1549247319.0,22,:Bills: Bills
Why are Burger King commercials always so god damn weird?,1549247329.0,20,:Buccaneers: Buccaneers
Andy Warhol?,1549247339.0,20,
That ad was weirdly tasteless ,1549247344.0,22,:Bears: Bears
"Great job, Amazon.",1549247725.0,22,:49ers: 49ers
ASMR has gone mainstream,1549248117.0,21,
Why is nature silent? She’s next to a waterfall and there should be birds.,1549248131.0,21,:Broncos: Broncos
"Really, an ASMR commercial?",1549248142.0,21,:Raiders: Raiders
An interception?! Who was Goff throwing to?! ,1549248177.0,20,:Lions: Lions
Edelman is getting SB MVP. Calling it now. ,1549248179.0,22,:Packers: Packers
this is weirding me out man,1549248193.0,21,:Bengals: Bengals
Goff wasn’t ready for tonight. Made horrible reads all night. ,1549248230.0,20,
Who is the MVP right now? Edelman?,1549248351.0,22,:Cardinals: Cardinals
Well... There is nothing sweet about this victory... ,1549248495.0,21,:Vikings: Vikings
That spot provided 8% of the total yardage gained this game.,1549249068.0,22,:Chiefs: Chiefs
Shaky ass kicking game ,1549249155.0,22,:Browns: Browns
"Congrats Pats. That game was boring as fuck, but congrats on the win.",1549249291.0,21,:Ravens: Ravens
Imagine not playing Sweet Victory ,1549243084.0,61,:Patriots: Patriots
"LOL Verizon throttled first responders’ data during the wildfires in California, now they’re backpedaling and trying to sell themselves as pro-first responders.

Fuck Verizon.",1549245046.0,39,
"1st quarter: “I cant wait for some great touchdown drives”

Spongebob narrator: “3 hours later....”",1549247702.0,39,:Giants: Giants
[deleted],1549248081.0,42,
Hahahaha Jesus fuck... What a perfect way to end this shit show,1549249464.0,44,:Eagles: Eagles
START WITH THE SHIT MAROON 5 MUSIC AND FINISH WITH SWEET VICTORY,1549242590.0,40,:Packers: Packers
"Every Verizon commercial about first responders has the exact opposite effect, because it just reminds everyone of the time they fucked over California firefighter in the middle of wildfire season.",1549245151.0,41,
I think I picked the wrong game to get into football lol.,1549245426.0,41,
My dad just fell asleep. ,1549246263.0,39,:Lions: Lions
Yo I’m gonna need a breakdown of that disastrous postgame. Shit was hilarious. ,1549250016.0,42,:Bears: Bears
Why didn't LA call their timeouts at the end of the half? There wasn't room for three kneels so they would have had a chance for a safety on third down forcing the pats to hand it off,1549242461.0,20,
Fuck yeah! Wait no. Fuck no!,1549242686.0,20,
"Goddamn it, Squidward, but than fucking sicko mode",1549242722.0,20,:Bills: Bills
Remember when people like Prince and Michael Jackson did the half time show?,1549242827.0,20,:49ers: 49ers
"Mr. Krabs: We've been duped!

SpongeBob: Duped!

Mr. Krabs: Bamboozled!

SpongeBob:
WE'VE BEEN SMECKLEDORFED

Mr. Krabs:
That's not even a word and I agree with ya!",1549242854.0,22,:Dolphins: Dolphins
NO SWEET VICTORY FUCK THIS,1549242914.0,20,
I should’ve just watched a full spongebob episode instead of this,1549242916.0,19,
##**WE’VE BEEN SPECKLEDORFED**,1549243294.0,19,:Dolphins: Dolphins
Adam Levine was on the field longer than Jared Goff was in the first half ,1549243342.0,21,:Packers: Packers
*Water stunt performed with aftermarket snorkel.,1549244101.0,20,
Greatest gunner of all time,1549244578.0,20,:Panthers: Panthers
Ow tmobile stole that meme ,1549244630.0,20,:Dolphins: Dolphins
Netflix getting into the planet earth game? Fuck yeah I’m in,1549244714.0,21,
Punting record!!!,1549244894.0,20,:49ers: 49ers
PUNT RECORD!,1549244902.0,21,
Jim Nance lmao,1549244914.0,21,:Colts: Colts
Of course this game would feature the longest punt in Super Bowl history,1549244928.0,20,:Rams: Rams
Lol even the announcers are getting bored.,1549244951.0,20,:Eagles: Eagles
Verizon trying reeeaaalll hard to make us forget they throttled speeds during the California fires.,1549245128.0,19,:Buccaneers: Buccaneers
This is the polar opposite of the previous SB lol,1549245166.0,21,:Patriots: Patriots :Lions: Lions
The Rams have 82 yards and 3 first downs in Atlanta. It’s a 28-3 palindrome.,1549245186.0,21,:Saints: Saints
"Hey

Hey Verizon

Fuck you",1549245212.0,19,:Cowboys: Cowboys
If game ended right now Edelman is MVP,1549245253.0,22,
Imagine this game ends 3-2,1549245266.0,20,:49ers: 49ers
"Prediction: Everyone turns off before the 4th, then 35-31 final score",1549245299.0,19,:Bills: Bills
Is this the worst SB in the last 9 months?,1549245411.0,19,:Vikings: Vikings
"#Lowest–Scoring Super Bowls

#1 Super Bowl VII: Miami Dolphins 14, Washington Redskins 7

#2 Super Bowl IX: Pittsburgh Steelers 16, Minnesota Vikings 6

#3 Super Bowl III: New York Jets 16, Baltimore Colts 7

#4 Super Bowl VI: Dallas Cowboys 24, Miami Dolphins 3

#5 Super Bowl V: Baltimore Colts 16, Dallas Cowboys 13",1549245480.0,21,:Falcons: Falcons
Nobody and I mean NOBODY stops Goff for 9 straight 3rd downs.,1549245616.0,21,:Chiefs: Chiefs
Mannn he threw that way too late,1549245736.0,19,:49ers: 49ers
"Wow, so late on that throw, he was open in the endzone for ages",1549245736.0,20,:Eagles: Eagles
Jared Goff has 0 awareness ,1549245810.0,21,:Steelers: Steelers
OH MY GOD POINTS,1549245856.0,18,:Panthers: Panthers
"RIP, first ever Super Bowl shutout.
",1549245870.0,21,:Lions: Lions
What’s the score on the puppy bowl?,1549246256.0,20,:Raiders: Raiders :Eagles: Eagles
At this point I hope we end up with the first touchdownless SB.,1549246292.0,19,
The day after the Super Bowl should be a national holiday.,1549246308.0,21,:Browns: Browns
"Say what you want about the rest of the game, but there's been some **GREAT** punts.",1549246655.0,20,
Keep Gurley focused? You're only playing in the fuckin' Super Bowl,1549246727.0,20,:Lions: Lions
ok those adaptive controllers are fucking cool,1549246793.0,19,:Seahawks: Seahawks
How in the fuck did Weathertech.com afford a commercial?   That was like something I'd see at 3 AM.,1549246879.0,19,
"I know they keep saying he's not but Gurley has to be hurt, right?",1549246919.0,19,:Raiders: Raiders
Inb4 double OT at 3-3 🙄,1549246946.0,22,:Bills: Bills
bring SpongeBob back or we riot,1549246974.0,19,
this is setting up for the pats to win a 9-6 game and brady gets all the praise ,1549247052.0,18,:Chiefs: Chiefs
These commercials are so fucking stupid ,1549247291.0,20,:Chiefs: Chiefs
"Great game, but I'd really like to see more punting!",1549247291.0,18,
Don't eat like Andy,1549247296.0,19,:49ers: 49ers
That was the least appetizing Burger King commercial I’ve ever seen. ,1549247299.0,21,:Vikings: Vikings
Newsflash- young people don’t know who Andy Warhol is ,1549247317.0,20,:NFL: NFL
Brady chant? Yikes it’s a home game ,1549247467.0,19,:Lions: Lions
That's the end of the game right?,1549247596.0,20,:Giants: Giants
I honestly don't know if the Rams can answer. ,1549247606.0,20,:Cowboys: Cowboys
"Man in all seriousness, i dont want to go to work tomorrow",1549247625.0,20,:49ers: 49ers
Gronk is fucking ready for some Wendy's and bud light at the white house,1549247661.0,20,:Broncos: Broncos
If you have a spider in your face talk to your doctor. ,1549247744.0,20,:Browns: Browns
Vote Tony Romo for MVP.,1549247745.0,19,:Cowboys: Cowboys
r/popping is gonna lose it when they see that commercial. ,1549247784.0,20,:NFL: NFL
What the hell was that Goff?,1549248147.0,19,:Bears: Bears
Fucking ASMR? **CREEPIEST. COMMERCIALS. EVER.**,1549248169.0,22,:Rams: Rams
"Hate the sound of people whispering. Not sure why, but incredibly annoying. ",1549248298.0,22,:Browns: Browns
[deleted],1549248302.0,22,
Anyone get a screen cap of McVay's 1000 yard stare Vietnam PTSD flashback? ,1549248701.0,20,:Packers: Packers
This game looks like if the NFL did a consolation game for people who were close to making the playoffs or something. ,1549248840.0,20,:Seahawks: Seahawks
Awful spot. ,1549249045.0,21,:Cowboys: Cowboys
I would like to thank jared goff for wasting millions of people's time tonight,1549249204.0,18,:Vikings: Vikings
This was such a bad game smh,1549249289.0,20,:Bills: Bills
I’m a Rams fan and even if we came back and won I think id still be bored,1549249320.0,19,:Rams: Rams
I feel robbed of my Sunday after this lmao,1549249444.0,21,
That reporter is getting mobbed lol,1549249564.0,22,:Texans: Texans
"Dude this reporter chick is buried


Lmao",1549249599.0,21,:Steelers: Steelers
Wow. Those guys trying to live but they get swarmed by the media.,1549249636.0,20,:Dolphins: Dolphins
"Boy, CBS is blowing this lol ",1549249681.0,22,:Patriots: Patriots
This post game had given me more anxiety than any sporting event in history,1549249787.0,20,
That rapper looked like he came out of mad max,1549251316.0,20,
"Verizon: Remember when we shut off the first responders (CA fire fighters) phones? We love first responders, honest!",1549244999.0,39,
"So to update you all. My daughter's tea party went off without a hitch. ""Baby"" the Cheetah was a very gracious dessert ""go getter"" but I got a bad feeling about B-Bot the Transformer. Shifty eyed bastard that one. ",1549246892.0,36,:Lions: Lions
"No Sweet Victory

Adam Levine shirtless

Paririots leading with 3 min left after no one scoring all game

Worst.",1549248395.0,43,:Buccaneers: Buccaneers
Tony Romo is a FANTASTIC commentator. He does EXACTLY what I love in commentators. They give great insight about plays and rules most viewers aren't familiar with - but - they don't compete with the game. They're simply an addition. ,1549248729.0,41,:Giants: Giants
"The ending was worth it. 

That was a **cesspool**.

Hilarious.",1549250035.0,39,:Seahawks: Seahawks
"I can stand the football game, even if many considered it awful. I could manage the half time show.

But I shall not watch another shitty talent show. To netflix!",1549251427.0,40,:Titans: Titans
Did they really make a show about white people tiptoeing around black people,1549246337.0,55,:NFL: NFL
I’m never going to feel comfortable drinking in the same room as michelob anymore,1549248160.0,41,:Chiefs: Chiefs
Edelman for super bowl MVP ,1549250229.0,39,
Lol that was a great commercial ,1549242443.0,18,:Cowboys: Cowboys
THAT BETTER HAVE BEEN A TEASER FOR IT ,1549242784.0,20,
How dare they play sweet victory for 3 seconds,1549242814.0,20,:Chargers: Chargers
Somebody better have a nip slip to save this halftime show,1549242886.0,20,
Thank god big boi showed up this was tanking real quick,1549243126.0,18,
Is it me or was that the worst first half in a SB in recent memory? ,1549243175.0,17,:Giants: Giants
NFL producers busting a nut at an injury because they can run more ads...,1549243969.0,19,:Giants: Giants
"Since there's no ""Sweet Victory,"" whoever takes this game has to settle with an ""Alright Win""",1549244326.0,19,:Panthers: Panthers
The funniest ending imaginable would be for this game would go into OT 3-3,1549244397.0,18,:Dolphins: Dolphins
If this holds u think Tom is gonna kiss Edelman on the mouth during the MVP presentation ,1549244662.0,17,:Packers: Packers
what is with the robot commercials this year,1549244735.0,20,:Patriots: Patriots
HISTORY HAS BEEN MADE,1549244941.0,19,:Jaguars: Jaguars
This commercial yikes,1549244977.0,20,:Eagles: Eagles
Is Alicia Keys fused to that piano,1549245010.0,19,:NFL: NFL
Would a punter possibly get MVP if this game ends 3-0?,1549245037.0,19,:Giants: Giants
This has to be the worst Superbowl I’ve watched since the Broncos Seahawks,1549245195.0,19,
Everyone bitching all year how defence is dead and the season is coming down to two defences. Who would’ve expected that?,1549245272.0,20,
"As someone who’s square is 3 - 0 on a 500$/qtr SB board, this is an above average night. ",1549245335.0,19,:Jets: Jets
Hey I remember that graphic! Looks like the Bears offense summary from 2014-2017,1549245466.0,18,
[deleted],1549245661.0,19,
"CJ ""the chungus"" Anderson ",1549245765.0,18,:Raiders: Raiders
Tony Romo’s The most entertaining part of this game AND he’s doing it in Skechers?? Amazing,1549245964.0,19,:Bengals: Bengals
Oh good I really wanted another talent show,1549246026.0,19,:Panthers: Panthers
I'd like to extend a big F to anyone who bet the over for this game,1549246030.0,17,:Colts: Colts
Wise of Patterson to wear a gold chain with Talib in the game.,1549246055.0,21,:Patriots: Patriots
Romo trashing his own crew lol,1549246117.0,20,:NFL: NFL
"""hey guys, missed the first half, halftime, and 3rd quarter...what did I miss?""

you lucky son of a bitch",1549246309.0,21,:Broncos: Broncos
This is a punter’s league.,1549246485.0,20,:Rams: Rams
"If the Pats lose, we might need the Lombardi trophy photoshopped into that play",1549246632.0,19,:Browns: Browns
I hate the Pats but if they win 6-3 I'll be much less upset than if it was like 28-24,1549246744.0,18,:Broncos: Broncos
"Man, this game has it all: punts, passes for loss, punts, false starts on the QB, and punts.

What more could you hope for in a Super Bowl?",1549246746.0,19,:Eagles: Eagles
I thought this weathertech stuff was a joke,1549246807.0,18,:Seahawks: Seahawks
We could've had the Chiefs and Saints,1549246819.0,19,:Seahawks: Seahawks :Chiefs: Chiefs
Verizon throttles firefighter’s data during wild fires then has a commercial honoring them 😂😂,1549246987.0,19,
[deleted],1549247038.0,18,
Terrible call,1549247078.0,19,:Broncos: Broncos
I hate the rams so much right now,1549247275.0,18,:Steelers: Steelers
3rd and 22 and a run is LITERALLY giving up on the drive.,1549247285.0,18,:Steelers: Steelers
I don't want to eat like Andy.  ,1549247301.0,19,:Steelers: Steelers
I love to put ketchup on the side and dip. BUT WHY DID HE TAKE THE BUN OFF,1549247330.0,19,:Lions: Lions
Burger King’s commercial was more exciting than this game ,1549247349.0,19,:Cowboys: Cowboys
Did BK just put a commercial from circa 1989 on TV during the Super Bowl? And not even a particularly memorable one?,1549247398.0,20,:Seahawks: Seahawks
[deleted],1549247440.0,19,
The first play in the redzone OF THE ENTIRE GAME is with 7 minutes left in the 4th quarter. ,1549247609.0,19,:Seahawks: Seahawks
Imagine betting on Sony to score first TD of game and having to wait until the game is almost over to spend your winnings,1549247633.0,19,:49ers: 49ers
NFL not letting us vote for punters for MVP?,1549248002.0,19,
LOL goff,1549248073.0,17,:Steelers: Steelers
Lol Goff ,1549248082.0,19,
[deleted],1549248241.0,19,
And that’s the ball game folks. Another ring for Brady. ,1549248242.0,19,:49ers: 49ers :Jets: Jets
Goff wasn’t ready for this game it appears sadly.,1549248246.0,20,:Seahawks: Seahawks
"Honestly one of the worst games of the season, counting the pro bowl",1549248608.0,18,:NFL: NFL
"Eli didn’t show up playing or in a commercial this year 

There’s your reason why folks",1549248740.0,19,
McVay is gonna be in r/watchpeopledieinside ,1549248770.0,19,
Imagine the game we could have had if Dee Ford had eyes.,1549248980.0,21,:NFL: NFL
He wasn't even that close,1549248990.0,20,:49ers: 49ers
"Shout out to all the Rams fans with significant others who just said ""it's just a game""",1549249139.0,19,:NFL: NFL
Rams defense did everything right. Offense...nah.,1549249273.0,18,
Rams gonna go out with a whimper lol this is kinda sad ,1549249280.0,20,
Good luck to everyone’s team next year. ,1549249297.0,18,
"Have to watch the Patriots win *AGAIN*; no Spongebob ""Sweet Victory""; weakest batch of Super Bowl commercials I've ever seen...",1549249359.0,19,:Seahawks: Seahawks
Holy sht 13-3 final score seems so surreal.,1549249522.0,18,:Cowboys: Cowboys
This is only worth it if Tom retires.,1549249555.0,20,:Panthers: Panthers
What is with these camera fucks?,1549249603.0,18,:Packers: Packers
This audio tho.,1549249656.0,17,
CBS embarrassment ,1549249668.0,18,:Commanders: Commanders
They shouldn't allow the media to rush the field like that after the game. What a shit show.,1549249748.0,21,:Rams: Rams :Lions: Lions
And now the ceremonial forcing two grown men to make small talk covered in giant confetti,1549250921.0,18,:Eagles: Eagles
Belichick sounds so different when he isn't annoyed at the media,1549250960.0,19,:Vikings: Vikings
End with Sweet Victory you cowards ,1549243220.0,39,:Patriots: Patriots
[removed],1549244065.0,40,
That Bubly commercial was great,1549244079.0,38,:Vikings: Vikings
Okay this frozen food ad hit too close to home,1549245002.0,34,:Giants: Giants
"DIDN'T VERIZON FUCK WITH THE CALIFORNIA WILDFIRES SITUATION??? WTF (you're cool firefighters and Lynn, that's my coach)",1549245026.0,39,:Chargers: Chargers
"""We got a scoring spree going on!""

lmao",1549245928.0,36,:49ers: 49ers
"I'm a cynical guy and that was honestly a pretty touching commercial. That ""hes not different when he plays"" line got me",1549246850.0,41,:Seahawks: Seahawks :Seahawks: Seahawks
Actually fucking pathetic. ,1549249435.0,35,:Steelers: Steelers
CBS completely mishandled that end game interview. Patriots security had to protect her from the madness. CBS should be ashamed for not sending their own security for that on field. ,1549250210.0,40,:Broncos: Broncos
"Meanwhile in an alternate universe, the Saints vs KC Superbowl is a close one at 74-71 points. ",1549246726.0,54,:Lions: Lions
"We don't need an ASMR commercial to help us fall asleep, this game took care of that sometime in the second quarter.",1549248177.0,52,:Packers: Packers
T Mobile’s whole fucking ad campaign is just reddit reposts.,1549248882.0,51,:Titans: Titans
The highlight of this SB was the unexpected crossover between Bud Light and Game Of Thrones.,1549250250.0,52,:Packers: Packers
We all deserve a Super Bowl ring for having to suffer through 4 hours of this. ,1549248762.0,125,
/r/bikinibottomtwitter is livid right now,1549244388.0,34,:NFL: NFL
"Saints vs Chiefs.

Imagine the possibilities. ",1549245141.0,37,:Seahawks: Seahawks
ASMR commercial?,1549248130.0,41,:Chargers: Chargers
"This has been a total waste of my evening. 

",1549249481.0,36,:Saints: Saints
God those reporters are pricks. Back the fuck up.,1549249738.0,34,:Chargers: Chargers
"Fuck this those guys in the other thread were right. Like 5 seconds of spongebob and that’s it.

Fuck this stupid halftime show.",1549242758.0,69,:Panthers: Panthers
The Neighborhood is funny because BLACK! HAHAHAHAHA!,1549246309.0,109,:Eagles: Eagles
Fuck that noise. That was the spongebob moment???,1549242707.0,64,
This NFL100 comercial is lit,1549242492.0,18,:Buccaneers: Buccaneers
"Greatest football commercial ever 

End Game
 
We’re done here ",1549242520.0,18,:Jaguars: Jaguars :Eagles: Eagles
That was all? I feel ripped off.,1549242707.0,19,
IT'S HAPPENI....... wait wtf...... NOOOOOOOOOO,1549242728.0,16,
I'm jealous of deaf people right now.,1549242980.0,18,
Bro. What is the fucking THEME of this halftime show.  ,1549243072.0,16,:Broncos: Broncos
Reddit servers worse than that halftime show,1549243878.0,19,:Giants: Giants
So serious for just a Kia commercial,1549244041.0,16,:NFL: NFL
"Kia commercial lol, this isn’t good. This thing you’ve assembled. It’s not good. It’s not famous. Or incredible",1549244049.0,18,
If that was me they would have to cancel the game because I would be rolling on the ground still and crying...take a good day or two for me to get up.,1549244208.0,16,:Eagles: Eagles
The best part of the superbowl game threads is that literally no one reads anyone elses comments,1549244628.0,17,:Broncos: Broncos
Netflix with the Planet Earth clone. I'm there ,1549244662.0,18,:Dolphins: Dolphins
"Oh shit, Our Planet looks awesome",1549244680.0,17,:Steelers: Steelers
"Oh shit, new nature doc! Time to get stoned and watch Our Planet

More hyped about this than the game",1549244701.0,17,
Holy jesus how many robot commercials do we need,1549244722.0,18,:Bears: Bears
"I am an oracle, here to predict your future:

You will soon watch the Rams run the ball twice, Goff throw an incompletion on third and long, and a rushed punt give the ball back to the Patriots at the 40.",1549244744.0,17,
"This has been, from top to bottom, the worst Super Bowl of all-time so far. 

Hope it picks up. ",1549244767.0,19,:Colts: Colts
[deleted],1549244794.0,20,
