text,time,upvote,flair
How dare he do this to Black Betty. Somebody needs to RamJam that mic up his ass for this.,1580678815.0,4,:Browns: Browns
Damn they’re thick,1580678840.0,3,
Why couldn't David Gilmour or James Taylor be born in Miami so that they could be performing instead of this charlatan?,1580678873.0,4,:Eagles: Eagles
Everyone wearing red this super bowl...,1580678941.0,3,:Saints: Saints
"Pitbull getting old.... 
Which reminds me


I'm getting old 

:(",1580678946.0,4,:Raiders: Raiders
"The Super Bowl in the words of Vince Lombardi (well the Dan Lauria portrayal of the legendary coach at least)

""Gentlemen, I firmly believe that any man's finest hour... his greatest fulfillment of all that he holds dear, is that moment when he has worked his heart out in a good cause and lies exhausted on the field of battle... victorious.. Gentlemen, THAT moment is waiting on you, it's waiting on every man in the 49ers locker room, it's waiting on every man in the Chiefs locker room.. What separates the Super Bowl from any other game.. is that a Super Bowl is always remembered.. it's not just another 60 minutes of football.. It's 60 minutes that can define you forever as a winner.. 

You know people ask ""Is winning the only thing?"", well my answer to them.. is my answer to you.. ""**ASK YOURSELF THE DAMN QUESTION""** IS WINNING THE ONLY THING TO **YOU?!!** IS IT WHAT **YOU** WANT?!! DO **YOU** WANT TO BE REMEMBERED AS A WINNER or as something else? 

Playing in the Super Bowl is about playing in a game that will define you forever... Make this game your finest hour..  I'll be waiting for you..""",1580678963.0,4,:Dolphins: Dolphins
"it's 7.30am in Australia, when do I start drinking tia",1580679044.0,5,:49ers: 49ers
"Pizza hut, barf",1580679126.0,4,
Pizza Hut just wasted how ever many dollars it cost to do this commercial.,1580679150.0,5,:Chiefs: Chiefs
Joe Buck being funny feels weird.,1580679192.0,4,:Browns: Browns :Bills: Bills
STOP BREAKING KAYFABE,1580679292.0,4,:Patriots: Patriots
im guessing tonight that LIZZO will come out during halftime show and start twerking.,1580679305.0,4,:Panthers: Panthers
When they said James Palmer I got excited cause I thought they said Robert Palmer. But it was not Robert Palmer.,1580679443.0,4,:Chiefs: Chiefs
Does anyone from the UK know roughly what time the third quarter will be? I doubt I'll be able to stay up for the whole game but if I could wake up to watch the ending that'd be sweet.,1580679581.0,3,
If we don’t get a drunken Brett Hull cheering on the Chiefs then I declare the whole event a shambles,1580679842.0,4,:Vikings: Vikings
Alright. My prediction: San Fran gets up big early and holds off rabid comeback to win... I'm gonna say 38-30,1580680309.0,5,:49ers: 49ers
Lived in the Bay for 22 years and spent 4 years living in KC during college. Happy to see both of these teams getting to fight each other for the win. Still miss my Kansas City Longboards wraps or the amazing BBQ at Jack Stacks.,1580680329.0,4,:49ers: 49ers
49ers 36-Chiefs 28,1580680349.0,4,:Panthers: Panthers
#ITS LITTLE JOE,1580680463.0,4,:Panthers: Panthers
Seems like there’s someone on the graphics team that’s getting scolded right now,1580680573.0,4,:Jets: Jets
DAE think Fox is the worst of the 3 networks that broadcast the NFL? (not counting ESPN since they only get one game/week),1580680601.0,4,:Broncos: Broncos
Can’t be mad at either coach getting the win. Reid’s earned it for his career and Shanny would be proving that he’s legit and not just a legacy hire,1580680612.0,3,:Lions: Lions
"FOX Pregame:

Watch 5 guys make the trek to the stadium.",1580680835.0,4,:49ers: 49ers
Kitten Bowl is starting,1580680875.0,3,
Jesus Christ,1580681009.0,5,:Eagles: Eagles
They should just start playing now,1580681010.0,4,:Ravens: Ravens
I can't see Glazer.,1580681025.0,4,:Cowboys: Cowboys
Only halfway through this pregame thread but it already has 21 times as many people as the average lions thread,1580681029.0,4,
"DJ Khaled’s real name is


Khaled Khaled",1580681029.0,5,:Lions: Lions
Howie: “wtf is this shit”,1580681048.0,5,
Same Damn Time beat as the Fox pregame crew's walk-up music. Incredible.,1580681054.0,4,
DJ Khalid really doesn’t need a microphone. Everyone in that stadium can hear him.,1580681057.0,4,:Browns: Browns
What if the real Super Bowl was the friends we made along the way?,1580681082.0,4,:Vikings: Vikings
Joe Buck should be color commentating the Puppy Bowl,1580681084.0,4,
Andy Reid was born a healthy 20 lbs 8oz.,1580681108.0,4,:Cowboys: Cowboys
Fox is confirming that Chiefs HC Andy Reid (Food Coma) will be coaching today,1580681118.0,4,:Chiefs: Chiefs
"Does anyone else remember watching the SB33 pregame show when [Kiss was the musical act?](https://youtu.be/4SNZ217ZTB8?t=24) They put all of their stage effects into one song, pyro, bombs, fireworks, smashing guitars, and a hundred dancers on the field in Kiss makeup.  

The video I found doesn't show it, but after the song, the original broadcast cut back to Terry, Jimmy, and the gang sitting at their desk looking totally shell-shocked. They were like, ""Uhhh...okay...we'll be right back...""",1580681118.0,5,
First Super Bowl I can think in my entire life there isn’t a genuine favourite.. should be interesting,1580681305.0,4,:Patriots: Patriots
I don’t care who wins this game I just hope it’s a good one,1580681316.0,3,:Packers: Packers
that Reid dab has to be the cover of the next Madden,1580681327.0,4,:Cowboys: Cowboys
"I cannot stop pronouncing it ""Super Bowl Liv"".",1580681332.0,4,:Broncos: Broncos
"Fellas, where’s the Champ?",1580681394.0,5,:Bears: Bears
I want to see Andy Reid throw a touchdown pass.,1580681428.0,4,:Cowboys: Cowboys
"Final game of the season until fall, boys. Let's hope for a good one.",1580681455.0,4,:Texans: Texans
Holy shit I'm waiting for the match all day and there is 1.30 hours more,1580681482.0,4,:Ravens: Ravens
"We Dolphins fans wanted Tannehill to come back to Miami and sit in his old locker, but instead we got Matt Moore to come back to Miami and sit in his old locker.",1580681495.0,5,:Dolphins: Dolphins
Went for Yellow Gatorade and Over 2.5 JLo dress changes,1580681563.0,3,:Packers: Packers
I have a feeling Flo Rida is going to make an appearance at the halftime.,1580681655.0,4,:Bengals: Bengals
Its time for Superbowl 54.......in an hour,1580681733.0,3,:Cowboys: Cowboys
What the fuck is this lol. Everyone has an anime character instead of their picture?,1580681828.0,5,:Broncos: Broncos
Prediction: San Fransisco will win in overtime on the first drive creating controversy and the rule will be changed so that both teams get at least one drive in overtime in the playoffs.,1580681868.0,3,
Super Bowl crowds are the worst,1580681968.0,4,
In my 30 years of watching the super bowl this might be the first time I watch the halftime show. Can't go wrong with two mature hotties.,1580681982.0,5,:Jets: Jets
Excited for Rick and Morty commercial!,1580682003.0,4,:Patriots: Patriots
all i see red fans out there,1580682033.0,4,:Rams: Rams
Let's go Chiefs. That fat bastard is one helluva football coach and deserves a ring,1580682057.0,4,:Titans: Titans
Aaron Rodgers made it to the Superbowl. In a State Farm commercial.,1580682058.0,3,:Giants: Giants
Surprised State Farm didn’t get permission to photo shop Garappalo’s face over Rodgers’.,1580682092.0,3,
Here's hoping the power grid is more reliable at the Hard Rock Stadium than at the Superdome.,1580682093.0,4,:NFL: NFL
Is there any chance a specific player retires if their team wins tonight?,1580682104.0,3,
"I've got my food, white claw, weed, and bet put in.  Lets fucking go.",1580682153.0,5,:Packers: Packers
Is it actually going to start at 6:30 or is that just when the program starts?,1580682184.0,3,:Commanders: Commanders
Rob riggle has the most punchable face,1580682245.0,4,:Patriots: Patriots
I want a full music video of Jimmy G looking for his helmet now.,1580682257.0,4,:Bengals: Bengals
Who uses A-Rod as a spokesperson?,1580682287.0,5,:NFL: NFL
Catrick Meowhomes the goat,1580682342.0,4,:Giants: Giants
What time should I tune in?,1580682360.0,4,
Patriots managed to get in Superbowl,1580682378.0,6,:Rams: Rams
Do all NFL players have each other’s number? Maybe they are in one huge group text 🤔,1580682396.0,4,:Buccaneers: Buccaneers
"Remember, no more Riggle sketches after tonight!",1580682417.0,5,:Bears: Bears
Predict- SF opens with a deep shot off of play action after all this talk about Jimmy G not throwing.,1580682478.0,3,:Packers: Packers
M......v .......p..... three letters are very hard to remember,1580682515.0,4,:Jaguars: Jaguars
"Jimmy G should go make movies. I could see him doing Fast & Furious or something.

Please, Jimmy.",1580682531.0,3,:Seahawks: Seahawks
Jimmy G is a fookin gamer,1580682566.0,3,
"Jimmy G gonna be a 3 time SB champ if he wins, that's kinda crazy lol",1580682613.0,4,
Jimmy seems like such a good dude,1580682661.0,4,
That wrinkle commercial was weird.,1580682701.0,3,:Giants: Giants
I hate that SpongeBob is 3D,1580682713.0,4,:Panthers: Panthers
Wasn't Gary being missing an episode of SpongeBob before? Or am I losing my mind,1580682749.0,4,:Giants: Giants
New spongebob is ass,1580682759.0,3,:Ravens: Ravens
I will never understand TikTok,1580682868.0,4,:Vikings: Vikings
So what food y'all chowing down on and better question: have you already eaten it all before the game?,1580682885.0,6,
[deleted],1580682941.0,4,
"One thing that repeats itself every SB with a big name MVP QB- they are surprisingly stifled. Even the example of the success story of an elite offense winning the SB (1999 Kurt Warner and the Greatest Show On Turf) were having trouble most of the game against the Titans. 02 Gannon, ‘07 Brady, ‘13 Peyton, ‘16 Ryan - MVPs having trouble somewhere in the game and losing. Not to mention where ‘04 Peyton, ‘11 Rodgers,  ‘18 Mahomes, ‘19 Jackson ended up losing big playoff games. And it makes sense, this is the biggest test. 

I don’t see anything stopping the Locomotive 49er train today, rooting for Mahomes of course- but that’s not enough. My football eyes just don’t see it. If anything, that makes it even more exciting of Mahomes pulls this off.",1580683172.0,3,:Seahawks: Seahawks
"Pizza, Wings and a cold one at the ready.....I think I’m prepared.",1580683246.0,4,
"""He whips it over handed he whips it under handed""-extenze mascot",1580683246.0,3,:Jaguars: Jaguars
I’m ready to break Reddit tonight.,1580683261.0,5,:Eagles: Eagles
Go red team!!!!,1580683295.0,4,:Cardinals: Cardinals
Who’s going to win? And why will it be the 49ers?,1580683313.0,4,
Hannity color commentating the game?,1580683321.0,3,
"very important question to note: the offense/defense commercial with polamalu and mahomes, mahomes says defense first so doesn't that mean he loses??",1580683412.0,4,:Ravens: Ravens
"Is FOX always grainy quality or is it just me?

Versus NBC, where it is HD.",1580683542.0,5,
Is this what hell sounds and looks like?,1580683564.0,3,:Bears: Bears
Hold up is Dr. Phil a chiefs fan?,1580683566.0,3,:Chiefs: Chiefs
How are there 2 Pitbulls,1580683586.0,4,:Titans: Titans
this is the first super bowl i’ve ever watched where I don’t care who wins,1580683597.0,3,
Remember everyone win or lose we still booze,1580683603.0,4,:Packers: Packers
What was that ?,1580683627.0,5,
49ers smacked the packers twice and helped me win my fantasy league...Let’s to 9ers,1580683649.0,5,:Lions: Lions
"What do you call a cow with no legs? 


Ground beef!



-NFL pregame show apparently",1580683662.0,5,:Browns: Browns
"No matter who we cheer for tonight, we should all be thankful for another year without having to watch the Patriots play the Cowboys in the Super Bowl.",1580683786.0,3,:Bills: Bills
Is Joe Buck self aware,1580683923.0,4,
"As an impartial fan, this is the most excited I’ve been for a SB in a while now. I hope it’s a close game. Doesn’t matter if it’s 31-28 or 17-14. I just don’t want to see one team win by 3 scores.",1580683993.0,5,:Vikings: Vikings
#BOOOOOOOOOOOOOOOOOOOOMARTHAFIRESTONEFORDBOOOOOOOOOOOOOOOOOOOOO,1580684104.0,4,:Lions: Lions
Have we always been at war with Eastasia?,1580684104.0,5,:Packers: Packers
"Chiefs - you've waited 50 years for this. You need to seize the moment. It's your time. Nothing can stop you. Don't fuck this up. Beat the 49ers, and keep them out of the 6 Super Bowl club.",1580684127.0,4,
I love America more than I love my own son,1580684132.0,4,
"Listened to Johnny Cash yesterday, but not this song. I kind of see the future",1580684133.0,4,:Dolphins: Dolphins
"Inject that fuckin War of 1812 re-enactment into my veins, NFL.",1580684161.0,4,:Bears: Bears
Every Super Bowl theres always the surprises comments about the obligatory USA wank before kickoff.,1580684161.0,4,:Bills: Bills
I'm all about America and democracy but why does this have to be 5 minutes long?,1580684162.0,5,:Dolphins: Dolphins
"Lmao, as a non-NFL viewer, what in the ever love does this have to do with football?",1580684183.0,5,
Wtf i love america now,1580684184.0,3,:Seahawks: Seahawks
Doleman 💜💛💜💛,1580684223.0,6,:Vikings: Vikings
RIP KOBE................ GAWD,1580684241.0,2,:Rams: Rams
Kobe!!!,1580684247.0,4,:Jets: Jets
WILDER FURY HYPE,1580684254.0,3,
Kobe!,1580684300.0,3,:Cowboys: Cowboys
Why are people so bad at moments of silence,1580684307.0,3,:Patriots: Patriots
49ers +2 BOOK IT,1580684324.0,3,:Cardinals: Cardinals
"Way to play it cool, dude in the Kobe jersey.",1580684335.0,5,:Eagles: Eagles
Wilder Fury II is gonna be lit and everybody is gonna hate how it ends no matter what.,1580684351.0,4,:Patriots: Patriots
"I kind of thought they would have the Kobe tribute a little closer to the anthem honestly, but it doesn’t really matter",1580684373.0,5,:Dolphins: Dolphins
"So do Super Bowl commercials ""officially"" start after kickoff? Like Fixodent didn't pay $3 mil for this pregame ad right?",1580684390.0,4,:Eagles: Eagles
Wtf kind of commercial was that? Lmfao,1580684461.0,4,:Buccaneers: Buccaneers :Steelers: Steelers
https://www.reddit.com/r/nfl/comments/exx0qr/super_bowl_liv_game_thread_san_francisco_49ers/ Everyone lets Moved!!!,1580684474.0,4,:Rams: Rams
"As an Iowa fan, so cool seeing Kinnick and coach Ferentz!!",1580684538.0,4,:Chiefs: Chiefs
PRE KICK SHOW  30 MINUTES TOGO,1580684562.0,3,:Rams: Rams
#LOOK AT THOSE NEW GRAPHICS,1580684578.0,3,
"Josh Brolin makes me wet. 

I’m a male.",1580684592.0,5,
"Here’s that Iowa ad I mentioned earlier: https://imgur.com/a/F1WWMTi

Edit: [Previous comment](https://www.reddit.com/r/nfl/comments/exun4w/super_bowl_liv_pre_game_thread_san_francisco/fgdnas6/?utm_source=share&utm_medium=ios_app&utm_name=iossmf)",1580684641.0,4,:Patriots: Patriots
Joe Buck internal monologue: “How can I make this about me?”,1580684656.0,4,:Lions: Lions
Gus Johnson should call FOX Super Bowls instead of Joe Buck.,1580684698.0,5,
STAND YOU LAZY REDDITORS,1580684727.0,3,:Rams: Rams
RIP everyone not there,1580684799.0,5,:NFL: NFL
100 greatest players who haven’t sued us for CTE,1580684801.0,4,
🐻⬇️!!,1580684835.0,4,:Bears: Bears
Oh shit Shula is old fuck,1580684841.0,4,:Cowboys: Cowboys
I fucking love Jerry Rice.,1580684860.0,3,:Buccaneers: Buccaneers
Jerry Rice wants some reps lol,1580684891.0,3,:Giants: Giants
RICE IS READY,1580684892.0,4,:Rams: Rams
Damn one of Bill's rings looked like an avocado,1580684914.0,4,
bill smile .. what is happening,1580684915.0,6,:NFL: NFL
RIP Reggie,1580684918.0,3,:Packers: Packers :Cardinals: Cardinals
# DICKTA,1580684948.0,4,:Lions: Lions
I thought Deion's first name was Neon?,1580684954.0,4,:49ers: 49ers
Darth Hoodie with the hardware!,1580684961.0,3,:Patriots: Patriots
Bill literally flexing on us on our home field.,1580684978.0,3,:Dolphins: Dolphins
I’m ready to spend the next 3-4 hours shitposting with y’all,1580684982.0,4,:Vikings: Vikings :Dolphins: Dolphins
Surprised Goodell didn’t make them put “greatest commissioner of all time” in there,1580684983.0,5,:Vikings: Vikings
Fox is gonna blow their entire CGI budget on this game lmao,1580684993.0,3,:Steelers: Steelers
"Teams, skills, names, nicknames., positions, stadiums... Is there a more disorganized way to list 100 players? This is giving me an anxiety attack.",1580685008.0,4,:Broncos: Broncos
this is a nice tribute to 100 years,1580685010.0,4,:Cowboys: Cowboys
Where's OJ?,1580685020.0,4,:NFL: NFL
I could see Schula organizing a Rascal street racing circuit.,1580685043.0,6,:Cowboys: Cowboys
OJ will never be canceled.,1580685069.0,3,
They did such a good job with that presentation. Well done.,1580685071.0,4,:Buccaneers: Buccaneers
Crocs out 4 Favre,1580685081.0,4,:Packers: Packers :Chargers: Chargers
Anyone else expect Brady and Peyton to shove each other lol,1580685092.0,4,:Texans: Texans
Hey I know them,1580685097.0,4,:Titans: Titans
The shade to the Chiefs showing a Montana 49ers TD pass,1580685113.0,4,:Lions: Lions
"Does Favre ever wear anything but a black tshirt?

I bet it’s Copper Fit too",1580685113.0,4,:Patriots: Patriots
Brady is there,1580685119.0,4,
Barely any attention for the man who saved us from invading Martians smdh,1580685123.0,4,
THE LEGENDS OF THE GAME,1580685136.0,2,:49ers: 49ers
Its nice of Bill to come up from his throne.,1580685148.0,4,:Cowboys: Cowboys
"OJ firing up his Twitter  
  
#HEY TWITTER WORLD",1580685241.0,3,:Texans: Texans
I’m ready to hear joe buck make the entire super bowl about the one player he saw in the hotel bathroom yesterday,1580685263.0,3,:Lions: Lions
"super bowls and Tom Brady, name more of an iconic duo",1580685281.0,5,
I love the Rock.,1580685335.0,4,:Saints: Saints
I am so here for the XFL.,1580685348.0,4,:Panthers: Panthers
Dwayne is such a good dude.,1580685374.0,4,:Steelers: Steelers
"If you want a hype man, you can't really pick a better one than The Rock",1580685377.0,3,:Packers: Packers
I'm okay with more of the Rock in the NFL.,1580685406.0,4,:Raiders: Raiders
Is it just me or are Joe Buck's pants uncomfortably tight?,1580685437.0,5,:Vikings: Vikings
Why is The Rock auctioning off the players to a bunch of debutantes?,1580685475.0,4,:Broncos: Broncos
oh this is a KC home game lmao.,1580685537.0,4,
And there’s another 5 million dollars in the Rock’s pocket,1580685542.0,3,:Giants: Giants
[LEGION OF ZOOM](https://youtu.be/vVrjh-1CTtQ),1580685555.0,5,:Titans: Titans
Uhh they need to give the rock however much money be wants to announce every team for every game from now on,1580685564.0,4,
LETS BRING BUMGARNER OUT THE TUNNEL JUST TO FUCK WITH KC,1580685588.0,4,:49ers: 49ers
Shanahan always dresses like a guy at a Limp Bizkit show in 2001.,1580685617.0,4,
"From The Rock on the mic to Chris Myers cringing out the word ""swag"" is too much of a stylictic whiplash for my mind to handle.",1580685617.0,3,:Broncos: Broncos
Oprah and The Rock would probably have a decent chance to at least win the nomination lol,1580685708.0,4,:Vikings: Vikings
Anyone see that failed PETA ad they attempted to air?,1580685742.0,4,:Vikings: Vikings :Dolphins: Dolphins
Okay so we need a shot of the lady screaming at the tornado looking up through her open sun roof.,1580685816.0,3,:Packers: Packers
My whole mood is the Super Bowl Signing Chick,1580685848.0,3,:Chargers: Chargers
Even sign language ladies have swag now,1580685855.0,4,:Jaguars: Jaguars
Don't gotta be saluting this song ppl,1580685856.0,4,:Dolphins: Dolphins
"you look great, Sun kim!",1580685872.0,4,
Dude I feel bad for the players that get all hyped and then have to stand for an hour through all this bullshit,1580685895.0,5,:Seahawks: Seahawks
"Hires professional signer

Doesn't show the signing on the broadcast",1580685899.0,4,:Steelers: Steelers
Kids saved it by going faster,1580685930.0,4,:Broncos: Broncos
Let's see who wins the first prop of the night. She's going fast...,1580686016.0,4,:Dolphins: Dolphins
"actually, this is the best she's looked in a long time.. and sounded",1580686034.0,3,
Show people standing up for this in their living rooms next.,1580686085.0,4,:Lions: Lions
Show the planes again!,1580686119.0,5,:Ravens: Ravens
"No Top Gun song, I feel robbed",1580686177.0,4,:Seahawks: Seahawks :49ers: 49ers
Demi got some pipes!,1580686195.0,3,:Bears: Bears
Super Bowls when it’s dark outside > Super Bowls when it’s light outside,1580686214.0,5,:Cowboys: Cowboys
What a great commercial for sweaty clam deodorant,1580686246.0,4,:Lions: Lions
"Wow, a woke commercial",1580686258.0,5,:Dolphins: Dolphins
I missed the “woke” commercial what was it about,1580686277.0,3,:Dolphins: Dolphins
A lego competition show? Hardest of nos.,1580686303.0,5,:Falcons: Falcons
That commercial is pure cringe. Virtue signal harder won’t you,1580686320.0,5,:Buccaneers: Buccaneers
"Ah yes, the no-call ref",1580686338.0,3,:Vikings: Vikings :Dolphins: Dolphins
FUCK BILL VINOVICH,1580686343.0,3,:Broncos: Broncos
I like the OG soldiers/sailors/marines. They always have the best stories.,1580686402.0,4,:Giants: Giants
Great why is Bill the ref,1580686432.0,5,:Titans: Titans
Wonder what they'd do if one of them collapsed on the field,1580686458.0,5,:Titans: Titans
What does deferred mean?,1580686493.0,5,
Game hasn't even started and the refs are messing around,1580686517.0,4,:Giants: Giants
Bill is confused,1580686518.0,4,:Falcons: Falcons
She sounds hideous!,1580686576.0,5,:Cowboys: Cowboys
PIP commercials,1580686676.0,5,:Falcons: Falcons
"Jim brown has had a crazy life man, a true American hero",1580686729.0,4,:Lions: Lions
Was that timthetatman?,1580686732.0,4,:Bills: Bills
Another one of these commercials hell yeah,1580686755.0,4,:Vikings: Vikings :Dolphins: Dolphins
What a dope little short,1580686767.0,4,:Cowboys: Cowboys
Commercial to real life transition!,1580686802.0,4,:Vikings: Vikings :Dolphins: Dolphins
THis commercial is taking forever,1580686816.0,3,:Cowboys: Cowboys
AHHHHHHHHHHH WAIT THAT WAS COOL,1580686831.0,4,
Finally!,1580686912.0,3,:Cowboys: Cowboys
NEW SCORE BUG HYPE.,1580686927.0,4,:Texans: Texans
These new graphics are weird,1580686927.0,4,:Vikings: Vikings :Dolphins: Dolphins
M'homes. *Tips helmet*,1580687004.0,4,:Patriots: Patriots
All the cool kids are still talking in this thread instead of the actual gdt,1580687005.0,3,:Titans: Titans
The new package looks crisp and clean... I wonder how it will translate to the other big event on Fox this month... the Daytona 500...,1580687025.0,5,:Dolphins: Dolphins
[deleted],1580687326.0,4,
"Deebo is so good, it was weird not seeing him get more NFL hype after the production he had in a terrible Will Muschamp offense at South Carolina. This isn't that surprising to me.",1580687409.0,3,:Falcons: Falcons
I'm already sad for not having football for 7 months.,1580687597.0,4,:Seahawks: Seahawks :49ers: 49ers
Oh no,1580687761.0,3,:Dolphins: Dolphins
It’s a Tide ad!!!,1580687769.0,4,:Seahawks: Seahawks
"i've been convinced, time to buy a porsche!",1580688871.0,4,
Winona stole that computer.,1580689025.0,4,
I was hoping I wouldn't have to hear a Boston accent today. :(,1580689587.0,4,:Cowboys: Cowboys
And Pringles win again,1580690458.0,5,:Chargers: Chargers
Charlie Day taking over the Superbowl commercials,1580690493.0,4,:Cowboys: Cowboys
Harvard doesn't make people smart...wtf,1580690613.0,4,:Seahawks: Seahawks
what do yall think was the last watchable halftime? I'm thinking U2,1580690806.0,4,
Jonah Hill looks so different now,1580690852.0,4,
Mr Peanut died?!?!?,1580690985.0,3,:Bills: Bills
what does weather tech have to do with that?,1580691303.0,4,:Texans: Texans
Really good coaching boys,1580691358.0,4,
Only way I would consider watching the masked singer is if they let AB back on it,1580692339.0,5,:Titans: Titans
"Meh, I'd rather have more Shakira over dominatrix J.Lo",1580692624.0,5,
It's going to be so sweet when all our gfs/wives age to 43 and become as hot as Shakira right guys?,1580692652.0,4,:Lions: Lions
Next years halftime show will just be the refs coming out and explaining the catch rule with charts and examples.,1580692728.0,5,:49ers: 49ers
am i at a strip club?,1580692795.0,5,:Texans: Texans
Sherman getting exposed,1580697943.0,4,:Vikings: Vikings
this is pathetic,1580684122.0,12,
The only other country that jerks off to itself as much as America does is North Korea,1580684182.0,19,:Bears: Bears
"So many reasons to cheer for the Chiefs, but the best one is seeing the pain on 9er fans since they loved our loss so much.

[Go Chiefs!!](https://i.redd.it/rva3wt0514z11.jpg)",1580676231.0,9,:Rams: Rams
[removed],1580676544.0,10,
what the fuck are they playing us right now,1580684049.0,10,:49ers: 49ers
MUH FLAG,1580684053.0,8,:Patriots: Patriots
This is quite the ‘Merica pandering right now. Holy hell.,1580684190.0,9,:Chiefs: Chiefs
"A’ight I’ll admit it

I teared up",1580684233.0,10,:Titans: Titans :Falcons: Falcons
People couldn't even shut up for one minute at the stadium for a moment of silence.,1580684302.0,10,:Chiefs: Chiefs
I'd rather listen to cats fuck than listen to Joe Buck talk,1580684609.0,11,:Lions: Lions
Idk what it is but this super bowl just seems so much more enjoyable than the past few years. Maybe because the pats aren't in it,1580685684.0,9,:Saints: Saints :Saints: Saints
Military tie-ins to football are officially weapon-grade cornballishness. Enough.,1580683931.0,13,
Am I watching Armed Forces Network,1580686407.0,12,:Vikings: Vikings
"Get this Boomer-ass shit off of my TV, man 😂",1580684080.0,15,:Seahawks: Seahawks
"Yeah, this shit is making me want to take a knee for the national anthem",1580684106.0,13,:Vikings: Vikings
Aired on FOX just now: [What went through your visor when that massive amount of yellow liquid hit your face](https://streamable.com/0123g),1580675470.0,5,:Bears: Bears :Broncos: Broncos
