text,time,upvote,flair
"JLo is 50 and looks 30. Millions of dollars, a personal chef, a personal trainer and plastic surgery are all a hell of a thing",1580677861.0,7,:Buccaneers: Buccaneers
"Pitbull is singing? Yeah I'm out, see you guys",1580678718.0,7,:Eagles: Eagles
Fox seems really hellbent on making us watch wrestling.,1580679139.0,8,:Browns: Browns
Fox gonna change their logo to a swastika or what?,1580679234.0,7,
[deleted],1580680026.0,6,
Damn did any Niner fans make the trip to Miami?,1580680173.0,7,:Cowboys: Cowboys
"Clearly, if there is anything 49ers and Chiefs fans can agree on, it is a shared dislike of Joe Buck.",1580680681.0,7,:Chiefs: Chiefs
Over/under on stupid shit AB does trying to upstage the game tonight?,1580681568.0,7,:Vikings: Vikings
Fuck I’m going to miss NFL football. Off-seasons suck,1580681847.0,6,:Vikings: Vikings
Bradshaw is hitting Don Cherry levels of inability to speak.,1580682511.0,7,
What you fools drinkin? Got some Sweet Water IPAs myself.,1580682587.0,8,
Soo is there any actual trash talking in this thread? Lmaooo,1580682768.0,7,
man is spongebob just gonna keep going forever like the simpsons?,1580682777.0,7,
I just realized that joe buck is commenting the game. Fuck,1580682792.0,8,:Bears: Bears
I’m so torn between hermit the frog and jimmy g,1580683097.0,8,
"On the upside, neither Super Bowl team helps cover up sick priests.",1580683240.0,8,:Saints: Saints
"I for one, am a Packers fan today

Edit: Typed faster than my brain was working. Meant Chiefs fan for today.",1580683671.0,6,
lots of old white ladies..,1580683981.0,7,:Rams: Rams
Good god the propaganda,1580684037.0,7,:Vikings: Vikings
Whats the over on this annual Super Bowl jingoism session?,1580684085.0,7,
Now I'm ready to get drafted!,1580684141.0,7,
"Bit of a personal op, but I really hate how they constantly try to make the superbowl more than it is. The sheer difference the media between the championships and the superbowl is insane and oh my god how long is this commercial going on for",1580684196.0,6,:Cardinals: Cardinals
Ray Lewis killed a man,1580685023.0,8,:Vikings: Vikings
That intro was badass for the 9ers,1580685603.0,7,:49ers: 49ers
"They got a gospal singer for this, and it's not Kanye??? Absurd NFL.",1580685914.0,7,
Fake there’s no black holders,1580686282.0,8,
"If the Niners win by exactly 22 I win $3,000. Here’s hoping.",1580686294.0,5,:Browns: Browns
"This thread is going to be 90% brand new NFL ""fans"" (I quote it because they wont watch any football game for another 365 days) just bitching about the number of commercials this game has",1580686549.0,7,:Falcons: Falcons
"Friendly Reminder: 

JLO is 50 years old and still hot as fuck",1580692775.0,6,:Packers: Packers
Nobody hates America as much as Americans on Reddit,1580684272.0,44,:Patriots: Patriots
Take a shot every time they mention Kobe.,1580678377.0,9,:Giants: Giants
"As a non-American, your media has a weird way of selling your country to you",1580684075.0,9,:Packers: Packers
"how much did the DOD pay to have people reenact the revolutionary war

also the alamo wasn’t fighting for the US",1580684097.0,10,:Broncos: Broncos
"I'm sorry, but an awful lot of this feels all too jingoistic for my interest.",1580684060.0,12,:Buccaneers: Buccaneers
Nothing like a good patriotic circle jerk to kick off sports ball.,1580684164.0,14,:Vikings: Vikings
[removed],1580676990.0,12,
Would you fuck Virginia Halas if it meant you got ownership of the team?,1580683985.0,11,:Bears: Bears
They’re starting the draft for WW3 early I see.,1580684113.0,11,
If this whole Super Bowl was Groundhog Day themed instead of America themed it'd be much better,1580684383.0,11,:Chargers: Chargers
Reddit and bitching about nationalism. Love it.,1580684204.0,15,
"Alright guys, I'm a European who only watches the Superbowl so I am a total noob when it comes to the game. However, I have watched [this 16 minute long video](https://www.youtube.com/watch?v=zJt-K-TXYQI) from the NFL YouTube channel, which goes over the stats for both teams, so I'm basically an expert now. 

Only kidding of course. I'll give you guys my take on what I think, so please reply if you'd like!

From what I understood from the video ^(not much), it seems like the 49ers have the best shot? They do a lot of running, and KC has a pretty weak defence when it comes to stopping runs, it seems? KC is great at both throwing and running, but the 49ers seem to have one of the best all-round defensive lines. So to me, it looks like the Chiefs will have a hard time picking up yards, while SF might have an edge when it comes to running the ball.

Please reply if you think I'm wrong (or right, idk) on all of this. I'm looking forward to kick off!",1580682687.0,10,:Browns: Browns
i hate this fake jingoistic patriotic militaristic bullshit every goddamn super bowl,1580683982.0,9,
Nice propaganda lol,1580684057.0,12,
This is so fucking forced it's bordering on cringe.,1580684094.0,10,:Chargers: Chargers
Pregame propaganda,1580684097.0,8,:Panthers: Panthers
"Flag burning is constitutionally protected per the Supreme Court, but ok FOX, you do you.",1580684165.0,10,
Imagine parading a medal of Honor winner out for some stupid fuckin Superbowl ad. Jesus Christ fox.,1580684170.0,10,
There are 40 million people living in poverty in America,1580686032.0,11,
**SLEEPY** **EMAILS**,1580676111.0,6,:Bills: Bills
We get Joe Buck and Troy Aikman for this game. Fuck yeah!,1580676468.0,7,:Colts: Colts
"Just put the puppy bowl on, it's way better than this pregame garbage.",1580676546.0,5,:Bears: Bears
I pray to god that Kittle does the DX suck it taunt in-game,1580677151.0,6,:Bears: Bears :Bengals: Bengals
[deleted],1580677669.0,6,
You can’t have a Super Bowl in Miami without Pitbull,1580677990.0,5,:Seahawks: Seahawks
"\>Kobe Bryant

\>Crowd cheers",1580678284.0,6,:49ers: 49ers
Kobe!,1580678351.0,6,:Cowboys: Cowboys
"Yeah I’m into fitness 

Fitness whole pizza in my stomach before 4:00 central time",1580678615.0,6,:Vikings: Vikings
How dare he ruin Black Betty! I expect to hear this song in car commercials now.,1580678896.0,6,:Cowboys: Cowboys
Who the hell is pitbull and what was he doing on my TV?  It was so bad.,1580679052.0,6,
Will Pitbull appear at half time? I Hope he does.,1580679535.0,6,:Buccaneers: Buccaneers
"Oi Australia, what's the score",1580680129.0,6,
Watching announcers run around on a mini field is just sad.,1580680250.0,7,
Chiefs 28-24,1580680443.0,6,:Chiefs: Chiefs
Let's not forget. This game is all about Joe Buck.,1580680784.0,7,:Falcons: Falcons
"I have a strong dislike of Joe Buck 

I wouldn’t even send him a Christmas card if he was my cousin",1580680838.0,5,:Vikings: Vikings
Holy fuck fox thought DJ Khaled doing this was a good idea lmao,1580681099.0,6,
[deleted],1580681322.0,6,
What's up with the sudden aggressive Turkish Airlines advertising?,1580681359.0,6,:Lions: Lions
"# OH FUCK

FOX ANIME!!!!",1580681706.0,6,:Broncos: Broncos
Anybody else drunk already?,1580681849.0,5,
BANG BANG NINER GANG,1580682263.0,6,:49ers: 49ers
Erin Andrews is 41,1580683051.0,7,:Giants: Giants
Bradshaw's hate boner for mahomes is nasty,1580683287.0,7,
That segment was pure cancer with some AIDS sprinkled on top.,1580683659.0,7,
Fuck Fox Sports!,1580683958.0,5,
Everyone's freedom boner better be at full attention or you're disrespecting the flag. Bunch of commies. /s,1580684107.0,6,:Bears: Bears
Can't have a Super Bowl on Fox without going overboard on nationalism.,1580684109.0,6,:Rams: Rams :Lions: Lions
boot as hell,1580684206.0,6,
Mamba forever.,1580684231.0,5,
Got my Texas tech Patrick Mahomes II jersey on and some brisket on my plate. (Texas style).. I’m ready.,1580684433.0,6,:Cowboys: Cowboys
Not including Jim Kelly with the QB's is fucked up.,1580685139.0,7,:Bills: Bills
I know the WWE is fake but it’s still fun,1580685221.0,5,:Bears: Bears
"Favre in the back row thinking ""All of y'all have seen my junk lmao""",1580685291.0,6,:Cowboys: Cowboys
"GO CHIEFS!

FROM THE RAVENS! GO GET IT BOYS",1580685507.0,5,:Ravens: Ravens
Does anyone honestly NOT like The Rock? Hes amazing,1580685561.0,6,:Vikings: Vikings
Holy shit let’s just get to the game,1580685982.0,6,:Seahawks: Seahawks
God the “home of the CHIEFS” is so annoying and cringy,1580686190.0,7,:Patriots: Patriots
The NFL will not let this go,1580686364.0,6,:Packers: Packers
He’s gotta realize how bad the spray tan looks around his eyes,1580675867.0,8,:Seahawks: Seahawks
[removed],1580675985.0,8,
Please never let fox host ever again.,1580676785.0,9,:49ers: 49ers
If you didn’t enjoy that segment you don’t enjoy life,1580683629.0,8,:Jets: Jets
"""Thanks for sacrificing your lives for my tax breaks peasants""",1580684078.0,8,
JFC Fox. Stop trying to make me turn off the damn telecast.,1580684162.0,6,:49ers: 49ers :49ers: 49ers
What does war have to do with sports?,1580684172.0,8,
Is this an ad for a flag?,1580684190.0,9,:Giants: Giants
America the Beautiful is the real anthem don't @ me,1580685903.0,7,
more fucking military shit,1580686366.0,7,
I love the US but this shit is fucking stupid.,1580684090.0,14,
"Ugh, I don't need a bunch of old white woman lecturing me on civics.",1580683992.0,11,:Ravens: Ravens
They talk of freedom yet here we are watching democracy crumble for these rich bastards and the shit head in charge,1580684066.0,12,:Giants: Giants
Well that was fucking weird.,1580684251.0,11,:Chiefs: Chiefs
OH MY GOD ITS HAPPENING EVERYONE STAY CALM,1580675594.0,3,:Bills: Bills
Lets gooooooo Big Red!,1580675702.0,3,
What do chiefs fans think of eric stonestreet being everywhere now?,1580675722.0,3,:Jaguars: Jaguars
Bold Prediction: Gloria Estefan appears in the half time show.,1580675769.0,3,:Bills: Bills
I just hope everyone has a good time,1580675784.0,3,:Steelers: Steelers
I have to watch at work 😭,1580675786.0,3,
Got beer cheese dip for the party.,1580675925.0,3,:49ers: 49ers
Lol this is coming from someone who’s 6’4,1580676033.0,3,:Bears: Bears
"Please just be a good game, thats all I care about",1580676336.0,3,
Over under for starting to drink 3 hours before gametime?,1580676544.0,3,:Dolphins: Dolphins
what sort of play could happen tonight that would crash reddit due to the reaction?,1580676557.0,3,:Giants: Giants
Anyone have a stream to the kitten bowl?,1580676560.0,3,:Patriots: Patriots
Did Dee Ford get traded or leave as a FA?,1580676718.0,3,:Colts: Colts
Juice looks like Ken shamrock,1580676775.0,3,:49ers: 49ers
Fox Sports app on Android TV is supposed to be 4K HDR right?  So far looks like pure garbage,1580676933.0,3,:Packers: Packers
[deleted],1580677128.0,3,
WHO REMEMBERS BUD BOWL,1580677133.0,3,
What channel is the puppy bowl on?,1580677159.0,3,:Bills: Bills
If Key and Peele could do some more football names that would be greeeeeat,1580677175.0,3,:Vikings: Vikings
Kittle has the right attitude for this game.,1580677204.0,3,:Bears: Bears
I'm pregaming with D&D and Bud Light Seltzer. Life is wild huh,1580677214.0,3,:Dolphins: Dolphins :Steelers: Steelers
[deleted],1580677317.0,3,
LEGENDARY,1580677368.0,3,:49ers: 49ers
It's still weird seeing Greg Olson as a broadcaster/analyst. Same with Gronk.,1580677370.0,3,:Titans: Titans
Damn McVay has a great TV presence,1580677393.0,3,:49ers: 49ers
"I am so excited for the Super Bowl. I like both teams so I just hope it’s exciting game and that everyone plays well, no one gets hurt, and we get to see some close football action. 

On a related note, where can I get one of those NFL hats Rob Lowe had a couple weeks ago? It summarized my mood very well.",1580677468.0,3,
Hummer EV?! Lol,1580677538.0,3,:Chiefs: Chiefs
Great googlie mooglie,1580677551.0,3,:Patriots: Patriots
Wish I could watch but I live in Europe and I got school tomorrow :( Broncos fan so hoping for a 49ers win,1580677577.0,3,
Can it be game time now,1580677606.0,3,:Vikings: Vikings
Does terry think he looks less like someone who eats squirrel pie with that hat 🤔,1580677628.0,3,
Niners by 3,1580677638.0,3,
"Oh boy, JLo and Shakira doesn't look like how I remember",1580677765.0,3,:Falcons: Falcons
"When they did that John lynch interview like an hour ago, was that chandelier in the background supposed to be the molecular structure of THC. It definitely looked like a molecular structure of something.",1580677926.0,3,:Steelers: Steelers
If I never see Michael Strahan dance again I’ll be okay.,1580677944.0,3,:Eagles: Eagles
**MR WORLDWIDE**,1580677970.0,3,:Bills: Bills
"The superbowl and taxes, my two favorite things",1580678059.0,3,:Broncos: Broncos
What the hell Shakira still look like she's in her 20s,1580678129.0,3,:Chiefs: Chiefs
"Ultimately this game comes down to the play of Chad Henne. If he can perform up to his reputation as best player in the league, the Chiefs will win",1580678171.0,3,:Commanders: Commanders
"Kendrick Bourne MVP with 8 catches, 137 yards, 2 TDs. 

FIGHT ME.",1580678446.0,3,:Patriots: Patriots
This heartfelt discussing about Kobe Bryant brought to you by Pizza Hut.,1580678477.0,3,:Browns: Browns :Bills: Bills
I like how their desk just says pizza hut like they're all just really hyped about pizza,1580678499.0,3,:Jaguars: Jaguars
What's everyone else planning on eating? I got some Hawaiian Pizza and some Asian Zing wings on the way,1580678511.0,3,
REMEMBER PITBULL GUYS? He sang that song with Ke$ha!,1580678777.0,3,:Buccaneers: Buccaneers
the super bowl game thread is always the lowest football IQ game thread,1580678788.0,3,
[Time to post my favourite meme in the whole world](https://pics.me.me/when-ucant-fit-throu-door-r-wide-32805808.png),1580678794.0,3,:Eagles: Eagles
"Oh shit, we worldwide now.",1580678799.0,3,:49ers: 49ers
Yikes pitbull sounds awful live.,1580678811.0,3,:Patriots: Patriots
I can't even understand what he's yelling,1580678811.0,3,:Vikings: Vikings
“Put some Pitbull on” said no one ever,1580678812.0,3,
O_o those are great outfits,1580678814.0,3,
Pitbull? LMAO,1580678816.0,3,
What the fuck is this shitshow?,1580678827.0,3,:Chiefs: Chiefs
Been nervous all week. Can’t wait to see our guys  on the field,1580678845.0,3,:49ers: 49ers
Past 12 months has been the most monumental of my life and a Niners title would scratch off a bucket list item to top it off,1580678884.0,3,
PUT EM UP....,1580679014.0,3,:Saints: Saints
How many times has their been teams with similar color schemes in the superbowl,1580679068.0,3,:Bills: Bills
Can anyone recommend an alternative to the FOX crew for the game? No way am I listening to Buck and Aikman for 3+ hours.,1580679095.0,3,:Falcons: Falcons
Is this the avengers,1580679110.0,3,:Broncos: Broncos
Jimmie did the mummy.,1580679151.0,3,:Cowboys: Cowboys
Why does Fox always treat their pregame show like an extended SNL skit?,1580679155.0,3,:Seahawks: Seahawks
"Hey, did you guys know WWE Smackdown is on Fox?",1580679198.0,3,:Titans: Titans
Watching Jimmy Johnson throw a Pizza Hut party is honestly really wholesome lol.,1580679217.0,3,:Rams: Rams
so when do we get the PPV of Kristina Pink’s “too hot for TV” dance moves,1580679230.0,3,:Titans: Titans
2 MORE HOURS 🔥🔥🔥,1580679235.0,3,:Saints: Saints
Sometimes I put the TV on mute when the Falcons are doing bad and then they turn it around. So it became a superstition. I tried it out on the pitbull performance and it turned it around. Superstition confirmed.,1580679274.0,3,:Falcons: Falcons
How does his hair fit in his helmet,1580679314.0,3,:Jets: Jets
Romans love pizza.,1580679320.0,3,:NFL: NFL
Have they been promoting WWE or AEW at all? I’m watching the Super Bowl for the first tike from the U.K. but I’m a big wrestling fan and I know that WWE SmackDown is on FOX now. Have they plugged it?,1580679384.0,3,
Que Saleh saleh,1580679389.0,3,
There is an alternate universe that Ohio State had Nick Bosa and Chase Young on opposite sides of the same D Line for an entire season.,1580679426.0,3,:Browns: Browns
"Watching this pregame I think Fox debuts a new score graphic for the game, or at least a fancier version of the current one like they did for 51.

Edit: apparently new graphics were announced recently.",1580679559.0,3,:Bills: Bills
"To all the other fans of losing teams it’s going to be ok, there’s a lot to enjoy in losing

1. We tried real hard and 2, we’re still good friends!",1580679632.0,3,:Broncos: Broncos
#GOTTA GO FAST,1580679683.0,3,
Last years commercials were super lame. Shouldn’t be hard to find better ads,1580679706.0,3,:Buccaneers: Buccaneers
/r/nfl vs. Vegas. Who will win?,1580679743.0,3,:Chiefs: Chiefs
let’s get this over with i’m hype for draft szn,1580679851.0,3,
"What was the drug,pot?",1580679943.0,3,:Cowboys: Cowboys
Damn i forgot how much trouble he got into,1580680006.0,3,:Rams: Rams
Oh shit,1580680125.0,3,:Eagles: Eagles
Man if you’re hammered in a club full-blown arguing with yourself in the bathroom mirror you got more problems than just figuring out how you’re going to get home,1580680357.0,3,:Browns: Browns
"Oh god, theres another Buck",1580680457.0,3,:Eagles: Eagles
I'm getting the ESPN commentary. Wish me luck.,1580680462.0,3,:Packers: Packers
Fuck nepotism this is what it gets you,1580680491.0,3,
I will take Montana over Buck for the play by play in a heartbeat,1580680505.0,3,:Buccaneers: Buccaneers
Ah shit I forgot we were gonna get Joe Buck commentating this Super Bowl,1580680526.0,3,:Cowboys: Cowboys
Stop interrupting joe Jesus Christ let someone else talk,1580680615.0,3,
after these Buffalo wings I might need some Tums,1580680887.0,3,:Cowboys: Cowboys
gonna need some tums after i eat this meixcan food,1580680903.0,3,:Rams: Rams
im so hard,1580680957.0,3,:49ers: 49ers
"Great news! Not the entire cable, but literally just Fox is out in my area!!! Love it!",1580680988.0,3,:Bills: Bills
#ANOTHERONE,1580681000.0,3,:Titans: Titans
Pitbull and now DJ Khalid... shoot me now,1580681040.0,3,:49ers: 49ers
I’m shocked that terry bradshaws care takers still  let him out of the home for this,1580681051.0,3,:Broncos: Broncos
"Nobody :           
DJ Khalid : Let's go",1580681074.0,3,:Falcons: Falcons
"Damn, the Andy Ried coaching tree is impressive",1580681126.0,3,
*All of these coaches could also fit inside of him at the same time.*,1580681144.0,3,:Patriots: Patriots
"**Attention All Other 30 teams** in honor of Jason Garrett leaving my Boys, let's all clap for these two team fans that are left remaining.",1580681149.0,3,:Cowboys: Cowboys
GO RED TEAM,1580681183.0,3,:Browns: Browns
Andy Reid DAB,1580681205.0,3,
That Andy Reid clip will never die,1580681248.0,3,:Lions: Lions
[deleted],1580681278.0,3,
God I hope Andy wins lol,1580681282.0,3,
I’ve had 2 weeks and still don’t know who to root for,1580681383.0,3,:Panthers: Panthers :Bills: Bills
Bradshaw is becoming an absolute unit,1580681456.0,3,
All I want is a passing touchdown this year,1580681490.0,3,
The Invisible Man looks 2sp00pyforme,1580681502.0,3,:Broncos: Broncos
hedge bets on Andy at the tailgate right now,1580681539.0,3,:Cowboys: Cowboys
Wtf is that commercial,1580681547.0,3,:Eagles: Eagles
Andy Reid should compete in a hot dog eating contest against Joey Chestnut,1580681598.0,3,
"I am ready for some peak football.

Bring it on football gods!",1580681662.0,3,:Eagles: Eagles
Oh brother Scientology’s here,1580681683.0,3,
da fuck are those cartoons,1580681700.0,3,:Cowboys: Cowboys
"The Complete Team^TM versus the Best Damn Player in the League^TM.

I'm pretty hyped.",1580681729.0,3,:49ers: 49ers
Did anyone else lose the channel on directv?,1580681733.0,3,:49ers: 49ers
Did the animation team from Archer draw Jimmy G and Pat Mahomes?,1580681831.0,3,:Bears: Bears
"unless your leg got cut off, you're playing the superbowl",1580681835.0,3,
Breida gonna kill it.,1580682007.0,3,:Cowboys: Cowboys
Wtf is Micheal doing,1580682035.0,3,:Eagles: Eagles
What's that GMA guy DJ'ing for?,1580682059.0,3,:Cowboys: Cowboys
has poop every fallen out of someones pants onto the field?,1580682126.0,3,:NFL: NFL :NFL: NFL
I hate both these teams so goddamn much. 7 beers in. Only have 5 left,1580682163.0,3,
"This game is going to be decided in the trenches. If the Niners can pressure Mahomes all game long, I think they'll win. If they can't pressure him and he does what he wants, Chiefs win. I think the Niners offense will produce but not at the rate that an unmolested Mahomes will.",1580682176.0,3,:49ers: 49ers
Two teams that haven't won the big one in a long time. Should be a great one.,1580682199.0,3,:Dolphins: Dolphins
The Charmin clean ass bears bears doesn't say Super Bowl to me,1580682214.0,3,:Chargers: Chargers
when was the last time the 49ers have been to the super bowl and won it? i know the chiefs haven’t been in 50 years but what about the niners?,1580682279.0,3,
Was that Jeremy Renner in the background?,1580682279.0,3,:Eagles: Eagles
"Huge props to you guys on the east coast, I couldn’t imagine waiting till 6:30 for this game to start.",1580682281.0,3,:Seahawks: Seahawks
[deleted],1580682375.0,3,
"The team that has red, black and white in their logo with two letters gonna win tonight",1580682425.0,3,
"No matter the outcome of this game, Jimmy G has more rings than Mahomes",1580682467.0,3,:Lions: Lions
The real Super Bowl were the recievers we cut along the way,1580682471.0,3,:Patriots: Patriots
*Sniffs* Jimmy G is like your kid that grows up before you know it. Go Jimmy Go!,1580682481.0,3,:Bengals: Bengals
"Jimmy's been in the Super Bowl before, now he's *in* the Super Bowl. Let's fucking go!",1580682491.0,3,:49ers: 49ers
I’m outta wine,1580682531.0,3,
>Don't unestimate Jimmy Garafolo.,1580682541.0,3,
"I'm guaranteeing a Kyle Juszczyk touchdown tonight!

You heard it here first, folks!",1580682560.0,3,:Bengals: Bengals
George Kittle SB MVP!,1580682603.0,3,
"Anyone know what exact time the National Anthem is performed? I'm a fan of Demi Lovato and will probably miss the first half. But I can stream on the app, but will be at the park so idk how good the service will be.",1580682632.0,3,
Mikey Vick in da house!!... hide your dogs (lol had to do it to em),1580682639.0,3,
Turkish Airlines gets half the screen. seems weird.,1580682643.0,3,:Seahawks: Seahawks
JESUS CHRIST WTF WAS THAT AD,1580682652.0,3,:Eagles: Eagles
Where's Erin Andrews??!!,1580682670.0,3,
"Both teams gonna switch up lol, Jimmy G throws the ball each time and Patrick Mahomes becomes a game manager",1580682671.0,3,
[deleted],1580682748.0,3,
what is everyone listening to for hype music? i got Unknown Pleasure finishing up and then i’m gonna put on Good Kid M.A.D. City,1580682778.0,3,
After that commercial I'm sold on never going to Portland.,1580682836.0,3,:Patriots: Patriots :Bears: Bears
Mahomes and globetrotters is the best crossover,1580682930.0,3,:Ravens: Ravens
Erin Andrews is an absolute dime,1580682934.0,3,
I'm just glad the titans arent in this game tbh,1580682983.0,3,:Jaguars: Jaguars
How many Tom Rinaldi-esque football sappy sob stories can they fit in before the actual game?,1580683061.0,3,:Browns: Browns
Hot take: I actually don't mind Joe Buck,1580683064.0,3,:Patriots: Patriots
"""How bad do you want this [to win the Super Bowl]?""  
  
""Eh... I don't care""",1580683106.0,3,:Browns: Browns
Mahomes is an absolutely absurd talent,1580683125.0,3,
Mahomes with the Uncle Rico throw there,1580683129.0,3,:Broncos: Broncos
"Tortilla chips and pico de gallo are ready. If the food's name has two ls, I'm in.",1580683136.0,3,:Seahawks: Seahawks :49ers: 49ers
When will I ever get to see my Bucs play in this cool thing?,1580683186.0,3,
Im ready to see these companies that paid 5 mill for 30 secs,1580683188.0,3,:Ravens: Ravens
Jay Glazer looks like he uses sticks of butter as suppositories,1580683198.0,3,:Buccaneers: Buccaneers
"Dee Ford is 67-1 MVP odds for me.

Any better bets than that for SBMVP? Ford is a sleeper but who do y'all have",1580683243.0,3,:Bengals: Bengals
Elway was special.,1580683245.0,3,:Cowboys: Cowboys
bruh 50 more minutes,1580683302.0,3,
"Completely irrational and crazy prediction: If #15 goes down, Matt Moore will emerge and ball out. Guy's got a lil sneaky gunslinger in him...

Along with Tannehill, Damien Williams, just another name in the Dolphins/Former-Gase guy lore",1580683377.0,3,
i dont think i have enough alcohol,1580683419.0,3,:49ers: 49ers
Are we still making Demi Lovato jokes?,1580683490.0,3,:Packers: Packers
Pitbull is beautiful,1580683493.0,3,:Jets: Jets
How is Larry King still living?,1580683502.0,3,
need Rob Lowe’s hat,1580683523.0,3,:Titans: Titans
I don't think Dr. Phil has ever been invited to a party.,1580683523.0,3,:Raiders: Raiders
"Everyone got their shittin pants on?!
It’s time to shit your pants",1580683534.0,3,:Seahawks: Seahawks
Can't wait for Shakira at halftime! She is bae,1580683543.0,3,:Lions: Lions
Hey so what the fuck is happening?,1580683565.0,3,
LOOOL,1580683568.0,3,:Giants: Giants
This pre-game show has been so horrible.  Just get me to the game.,1580683584.0,3,:Raiders: Raiders
Ok well I never want to think of Larry King in a hot tub,1580683602.0,3,
Fox should give the pregame comedy bit to Larry King next year,1580683605.0,3,:Seahawks: Seahawks
WTF IS HAPPENING,1580683625.0,3,
Hope the commercials won’t be a L this year,1580683627.0,3,:Seahawks: Seahawks
49ERS BY 4+9 !!,1580683683.0,3,:Rams: Rams
Every SB party is amateur hour.,1580683686.0,3,
"Chiefs to spot the 49ers 21 points, then the game begins",1580683730.0,3,:Chiefs: Chiefs
Is the feed on tv upscaled HDR or something? The colors are popping more than normal,1580683734.0,3,:Broncos: Broncos
"5G? What’s that?

*laughs in iPhone*",1580683740.0,3,:Bears: Bears
I’m thinking 34-24 Niners in my completely unbiased opinion,1580683771.0,3,:49ers: 49ers
ANYONE ELSE AT THE MGM GEAND SOORTS BOOK IM HERE FUCKERS COME THRU,1580683773.0,3,
im seeing a lady eating cheetos with chopsticks here? what.,1580683807.0,3,
I’m never watching movies ever again,1580683810.0,3,
