text,time,upvote,flair
Wtf do people on the west coast do after the Super Bowl?,1580676807.0,220,:Patriots: Patriots
Jerry Rice wearing his own goddamn jersey as a fan to the super bowl. I fucking love it.,1580680235.0,106,:49ers: 49ers
This is the worst football analysis ever... (Currently on FOX),1580675796.0,101,:49ers: 49ers
Wtf happened to the pregame? They really makin me head to ABC to watch Zion vs Rockets,1580676188.0,103,:Chiefs: Chiefs
[deleted],1580676789.0,80,
Talk about football you cowards,1580676129.0,221,:49ers: 49ers
"""Oh they're playing in Miami today? What happens if an alligator gets on the field?""

My lovely gf, ladies and gentlemen.",1580676642.0,325,:Patriots: Patriots
They gonna tongue kiss at the end of this ain’t they?,1580675910.0,58,
I’m gonna be sick.,1580675439.0,351,:49ers: 49ers
Imma take my dog on a walk Jesus Christ fox,1580676173.0,49,:Browns: Browns
"America to Fox:

>Sir, this is a Wendy’s",1580684147.0,40,
[removed],1580675866.0,119,
[removed],1580676175.0,38,
"who vomits more before the game: me after 23 beers or kittle after a head smash

place your bets, people",1580675474.0,39,:49ers: 49ers
"Enjoy this game, because the next two months will be nothing but coverage of Brady's manufactured free agency tour and GIFs of Joe Burrow smoking cigars.

It will be a nightmare.",1580680234.0,36,
Get this garbage ass politics out of my football fox!,1580675796.0,228,:Giants: Giants
"My mom and my girlfriend are now just sitting and chatting about how hot Garappolo is. 

COME ON HALFTIME SHOW DON'T LET ME DOWN",1580682816.0,35,:Chargers: Chargers
"Sipping on ginger ale because I've been sober for 33 days. Big social events like this are hard, but I feel better every day.",1580683384.0,31,:Eagles: Eagles
Ew Sean hannity,1580675890.0,96,
[removed],1580676145.0,30,
Why the fuck is this on right now for fucks sake,1580675839.0,135,:Bears: Bears
20 years later and Shakira is still stupid sexy.,1580677946.0,30,:Broncos: Broncos
These men fought nazis. Isn’t that what reddit likes today?,1580686503.0,30,:Jets: Jets
"NFL fans: It's gonna be so great that we're gonna have a Super Bowl without Belichick and Brady

NFL: lol just you wait",1580685097.0,29,:Eagles: Eagles
"You know what goes great with distraction? 

Propaganda.",1580675875.0,126,
Should have read off all 9 victims names and not just the two famous ones.,1580684334.0,26,
Cool. Snowboarding on NBC,1580676129.0,27,:Giants: Giants
It's 65 in KC right now.  The fact that we're basically the same temp as Miami either means we're destined to win or our climate is fucked.,1580676750.0,48,:Chiefs: Chiefs
#LMAO WHY DID WE ZOOM IN TO GREGS CHIN,1580676386.0,26,:Raiders: Raiders
"Fuck off, Fox. Take this shit back to Fox News, not Fox Sports.",1580675873.0,127,:Cowboys: Cowboys
"This is the most bullshit pre superbowl crap ever, Fuck Fox",1580675873.0,90,:Cowboys: Cowboys
"So this is probably going to be my last every Super Bowl watching live due to health reasons,  but boy am I happy for it to not have the Patriots as the last one! (No shade at the Patriots - just nice for a change!)",1580683199.0,24,:Seahawks: Seahawks
Get fucked fox,1580675840.0,65,:Vikings: Vikings
STOP MAKING ME LIKE THE 49ERS FUCK YOU,1580678284.0,23,
[deleted],1580679920.0,22,
"As a UK NFL fan, I am rooting for caffeine today. 1130PM start, won’t finish until around 3AM, let’s go coffee!",1580681573.0,22,:Eagles: Eagles
Wait the US flag wouldn't be at the Alamo. The was the Texas Republic.,1580684149.0,23,
Why in the fuck is Fox showing this Fox News bull shit?,1580675893.0,100,:49ers: 49ers
Damn Shakira is one of the sexiest women of all time,1580677980.0,22,:49ers: 49ers
fuck off with this bullshit Fox.,1580675829.0,110,:Dolphins: Dolphins
Fox being Fox.,1580684138.0,20,:Commanders: Commanders
Very unfair so unfair unfair very very unfair unfair so unfair,1580675833.0,57,:Jets: Jets
Pretty disappointing that Fox is pushing political propaganda during the pregame show.,1580675870.0,141,:Packers: Packers
[removed],1580675857.0,73,
How much did Jay Glazer pay that guy to hold a Jay Glazer cutout,1580680079.0,20,:Titans: Titans
"Chiefs fans 🤝 49ers fans

Being nauseous all day",1580677960.0,44,:Chiefs: Chiefs
There is a 10 out of 10 chance that Glazer asks women if they “want the Glaze”,1580679912.0,40,:Browns: Browns
[removed],1580675787.0,86,
[removed],1580676100.0,40,
[removed],1580676209.0,20,
Hell is just one continuous never ending Pitbull concert,1580678891.0,18,:Raiders: Raiders
Still better than Hannity,1580678907.0,17,:49ers: 49ers
"Damn I wanted Pinocchio in that Geico sequel commercial to tell Joe Buck ""you're such a great announcer"" and have his nose grow",1580682689.0,18,:Eagles: Eagles
"I'm laughing at Riggles ""KC by 27+"" pick",1580683706.0,20,:Chiefs: Chiefs
"LOOK THE COMMERCIAL IS ON THE FIELD, GOODBYE FOURTH WALL",1580686812.0,20,:Seahawks: Seahawks
"Not to be horny or anything, but I would smash Jennifer Lopez 50 year old ass, to space and back",1580677824.0,40,
Puppy bowl it is.,1580676200.0,20,
GOOD LUCKING EYETALIAN,1580682482.0,18,:Broncos: Broncos
Holy fuck Riggle. 27+ lol,1580683698.0,19,:Eagles: Eagles
Joe Buck is going to be lowered from the ceiling during the half time show to commentate Shakira’s ass,1580683964.0,18,:Vikings: Vikings
what the fuck is this,1580684140.0,18,
Worst moment of silence of all time.,1580684267.0,18,
Shakira>J Lo,1580677866.0,36,:Bears: Bears
Is this a mistake by Fox?,1580675816.0,47,:Rams: Rams
I’m going to miss football. But at least the future XFL champion Vipers play next week /s,1580680145.0,18,:Buccaneers: Buccaneers
Watch it be a Bud Light ad,1580684136.0,17,:Patriots: Patriots
">5 minutes of commercial break 

 Rip Kobe

>Back to commercial",1580684423.0,17,:49ers: 49ers
"The superbowl, sponsored by America",1580685979.0,17,:Seahawks: Seahawks
"Sean Hannity on the Super Bowl program, get this shit out of here!",1580675872.0,61,:Seahawks: Seahawks
Fuck you Fox. What is this bullshit?,1580675873.0,84,
Fuck you Fox. How dare you push an agenda when people just want to watch a game.,1580675903.0,88,:Bears: Bears
Latino more like latinYES,1580677713.0,17,
"As long as it's better than last year, which I'm sure it will be.",1580680051.0,16,
"Demi Lovato is going to hold out the lyric ""Free"" for 23 seconds calling it now",1580685656.0,16,:Lions: Lions
Thanks Fox for giving 20 minutes to turn off the TV,1580675911.0,32,:Jets: Jets
Sean Hannity makes Booger McFarland look like Tony Romo.,1580675937.0,42,:Cowboys: Cowboys
[removed],1580676294.0,15,
I still have a mad crush on Shakira,1580677815.0,15,:Bengals: Bengals
I don't even know what to do with myself for the next 2 hours...,1580678186.0,16,:49ers: 49ers
Pitbull is such a inspiration for all special needs people who want to become artist,1580678870.0,14,:Jaguars: Jaguars
This is the most hyped I've been about a Super Bowl in years,1580679393.0,15,
“That guy right there.”  Joe is seeing invisible people again.,1580680501.0,16,:Colts: Colts
Mom’s about to book me a trip to a Mike Pence camp if I keep talking about how good looking Jimmy G is,1580680745.0,15,:Lions: Lions
Its obscene how attractive Jimmy Garoppolo is,1580682322.0,15,
Terry Bradshaw just said eye-talian. I'm deceased.,1580682520.0,15,:Seahawks: Seahawks
If they put a timer and this fucker doesn't start when the clock hits 00:00 I'm calling the police,1580683240.0,16,:Ravens: Ravens
Remember the time in US history when our Founding Fathers wrote the Declaration of Independence then sat at the 50 yard line to watch the SB,1580684165.0,15,:Giants: Giants
"Those men fought and killed Nazis, they're heroes worth celebrating",1580686542.0,15,:Dolphins: Dolphins
Oh god here comes political ads surely there won’t be any arguing about this,1580687783.0,15,:Lions: Lions
[deleted],1580676301.0,77,
[removed],1580676310.0,29,
Fucking Fox,1580675864.0,44,
[removed],1580675864.0,70,
Nothing to worry about KC  fans I made a temporary jersey in support of you guys today https://imgur.com/r5XBN1T,1580676394.0,12,:Seahawks: Seahawks
"I still love you, Sherm.

Hope you get a pick 6 today.

And that you lose, but still..",1580678319.0,14,:Seahawks: Seahawks
Wait... Shanahan’s dad was a coach in the NFL?!?! You’d think they’d mentioned this before now,1580680561.0,14,:Browns: Browns
"So this is just a preseason game to get us ready for the XFL season, right?",1580681563.0,14,:Dolphins: Dolphins
I made rice Krispy treats with the strawberry krispies and it's fuckin phenomenal.,1580682831.0,12,:Packers: Packers
Rob Lowe taking a shot at himself. Love it.,1580683532.0,13,:Titans: Titans
Sun Kim can get it.,1580685828.0,14,:49ers: 49ers
Christ can you imagine living through World War Two and making it to today,1580686388.0,13,:Lions: Lions
[removed],1580675928.0,27,
[removed],1580676089.0,27,
I just hope everyone stays healthy. Bless the knees/backs/ligaments/brains,1580676349.0,15,:49ers: 49ers
Shakira>>>>>>,1580677850.0,12,:Jets: Jets
Wasn’t expecting to have an erection until the halftime show,1580678977.0,13,
"OK I'm running to the shops for carbs, anyone need anything?",1580681570.0,14,:49ers: 49ers
"Woot, I've been working on some weird wing sauces all day. Pretty excited, got a pomegranate Sriracha mint, a peach Chile, a tamarind, and a standard buffalo in case all the rest suck.",1580681696.0,13,:Panthers: Panthers
A fucking Scientology ad..... Really?,1580681737.0,13,:Colts: Colts
Good lookin I-talian,1580682486.0,13,:Panthers: Panthers
I fucking died when terry said eyetalian,1580682570.0,13,
3 second moment of silence,1580684277.0,13,
This should have been Romo 😔,1580684642.0,13,
LMAO we still got to see Brady and Bill in a Super Bowl. Four years running now.,1580685165.0,13,
# DEMI FUCKING KILLED IT GOD DAMN!!!!!!!!!!!!! WOOOOO!!!!!,1580686099.0,12,:Broncos: Broncos
She just flew through that song and I lost money on the over,1580686142.0,14,:Bears: Bears
Red jacket guy looks fucking amazing for 100 years old,1580686460.0,13,:Bears: Bears
PSA: puppy bowl is on - don’t watch idiot 2 interview idiot 1,1580676149.0,25,:Seahawks: Seahawks
So was Andrew Luck just a dream we all had?,1580682375.0,24,:Saints: Saints :Bengals: Bengals
Billionaires telling me to be proud of my country and defend it. this is rich,1580683998.0,25,:Seahawks: Seahawks
Son of a bitch I got drunk too early,1580675904.0,12,
[removed],1580676149.0,11,
[removed],1580676156.0,12,
Greg Olsen looks like he’s about to perform at this year’s Catalina Wine Mixer,1580676716.0,12,:49ers: 49ers
"**""ESPN TWITTER BREAKING NEWS: Gronk repeatedly referring to Travis Kelce in pre-game as ""Kels;"" Is he throwing shade or nah?! 😎😎 Tune into Sportscenter where we have 55 people rotating in and out of the studio to talk about it for an uninterrupted 45 minutes! 🔥🔥🔥""**",1580676761.0,13,
Tight Ends are absolute meatheads and I love it.,1580677094.0,12,:Steelers: Steelers
"Heart is on the Niners.

Money is on the Niners.

Brain is on the Mahomes is a beast train.",1580678416.0,12,:Patriots: Patriots
Jimmy G stole my gf,1580678541.0,13,:Cowboys: Cowboys
This is why the internet sent him to Alaska,1580678773.0,11,
I actually have respect for Pitbull and don't hate him at all but covering Black Betty in that way seems like sacrilege to me.,1580678848.0,11,
Between this and Shakira/J Low were really leaning into big booties this Superbowl. Gotta say I'm a fan,1580678998.0,13,:Patriots: Patriots
AB is reporting he just signed withe 49ers last second and will play in the Super Bowl in a IG story as he smoked a unconfirmed substance and then went on a racist slur filled tirade about Sesame Street.,1580679595.0,12,:Buccaneers: Buccaneers
"Boogity boogity boogity 

START THE GAME ALREADY IM DRUNK",1580679976.0,12,:Vikings: Vikings
[deleted],1580680852.0,12,
"had to remove a helicopter from a commercial but advertising a cult is perfectly okay

yeah ok right",1580681730.0,12,:Chiefs: Chiefs
Concession prices: https://twitter.com/bachscore/status/1224072718418620417?s=21,1580681887.0,12,:49ers: 49ers
"So after this, we become an XFL subreddit or",1580682305.0,12,
I want a clip of TB saying Jimmy was a “good looking eyetalian.”,1580682544.0,12,:Giants: Giants
What the fuck is this,1580683493.0,11,
"So if Fox is doing the Chiefs coverage all night, who’s doing the 49ers’?",1580683668.0,12,:Packers: Packers
This commercial is horseshit. Imagine putting a bunch of selfish owners on the same pedestal as a medal of honor recipient.,1580683977.0,12,:Seahawks: Seahawks
dude why is the quality so fucking shit,1580684262.0,13,
The Joe Montana Bowl is about to begin.,1580684518.0,13,:Giants: Giants
Bill Belichick is so happy when he's among a football museum like those guys,1580685168.0,14,:Giants: Giants
Who the fuck adds a question mark when they google something,1580685666.0,12,:Giants: Giants
"No one:

Fox: here's a close-up of someone's ear",1580685995.0,11,:Vikings: Vikings
The added music ruins the anthem.,1580686037.0,12,:Cowboys: Cowboys
Honestly she fuckin killed it,1580686093.0,14,:Vikings: Vikings
Fuck I thought it would be a Jake Fromm cameo. This super bowl is shit,1580686632.0,13,:NFL: NFL
Poor Tillman.,1580686753.0,11,:Giants: Giants
that was kind of cool ngl,1580686829.0,12,
Why is this on the pregame show? They aren't even talking football...,1580675882.0,38,:Broncos: Broncos
Um. What does this have to do with football?,1580684041.0,22,:Broncos: Broncos
I'm just waiting for this to turn into a Chevy ad.,1580684155.0,24,:Patriots: Patriots
"An Iowa company bought a 30 second ad that just says “this is a break from all the political ads. Enjoy”

It’s a plumbing company but I’m about to go break my toilet to give them business",1580684388.0,23,:Patriots: Patriots
A moment of silence for the mods,1580675870.0,20,:Cowboys: Cowboys
Chiefs 34 9ers 38 Jimmy leads a 2 min drive to win it with kittle making a miraculous catch,1580675732.0,11,:Jets: Jets
[removed],1580676220.0,11,
"Best of luck to the Niners. Even if they weren't playing a hated division rival I'd root for them as most of my friends and family are Niners fans.

This past two weeks has been interesting. I've learned that a lot of the beef between Niners/Raiders really depends on your friends and family. I like the Niners overall, I just like the Raiders more and most of my friends and family wish the Raiders well. I don't know; I just can't see myself hating the Niners.",1580676456.0,11,:49ers: 49ers
I’m just happy to be here,1580676792.0,11,:Chiefs: Chiefs
This matchup feels like a true Super Bowl matchup. These teams each fully deserve to be here. This is the feeling I thought every Super Bowl would have as I was growing up.,1580677682.0,11,:Browns: Browns
[deleted],1580677920.0,12,
Who the fuck approved Pitbull,1580678540.0,11,
Lmfao @ how dead this crowd is for Pitbull.,1580678865.0,12,
Sour Cream and Onion and Cheddar Ruffles are the GOAT pairing of chips. Belee dat.,1580679054.0,10,:Patriots: Patriots
"Wooooah Black Betty 

Ampersand",1580679127.0,11,:Vikings: Vikings
"Just broke my wrist after slipping on some wet leaves.  SB party cancelled but I’ll be watching from an ER TV if I have to.

Go NINERS!",1580679137.0,11,:49ers: 49ers
"It’s a bit of a weird opinion, but I honestly like seeing all these tropical colors being used for the Super Bowl. It just feels like a refreshing thing after so many grey palettes!",1580679355.0,11,:Bears: Bears
Gronk is living the bets life,1580679823.0,11,:Falcons: Falcons
Gronk wearing a bowtie looks like a weird steroid Seacrest.,1580679875.0,11,:Chiefs: Chiefs
I'm just here waiting another year for a browns lions Super bowl,1580679937.0,11,:Browns: Browns
The Pats clearly only scout/draft their QBs with photo headshots.,1580682357.0,12,:Browns: Browns
we're legally allowed to punch people who remind everyone constantly they're only watching this for the commercials. they just said it on the news,1580682503.0,11,:NFL: NFL
Snoop Dogg in a SpongeBob movie just makes sense.,1580682720.0,11,:Raiders: Raiders
Remember y’all can make a free 7-day YouTube TV trial to watch the Super Bowl. Then cancel that shit ASAP,1580682790.0,13,:49ers: 49ers
[This was a bet](https://i.imgur.com/kMadjqq.jpg) and [this as well](https://i.imgur.com/thQ14Sn.jpg),1580683005.0,11,:Eagles: Eagles
[Bears fans when they see Mahomes](https://i.imgur.com/QgDwcNn.jpg),1580683022.0,10,:Bears: Bears
"People who are streaming - if you have an antenna, you can get it for free and without a delay. Fox is a free broadcast, dude",1580683655.0,12,:49ers: 49ers
This thread is gonna be a hate crime when Demi Lovato sings the National Anthem.,1580683834.0,12,
FOX quality is so fucking bad omg,1580683903.0,12,
"IT’S “INALIENABLE”, NOT “UNALIENABLE” - what does that even mean?!",1580683979.0,11,:Buccaneers: Buccaneers
This weird flag promo is like a parody of what other countries think America is. Except it's real,1580684094.0,11,:Giants: Giants
"Yvan eht Nioj

Yvan eht Nioj

Yvan eht Nioj",1580684125.0,10,:Seahawks: Seahawks
"In case you were wondering, the DOD paid the NFL over $100million dollars last year.",1580684175.0,10,:Steelers: Steelers
Take a shot everytime an American flag shows up on screen to die.,1580684181.0,12,:Bengals: Bengals
[removed],1580684311.0,23,
I believe the red team is going to win but don’t quote me,1580684323.0,11,
"It’s gonna be 24-8 

For Kobe",1580684369.0,11,:Vikings: Vikings
People who find the Big Bang Theory funny have the sense of humor of a bag of shit,1580684429.0,11,
I really liked the NFL100 thing to be honest.,1580685115.0,11,:Packers: Packers
"Prayers up for our international fam, who have to listen to Tess and Booger.",1580685599.0,11,
i'm pretty sure i've seen this ladies butthole,1580686081.0,12,:Cowboys: Cowboys
"Aw that is pretty cool, guarantee you that kid is going to remember that until the day he dies..",1580686839.0,11,:Dolphins: Dolphins
Didn't Verizon throttle firefighters data during the 2018 California fires?,1580691507.0,12,:Bills: Bills
fucking piece of trash on my tv wtf is this shit liar fox,1580675870.0,55,:Saints: Saints
What the hell is this crap. I want to watch football not politics.,1580676093.0,39,
The NFL is trying to go full patriotic mode to get back all of those viewers who got mad at the Kaepernick protests and accused the NFL of hating the military and the American flag,1580684152.0,27,
[removed],1580675970.0,20,
Should've let CBS keep it's share in the NFL...,1580676013.0,22,
[removed],1580676061.0,19,
"*peeks in*

nope, see y'all after another lil sumpin",1580676129.0,19,:Bears: Bears
[removed],1580676245.0,21,
Boys it’s a been a privilege shit posting with you this season,1580676063.0,9,
Can we all just talk about how much we love Alex Smith until the game starts?,1580676222.0,10,
[removed],1580676512.0,10,
"I'm on the Chiefs bandwagon partly because of Andy Reid - a dude who likes food and football, my man. This morning I dropped my bowl of Coco Pops on the floor. Sorry Chiefs fans, I think that's a bad sign.",1580676937.0,11,:Eagles: Eagles
If shakira doesn't dance we riot,1580677837.0,11,:Bills: Bills
"Is beer, scotch, and chips enough to bring to a party?",1580678044.0,11,:Packers: Packers
"28-24, 49ers",1580678222.0,10,:Saints: Saints
Imagine if we were looking forward to romo,1580678273.0,10,
Wtf are the dancers wearing lmao,1580678845.0,11,:Falcons: Falcons
This is herpes in music form,1580678849.0,10,
I would be okay with those pants becoming popular for everyday use.,1580678888.0,9,:Raiders: Raiders
Those outfits are hot ngl,1580678890.0,10,:Giants: Giants
I don’t hear from Flo Rida anymore... why can’t Pitbull do the same?,1580678962.0,10,:Buccaneers: Buccaneers
"Fucking NFL can you PLEASE start scheduling the super bowl on a Saturday? Some of us are from Europe and have work tomorrow.    

Who am I kidding, I took the day off. Let's watch some football!",1580679052.0,11,:Giants: Giants
Who else is drunk already?,1580679442.0,10,:NFL: NFL
"As a Lions fan, i cant but think how cool it must be to have your team playing in the superbowl. 

Like, it must be hype af, just a way better experience. What's it like?",1580679447.0,9,
The simpsons said the 49ers win in Miami,1580679448.0,9,
I really hope this Super Bowl isn't like last years,1580679928.0,10,:Patriots: Patriots
Nfl needs to ease up on weed,1580680007.0,11,
Am I an asshole for finding this cancer commercial fucking annoying? It was tender and sweet the first time I watched it but it's playing literally every commercial break.,1580680316.0,11,
Joe Buck pointing to nothing,1580680494.0,9,:Lions: Lions
JOE BUCK HAS A BIG SPLEEN AND A SMALL PEEN,1580680587.0,10,:NFL: NFL
Joe buck is the worst interviewer of all time,1580680649.0,9,:Seahawks: Seahawks
Really cool to watch joe buck interview joe buck with Kyle shanahan watching,1580680684.0,10,
Dj Khaled and Pitbull. Why are we still having to listen to these chumps?,1580681041.0,10,:Bears: Bears
I have absolutely ZERO idea who is gonna win this. And I have absolutely no stake in it whatsoever. I’m gonna enjoy this.,1580681440.0,9,
Terry bradshaw is cte in human form,1580681515.0,10,:Jaguars: Jaguars
"Man, I wish tomorrow wasn't a Monday.",1580681617.0,9,:Raiders: Raiders
Obligatory fuck Scientology,1580681723.0,9,:Cowboys: Cowboys
We gonna have one red ass crowd in the stadium tonight.,1580681898.0,10,:Dolphins: Dolphins
Nantz and Romo should do an alternate commentary Twitch stream.,1580682014.0,9,:Ravens: Ravens
"Tuning in from Europe.  

Will ye be my friends for the next few hours? 


Cool.",1580682568.0,12,:Seahawks: Seahawks
I can't see the difference between Joe Buck and Pinocchio,1580682651.0,10,
Harleem Globtrooters still around god bless them,1580682898.0,9,:Rams: Rams
[deleted],1580683024.0,10,
Decided to stay home and watch the game with my dad instead of going to some party with half knowledge fans. Thus far I am happier,1580683295.0,11,
OH SHIT DID THEY JUST BLEEP THAT LOL,1580683558.0,9,:Broncos: Broncos
Murder-suicide joke. Im into it,1580683571.0,9,
Fox just bleeped their own promo 🤣🤣😂😂🤣,1580683637.0,11,:49ers: 49ers
GOD BLESS AMERICA,1580684192.0,9,:49ers: 49ers
lmao was that a scientology ad,1580684415.0,10,:Dolphins: Dolphins
[deleted],1580684436.0,10,
"Gronk: ""they said my name :D""",1580684988.0,11,:49ers: 49ers
I wish the NFL had the balls to put Oj Simpson in there,1580685123.0,11,:Lions: Lions
Legion of Zoom? Terrible.,1580685498.0,9,:Browns: Browns
NFL isn't patriotic enough,1580686005.0,10,:Lions: Lions
Demi is killing it,1580686058.0,12,:Broncos: Broncos
Smh can’t believe the NFL didn’t get a holographic version of Kobe to fly over,1580686256.0,10,:Seahawks: Seahawks
On what planet would fans not know their team had women on their roster?,1580686270.0,10,
They were having a nice parade until Alvin Kamari started being a dick,1580686767.0,10,:Chiefs: Chiefs :Lions: Lions
My dad just tried to take a wine cork out with his teeth and he ended up biting it in half now it’s stuck in there. I hope this story eases up everyone in this thread.,1580687693.0,11,:Bears: Bears
The Masked Singer seems like the biggest piece of shit ever.,1580690999.0,11,:Jets: Jets
"Yeah, yeah we get it you love the troops or something.",1580684136.0,21,
NFL trying so hard rn to score some boomer points,1580684178.0,20,:Browns: Browns
Trying to win back the anti Kapperneck people who left.,1580684214.0,18,:Texans: Texans
[removed],1580684175.0,44,
"I have the best black people, everybody says so",1580687775.0,17,
I like soldiers. I like America. But college professors are going to have a field day showing that this is why the politicization of sports/military industrial conflict in football is so ingrained hardly anyone questions it.,1580684232.0,32,:Buccaneers: Buccaneers
"You know, it doesn't seem real. Part of me just feels like this is just a marquee SNF game and there will be another game next week. I can't seem to grip that this is the fucking **SUPER BOWL** and that this team is actually living up to the hype and expectation of possibly winning it. 

This feels fucking awesome.",1580675774.0,9,
[removed],1580676018.0,10,
Hmm wat,1580676673.0,8,:Jaguars: Jaguars
"Jesus christ, I forgot how terrible cable tv is.",1580676739.0,10,
IM NOT READY!!!!,1580676850.0,9,:49ers: 49ers
Puppy bowl tied at halftime,1580677029.0,8,:Patriots: Patriots
If Kittle wasn’t a football player I would swear he’d be that dude going to car auctions every week and buying a new wreck to fix up and flip,1580677327.0,9,:Vikings: Vikings
Lol this crowd wants nothing to do with Pitbull,1580678780.0,9,
Pitbull performing with approximately 20 people enjoying it and everyone else standing around. Why even bother.,1580678887.0,9,:Jaguars: Jaguars
"I swear Pitbull wasn’t even invited, they just found him outside of a local Publix and he followed them back to the stage",1580678928.0,9,:Chiefs: Chiefs
"I was so glad when it finally went to commercial break, only for the next cell phone commercial to feature the exact same song by Pitbull fade me now fam",1580678939.0,10,:Eagles: Eagles
"Roman Reigns, Sasha Banks, and... Joe Buck.",1580679194.0,9,
"Just saw Joe Buck dancing, thanks for ruining my fucking day Fox",1580679233.0,8,
I’m going to throw up,1580679661.0,8,:49ers: 49ers
This hurts the Browns chances at winning the super bowl this year,1580679698.0,9,
So Gronk ain’t coming back lmao,1580679843.0,8,:Eagles: Eagles
"GoCarting on a cruise ship.  
  
*What could go wrong?*",1580679852.0,9,:Browns: Browns
