text,time,upvote,flair
"Quick Jed, get Kap down to Miami in time to keel for the anthem just to fuck with Fox.

Then the 49ers win the game and refuse to go to the white house. Please.",1580676144.0,19,:49ers: 49ers
That intro made me feel as alive as Johnny Cash,1580684299.0,18,:Bears: Bears
Can we chill with the America circle jerk for even one day a year?,1580683996.0,33,:Seahawks: Seahawks
WTF is this supposed to be? Is he trying to win an award for the worst cover in the history of covers?,1580678915.0,14,:Chiefs: Chiefs
"So you’re telling me I can become famous if I just randomly shout Spanish words in a song I sing? 

Almost heaven 

West Virginia 

AY DIOS MIO 

Shenandoah River",1580678997.0,14,:Vikings: Vikings
So proud of the NFL to patriotically take millions of dollars from the army to show that ad.,1580684196.0,14,:Patriots: Patriots
"For everyone wondering why sporting events always have such over the top patriotism, [there’s a reason. ](https://www.truthdig.com/articles/read-the-full-tackling-paid-patriotism-report/?amp)",1580684259.0,13,
"America the Beautiful always shoulda been the national anthem, IMO.",1580685925.0,13,:Commanders: Commanders
Wow such a woke commercial,1580686216.0,13,:49ers: 49ers
That was literally Forest Gump but a 10 year old black kid and a bunch of football legends,1580686795.0,13,:Vikings: Vikings
Good game chiefs.,1580699346.0,13,:49ers: 49ers
moment of silence... crowd immediately starts making noise smh,1580684263.0,17,:Giants: Giants
This is one of the biggest patriotic jerkoffs I’ve seen before a Super Bowl. WTF?,1580684122.0,29,:Packers: Packers
This is exceptionally horrifying in 4K.,1580675977.0,15,
Tyrann Mathieu is stupid good,1580680142.0,11,:Chiefs: Chiefs
Question: What time do the Lions play?,1580680331.0,12,:Lions: Lions
[deleted],1580680765.0,12,
"Not to be un-American or anything but I’m Canadian 

Can we just do that football please",1580684071.0,11,:Vikings: Vikings
"Great job Fox, all this rah rah USA when an hour ago you interviewed a draft dodger who’s apparently above the law. Brilliant.",1580684188.0,12,:49ers: 49ers
[removed],1580676086.0,33,
This is a bit more propaganda-y than normal,1580684009.0,24,:Chiefs: Chiefs
[removed],1580684192.0,24,
[deleted],1580675484.0,5,
"Do you guys think this SuperBowl will have better, worse, or the same ratings/total viewership as last year?

I think it’ll decrease a bit.",1580675500.0,7,
I hope Andy Reid finally gets his wish.,1580675519.0,4,
Sherman walking in with a Kobe jersey look out chiefs,1580675886.0,6,:Buccaneers: Buccaneers
Hi friends! Enjoy the game!,1580676053.0,7,
Finally,1580676202.0,6,
I liked Gronk better before he was given a microphone.,1580676682.0,6,
Is anyone else an nauseous as I am? My anxiety is through the roof,1580677243.0,6,:Chiefs: Chiefs
"Wait, there's a game today?",1580677251.0,7,:Chiefs: Chiefs
Kittle looks like he has a car up on blocks in the front yard,1580677260.0,6,:Buccaneers: Buccaneers
"Imagine being on that FOX panel and having to bullshit for 2 1/2 hours straight ...?

Maybe they can induct Johnson into the HOF again.",1580677284.0,7,
I'm jacked.  I'M JACKED TO THE TITS,1580677346.0,5,:Chiefs: Chiefs
"This is the most nervous I have ever felt about a sporting event. Still,   let's go Chiefs!",1580677640.0,6,:Chiefs: Chiefs
Let’s go Master Chiefs,1580677695.0,7,:Falcons: Falcons
JLo is like a fine wine,1580677800.0,6,:49ers: 49ers
Love everyone in this thread acting like they're doing J Lo a favor by still being attracted to her even though she's 50,1580677956.0,6,:Seahawks: Seahawks
"A-Rod just said as a hint for the halftime show that it’s gonna be a family affair

Is Mary J making an appearance? Because if so... man, I did not see that coming",1580677974.0,6,:Jaguars: Jaguars
I dont think Ive ever paid attention to any SB halftime show in my entire life,1580678187.0,5,:Giants: Giants
Who will perform Sandstorm on the halftime show,1580678246.0,8,:Titans: Titans
"If the niners don't win, we're cutting our dicks off guys",1580678312.0,6,:49ers: 49ers
"This seems, on paper at least, to be a pretty solid match up - possibly the best I can remember in years",1580678331.0,6,:Bears: Bears
Moby moby moby moby,1580678350.0,6,:Jaguars: Jaguars
"DOWN.
SET.
FUCK",1580678554.0,6,:Bills: Bills
Can we all just be happy that we won't have to deal with shitty ass Adam Levine and shitty ass Travis Scott this year?,1580678700.0,6,:Broncos: Broncos
And the crowd goes mild.,1580678785.0,6,:Bears: Bears
Pitbull is so fucking trash,1580678804.0,5,:Seahawks: Seahawks
"Can we just start the fuckin game, pls",1580678817.0,6,:Bears: Bears
Anyone else planning on drinking most of their alcohol before the game starts?,1580678847.0,6,:Buccaneers: Buccaneers
vinyl seems impractical for miami weather,1580678941.0,6,:49ers: 49ers
"Pitbull is one of those artists that you're led to believe is popular (somewhere), but can't find anybody that really rocks with him like that.",1580678953.0,7,:Commanders: Commanders
"What the hell is this 

I’m not complaining, I’m honestly asking",1580679161.0,5,:Vikings: Vikings
Time to pick up some Pizza and Wings Not from Pizza Hut,1580679189.0,6,:Rams: Rams
"Got some buffalo wings, 7 Layer Dip, Tortilla Chips, A pizza from Dominos, and Coke tonight",1580679520.0,6,:Dolphins: Dolphins
Espn projected 67% of the stadium will be KC fans which is highest of all time. I'm honestly pretty surprised.,1580679710.0,6,:Chiefs: Chiefs
Gronk makes Jeff Gordon look like a kid.,1580679812.0,6,:Chiefs: Chiefs
who holds a Jay Glazer head lol,1580679872.0,7,:Cowboys: Cowboys
"I've considered going on a cruise, but then I remembered I'm not a 60 year old swinger",1580679923.0,6,
"no matter who wins the superbowl today, raider fans lose",1580680469.0,5,:Cardinals: Cardinals
Never forget the disrespect of Sweet Victory last year.,1580680707.0,5,:Browns: Browns
Let’s fucking go chiefs!,1580680718.0,5,:Ravens: Ravens
First time in a while the neutral fans can't just pick Not Patriots,1580681007.0,5,
DJ Khalid finally living up to his name y’all,1580681042.0,6,:Eagles: Eagles
How many cheeseburgers will Andy Reid eat if he wins the Superbowl.,1580681272.0,6,:Cardinals: Cardinals
Win or lose. Fans of both teams have got to be excited that their quarterbacks (scarily enough) are both just scratching the surface of how great they can be. At such young ages too.,1580681367.0,6,:Dolphins: Dolphins
"last year i bought the last batch of cajun fries at Popeyes and felt bad, so this year I decided to get my food way early and now I'm full af and need a nap. This game needs to start now.",1580681555.0,6,
"Bill Belichick watching at home, pigging out for the big game with some lemon water and two tea biscuits.",1580681631.0,6,
Can’t wait to play Madden every day for the next 7 months ;(,1580681697.0,5,:Dolphins: Dolphins
Can anyone tip me off if Glazer’s bead bracelet is related to death or illness so I can start roasting him? Please and thank you,1580681781.0,7,:Lions: Lions
"Great to see the pregame show sponsored by a longtime NFL partner like....Turkish Airlines.

Me and the boys are about to throw the most bitchin’ draft party in Ankara this spring.",1580681820.0,6,
DJ Khalid is a tool,1580682038.0,5,:Chiefs: Chiefs
[Charging $14 for a Bud Light should get you tried in The Hague.](https://twitter.com/humantorch/status/1224082421122863104?s=20),1580682086.0,6,:Texans: Texans
Only time I’ve ever seen DJ Khaled actually DJing,1580682094.0,6,:Bears: Bears
This is the first Super Bowl since I've started watching (XLI) that I don't have an active rooting interest,1580682116.0,7,:Colts: Colts
State Farm is scrambling to sign Jimmy G to revive their dream of State Farm Bowl,1580682146.0,7,:Eagles: Eagles
I like how we as a country just decided A-Rod was cool again,1580682195.0,5,:Seahawks: Seahawks
"""Before I was A-Rod, I was Aaron. Then I took ~~a lot of steroids~~ an entire bottle of Flintstones vitamins""",1580682229.0,7,:Titans: Titans
Terry Bradshaw's brain is so full of holes that it is currently ranked as the most absorbent sponge on earth today.,1580682313.0,6,:NFL: NFL
Anyone put any money on Kaepernick not being mentioned at all tonight?,1580682371.0,5,
Yeah there's no way in hell they throw 10 times in a row,1580682490.0,6,:Chiefs: Chiefs
QUARTERBACK FACE - Colin Cowherd somewhere,1580682514.0,6,
one good lookin eye-talean,1580682542.0,6,
Since it’s on fox that means joe buck is covering it doesn’t it,1580682559.0,5,:Bears: Bears
"Man, y'all gotta love Bradshaw. Dude is giving every little bit he has left.",1580682627.0,5,:Broncos: Broncos
Oh Geico Pinocchio.. always up to some shenanigans,1580682681.0,6,:Ravens: Ravens
Spongebob movie looks intresting,1580682725.0,6,:Ravens: Ravens
"“How bad do you want this?”

Gee! I don’t know if he wants to win the Super Bowl!",1580683132.0,5,:Patriots: Patriots
I’m so excited for this game. Let’s go K.C.,1580683154.0,6,:Eagles: Eagles
start the game already goddamnit,1580683282.0,6,:Cowboys: Cowboys
"i got carried away with prop bets

i bet one that was -290 without realizing it like a loser",1580683387.0,6,:Broncos: Broncos
"there’s no way larry king is actually alive

like that can’t be possible",1580683477.0,5,:Broncos: Broncos
What in the god damn fuck is this horsecockery,1580683551.0,7,:Vikings: Vikings
Lol rob lowe with the self burn,1580683581.0,6,:Patriots: Patriots
Rob Riggle is the Pitbull of comedians.,1580683585.0,5,:Vikings: Vikings
Everybody's talking about Jimmy G. but they are forgetting [this guy](https://imgur.com/dpMV1Ch.jpg) back in the day. Pure sex.,1580683628.0,5,:Raiders: Raiders
So I just turned the pregame on. Who said KC by 27?,1580683660.0,5,:Ravens: Ravens
Pitbull making a career off of Miami sporting events cameos.,1580683687.0,5,:NFL: NFL
"The Pregame Show of the Pregame Show is over.  
  
Now for the Fox Pregame Show",1580683699.0,6,:Browns: Browns
Bleep naughty words but show full butt crack and cheeks,1580683739.0,6,:Jaguars: Jaguars
Notice how they are always outside in that Verizon 5g commercial? They have piss poor building penetration.,1580683861.0,5,:Falcons: Falcons
how long until applebees goes out of business? I'm doing my millennial part to never eat there.,1580683935.0,7,:Bears: Bears
This Pavlovian nervousness is starting to creep in.,1580683989.0,7,:Patriots: Patriots
The most horrifying thing: necks of nfl owner women,1580684026.0,5,:Ravens: Ravens
Just dropping by to point out that our way of life hasnt been threatened since *maybe* WWII.,1580684026.0,7,:Steelers: Steelers
Remember 9/11?,1580684105.0,6,:Broncos: Broncos
Loved the windows at the Alamo.,1580684130.0,5,:Packers: Packers :Jets: Jets
Random propaganda on a super bowl lmaooo,1580684168.0,6,:Patriots: Patriots
7/11 was a part time job,1580684201.0,6,:Seahawks: Seahawks
VOTE OR DIE,1580684242.0,8,:Seahawks: Seahawks
RIP #24,1580684320.0,6,
Marked safe from patriots super bowl appearance!!!,1580684398.0,6,:Jets: Jets
[deleted],1580684406.0,5,
THIS SUPER BOWL GOES OUT TO LIV MORGAN.,1580684485.0,8,:Cowboys: Cowboys
"So the pre-pre show is over, and now this is just the pre-show. That's nice.",1580684581.0,6,:Falcons: Falcons
I'm *convinced* Jerry Rice could still get 500 yards receiving and 4 TDs RIGHT NOW in the NFL,1580684889.0,5,:Dolphins: Dolphins
This is honestly pretty great.,1580684926.0,8,:Giants: Giants
Barry > Emmitt,1580684971.0,6,:NFL: NFL
COWARDS didn't bring out OJ.,1580685010.0,6,
OJ off committing a robbery somewhere?,1580685011.0,8,:Giants: Giants
"Everybody, look out! Marvin Harrison and Ray Lewis are there! Be safe, and don't get murdered.",1580685034.0,4,:Vikings: Vikings :Falcons: Falcons
that Sexy wink by Adam lol,1580685046.0,5,:Steelers: Steelers
Good god that’s a lot of talent in one place,1580685082.0,6,:Ravens: Ravens
Phenomenal job.  Extremely well done.,1580685083.0,7,:Giants: Giants
Oj not there????,1580685089.0,6,:Lions: Lions
"I knew that Brady was gonna be here, one way or another",1580685095.0,6,:Steelers: Steelers
This is making me feel like a grandpa and I'm only 29,1580685104.0,7,:Jaguars: Jaguars
Belichick could play a Sith Lord if his coaching gig stops working out,1580685104.0,6,:Giants: Giants
Belichick looks nice when he’s not in grinch mode,1580685114.0,6,:Steelers: Steelers
Now cut half of them and make a real greatest roster of all time.,1580685156.0,6,:Ravens: Ravens
Damn I love football. I don't want the season to end today.,1580685310.0,6,
Finally... Fox has hired a person who can actually speak to be a part of their broadcast.,1580685352.0,6,:Broncos: Broncos
We got ‘candy ass’ in a Super Bowl intro lmao I love it,1580685406.0,7,:Buccaneers: Buccaneers
I wish the Rock was my hype man,1580685415.0,5,:Texans: Texans
Dude holy shit the Rock is going full on old school The Rock for this hype video,1580685435.0,7,:Seahawks: Seahawks
Some bay area Thrash Metal to introduce SF. Nice touch \m/,1580685494.0,6,:Steelers: Steelers
"Okay, Kelce walking down that catwalk like an Egyptian was legit awesome.  Loved it.",1580685539.0,6,:49ers: 49ers
"jabornis can't handle The Rock's hype!

Go KC!",1580685561.0,7,:Cowboys: Cowboys
Shanahan looks like a beastie boy,1580685566.0,5,:Bears: Bears
Every NFL team needs the Rock to introduce them.,1580685656.0,5,:Giants: Giants
The production so far has been legit awesome. The NFL100 thing and those intros were legit cool.,1580685698.0,6,:Colts: Colts
The only tornadoes I watch is the ones with sharks in them.,1580685799.0,7,:49ers: 49ers
LOL THAT WOMAN AND THE TORNADO,1580685822.0,6,
Did anyone else legit LOL at that 911 Lone Star teaser?,1580685828.0,7,:Dolphins: Dolphins
Who will be the first team to use an Abrams tank as a TD celebration?,1580685856.0,5,:Steelers: Steelers
Kyle Shanahan staring right into the camera and realizing he’s on camera was hilarious,1580685914.0,6,:Broncos: Broncos
Fergie >> Yolanda,1580685924.0,7,
Let’s kick the damn ball off,1580685925.0,6,:49ers: 49ers
I want The Rock to be my hype man when I wake up on monday mornings,1580685953.0,6,:Vikings: Vikings
Did anyone see the peta kneeling commercial I didn’t even get what point they were making they seemed to think it was deep,1580686025.0,7,:Lions: Lions
Demi has clothes on?!!?,1580686026.0,5,:Chiefs: Chiefs
whats with this orchestral backing WTF,1580686030.0,6,:Patriots: Patriots
Joe Buck going to have to work twice as hard to be a wet blanket and bring the hype level back to reasonable levels.,1580686056.0,6,:NFL: NFL
You'd be amazed at how much easier it is to gain weight when you're not on hard drugs,1580686077.0,7,:Titans: Titans
You’d think you’d maybe show the person signing the anthem in a box in the corner instead of showing her for 2 seconds,1580686105.0,6,:Patriots: Patriots
“6 branches of military” does that mean the Space Force was out there during the national anthem?,1580686171.0,6,
Took an L on my pizza... they brought pepperoni and ground sausage instead of Italian sausage smh .,1580686379.0,7,:49ers: 49ers
Grabbing the nearest girl to kiss her today probably isn’t as celebrated.,1580686382.0,5,:Texans: Texans
All heroes,1580686385.0,6,:Dolphins: Dolphins
Dak playing ref.,1580686467.0,6,:Cowboys: Cowboys
lmfao they always fuck it up,1580686504.0,8,
No Jake Fromm I’m disappointed,1580686579.0,6,:Vikings: Vikings :Dolphins: Dolphins
State Farm setting up the Jake Fromm series for next year. Smart,1580686595.0,6,:Dolphins: Dolphins
State farm using an older commercial for their spot,1580686611.0,7,:Cowboys: Cowboys
wait that looked like Tim the Tattman wtf,1580686714.0,7,
"Yeah I'll give him a tip, all right

SPECIAL VICTIMS UNIT",1580686720.0,7,
What is so hard about *JUST START THE DAMN GAME*.,1580686725.0,7,:Falcons: Falcons
Joe wants to fuck Jimmy too.,1580686728.0,5,:49ers: 49ers
Ray Lewis killing kids what’s new,1580686776.0,7,
This is way too long,1580686784.0,6,:Packers: Packers
"Okay, that was a pretty dope Super Bowl intro..",1580686788.0,6,:Dolphins: Dolphins
okay that was fucking sick what the hell,1580686816.0,5,:Colts: Colts
We will all be dead by the next 100,1580686826.0,5,:Packers: Packers
Is the audio buzzing ???!?!,1580686854.0,5,:Cowboys: Cowboys
Holy minimalist scoreboard,1580686918.0,5,:Dolphins: Dolphins
Loving the scoreboard thing,1580686976.0,5,:Lions: Lions
"It finally happened. I never thought we’d get here.

They started the game.",1580686997.0,6,:Eagles: Eagles
I just don't see how KC defence can hold this up all game.,1580687684.0,5,:Patriots: Patriots
You guys understand that this is a pre game thread right?,1580688110.0,7,:Browns: Browns
He should impaled Mahomes whether he pitched it or not.,1580688668.0,6,:Commanders: Commanders
Wow Brady got me on that one,1580688905.0,6,:Giants: Giants
It's more likely Jonah Hill used the other type of Coke.,1580690906.0,6,
Wtf is this,1580684155.0,16,:Giants: Giants
[deleted],1580684078.0,23,
"Fox right now - “Let’s push an agenda that America isn’t in shambles politically right now”

Also Fox - “Yeah Kobe is dead. Aight imma head out.”",1580684334.0,19,:Patriots: Patriots
"It's over!

I thought FoxNews was against softball players...",1580676193.0,9,:49ers: 49ers
">first African American quarterback to open the Super Bowl

>People start booking

What the fuck, America?",1580676381.0,12,:Vikings: Vikings
Is it wrong to want a wardrobe malfunction at the halftime show?,1580682227.0,11,
"This game must be hard for Raiders fans to watch, well at least for the ones who aren’t currently incarcerated",1580683041.0,11,
Yeah but Mahomes got beat 66-10 by a 3-9 Iowa State team so,1580683195.0,12,:Patriots: Patriots
[removed],1580684061.0,11,
I swear if this ends up being a tide commercial....,1580684139.0,12,:Seahawks: Seahawks
I just wanna watch the game already,1580684149.0,10,
"Imagine being so rich you have a ""game"" room and a ""media"" room",1580684362.0,12,:Chiefs: Chiefs
A ton of rings in that QB group.  Marino was there too.,1580685222.0,12,:Panthers: Panthers
So the cost of this free 4k stream from the fox sports app was state sanctioned propaganda.,1580676475.0,18,
And I’ve changed the channel,1580676071.0,17,:49ers: 49ers
Wtf has this got to do with football,1580683994.0,17,:Vikings: Vikings
What’s the point of this “tribute”? Like we know where we live,1580684108.0,16,:Seahawks: Seahawks
"Gotta appeal to the fox news crowd they, for some reason, are trying to reign back in.",1580684135.0,16,:Titans: Titans
"Goddamn Fox, please never do a Superbowl again. Your videos are fuckin horrible",1580684219.0,21,:Dolphins: Dolphins
Go njners,1580675439.0,18,:49ers: 49ers
Respectfully this doesn’t need to be this long or cinematic,1580684171.0,18,:NFL: NFL
bengals vs xfl winner for relegation/ promotion,1580680049.0,14,:Patriots: Patriots
"""We hold these truths to be self-evident, that all men are created equal""

lol. These dudes were bullshitting",1580683994.0,14,
Time for bootlicker commercials all night,1580683975.0,25,
"And Rockets are play Pelicans
Someone tell me when the shitshow is done",1580675972.0,9,
[removed],1580676243.0,8,
"F/M/K Shakira, JLo and Michael Strahan, go",1580677889.0,11,:Chiefs: Chiefs
Fox is the worst network to host a Super Bowl. This is so bad.,1580679784.0,10,
Joe “I have a dad too” Buck,1580680786.0,10,
[deleted],1580684042.0,11,
I love my country but this is fucking ridiculous cmon now,1580684120.0,10,
The constant 9/11 reminder just feels like they’re trying to drum up support for some other endless war,1580684192.0,10,:Seahawks: Seahawks
I'm sorry for all of you missing Pat Mahomes being goofy in our local commercials,1580684359.0,12,:Chiefs: Chiefs
So wait...somehow the *entire fucking stadium* didn't know the kicker and holder were women?,1580686228.0,8,:Vikings: Vikings
Why are we getting 15 year old State Farm commercials,1580686610.0,10,:Falcons: Falcons
[removed],1580676085.0,17,
Jesus fuck this is cringe,1580684149.0,17,
"brb...going to get really, *really* drunk",1580675479.0,5,:49ers: 49ers
I don’t want to get too technical but if the Chiefs don’t score more than the Niners today they are going to lose.,1580675556.0,5,
"if the chiefs win, i'll listen to Kermit the Frog's ""Rainbow Connection"" for 24 hours straight",1580675637.0,4,:Broncos: Broncos
I’ve eaten a ton of buffalo chicken dip today,1580675882.0,5,:Ravens: Ravens
[deleted],1580676075.0,5,
Just found out my friend is at the game. Guess I gotta root for the 49ers now.,1580676178.0,5,:Vikings: Vikings
How high is Troy right now,1580676422.0,6,:Buccaneers: Buccaneers
Go 9ers!,1580676526.0,6,:Chargers: Chargers
Thank you NFL Network for Super Bowl coverage,1580676963.0,4,
[removed],1580677042.0,5,
"i love that TEs are getting so much love in the leadup to this game. fox has gonzalez, gronkowski, olsen talking",1580677092.0,6,:Chiefs: Chiefs
George kittle is not as handsome as pornstar jimmy,1580677173.0,5,
Minor Deity of Shitposting checking in,1580677181.0,6,:Bills: Bills
Oh god I have the Puppy Bowl on and my dog won’t stop barking at the TV.,1580677194.0,5,:Bills: Bills
"That TE room tho, cool segment",1580677204.0,6,:49ers: 49ers
Anyone got any dumb bets? I cashed in my Lamar MVP tickets this morning and decided to put $50 on Anthony Sherman scoring any time and scoring first touchdown.,1580677408.0,3,:Patriots: Patriots
First time I’ve seen a shift change live on tv,1580677455.0,5,
So much red in that pregame crowd.,1580677656.0,5,:Seahawks: Seahawks
"Pregame show has been brutal all afternoon but luckily I just listened to Mobb Deep's Shook Ones Pt. 2 and I want to run through a goddamn brick wall. 

Let's do this shit",1580677678.0,5,
Hey fox change your fucking music already,1580677701.0,6,:Jets: Jets
I wonder which current artist today is gonna get the SB halftime show 15 years from now,1580677814.0,5,:Giants: Giants
"I’m just glad to keep this super bowl really lowkey, and without a party that includes the loudest person who hasn’t watched a game all season. There’s always one.",1580677815.0,5,
Told my boss I'm not coming in tonight (I work overnights) because no matter how this game goes I'll probably die,1580678001.0,5,
All things considered with 100 years of history it is kinda cool to see one of the reps of SB1 be here today,1580678013.0,6,
"Halftime: 

Wakka Wakka for 15 minutes",1580678107.0,4,:49ers: 49ers
"You know what would make the halftime show even better? 

If My Hips Don’t Lie fades off into Sweet Victory",1580678120.0,3,:Vikings: Vikings
"Hype af right now, should be a great game. My pick is THE REFS by at least 10 maybe more",1580678154.0,5,
Man I hope I get to see us play in one of these games one day,1580678288.0,5,:Dolphins: Dolphins
I hope J lo plays that booty song she did with iggy,1580678297.0,4,:Bills: Bills
"Omg I don't dislike pit bull, but this is horrible 😂",1580678740.0,6,:Vikings: Vikings
"""Oh thank god, I made it in time for Pitbull""

-absolutely no one",1580678757.0,4,
Hurricane Maria was so evil it spared Pitbull.,1580678766.0,4,:Cowboys: Cowboys
THAT IS PITBULL! THAT CROWD IS SO DEAD THEY NEED TO SHOW SOME RESPECT FOR MR. WORLDWIDE!,1580678815.0,5,:Texans: Texans
Crowd looks real into it!,1580678819.0,5,
Pittbull fucking blows!,1580678839.0,5,:Eagles: Eagles
"Lemme hear you say hey! 

*crickets*",1580678850.0,5,:Vikings: Vikings
Lets hope this is all we see pitbull and not in the halftime show,1580678870.0,5,
What the fuck is this. Is that pit bull?  This song sucks shit.,1580678877.0,4,
Pittbull performance coupled with a commercial get this man off my tv please,1580678944.0,4,
SLURMS MCKENZIE,1580678970.0,5,:Seahawks: Seahawks
Pitbull sounds baaaaaad,1580678998.0,6,:Raiders: Raiders
They should get that YouTube star from the Genesis halftime show on MNF.,1580679059.0,5,
That pizza hut commercial was the most cringe thing I've seen in a while,1580679173.0,5,
My party host is having Olive Garden Pasta bar!!!,1580679185.0,6,:Panthers: Panthers
"Wish I could go up on stage, say (not sing) the same lyric 10 times, and make millions doing so. It’s ridiculous.",1580679222.0,6,:Chiefs: Chiefs
I’d never thought I’d hear someone call Joe Buck a genius,1580679309.0,6,:Eagles: Eagles
Respect to Robert Salah.... what he did with this defense is amazing. Gonna be a great super bowl,1580679355.0,5,:Saints: Saints
"Good Segments:

TE talk 1

TE talk 2 with Kittle and Kelce

49ers D 

(I hope KC gets a good segment like this)

________

Bad Segments

Everything else",1580679415.0,6,:49ers: 49ers
Vegas has the spread at a point. This game will be one for the ages.,1580679470.0,5,:Chiefs: Chiefs
NFL Network pregame is good highly recommend,1580679513.0,6,
Kyle don’t get pass happy and play your game and run the ball!!,1580679517.0,5,:Broncos: Broncos
Is FOX debuting a new scorebug for the game?,1580679528.0,6,:Packers: Packers
That Sonic movie looked significantly less shitty,1580679706.0,5,:Chiefs: Chiefs
"Buffalo fan. Never been more impartial to either team in a superbowl before. I like jimmy g, I like patty Mahomey, both teams are solid and fun to watch. Itll be a good game for sure, just not sure who to root for.",1580679733.0,5,
"Im excited to finally watch a superbowl without having heart attacks. I can enjoy today,  so this is a nice change.",1580679742.0,5,:Patriots: Patriots
The XFL gonna boom or bust,1580679751.0,6,:Eagles: Eagles
[deleted],1580679754.0,6,
"There’s no way this super bowl could be as boring as last years. 

Is there?",1580679783.0,5,:Broncos: Broncos
Gronk and Jeff Gordon.. wtf.,1580679793.0,6,:Panthers: Panthers
